"hot_word","hot_word_num"
"张若昀正式起诉父亲张健","5226088"
"游客农家乐遭强奸已被警方立案","3286608"
"淘宝直播盛典","2059992"
"张翰吃牛肉面了","1733929"
"李菲儿说不认识Angelababy","1722570"
"随手拍春夏穿搭","1721855"
"赵立坚回应转发网友画作","1704678"
"没有武林外传蹭不上的热点","1698124"
"大岛日记","1687517"
"苹果将削减AirPods的产量","1660141"
"阿娇胖了","1657460"
"张翰十年只谈过两个女朋友","1450755"
"印度变种病毒至少已在17国出现","1447865"
"90岁结核医生说最有效的处方是爱","1350294"
"国台办回应两岸最终难免一战说法","1314033"
"贵阳机场厕所洗手池布满化石","1267362"
"官方通报广西男子砍伤幼儿园师生","1194282"
"闲鱼崩了","1160508"
"广西一男子闯入幼儿园砍伤师生","1097701"
"男子15万8卖亲儿子后到处挥霍","1064347"
"杨超越 曝光我造型出图还有新鲜感么","1061681"
"我科学家发现能降解塑料菌群","1029706"
"肖战给孙燕姿反黑","1025549"
"陈建斌 蒋勤勤出门是史诗级长篇连续剧","913331"
"周捷推荐谭松韵上妻子7","894345"
"张馨予为演军医剪短发","810618"
"甘望星生图","807578"
"从楼上明白了分手的痛苦","420210"
"美团回应副处长当骑手1天赚41块","348397"
"狗狗币大涨","329243"
"现在的家长有多硬核","312905"
"怦然心动20岁艺人官宣","308961"
"小舍得","262740"
"我国人造卫星开拓者闵桂荣院士逝世","237468"
"初中生800米冲刺没摔没撞竟骨折","236876"
"上海一高校期末考当堂办婚礼","236556"
"你的婚礼","225973"
"导盲犬带主人乘飞机","203748"
"见过最离谱的约会","203203"
"五一假期全面实施门票预约制度","190814"
"吴宣仪 我感情洁癖","187736"
"王俊凯晒旅行风景照","174211"
"加满一箱92号汽油贵4元","161462"
"英雄联盟修改英雄称号","158105"
"云南文山遇冰雹街道成冰河","157254"
"从经济学角度看调休","156807"
"武汉在校博士后因套路贷自杀","156266"
"女心理师蒙眼吻海报","152643"
"推文被日方抗议后赵立坚索性将其置顶了","145594"
"住农家乐游客报案遭村民入室性侵","143042"
