"hot_word","hot_word_num"
"易烊千玺抱胖虎女儿","2531968"
"陕西有一块985和211路牌","2528823"
"女子超市偷4000元巧克力只嚼不咽","2461098"
"张哲瀚代言燕京雪鹿啤酒",""
"夏之光微博热评","2399999"
"被公司要求转发朋友圈","2358533"
"高三老师入住学生宿舍全程伴考","2259888"
"北石时光机",""
"明天都给我好好考","2218480"
"邓伦假扮岳云鹏给蔡明打电话","2178630"
"看把小象给摔的","2129096"
"黑龙江鸡西煤矿事故失联8人全部幸存","2067334"
"因摩尔庄园分手了","2000518"
"巴西消费者告赢苹果公司","1975473"
"中山全市开展大规模核酸检测","1899994"
"女孩高考前坐末班车给司机留纸条","1847511"
"近视和老花不能相互抵消","1784237"
"汪小菲太有趣了","1763165"
"张颜齐","1505159"
"邓伦发微博有多严谨","1324907"
"李现晒重庆大学打卡照","1042741"
"林志玲晒照纪念结婚两周年","721277"
"张彬彬把隐形眼镜哭掉了","712455"
"大S妈妈透露大S仍在生气","632419"
"一诺状态","572004"
"连打疫苗都有内卷了","542953"
"各大军校学员为高考生加油","534567"
"刘涛许凯吃西瓜沾盐的表情","533646"
"初晨的露娜","467571"
"有些人比狗还要狗","433827"
"广州地铁好空","348840"
"东风快递员夏日烧烤晚会","345547"
"考生因太紧张连续2天丢失身份证","342781"
"二十岁就参透生死是啥体验","333418"
"赵丽颖生图","323858"
"觉醒年代","308546"
"白俄总理称准备放弃欧美技术","307408"
"张哲瀚ins更新","306279"
"与君初相识剧组杀青","302549"
"一个班级可以有多温暖","301542"
"恰好是少年","300889"
"见过最社死的考试翻车现场","269149"
"论文人在导师面前有多卑微","254376"
"男子隔玻璃给猩猩送吻被回吻","253852"
"nv夺冠","250835"
"专家提醒亚洲象会不惜代价保护小象","247805"
"上学时最爱看的杂志","245015"
"校长为高考生送1个火腿2鸡蛋","244131"
"粗心父亲半年时间两次丢娃","240788"
"迪丽热巴驭鲛记路透","239841"
