"hot_word","hot_word_num"
"姚明明道歉","5042087"
"养母称未见到姚策最后一面","3738925"
"追山河令大结局正确姿势","3671784"
"黄轩终止与HM合作","3643009"
"宋茜终止与HM合作","2942058"
"5杯水如何分给6个领导","981421"
"我们玩的都是老祖宗剩下的","848481"
"涉嫌猥亵女童13岁男孩被家属接回","779055"
"华春莹表示五眼联盟显然搞错了时代","736760"
"尾号55555手机号120万拍出","730891"
"姚明明与女生亲吻","729079"
"MMAQL","727172"
"彭于晏 单身的请举手","724642"
"妇联回应女子疑遭多人暴力侵害视频","721839"
"美国25%亚裔年轻人成种族欺凌目标","719275"
"郑州财经学院一男生在公寓死亡","717440"
"男子离婚330万元房产仅得2.8万元","714963"
"海底捞人均消费超110元","712458"
"马斯克点赞中国碳达峰目标","710174"
"阚清子说不想再压抑自己了","707387"
"戚薇 谁说医生不可以时尚","705998"
"情侣玩密室逃脱吓得抱错女朋友","703698"
"阿米尔汗感染新冠","659223"
"我国计划3年内新建机场超30个","570360"
"十年硬汉无人知 一朝老婆天下闻","566456"
"辛巴宣布复出","529216"
"妹妹长大了","528412"
"特斯拉美国官网支持比特币付款","406504"
"特斯拉ModelY涨价","371200"
"极限挑战录制","370219"
"张彬彬觉得景甜是甜甜的小女生","347553"
"美国侵犯人权报告","331377"
"郑允浩退出Kingdom","323734"
"考察组回应三星堆纵目人后裔研究","314908"
"山河令制片人 请放过我们编剧吧","311828"
"南宁警方调查女子疑遭多人暴力侵害","304851"
"中国坚决反对疫苗民族主义","290751"
"原来兔八哥是这个意思","289067"
"台媒称福原爱通过视频电话提离婚","261133"
"吐槽大会体育专场下半场","240900"
"山河令","234505"
"听姐说","231986"
"2020美国警察只有18天没有杀人","227557"
"风吹麦浪能有多治愈","224488"
"去年美国平均每天110多人死于枪击","223263"
"原来富士山是私人财产","207585"
"腾讯第四季度财报","203815"
"全球最大油画拍获6200万美元","201002"
"抓捕现场民警选择集体说谎","200489"
"成都熊猫专列自带麻将机","199769"
