"hot_word","hot_word_num"
"赵英俊没告诉妈妈自己得病","4214181"
"深圳茶颜悦色已排队3万号","1993275"
"郭德纲首演赵云","1666175"
"陈小纭 讨论抨击我都接受","1525989"
"郭老师","1414359"
"爬个长城爬到一半还得加班","1181372"
"瑞丽急需流调人员和缅语翻译","649445"
"塞尔维亚总统采访中力挺中国","619807"
"十年一品温如言选角","593082"
"刘昊然说袜子不同色是fashion","548774"
"蒋勤勤 建斌诗集随手一翻好多错字","475252"
"台铁事故原因","472246"
"北京市新冠疫苗接种突破1000万人","455841"
"等等让孙俪去医院看看头脑","455641"
"多名证人称弗洛伊德在案发现场已死亡","455563"
"清明假期全国天气预报地图","455310"
"王俊凯因高反错过看流星","455150"
"国际泳联取消跳水世界杯","454751"
"教育部明确3个重要时间保睡眠","454654"
"娜扎侧颜","454452"
"外地户籍迁入温州购房可领5万补助","454122"
"创4学员二创涂鸦海星鹅","454027"
"董明珠三十年没休过假","446137"
"深圳茶颜悦色","425790"
"刘涛 我不端水我举缸","404332"
"华春莹质问美国对台是真关心还是当棋子","301124"
"林依轮两个儿子同台走秀","293229"
"新疆问题教材使用长达13年","292731"
"ATM机一年减少8万台","292651"
"汪东城 希望我明年是真的公开了","292574"
"如何反击别人说你胖了","288257"
"马来西亚外长用中文称呼王毅大哥","283587"
"青你3先导片","266239"
"保持对侮辱英雄烈士等行为的打击震慑","251263"
"向往的生活中国风概念海报","250216"
"李长歌狠强惨","240221"
"恰好是少年发布会","232028"
"长歌行","229018"
"台铁脱轨列车司机确认殉职","209831"
"沈铁部分火车允许农民摆摊","196941"
"宋妍霏科目一考了两次都没过","164174"
"最爱的广式茶点","134286"
"台铁列车脱轨救援现场","103457"
"王鸥对姐姐的理解","102833"
"台铁列车脱轨","101339"
"清明假期出游人次将达1亿","99907"
"追星星的人官宣","98776"
"北京接种新冠疫苗最年长者100岁","97444"
"芹菜青椒降价30%","97118"
"变形计尚成苍爷爷去世","96513"
