"hot_word","hot_word_num"
"尔冬升离场","261945"
"官方通报举报补课被班主任丈夫暴打","193689"
"郭敬明被尔冬升怼哭","160495"
"周冬雨金马金像金鸡三金影后","126025"
"演员请就位","123022"
"我们离婚了","121338"
"隐秘而伟大大结局","118676"
"快乐大本营","115981"
"国务院建议试行企业休眠制度","113589"
"狼殿下","107814"
"黄奕马苏倪虹洁把票让给张月","107442"
"所以贾玲见到刘德华了吗","75393"
"钱学森之子分享父亲的十个感人故事","75037"
"陕西2地店家急寻顾客做核酸检测","74918"
"黄晓明金鸡奖最佳男主角","74855"
"广东一18岁高中生迎娶14岁初中生","74265"
"关晓彤陈飞宇对称表情","68974"
"甘孜机票预定量","63456"
"嫦娥五号顺利进入环月轨道","63215"
"刘念总选举第二","63154"
"周冬雨金鸡奖最佳女主角","52428"
"刘德华 可能明年金鸡奖有我提名","46119"
"搭讪路人偷拍上传涉嫌违法","41118"
"夺冠金鸡奖最佳故事片","40351"
"坐图书馆横梁14小时男子被批捕","40345"
"舞蹈风暴","38889"
"30个专业学位类别将体检","38533"
"嫦娥五号踩了脚太空刹车","38514"
"伊朗称以色列参与暗杀核科学家","38513"
"印小天金鸡奖最佳男配角","38512"
"中山大学副教授否认燕窝是智商税","34692"
"刘耀文和丁程鑫把宋亚轩顶破音了","34547"
"金鸡奖最佳音乐奖空缺","34340"
"2021年起我国将全面禁止进口固体废物","33679"
"星辰大海","33254"
"西藏和四川开始rap battle了","31038"
"丁真肤色跟热干面挺像的","30534"
"人民日报评马保国","29372"
"西安年底前禁用不可降解塑料袋","29043"
"李易峰演技","28964"
"李佳琦直播","27435"
"袁泉金鸡奖最佳女配角","25155"
"绿松石耳坠","23920"
"夏处长没有牺牲","23819"
"KPL","22499"
"丁程鑫画心好唯美","22407"
"持刀凶徒在干警追逃下窜入法院","21910"
"亚冠","21782"
"虐杀动物兜售视频成地下产业链","21536"
"时代少年团演唱会","21530"
