"hot_word","hot_word_num"
"复读生欲弃考好友请假跨省陪考","1967033"
"男子被蜱虫咬后染病毒进ICU","1469060"
"张真源出考场的状态","849997"
"618养猫",""
"新冠在艾滋患者体内突变30次","806334"
"高考数学","759622"
"保密高考卷经历了什么","733382"
"测核酸被挤到脸变形的宝宝","608759"
"3米长鲨鱼排便过猛致脱肛","564307"
"家中起火妈妈慌乱10岁儿子冷静救火","539510"
"觉醒年代","453069"
"没想到我让医生社死了","445536"
"广州疫情感染链17天增至110人","434308"
"哥哥送妹妹到自己4年前考点高考","418415"
"第一天高考结束","415622"
"中国女排 塞尔维亚女排","414097"
"王子文的腰","410479"
"本科和大专的区别","405564"
"千万不要忘记关投屏","401421"
"吴磊赵露思CP感","398962"
"宋妍霏像极了第一次下厨的我","394570"
"男生剪完寸头的颜值变化","389980"
"江疏影 感觉戴个头纱就可以结婚了","385318"
"因为没给加油钱被男友删了","380487"
"养孩子对狗不好","380452"
"广东江门市开平市3.0级地震","372383"
"刘亦菲晒侧身照","368969"
"贾静雯大女儿被陌生人威胁","352102"
"李沁在蔬菜大棚拍写真","309716"
"三家银行宣布支持鸿蒙","298342"
"撒贝宁高考押题小能手","289642"
"把瑜伽垫看成大腿","280099"
"追星三大禁忌","278522"
"王俊凯演的林鸣","251924"
"婚前爸妈让我交出全部积蓄","244558"
"民政部曝光8家涉嫌非法社会组织","229477"
"云南野象群今日暂停迁移","226916"
"英国小哥打卡中国唯一嵌入沙漠的县","224958"
"玉骨遥寒薇结海报","222653"
"杨洋演的于途","222551"
"吴宣仪身材好辣","211248"
"EXO回归","210719"
"叛逆者收视","200291"
"高意被换下去了","199867"
"朱一龙演的林楠笙","198448"
"对话高考作文漫画原作者","194924"
"黄景瑜催更爱上特种兵","169963"
"相亲没成可以要回红包吗","164060"
"大象睡觉","161499"
"再也看不到江苏浙江数学battle了","161185"
