"hot_word","hot_word_num"
"张小斐的妈妈叫王桂香","3418148"
"四点半妈妈","2013919"
"一万个理由爱小白管","1402536"
"Capper道歉","1319165"
"乃万","1312540"
"每条皱纹 都是勋章","1285507"
"第二只外逃豹子后掌疑断裂缺失","1268938"
"三亚跳舞坠楼女子遗体已火化","1224915"
"特斯拉今年已提价6次","1211538"
"俄罗斯卫国战争胜利76周年阅兵","1177044"
"印度男子瞒报行程致香港多人感染","1107991"
"陶昕然","1092279"
"奚梦瑶怀二胎","1002198"
"心疼连淮伟","894387"
"中国母亲对孩子说的话几百年没变","794469"
"我国平均分娩镇痛普及率仅约30%","735939"
"Amu喜内优心在利路修面前的表情","696456"
"鹿晗直播生图","673052"
"中国海军与印尼海军举行联合演练","621436"
"上海等级考","612226"
"高三老师暂停讲课让学生去看晚霞","567551"
"台南号召小便不冲水","538381"
"贾玲 关于这部电影都在酒里了","505385"
"粉丝把范丞丞爸爸认成范丞丞","491588"
"吴尊异地为老婆和妈妈过母亲节","427827"
"宋轶 暗夜行者","421217"
"徐冬冬曾被男友家暴","393725"
"外贸企业再现缺舱缺箱","382809"
"shib","379982"
"第七次全国人口普查主要数据即将公布","378923"
"母亲节快乐","378767"
"戴了口罩也需全脸涂防晒","354537"
"没想到母亲节也社死","281742"
"地铁里的汉服小妹妹","280003"
"欧盟决定暂缓豁免疫苗知识产权","276305"
"妈见打留言本","275495"
"悬崖之上","274092"
"上班第一天直接跑了","260600"
"母亲节鲜花快递量超过情人节","236697"
"女孩买花给开公交的妈妈送惊喜","219966"
"和学霸男友恋爱是什么体验","219115"
"男人的底线有多奇怪","198309"
"天天兄弟合唱萱草花","166282"
"91岁痴呆妈妈收到洋娃娃笑成花","153720"
"妈妈画上老年妆出席班会孩子落泪","138262"
"西藏侦察兵30米外打中摇晃瓶盖","137471"
"妈妈偶尔爱我一下就可以","137283"
"46斤百年巨鳖上岸被捉","133438"
"车辆坠河母亲托举救子","126317"
"狗狗币","119987"
