"hot_word","hot_word_num"
"张艺兴练习生被要求现场卸妆","3969051"
"美国同时出现抗议示威和上街庆祝","2082469"
"尾款人晒单","1770078"
"天津进入战时状态","1763702"
"演员田亮","1611436"
"青春创世纪开播","1323692"
"王源重回地下通道唱旋木","1161835"
"微信表情翻译","1117847"
"拜登向全国发表讲话","841273"
"胡明轩赵睿被罚款","761617"
"特朗普团队正募集6000万美元用于诉讼","733629"
"杨幂双丸子哪吒头","724469"
"日本松叶蟹拍卖最高达16万一只","719772"
"故宫的秋","708379"
"千万别穿和背椅同色的衣服","690288"
"拜登称首要任务是控制疫情","687555"
"立冬后的第一杯奶茶","670882"
"綦美合","664836"
"日本举行立皇嗣之礼","655152"
"当东北食堂开始腌酸菜","607509"
"密逃大厦卖预售票后人去楼空","606049"
"谭松韵温州","571148"
"Uzi","524016"
"武汉一高校食堂员工用脚洗菜","504151"
"原来彩虹圈是这样玩的","343636"
"用一张图证明你压力比我大","323959"
"魏大勋GAI做客王源生日直播","318281"
"翟潇闻缺席R1SE长沙签售会","314363"
"天津疫情防控发布会","308630"
"学校回应食堂员工用脚洗菜","275472"
"天津本地确诊病例详情","274845"
"杨紫女心理师路透","272921"
"马苏发长文","272416"
"恋爱综艺中的意难平","269377"
"危险发言","265870"
"韩国脱发人口达1000万","256927"
"孟佳头发这么少还有假发片","244894"
"脱粉","235715"
"天官赐福宣姬","210855"
"CNN评论员泪洒主播台","185736"
"当你发现算命不准时","182017"
"易烊千玺空军招飞宣传片","180829"
"徐波回应员工自愿降薪","179066"
"家长为了孩子的手工课有多努力","177171"
"谢楠桡骨粉碎性骨折","151515"
"音像协呼吁短视频配乐应取得授权","151377"
"人民空军新版招飞宣传片","151261"
"哈里斯","139701"
"记者中的特殊群体军事记者","139355"
"假如你是李明","139293"
