"hot_word","hot_word_num"
"angelababy ins配图","1069337"
"电视剧女主睡在我家床案一审判决","350327"
"种草纲目","348316"
"日媒称江宏杰语言暴力福原爱","347781"
"和马的眼睛太好看了","326832"
"水城威尼斯严重缺水","266054"
"3分钟了解今年两会为何如此重要","211171"
"赘婿","211093"
"杭州3月14日可领结婚证","210825"
"福原爱回应与男子约会","210347"
"中国最大恐龙足迹点在四川","210005"
"杭州规定开学一个月内不考试","209869"
"外交部回应中美关系民调","209538"
"办案坠楼杭州民警初步脱离危险","209198"
"天津大学南开大学校际互选课程开放","208899"
"创造营","208613"
"孙俪尝试做没有面粉的华夫饼","208315"
"刘西瓜","208205"
"宁毅苏檀儿第二次大婚","194693"
"徐令宜十一娘今天体面了吗","156182"
"刘英三观好正","149374"
"吴白艾情被外公催生","127530"
"1.1亿年前蟑螂亲戚","122633"
"3D还原货拉拉坠车事件经过","112690"
"虞书欣祝赵妈妈生日快乐","110311"
"被吉吉国王笑死","108792"
"央视专访玻璃大王曹德旺","105966"
"多种家电涨价","99450"
"东京奥运会计划不接待国外观众","96472"
"刘耀文牛油果绿造型","95930"
"婚姻是恋爱的终极目标吗","89472"
"替朋友接孩子致其意外受伤被告上法庭","84383"
"杨幂想跟安静学心理学","79171"
"代表建议毕业生体检档案建立共享机制","74353"
"FBI局长称国会暴力是本土恐怖主义","70874"
"近50%的人使用视听设备音量超标","67784"
"力丸刘宇不是撑腰王","67654"
"刚刚过去的冬季为暖冬","66736"
"锦心似玉","64451"
"锦心似玉预告","64355"
"蔡徐坤旋转楼梯","61505"
"周子舒喝酒晒太阳","60147"
"玻利维亚一大学楼道护栏断裂学生坠亡","58666"
"奥利奥的神奇吃法","56776"
"暴风眼","52814"
"北大获10亿元个人捐赠","49434"
"付豪18分","45914"
"货拉拉涉事司机被批捕","45217"
"长沙一小学签晚9点后不做作业协议","44282"
"杨鸣批辽宁队打得臭","43643"
