"hot_word","hot_word_num"
"赵英俊去世","15443248"
"美国正式认定缅甸军方政变","7739710"
"TOMFORD苦桃香水","4419854"
"毛戈平化的赵露思","4419854"
"石原里美感染新冠","3738611"
"新年第一个祝福","2631692"
"人人影视字幕组因盗版视频被查","2009049"
"滑雪滑出了社死现场","1054364"
"乳腺癌已成全球最常见癌症","1038224"
"科大讯飞跌停","1025665"
"仅三成网民月收入在5000元以上","996721"
"张雨剑","982421"
"吴世勋胖了好多","952298"
"硬糖少女官博回应丁太昇","951870"
"黄牛代抢离婚名额广州民政局回应","934141"
"可可西里300多只藏羚羊重回自然","910541"
"友善福","903565"
"金靖吃瓜吃到自己身上","875278"
"男子离婚2天后杀害前妻父母","847836"
"李斯丹妮没有高跟鞋的女艺人","843286"
"大理地震","777603"
"王一博眼尾钉","727737"
"05后的恋爱有多玛丽苏","672097"
"山海情扶贫干部原型因车祸殉职","554264"
"我驻外使领馆向留学生发放春节包","507989"
"爸爸能有多气人","503921"
"刘昊然喝酒一口闷的原因","456276"
"贵州茅台叫停有条件促销","435752"
"郑州提高租房提取公积金额度","435437"
"默克尔承认塞尔维亚接种疫苗比德国快","435247"
"卷福跑路","435173"
"宋寅","423536"
"集不齐五福怎么办","403869"
"人人影视字幕组侵权14人被抓","391283"
"黄强当选四川省省长","374007"
"动物餐厅","371877"
"王者荣耀摇心愿","345592"
"缅甸民众敲锅碗瓢盆鸣笛向军方抗议","337389"
"央视春晚第二次大联排","328631"
"年轻人有必要在大城市买房吗","322046"
"刘耀文加盟百变大咖秀","313449"
"过年版合成大西瓜","310842"
"明星大侦探","269384"
"立春为什么要打春牛","269275"
"视觉瘦五斤瘦脸操","250095"
"哪吒重生终极预告","246420"
"邢菲问演员不能夸自己的作品吗","243678"
"城管没收5匹马8个月花销10万","232138"
"英国维和部队首次由中国军官指挥","214397"
"上门核酸检测医生的vlog日记","212873"
