"hot_word","hot_word_num"
"离婚证必须双方同时领取","2416514"
"明年1月1日起办理离婚将设冷静期","1844263"
"企业凡尔赛大会","1667072"
"李佳琦增补为上海青联委员","1459065"
"孙俪一件衣服穿十年","1430477"
"张雨绮被减肥失败冒犯到","1298764"
"四川失联女子疑在菲律宾遭男友杀害","930535"
"当我妈妈必须先当硕士","884716"
"美发布限制中共党员及家属赴美旅行新规","872954"
"华春莹回应澳总理微信发文被删","858804"
"广州恒大将改名广州队","824273"
"李沁一米长发","795614"
"张子枫古装造型","776304"
"奚梦瑶发长文谈产后抑郁","766836"
"黄一川被执行死刑","750266"
"离婚冷静期实施条款","746762"
"Sunnee机场要邓紫棋签名","745943"
"丁真的舅舅像疯了的郑伊健","743661"
"掌中之物","722503"
"凶宅试住主播","690351"
"00后男生眼线消费增速是女生4倍","683314"
"骑爸爸最好的马 骑珍珠","678550"
"丁真直播","648527"
"丁真的舅舅简直是糊弄学大师","557413"
"澳总理希望与中国建设性接触","542770"
"丁真高原藏族妆","542175"
"王霏霏在逃香水图鉴","477748"
"生日快乐是别人的","417135"
"教育部答复义务教育改为十二年制建议","403329"
"申花","392716"
"连电视剧都不敢这么拍","390933"
"唐嫣摄影师回应粉丝不满","350296"
"木子洋室内抽烟","349898"
"离婚冷静期有必要吗","264679"
"拜登拟任命亚洲事务主管","260573"
"冬季护肤误区","259710"
"丁真有多爱他的小马珍珠","245924"
"阿里拍卖回应招募凶宅试住主播","217667"
"Uzi解说GNR","216500"
"2020年将为有记录以来最暖年份之一","215977"
"东北民房着火村民铲雪灭火","214262"
"你镜头下的初雪","212963"
"云南初中学生体育音乐美术考试方案","212428"
"马斯克称人类应该提防人口崩溃","211215"
"体育老师示范动作有多可爱","204177"
"南北方搓澡文化的差异","202104"
"很多美国网友称去年12月已感染新冠","197784"
"浙江玉环一份进口冷冻猪肉标本核酸阳性","197486"
"刘雯在走廊走出秀场的感觉","197446"
"浙江玉环阳性冻猪肉密接55人已隔离","196725"
