"hot_word","hot_word_num"
"夫人泪别袁隆平","4920292"
"吴孟超灵堂放的是国际歌","1337396"
"袁隆平家属以书面形式致答谢辞","1193497"
"引发西安两大学争议地铁站名确定","1066033"
"我国现有疫苗可应对外国变异株","1060512"
"袁隆平遗体送别仪式","1026991"
"印度成第3个新冠死亡病例超30万国家","921243"
"袁老身上覆盖着鲜红的国旗","893702"
"我国新冠疫苗接种超5亿剂次","710710"
"科技部沉痛悼念袁隆平","692983"
"宋丹丹张翰 尴尬","657794"
"下了半个月雨的长沙放晴了","606867"
"死亡越野赛背后公司员工仅22人","589018"
"倒也不必这么冷静","587115"
"马拉松事故里去世的残运会冠军","583867"
"前来吊唁的群众为袁老带来了气排球","580229"
"河北一中学发生砍人事件","578417"
"金希澈","571624"
"美团 微信支付","567864"
"上海试点公积金异地还房贷","567299"
"李昇基李多寅恋情","561751"
"李光洙录制最后一期RM","560758"
"美图炒币亏损1300万","560334"
"小伙身陷传销组织手指写110获救","553601"
"一个合格男朋友的自我修养","488663"
"施展 聊天记录","482442"
"美国新冠康复者出现巨舌症","472800"
"施展否认聊天记录","461478"
"61岁农民背龙凤胎外孙送别袁老","428822"
"清华成立量子信息班","399739"
"当我买了一个汉服盲盒","394889"
"袁隆平梦想后继有人","353832"
"比新郎官还紧张的司仪","350897"
"官方回应电视台重播马拉松开幕式","324851"
"我的暗恋行为被室友直播了","316567"
"Homme祝贺并感谢RNG","294485"
"军人爸爸拄拐回家儿子不敢相认","263326"
"印度数千毛霉菌患者为保命或摘眼球","262251"
"饥荒的时候有多可怕","260082"
"揭秘中情局操纵涉疆谎言过程","255455"
"丰巢科技被行政处罚5万","248170"
"赵立坚说袁隆平的梦想一定会实现","245295"
"小区里的社死现场","244551"
"女子被骗22万后绝地反杀引诱骗子回国","243954"
"兵王潜水员遭遇鲨鱼群","230895"
"吉安师生国旗下缅怀袁隆平","229483"
"市民写给袁老的留言看哭了","221212"
"年轻人为什么如此反感团建","218584"
"寂静之地2定档","217907"
"尽量不要用玻璃吸管","207466"
