"hot_word","hot_word_num"
"莫文蔚 杜嘉班纳","2173529"
"台湾疫情","2029514"
"四级翻译 铁观音","950404"
"黄健翔滴滴特惠快车猜球",""
"金靖写给李佳琦的信","949653"
"一个苹果就能换国宝的仔","948856"
"易烊千玺有什么不会","924603"
"网红私自进校园拍摄被警告","622242"
"广州近6成确诊以为自己只是感冒","597482"
"让你包粽子不是绑架粽子","501262"
"雾化吸入型疫苗配方不变","487733"
"78岁爷爷千里送孙子投案","474302"
"六级","370196"
"澳大利亚发现恐龙新物种","366428"
"黄磊彭昱畅完成10公里长跑","361897"
"美国旧金山湾区近2百万人缺水","361651"
"金靖男朋友","357651"
"王安安","355916"
"袁姗姗签名签了个寂寞","353146"
"Angelababy金簪红衣造型","351558"
"停电时千万别让爸爸讲故事","348628"
"大S ins","347412"
"以为violent是小提琴","344407"
"时代峰峻工作人员假扮马嘉祺","342404"
"粽子","338496"
"抚顺有村民发现猫科动物踪迹","337629"
"男生的梦中情房","335835"
"澳大利亚一只鹦鹉假装吃面包屑","325256"
"业主因点外卖遭业委会砸门威胁","302602"
"宋妍霏爸爸年轻时的照片","298742"
"杨洁篪就涉疆涉港问题表明严正立场","285556"
"车祸也无法阻止爱学习的心","284893"
"上班和上学哪个更辛苦","274875"
"老师拨穗时男生直接亲上去","271429"
"武汉首趟禁毒地铁开行","182325"
"国足5比0马尔代夫","179872"
"广州拟推居住地疫苗预约功能","177492"
"朝鲜族大娘头顶满盆粽子送民警","171150"
"三星堆的土也是文物","150676"
"腾讯整治饭圈乱象","145093"
"绿皮火车上的美食去哪了","138783"
"杨紫杨迪魔性斗舞","138087"
"印度妇女委员会谈性侵案频发原因","137804"
"张艺兴加盟这就是街舞4","137329"
"周华健为儿子庆祝31岁生日","136990"
"热带往事","136447"
"6000万剂强生公司新冠疫苗或报废","135989"
"男子收快递被诅咒","135377"
"亲密关系里的语言暴力","135008"
"老民警讲述抓捕杀害李大钊凶手过程","134648"
