"hot_word","hot_word_num"
"张翰工作室声明","192568"
"多方发声驳斥美西方插手香港事务","112551"
"不公布考试成绩和排名","90472"
"自贡灯会","90077"
"咸素媛陈华计划生二胎","86496"
"释放真我不设限","79436"
"中国有超3亿人存在睡眠障碍","77206"
"显卡价格暴涨","65746"
"李诞黑尾酱合资公司注销","57644"
"清华规定申请硕士学位不必发表论文","57099"
"青春有你","56263"
"郭美美等销售违禁减肥食品被刑拘","55787"
"婆婆回应陈松伶放弃生育","55384"
"中国翻拍忠犬八公","54301"
"中美高层战略对话中方代表团抵达美国","54081"
"顶楼","52832"
"向往的生活路透","52772"
"深夜网约车改道女生害怕报警","48312"
"人间可以有多可爱","46291"
"王晶翁虹等香港艺人力挺爱国者治港","43476"
"考拉打架打输哭到声音沙哑","37432"
"黄圣依杨子对视哭了","36347"
"周深一秒转18个音","34471"
"蓝鲸误入繁殖地被75只虎鲸吃掉","33800"
"斗罗大陆超长花絮","31916"
"LISA说梁森像一休哥在跳舞","31123"
"父母让孩子窒息的教育方式","29726"
"广州多家银行严查购房首付来源","28903"
"近百年前男孩自信用英文介绍中国","27768"
"吴世勋金珉锡都暻秀看朴灿烈新电影","27053"
"Doinb","25850"
"杜淳最大的黑粉是王灿","24535"
"觉醒年代","24364"
"锦心似玉","24195"
"中方敦促美国立即停止侵犯人权","24186"
"90后炒熊一只最多赚数万元","24185"
"天津狗不理公司被注销","23647"
"印尼知名女运动员被确认为男性","23408"
"西虹市首富涉侵权案开庭","22166"
"18个新职业发布","22036"
"成都人民公园整治相亲角","21258"
"山河令","21053"
"义务教育质量评价指南发布","20942"
"法院认定小猪佩奇商标为驰名商标","20331"
"清华团队研发出液态金属外骨骼","19253"
"张新成问我的称什么时候坏了","18811"
"西安新增1例本土确诊病例","18796"
"一诺鲁班四杀","18231"
"余景天拿A开心到扇自己巴掌","18184"
"亚特兰大枪击案","17965"
