"hot_word","hot_word_num"
"白金汉宫宣布菲利普亲王去世","3312565"
"辛巴团队称遭职业打假人电话敲诈","2406311"
"Angelababy版全民奇迹2","2153471"
"张彬彬没把钟汉良微信推给景甜","2045111"
"闲鱼涉嫌发布违规租赁信息被约谈","1502802"
"刘昊然清爽神颜","1501547"
"陈小纭微博小尾巴是关你peace","1500186"
"张馨予隔空表白老公","1303286"
"日本政府基本决定将福岛核污水排入大海","1223104"
"幼儿连续用电子产品不宜超过15分钟","1196449"
"警方回应辛巴报案称遭打假人敲诈","1175462"
"李易峰说傻子才不拍号手就位","1171574"
"张雨剑吴倩带女儿出游","722461"
"刘若英力挺林依晨","579281"
"李兰娟呼吁尽早接种新冠疫苗","500533"
"巨型粉色兔子消失了","457477"
"允许非居民在海南自由贸易港内买房","410630"
"唐嫣为吕一打call","407645"
"龚俊 厦门","405125"
"皓嫣","404375"
"医生一铁锹拍翻持刀施暴男子","400137"
"曾黎恋情","398333"
"杨丞琳听到观众喊李荣浩的表情","395598"
"创造营粉丝见面会","394344"
"医学专家称弗洛伊德死于缺氧","387001"
"林一新剧上头","386879"
"水果蘸了辣椒后","348201"
"百世极兔因低价倾销被罚","326346"
"幼儿园不得设学前班","323390"
"马斯克公布猴子用意念打游戏视频","321675"
"汤姆的梦中情猫","321617"
"邓超说跟孙俪旅行是锻炼铁人三项","321311"
"各大视频平台影视公司联合声明","297258"
"那英被迫甜美营业","257671"
"小学严格执行免试就近入学","249544"
"不该为前置镜头焦虑的原因","248361"
"长歌行李乐嫣仿妆","247708"
"原来宠物也会争宠","225753"
"中学设情绪发泄室让学生解压","200034"
"荡个秋千拍出了笔仙的感觉","187320"
"极限挑战路透","182235"
"见过最硬气的撒娇方式","177248"
"龚俊乔欣 沉睡花园","158261"
"女子剪掉全球最长指甲","153388"
"人脸识别第一案终审宣判","149647"
"外交部回应日本将核污水排入大海","149179"
"LPL","149102"
"峨眉山金顶首次拍到小熊猫","144571"
"皓衣行","138441"
"公开人肉他人信息是否违法","134847"
