"hot_word","hot_word_num"
"部分男性对丁真的态度","2454168"
"成都网警回应20岁确诊女孩发声","1880325"
"成毅为ta过25岁生日","1626243"
"黄圣依方否认10万坑位费只卖出5个杯子","1456855"
"教资69分","1443495"
"外卖吃出了散文的感觉","1378500"
"专家建议放开三胎","1363912"
"金晨害怕陈一鸣接受不了金大喜","1359940"
"拜登宣布上任百天实现三大目标","1335197"
"教资","1323049"
"不愧是潮汕的大学宿舍","1314213"
"金莎被耿斯汉写的歌感动哭了","1297939"
"NASA收获史上首批太空萝卜","1278608"
"隔离期满近1月后再确诊","1255991"
"考研准考证12月10日起可打印","1243036"
"房子塌了 无人伤亡","1227961"
"霍思燕","1222497"
"易烊千玺武汉","1169448"
"5cm看出一个人的格局","925477"
"张一鸣在游戏群批员工上班时聊游戏","717447"
"江苏卫视跨年首波阵容","659301"
"教资笔试成绩","501824"
"江疏影喊话娜扎请叫我发量富翁","470857"
"男子怄气兑2万枚一毛币付赔偿款","355991"
"教资综合素质","355851"
"当法国人在中国超市","349247"
"李佳恩","343838"
"不同年龄段分手","337676"
"湖北向蒙古国回赠物资","286655"
"为了进成家班能有多拼","285297"
"印度不明怪病初步调查结果","273848"
"张子枫兔子礼帽大片","262872"
"对女朋友讲道理的下场","261221"
"拜登任命美国首位非裔国防部长","251863"
"狼殿下韩国定档","249356"
"没必要凝视下水道","248305"
"孟佳脸上的唇印是林允亲的","230781"
"假如用饭圈方式回复爸妈","230619"
"陈强墨墨在一起了","223250"
"成都20岁确诊女孩发声","220873"
"国人日均在线休闲时间4.9小时","211154"
"任言恺适合花城","204961"
"刘耀文机票掉坑里了","203031"
"LPL全明星延期","202925"
"女儿们的恋爱","202843"
"特斯拉被禁止大肆砍伐森林","201536"
"眉山警方通报12岁女孩坠亡","201494"
"天官赐福影视化","201489"
"全球城市经济竞争力排名","195974"
"一个掉毛一个粘毛的爱情","195177"
