"hot_word","hot_word_num"
"花呗借呗不得向大学生放款","1899701"
"中国有超3亿人存在睡眠障碍","1207567"
"张小斐 我不要面子的吗","1150366"
"西安新增1例本土确诊病例","793673"
"陆川说高晓松暴瘦到单薄","768653"
"释放真我不设限","739998"
"中方敦促美国立即停止侵犯人权","730949"
"NASA称火星地壳下可能含有大量水","666066"
"腾讯阿里字节跳动等11家企业被约谈","579503"
"山河令","552079"
"朱珠结婚","546767"
"李亚鹏","538100"
"义务教育质量评价指南发布","523906"
"福州滴滴司机案发后自述音频曝光","523824"
"美国亚裔奶奶反击袭击者","522655"
"聊城禁止校长老师带手机进课堂","521097"
"默读","519609"
"深圳一幼婴掉进床缝窒息身亡","519150"
"范丞丞湿发朋克封面","518327"
"锦心似玉","517367"
"近百年前男孩自信用英文介绍中国","488536"
"蓝盈莹吕一小手拉大手","464183"
"为免费吃日本寿司改名鲑鱼","431252"
"邓超晒和孙俪合照","350423"
"抑郁症早期的4大征兆","347312"
"今天是沸羊羊的生日","319084"
"创4学员睡衣趴造型","311925"
"张一得","309433"
"崔天凯说中方核心利益没有妥协余地","286439"
"武汉近六成申请离婚夫妻放弃登记","280033"
"104岁炒股奶奶","264787"
"恋恋小酒窝定档","250364"
"女孩遇车祸高位截瘫后成时尚博主","245901"
"崔天凯谈中美高层战略对话","240270"
"黄峥向浙大捐赠一亿美金","237431"
"西藏冒险王遗体疑似被找到","237297"
"当小朋友走累了","236445"
"公司强收离职员工4200元工装费","224114"
"吴镇宇女装照","215422"
"司藤","213800"
"乘风破浪的姐姐四公造型","203357"
"景甜童年照","201935"
"医学生的奇葩操作","193874"
"84岁奶奶7年创作300多幅农民画","184269"
"亚足联宣布江苏队退出亚冠","178590"
"你是我的城池营垒","177436"
"福州撞死乘客司机弟弟鞠躬致歉","174906"
"虔诚被轮换","170132"
"银行回应推出墓地按揭贷","170128"
"河北蠡县一家五口被害身亡","169846"
