"hot_word","hot_word_num"
"建议鼓励大中小学开设学农实践","2073504"
"梁振英感叹国家给了香港多少机遇","1702813"
"惊 卫生巾都有气垫了","1486153"
"代表连续4年建议牡丹为国花","800062"
"张桂梅说女高校训给了孩子们自信","722940"
"种草纲目","705486"
"建议设立国家汉服日","700846"
"米卡的睫毛比头发还长","691257"
"政协委员回应芯片卡脖子问题","664502"
"小朋友对喜欢的解释","658876"
"代表建议适当延长节假日拉动消费","595595"
"吴孟达曾带一麻袋现金到汶川救助","592249"
"视障阿姨因导盲犬排尿被邻居投诉2年","589604"
"吴孟达","587364"
"陈飞宇emoji解读","583610"
"全国政协十三届四次会议委员通道","578770"
"全国政协十三届四次会议第二次全体会议","575877"
"为什么女老板越来越多","572019"
"NBA总裁拒绝更换联盟Logo","570261"
"美国钢铁价格高于全球市场价格近七成","566648"
"宋茜把冉高鸣假发片吹开屏","564667"
"听过最凡尔赛的名字","560580"
"马嘉祺艺考总分186","555013"
"宋亚东UFC首败","553758"
"拜仁连进4球逆转多特","550826"
"2035年的中国什么样","547686"
"王子文吴永恩逛街被围观","536161"
"过期霉变食物或可致肝癌","505194"
"女生节","473565"
"国际油价连续上涨再创新高","339025"
"思维导图版十四五主要目标","333297"
"第二场委员通道采访直播","310971"
"皓衣行","310100"
"00后贫富差距特别大吗","304373"
"政协委员称分数不是教育的全部","279653"
"李晟一人分饰两角","262456"
"建议家庭教育立法让父母持证上岗","260870"
"政协委员谈好的教育应该是什么","246875"
"中国计划2022年前后完成空间站建设","241172"
"跨越种族的友情有多美好","224830"
"米卡醉拳直拍","219191"
"建议防止和纠正幼儿园小学化现象","217749"
"代表建议将肿瘤筛查纳入医保","217404"
"锦心似玉","215872"
"假扮混入马群被识破后","198127"
"马嘉祺记得给张纪中老师微信","194259"
"拜登宣布本月起发放1400美元纾困金","188198"
"殷桃看温如雪怼插队被爽到","186878"
"医院里最硬核的大爷","185537"
"如何看待明星与经纪人的关系","165060"
