"hot_word","hot_word_num"
"磊枫","4970019"
"男子即将跳伞时被路人发现没系安全带","1945045"
"邱泽演技","1701001"
"淘宝直播功夫大片yyds",""
"一套139平房子用60万能装修成什么样","1528790"
"热依扎 下部戏继续好好的演","1292845"
"苏炳添9秒98","880986"
"微博好物节",""
"男子拖欠孩子13年抚养费被强制执行","855945"
"摩尔庄园鲨鱼","819780"
"新冠疫苗完成接种6个月后是否需补打","685995"
"杨洁篪应约同美国国务卿布林肯通电话","680323"
"金靖逗蔡徐坤","673963"
"范丞丞工作室理智追星倡导书","669950"
"向往的生活","662929"
"以为张哲瀚抱了一个抱枕","657244"
"苏炳添在短跑界是什么水平","613425"
"朋友偷偷买了袋魔芋爽","583291"
"房租占了工资一半是啥体验","571380"
"作业帮前员工自曝造假套路","546024"
"上海电影节","521267"
"1分的差距可以有多大","510824"
"男子婚后被前女友跟踪骚扰3年","510592"
"甘肃景泰县委原书记坠楼身亡","464945"
"用HR的方式拒绝HR","426090"
"广州一家六口确诊感染患者否认瞒报","423861"
"杨洋迪丽热巴工作室联合倡议书","407540"
"当我跟爸妈分享蓝黑白金裙","402479"
"69岁垃圾站女工从监控中消失","385050"
"广东无考生因疫情退出高考","352707"
"云南象群总有两只象站岗守护同伴","351818"
"想念一个人到极致是什么感觉","329355"
"奔跑吧","315143"
"顶楼3","311903"
"白银市委书记等27名公职人员被问责","306839"
"小伙做品虾师一年吃掉3吨小龙虾","305446"
"那英回应把宋亚轩关注成萧亚轩","304189"
"螺蛳粉臭豆腐粽","300959"
"长沙地铁延长运营至24点","299599"
"马嘉祺晒和张颂文合照","298545"
"张子枫找吴磊握手","297099"
"货车高速公路翻车司机满地抓兔子","295645"
"法网2021","293414"
"DYG TES","289739"
"杨紫藏烟灰缸太努力了","289298"
"不小心进化成了美食","285463"
"李佳琦直播","285071"
"吴磊张子枫说悄悄话","279298"
"战士入伍3年后回家被妈妈当成顾客","267767"
"超市诬陷孩子偷窃家长要求道歉被拒","263578"
