"hot_word","hot_word_num"
"民警查嫖娼反被当作仙人跳","193451"
"终于等到庆余年2","88081"
"埃里克森倒地黄金救援14分钟恢复意识","71093"
"长期不上班会导致什么后果","71055"
"长成这样谁还网恋","70486"
"成都一食品企业6人掉废水池死亡","68589"
"小象睡觉实力演绎蹬鼻子上脸","65607"
"李光洙最后一期RM","64761"
"拍摄者详述男孩进女更衣室事件经过","63142"
"95后核酸检测员通宵单手拧管2000余次","60096"
"欧洲杯","59619"
"英格兰 克罗地亚","57692"
"洛神水赋摄影师泡水太久曾毛细血管破裂","45897"
"原来体检才是社死第一名","43294"
"有些肩颈痛按摩可能会加重","42535"
"张钧甯为新戏瘦了十几斤","42494"
"林允晒和张蓝心亲密旧照","41997"
"贾乃亮终于赢了","41925"
"穷不过三代是什么意思","41569"
"杨紫说看了阳光姐妹淘哭惨了","41390"
"刘彰 QQ空间贴吧发言","40963"
"中国女排 多米尼加女排","40838"
"反对父母生二胎是自私吗","40588"
"邓家佳深V","38619"
"男子游泳偶遇小鸭子被当成顺风船","37493"
"你认识的有钱人是怎样生活的","37369"
"煮血肠的时候一定要谨慎","37220"
"被王梦洁气到","35331"
"连猫咪都知道防晒了","34856"
"外籍船舶在中国海域违法排污","32439"
"cp发糖可不可以内卷","31840"
"洛神水赋女演员回应节目走红","31415"
"甄子丹谢霆锋发布会现场落泪","31343"
"狐妖小红娘竹业篇 李现","30858"
"建党100周年庆祝大会首次综合演练","30753"
"BBC播放埃里克森治疗及妻子哭泣特写","30745"
"有个偏心的妈妈是什么体验","29755"
"是cp终究会被看出来","28598"
"R1SE毕业发言","28483"
"岳云鹏被邓伦敲车窗受到惊吓","28219"
"天天向上","27006"
"极限挑战","24904"
"黄景瑜成李沁微博铁粉","23870"
"翟潇闻ending镜头","23134"
"何洛洛录最后一首歌哭了","23073"
"河北三河公布1密接者行动轨迹","22023"
"粽子","20644"
"洛神水赋舞飞天由拉鱼线实现","19561"
"英格兰战胜克罗地亚","19239"
"家长晒孩子高考前后伙食对比","18078"
