"hot_word","hot_word_num"
"李银河评我的姐姐","2092054"
"我国有约2000万名烈士","1750126"
"吴磊把粉丝送的笋吃了","1739563"
"独居女生坐电梯的小心机","1287158"
"原来派大星的坐姿是真的","829028"
"白敬亭脱鞋脱了个寂寞","805784"
"我的姐姐票房破亿","750623"
"科研人员发现中医经络存在证据","711718"
"妈妈在陈红军墓前摆满他爱吃的菜","585058"
"王子文不让贾玲跑","545527"
"顶楼主演囚服自拍","453134"
"美式咖啡用英语怎么说","396435"
"我的姐姐","379802"
"大学老师课上讲焦裕禄故事动情落泪","362264"
"陈红军妻子和孩子说好好看看爸爸","355175"
"刘嘉玲问大张伟为什么一直模仿梁朝伟","352507"
"Angelababy晒樱花自拍","347824"
"妻子的浪漫旅行5定档","342615"
"华为撤销云与计算BG部门","336889"
"我的姐姐开分","326753"
"被校园恋爱甜到了","322400"
"印度人大壶节跳入恒河沐浴","319982"
"金刚手语小女孩","277303"
"老人每周都为亡妻买3支玫瑰","268791"
"男子回家扫墓见孤单父亲大哭","264790"
"官方回应女鼓手称父亲操作大学成绩","235338"
"运20和歼11B飞行员完整对话首度公开","221590"
"库里秀功夫","221510"
"台铁局称列车脱轨系工程车滑落导致","221494"
"新疆反恐纪录片厅官接触暴恐头目","221489"
"刘惜君赵磊 不该","211291"
"网友委托快递员给陈红军烈士献花","204300"
"故宫七彩祥云心形太阳","169221"
"台铁脱轨事故仍有200人等待救援","167176"
"假如能和五年前通话一分钟","166496"
"拜登下令白宫降半旗向埃文斯致哀","164646"
"补偿式返乡","161747"
"叶青 定妆照","160732"
"人类发现银河系超高能宇宙线源存在证据","147344"
"对付猫的一百种损招","138491"
"王一博工作室辟谣出演将门毒后","138271"
"如何看待没有时间观念的朋友","135798"
"记者播报时被狗狗抢走话筒","133204"
"山河令","128909"
"男子月薪5万征婚被骂过于自信","128665"
"台铁事故中一名大陆学生轻微擦伤","128554"
"长歌行","126755"
"警校生女儿追忆牺牲警察父亲","125674"
"快跑","125023"
"重庆平流雾","121929"
