"hot_word","hot_word_num"
"赵英俊追悼会","3956327"
"世卫专家称武汉实验室泄露病毒毫无根据","3153203"
"周杰伦瘦了","3044606"
"微信红包封面","2911854"
"青岛困难户","2900941"
"伍佰王千源爆笑视频","2768404"
"苹果眼镜可检测用户何时分心","2741257"
"红黄蓝等涉德勤被举报违规审计事件","2641050"
"中国将向叙利亚提供15万剂新冠疫苗援助","2479053"
"薛之谦曾全程陪同赵英俊治疗","2378484"
"娜扎 心里是脏的看什么都是脏的","1640894"
"韩国东东","1041679"
"乘风破浪的姐姐2一公","1020891"
"斗罗大陆","1002321"
"那英听到张柏芝要选她的反应","996648"
"吴宣仪演的小舞","729011"
"顺丰超6亿元激励春节留岗员工","566679"
"上海严禁诱导一次性支付超3个月房租","550570"
"下嵌式的床能有安全感吗","442566"
"安又琪董璇李慧珍刘烨汤晶媚淘汰","440722"
"刘昊然法号浩然","439755"
"吉克隽逸周笔畅胡静单脚高跟鞋舞","439021"
"陈伟霆拍女生被对方男友要求删除","437990"
"北京支持部分机构企事业单位向雄安转移","430184"
"肖战原声台词","426318"
"央视春晚第三次大联排","415228"
"合成大西瓜","386395"
"小米四曲瀑布屏","376004"
"圭亚那终止与台湾设办公室协议","346689"
"易烊千玺嘉人封面预告","345200"
"螺蛳粉焖饭","300036"
"特朗普退出美国演员工会","287302"
"德勤员工群发PPT举报违规","276621"
"CGTN反对英国吊销落地许可","272573"
"节奏大师宣布暂停运营","269995"
"旧手机应不应该给父母用","261574"
"青岛调查困难户家摆放高档酒","241797"
"天津95后大学生脑电波写福字","236901"
"快手上市","201835"
"德勤官方声明","190000"
"陕西新人结婚当天出现小龙卷风","188363"
"微博会员","177972"
"原来春联也要与时俱进","175007"
"唐三左手的锤保护右手的草","172428"
"股市","172291"
"虾米音乐最后一天的日推歌单","172290"
"浙江宁波实行临时限制供水","168408"
"上海育婴师工资8千起步","165826"
"顺丰临时停牌","165176"
"大年初一少林寺预售","164904"
