"hot_word","hot_word_num"
"郑爽向金晨道歉","4001075"
"教育局通报小学生排队被老师竹板打手","3183524"
"黄明昊起名鬼才","3118833"
"丁真道歉信","2860068"
"乌合之众","1497333"
"口罩拉到下巴处会增加传染风险","1387724"
"虞书欣道歉","1239455"
"40岁女子在贝加尔湖冰面下游85米","1048278"
"蓝鲸一口够我吃一年","897838"
"特朗普称民主党人弹劾我对美国很危险","831749"
"俄罗斯一女子体内发现18种变异新冠病毒","791240"
"无骨鸡爪原来是这样脱骨的","635188"
"THE9否认虞书欣未按要求隔离","565333"
"于家翊见不到张豆豆时每天录视频","477223"
"石家庄有人核酸检测6次才呈阳性","457152"
"微信屏蔽拼多多小红书等外链","452319"
"虞书欣 隔离","441695"
"杨紫井柏然吻戏路透","435226"
"黄子韬随地吐痰","431508"
"基金","421266"
"男子买特斯拉股票身价千万宣布退休","419483"
"男子约见男网友睡醒钱被转走","418484"
"发腮","414814"
"道歉日","413049"
"威海新增1例无症状详情","412237"
"武汉快递今年春节不打烊","408720"
"明星大侦探","406600"
"国药控股董事长因个人原因辞职","405563"
"中南财经政法大学","404982"
"美众议院通过罢免特朗普决议草案","404838"
"浙江嘉兴发现1例石家庄输入无症状","404827"
"尼格买提问傅菁为什么大家叫她老公","404812"
"金莎 真实的浪漫不是投我所好","399255"
"廊坊","385031"
"YouTube下架特朗普新视频","384725"
"流金岁月","383085"
"万达长白山187套别墅全拆除","382089"
"偶像的另一面有多可爱","379577"
"上阳赋制作班底","379060"
"同一屋檐下吐槽太好笑了","377863"
"退役军人爬楼救2岁幼童摔骨折","375466"
"乔丹体育更名为中乔体育","375020"
"上阳赋里的电影级画面","372813"
"湖人双杀火箭","371474"
"汤普森现场观战勇士","369666"
"杭州降低职工医保缴费比例","369507"
"格林9记三分","368101"
"赵丽颖向防疫人员致敬","366799"
"大妈掏400元想让公交变专车","336212"
"怎么会有这么乖的狗子","335763"
