"hot_word","hot_word_num"
"韩美娟想复活回去看龚俊","2444397"
"只有10％被蜱虫叮咬的人会发病","1731094"
"新一代国潮好奶粉","1683960"
"王子文吴永恩在一起了","1664708"
"唐晓天直接把吴昕拎起来了","1619973"
"走在星环上的孩子","1581659"
"肯德基 消毒水","1380505"
"害羞的男孩子有多可爱","1287928"
"恋综天花板","1181936"
"菲利普亲王葬礼将于17日举行","1102609"
"年轻人也可能得帕金森病","1012675"
"杜江嗯哼冲浪","893540"
"商务部回应美方打压7家中国超算实体","880925"
"张九龄德云九队队长","874866"
"郭麒麟终于穿大褂了","859327"
"北京疾控发布接种新冠疫苗提示","842367"
"打疫苗时都变成了小朋友","837970"
"梁森 我要出道且高位出道","828347"
"刘涛珍惜每一次面对镜头的机会","689146"
"多国房价再创新高","674418"
"印度一山羊宝宝长出人脸","663532"
"湖人 篮网","505302"
"演唱会社死现场","480332"
"大同卫健委回应医生自曝收50万回扣","461306"
"小学严格执行免试就近入学","449713"
"两百多天能掉多少头发","445705"
"每一只猫爪都是小熊软糖","375090"
"22岁大学生在看守所完成论文答辩","355873"
"皇马战胜巴萨","355523"
"狗狗为了干饭有多努力","355276"
"王琳 方磊","350169"
"浪浪钉","336522"
"头一次见到房景房","269453"
"虞书欣王鹤棣反击代拍","247515"
"乒乓外交五十年","233498"
"黄奕崔伟牵手","228774"
"央视揭秘量子概念产品","218928"
"长歌行","202559"
"新疆一煤矿发生透水事故21人被困","201796"
"G2输了","191058"
"伊能静儿子 我爱岚妹岚妹爱我","189645"
"怦然再心动大结局","168536"
"毛不易 沙发都被我坐出坑了","160755"
"欧文极限拉杆","153850"
"欧文施罗德被驱逐","153802"
"扬州百米高风力发电机倒塌","153767"
"瑞丽4月11日起第3轮全员核酸检测","127797"
"杜兰特飞身暴扣","123980"
"纸扇书生实景拍摄只用了4天","123532"
"老师的朋友圈有多好玩","122020"
