"hot_word","hot_word_num"
"董子健接单代骂谢宏祖","3158313"
"两名中国人在柬埔寨遇害","2847310"
"光良身材","2612016"
"蔡徐坤 歌是我写的白酒不是我喝的","1934639"
"南宁确诊1例新冠肺炎病例","1804283"
"2021第一抹红","1341064"
"叶谨言第一次见朱锁锁穿的满身钥匙","1326737"
"河北通报死亡病例原因","1144713"
"中国白酒英文名改了","1129098"
"东莞新增1例无症状感染者","1123265"
"江疏影希望孙艺珍演王漫妮","1120621"
"阚清子想演傅慎行","818968"
"急寻K350和Z158列车乘客","708078"
"杭州制定3岁以下婴幼儿照护服务政策","606362"
"姚安娜出道","578072"
"郑渊洁十年前寻找小读者","552657"
"罗晋 都当网红谁种地","545861"
"腾讯7款App遭广东责令整改","519490"
"福牛","516709"
"男朋友在迪士尼的真实状态","513867"
"合肥大润发","511015"
"南宁疫情","503928"
"麦当劳肉夹馍被曝肉量极少遭吐嘈","503538"
"中国将向海外留学生等发放春节包","503293"
"罗云熙被大妈拉着相亲","503211"
"天津大桥道","472448"
"中国成唯一货物贸易正增长主要经济体","453358"
"基金","442333"
"朴槿惠累计获刑22年","440322"
"韩国首尔发布孕妇指南遭抵制","439318"
"slay全场的小女孩","388958"
"怀疑歌手吃了cd的瞬间","388904"
"南宁虎丘","369620"
"张新成city of stars","355153"
"上海拟建议夫妻共用育儿假","331940"
"关晓彤造型师的求生欲","327919"
"白敬亭想要财富自由","314007"
"孟晚舟","307094"
"男生画女团妆是什么体验","305310"
"放假后滞留石家庄大学生共2127人","302684"
"杭州鼓励打车尽量坐后排","301563"
"易烊千玺的生命清单","299922"
"人民日报评女子不配合防疫登记","296759"
"天津工厂爆炸已造成1死7伤","295350"
"日本鸡肉每公斤近50元","291330"
"大女主新年转运妆","290604"
"韩国将翻拍三十而已","288916"
"Zoom剑魔","282531"
"天津伊势丹","279738"
"上阳赋","279481"
