"hot_word","hot_word_num"
"HM最新声明全文没提新疆","3122967"
"朱珠孕肚","2475081"
"易烊千玺申请冻结侵权公司财产","2295274"
"焦恩俊称与林千钰和平分开","2148377"
"HM在华关闭约20家门店","2042150"
"夜明金性坚今夜不回家","1526342"
"时尚芭莎年度派对","1475327"
"中戏成绩","1398648"
"水貂和猫等动物对新冠病毒高度易感","1357951"
"丁真以为要举右手打招呼","1357722"
"白敬亭 王子走红毯","1248021"
"与福原爱约会男子否认恋情","982505"
"钟南山说不抓紧打疫苗有危险","945336"
"中国是首个和世卫联合溯源的国家","935510"
"龚俊好像花蝴蝶","929170"
"HM最新财季税前亏超10亿","864159"
"李现对李雪琴说我不是吴亦凡","824964"
"男子6年花20万研制出停车掉头系统","785422"
"14天内从瑞丽出来的人都去了哪","762181"
"心外无物 肖战","756582"
"杨紫 沉香如屑定妆","647482"
"岳云鹏把极限男团p成葫芦娃","613267"
"张柏芝港风蜜桃妆","462142"
"华为计划在手机上推出鸿蒙操作系统","459474"
"宇宙少女UNNATURAL","435848"
"王嘉尔乌云灰渐变西装","414175"
"沙磊","395278"
"经历过最尴尬的社死瞬间","318181"
"中文水平等级标准","306189"
"法院回应南大碎尸案家属起诉学校","300334"
"滴滴司机性骚扰男乘客被永久封禁","297213"
"尹弘同志任甘肃省委书记","289978"
"司藤","253679"
"华春莹历数美国触目惊心的人权问题","251910"
"华南海鲜市场动物制品检测未发现阳性","246545"
"长歌行","238300"
"山河令","224044"
"外交部回应BBC记者非正常离任","214373"
"山河令花絮","201476"
"张哲瀚ELLE电子刊封面预告","200439"
"高颜值紫薯山药酸奶蛋糕","196206"
"官方通报高溜整形失败鼻尖坏死","194444"
"你被哪些玩笑伤害过","189945"
"Viper获常规赛MVP及最佳新秀","189580"
"RNG","186658"
"湖南永顺对全县公职人员进行毛发验毒","183411"
"年度最佳经理杜兰特","155833"
"动漫男主收过的奇怪礼物","155645"
"南大碎尸案家属讲述25年艰难生活","155270"
"校方回应暴雨冲塌教室天花板","155056"
