"hot_word","hot_word_num"
"你记得我我就活着","292568"
"AK 把时间调回去我会求节目让我来","180239"
"为英烈默哀三分钟","147267"
"烈士的告白你听见了吗","145888"
"清明档票房破3亿创新高","144274"
"张哲瀚粉色头发","106748"
"韩美娟被淘汰","101053"
"接种新冠疫苗女性应注意什么","82979"
"向台湾列车出轨事故遇难同胞表示哀悼","79407"
"快乐大本营","79299"
"王子文吴永恩亲上了","73866"
"边伯贤患甲状腺功能低下症","67854"
"美国男子与亚裔结婚被说背离传统","62497"
"雨中陵园浙江8岁男孩感动所有人","59730"
"胡夏被龚俊带得找不到调","59519"
"邓超发文告别创造营淘汰学员","59193"
"孙怡在山河令哪一帧","58881"
"小学生设计出智能分类垃圾箱","58783"
"加拿大运动员入籍中国","58446"
"文森佐","58127"
"胡烨韬 我已经没有底气说能了","57673"
"怦然再心动","57641"
"年轻人放不下手机的原因","56368"
"李汶翰但愿人长久","56175"
"上万游客挤满清明上河园石桥","51011"
"邵明明 我在这里显得大家更加的优秀","50041"
"2020年因公牺牲民警名单","46795"
"辽宁外援泰勒抵达沈阳","46345"
"微软天价合同为美军打造AR头盔","46273"
"米卡 不喜欢battle但我为你们而战","46258"
"毛不易评价龚俊唱歌","44006"
"全球统一的童年记忆","43865"
"金曲青春","43593"
"我国已接种新冠疫苗13380.1万剂次","43136"
"金曲青春像张艺兴的考研班","43040"
"林芸芸对顾家伟发飙","40152"
"大二女生回到曾祖父牺牲地求学","38730"
"司藤","37483"
"长歌行陷进去了","36802"
"长歌行","32126"
"80后90后立遗嘱4年翻近6倍","31216"
"心疼林芸芸","29571"
"陈祥榕遗像前有这样一张卡片","28890"
"邢克垒又放米佧鸽子","28392"
"俄罗斯道路两旁高达18米的雪墙","25195"
"iBoy失误","22450"
"少年ON FIRE","20073"
"山河令","20051"
"甘孜官兵集体为牺牲战友答到","19808"
"我的姐姐","19683"
