"hot_word","hot_word_num"
"赵丽颖黑长直 病娇美人","3458145"
"民政局拒绝3月14日加班建议","1443152"
"江西坠机事故飞机型号确认","1413187"
"张子枫演技","1315083"
"王彦霖承认恋情","1053679"
"高姿防晒代言人范丞丞","943159"
"基金","790536"
"代表建议禁止明星代言网游","690970"
"北京部分60岁以上老人接种新冠疫苗","627639"
"刘芸 我太想演一个被爱的角色了","551786"
"网友科普广东一县凤梨产量惊到台名嘴","531043"
"人大代表建议公共场所大量装备AED","522675"
"儿童中耳炎发病率上升","454431"
"宋轶道歉","410104"
"父亲回应20岁智障女儿嫁55岁男子","379658"
"人大代表第三次建议夫妻合休产假","377179"
"相亲发生关系被判强奸男子出狱","366742"
"蔡少芬录节目时被狗咬伤","359863"
"物理老师室内演示电流","352081"
"许凯把口罩当发箍","347216"
"超9成大肠癌源于息肉癌变","342710"
"GQ","333012"
"茅台大跌","329457"
"凤梨","322979"
"易烊千玺费加罗封面","313188"
"2020年中国成就对账单","298334"
"性格会受父母影响吗","285803"
"教资面试成绩","281775"
"草莓麻薯芋泥脆脆杯","276702"
"二手平台可批量买卖品牌空瓶","275994"
"山河令直播","240850"
"钟睒睒成全球前十首位中国富豪","235213"
"雪崩的瞬间可以有多震撼","220536"
"广东茂名女大学生失联","218610"
"张哲瀚演技","215756"
"陈祥榕烈士遗属获授一等功臣之家","205644"
"王彦霖 艾佳妮","205136"
"大妈5000块买秋名山车神老司机证","202829"
"全球五分之一的人听力受损","202412"
"榴莲的生长过程是这样的","199044"
"福建籍男子在美国见义勇为被害身亡","194148"
"温客行鬼谷开会","192877"
"老师讲述戍边英雄事迹学生哭成泪人","191277"
"专家呼吁尽快接种疫苗以实现群体免疫","190426"
"日系病娇少女妆","188172"
"中国籍船只冲绳石垣岛北部倾覆","187409"
"山河令","186217"
"超8成中小学生睡眠时长未达标","181346"
"手机保管箱成教室新标配","180359"
"明星大侦探","179845"
