"hot_word","hot_word_num"
"福原爱回应与男子约会","3823556"
"货拉拉涉事司机被批捕","2144478"
"解锁春光密码","1213163"
"创造营","1143064"
"赘婿","1089462"
"vivo发布会神仙阵容","1048481"
"江宏杰方否认与福原爱离婚","1041809"
"玻利维亚一大学楼道护栏断裂学生坠亡","857461"
"全国政协十三届四次会议新闻发布会","803095"
"北大获10亿元个人捐赠","775539"
"吴孟达讣告","766130"
"陈漫拍的李冰冰","590040"
"R1SE创4预告","588690"
"Hello Kitty将拍真人电影","587467"
"政协发言人回应民调显示中国形象下滑","585295"
"锦心似玉","582028"
"卫健委答复夫妻合休产假","579660"
"马天宇又收到养老院的信息","577794"
"北京严禁学校参与小饭桌经营","575391"
"上海购房网签备案满5年后方可转让","575181"
"孙芮澡堂被偶遇","571974"
"邓紫棋 正在准备一个惊喜","569763"
"替朋友接孩子致其意外受伤被告上法庭","568765"
"刘雯对镜自拍","566699"
"杀破狼","524300"
"陈伟霆照片发反了","469929"
"张新成 费渡","462093"
"段小薇秒删","417552"
"长沙一小学签晚9点后不做作业协议","354197"
"法国开始拆除华为设备","349044"
"日本富豪免费邀请8人加入月球之旅","347655"
"甘望星 憨憨帅哥","323096"
"优衣库回应未禁止成人试穿童装","305811"
"纯素食幼儿园","301353"
"耳机音量超标听力损伤或多年后显现","292855"
"唐嫣倪妮王源杨幂杨紫同框氛围感","291630"
"不花钱就能得到的快乐","280401"
"手机越贵打车越贵是否违法","272161"
"创造营一公造型","245902"
"政协发言人回应中国疫苗安全质疑","206525"
"西安民政局允许汉服照登记结婚","205467"
"成都大熊猫博物馆开馆","203136"
"耿护院为救宁毅牺牲","203027"
"小镇一条街横跨豫鄂陕三省","202963"
"风的形状可以有多美","200045"
"官方回应动物园以狗充狼","193034"
"山河令","184843"
"恶女财阀千金妆","169734"
"深圳10年无房加40分","157019"
"为救人牺牲的护边员被追授时代楷模","153111"
