"hot_word","hot_word_num"
"李雪琴 王一博为什么要有标准","241210"
"卖高仿鞋团伙获刑并被罚1020万元","151564"
"黄景瑜吴谨言座椅抱","113273"
"霉霉在薇娅直播间送祝福","100058"
"隐秘而伟大","75133"
"我们的歌","52419"
"美国同时出现抗议示威和上街庆祝","50324"
"郭艾伦被罚115万","49206"
"天津疫情","46869"
"黄绮珊张碧晨是否爱过我","46467"
"被坠楼者砸死的快递员妻子发声","44640"
"小霸王法人被限制高消费","40903"
"天津进入战时状态","37650"
"日本接连出现禽流感疫情","37175"
"周迅丸子头好可爱","37102"
"天天向上","37022"
"带女儿住桥下的单亲母亲获救助","36956"
"陆军某特战旅高原寒区潜水集训","36891"
"大爷自制假人拉车在街头行走","36818"
"THE9合体留喻言位置","36723"
"天津涉疫情货物已流向3个地区","36660"
"萧燕燕韩德让私奔","33610"
"谨防街头扫一扫骗局","31654"
"公园配10名保安防游客踩粉黛草","31235"
"王源挥手背影","30922"
"李玟孙楠小鬼你怎么舍得我难过","30337"
"C罗被踢中脚踝","29413"
"谭德塞称期待与拜登团队合作","28633"
"隐秘而伟大男主人设","28016"
"刘昊然考编成功","27970"
"綦美合哥哥回应","27924"
"恋爱综艺中的意难平","27229"
"特朗普团队正募集6000万美元用于诉讼","27086"
"潍坊高新区禁止让家长批改作业","26945"
"李佳琦直播","26791"
"薇娅品冠新歌爱你需要练习","26587"
"QGhappy","25938"
"用一张图证明你压力比我大","25777"
"武汉一高校食堂员工用脚洗菜","25612"
"杨丞琳李荣浩隔空合唱暧昧","25543"
"谢楠桡骨粉碎性骨折","25487"
"韩国脱发人口达1000万","25333"
"苏宁 恒大","23896"
"多款3000元内5G机型上市","22839"
"萧胡辇救太平王","22624"
"顾耀东追星","22253"
"WCG魔兽争霸3","21767"
"记者节","21448"
"美国疫情","21086"
"黄圣依撞脸姚明大笑表情包","20931"
