"hot_word","hot_word_num"
"未来5年的新职业什么样","463419"
"陶勇说近视度数不断增加或致盲","434448"
"建议强制平台为外卖小哥买意外险","236667"
"建议全面取消经营性公墓","210166"
"建议公示逃税主播名单","172614"
"原来你是这样的杨利伟","172431"
"日原子力委员会称福岛核电站或再爆炸","171022"
"张文宏说今年摘口罩难度很大","168625"
"你的职业是你的兴趣吗","167132"
"哈尔滨全面有序恢复","166160"
"浙江两名高校学生拒服兵役被处罚","164947"
"薇娅做手术","162522"
"景甜气质","161946"
"王中军称华谊还没到摘牌边缘","155633"
"张凯丽谈女性容貌焦虑","155551"
"原来硬糖少女才是真正男子汉","154566"
"李兰迪演技","154462"
"在猪肉店起舞的9岁芭蕾女孩","153661"
"美特斯邦威拟卖资产回血","152891"
"元娘竟然是被乔莲房害死的","152206"
"上海一教练车坠河致1人死亡","152187"
"龚俊模特时期业务范围好广","150379"
"司藤身世","146959"
"特斯拉上海工厂摄像头被入侵","116548"
"夏之光面部受伤","102817"
"别想打扰我学习","102354"
"山河令","92199"
"铜价涨至九年新高","85122"
"联通电信辟谣首批5G用户被抛弃","78779"
"如何看待娘系男生","78663"
"锦心似玉","77303"
"埃及医生用2万余根火柴杆制天坛","75533"
"特斯拉回应女子坐车顶维权","73852"
"时代少年团赞赞新时代","71327"
"周子舒好温柔","68561"
"建议警惕一些影视作品伪娘化","67714"
"顶楼","66053"
"张文宏说年轻人打疫苗是为国家做贡献","65828"
"平均不满23岁女兵给导弹做体检","64917"
"司藤","62972"
"创造营","58188"
"物业撤明星广告牌换成戍边英雄","55170"
"夏之光报平安","54530"
"庭审现场家暴者竟跑到受害者家中","52812"
"司藤救秦放","51236"
"建议9年义务教育延至12年","50283"
"人大代表回应不建议戴美瞳","49090"
"2分钟混剪2021两会好声音","46700"
"东京奥运会体操测试赛被取消","46050"
"建议劣迹艺人惩戒期满后可复播作品","45628"
