"hot_word","hot_word_num"
"总理记者会","2238585"
"12306对60岁以上老人优先安排下铺","1354923"
"建议以家庭为单位发生育补贴","1156426"
"十三届全国人大四次会议闭幕会","947326"
"代表建议明星返还金条等贵重应援礼品","764757"
"完善香港特区选举制度决定表决通过","668925"
"你好李焕英进入全球票房榜前100","667563"
"涉港决定通过后会场响起超长掌声","555739"
"中国毛豆风靡西班牙","547357"
"法院认定未成年人直播打赏无效","449722"
"上海导盲犬排泄争议事件终获解决","447307"
"许志安复出拍戏","444605"
"虞书欣提议THE9不解散","441660"
"曾春蕾怀孕","436832"
"孙艺珍点赞玄彬照片","433414"
"佟丽娅被俞灏明深夜投喂","431429"
"何泓姗想演好人","427488"
"张艺兴新剧开机","424167"
"基金反弹","422661"
"日本大地震后老人海底寻妻10年","418354"
"建议取消基层干部各群打卡","416557"
"杭州一婚介所招赘婿已排300多位","402298"
"西安HPV九价","394382"
"Cat首发","375007"
"龚俊1000万粉丝福利 就这","371659"
"政府工作报告表决通过","360547"
"郑业成路透","321561"
"孙悦赛季结束后将退役","317503"
"复旦自主研发显示织物","317307"
"中国慢性肾病患者人数超1亿","317224"
"义乌选聘教师最高年薪120万元","315084"
"上海导盲犬","314917"
"俄女子破冰水憋气吉尼斯世界纪录","283425"
"蔡徐坤白背心照","276420"
"宫脇咲良","276036"
"2000多只羊排队过冰湖","251664"
"警方还原毒花生事件始末","248802"
"近三成消费者每月花400元喝新式茶饮","246368"
"美国5名警官枪杀15岁嫌犯","242647"
"山河令细节","232256"
"易烊千玺黑白大片花絮","232186"
"两会你我他","231048"
"建议平等对待非全日制研究生","229023"
"如何保护未成年人个人信息","228347"
"春日初恋女友妆","227339"
"富士山咖喱蛋包饭","226296"
"创4主题曲挑战赛","225412"
"张哲瀚 演员只是作品的一部分","218928"
"夏威夷遭遇25年来最大洪灾","218441"
"十三届全国人大四次会议闭幕","215304"
