"hot_word","hot_word_num"
"微信支付宝将进行适老化改造","3096737"
"张家口急寻无症状感染者密接同车人","1106632"
"天猫华为盛典","1098705"
"胡杏儿怀三胎","1098287"
"林峯张馨月一家三口合照","1037254"
"脱口秀搞跨年有点意思","974266"
"王栎鑫方回应新恋情","913747"
"国家卫健委派出工作组赶赴大连","832094"
"沈阳阳性病例个人信息遭泄露","760312"
"晴雅集评分","742202"
"晴雅集","614201"
"陈铭 没有黑幕只有节目","614134"
"巴西证实中国新冠疫苗安全有效","534817"
"圣诞节","492696"
"英国宣布完成脱欧","490961"
"SHE圣诞合照","490308"
"女神降临 社死现场","488531"
"萧亚轩 赤裸真相","484597"
"安崎Yea","478275"
"考研酒店房价格暴涨10倍","475804"
"黄子韬徐艺洋石玺彤合体发歌","471958"
"鹿晗三巡演唱会门票","464073"
"微信上线专属圣诞表情","460990"
"人民日报再评阿里巴巴被调查","459370"
"德国确诊首例感染变异病毒病例","458530"
"Angelababy向日葵日系大片","455786"
"同事在厕所说我坏话要出去吗","453776"
"王一博黑白氛围感大片","451595"
"发带也太挑人了吧","450146"
"阿里巴巴股价大跌","447433"
"学霸的圣诞树","445612"
"圣诞节别人家的男朋友","444850"
"虞书欣Gwalla","443685"
"中国高铁复兴号家族图鉴","433299"
"英国欧盟达成贸易协议","429986"
"被一只长颈鹿惊艳到了","427468"
"BLACKPINK圣诞节舞台","411838"
"往后余生开机","339847"
"胡先煦 不捏一下很难收场","316184"
"夫妻18年在沙漠种下4000多亩梭梭","290570"
"成年人社交常见的潜台词","275314"
"刘雨昕方律师声明","273957"
"沈阳新增1例确诊为此前病例外孙女","271494"
"迪士尼的圣诞有多浪漫","269769"
"免烤圣诞版草莓蛋糕","268520"
"郝蕾听见她说预告","267294"
"THE9新专辑","265208"
"北京卫视跨年阵容","249409"
"北京西什库社区连夜核酸检测","244894"
"王子文造型好像黑化前后","244147"
