"hot_word","hot_word_num"
"牧羊人连救六名山地越野赛选手","3141651"
"外媒集体为袁隆平刷屏","1593942"
"法国发现极为罕见变异新冠病毒","1377649"
"28天抗糖 肌肤不会黄",""
"袁花花再也无法陪袁隆平听汇报了","1316189"
"BBC骗访戴安娜面临审查","917861"
"长沙的鲜花外卖单","884277"
"官方回应饲养员被老虎袭击身亡","834922"
"长沙有太多的感动了","800988"
"梁晶遇难细节","752905"
"大连轿车撞人逃逸肇事者系报复社会","479493"
"深圳福田通报赛格大厦实时监测情况","474377"
"甘肃山地马拉松幸存选手发声","466579"
"4岁小女孩因以军空袭面临瘫痪","420724"
"深圳新发现2名无症状感染者","349578"
"厦门一网民侮辱4院士专家被警方控制","348026"
"陈语嫣 迪士尼","346113"
"极限挑战","344739"
"明星社死时有多尴尬","343699"
"没有人年年恨天临 但年年有人恨天临","341165"
"深圳一学区房狂降662万元","338641"
"恰好是少年延播","337680"
"窦骁 温柔","335688"
"安徽一动物园饲养员被老虎袭击身亡","332250"
"MSI","332125"
"浙江莫干山越野赛紧急取消","329761"
"吊脖子健身恐致高位截瘫","327083"
"漫威总裁承认古一法师选角错误","326303"
"哈里斯和文在寅握手后在裤子上擦手","325078"
"RNG DK","324956"
"CUBA全国大赛","324927"
"骊歌行大结局","324903"
"世界网友悼念袁隆平","272957"
"两个互相观察的小朋友","258442"
"袁隆平雕像前的花海","240739"
"甘肃山地马拉松事故21人遇难","221239"
"女生如何对抗年龄焦虑","221233"
"小猫咪的睡姿有多可爱","216279"
"顶楼第三季路透","215180"
"韩萌 马健星","205502"
"长沙上万市民冒雨悼念袁隆平","187384"
"力丸上班图","180400"
"全球变暖导致极端气象事件频发","174551"
"好友讲述黄关军参赛马拉松挣奖金","166742"
"御赐小仵作","160642"
"大佬坐姿的猫咪","156561"
"近视眼的真实写照","147709"
"小朋友的作业能多好笑","131669"
"李佳琦直播","129290"
"人类社死名场面","128443"
