"hot_word","hot_word_num"
"重要的不是睡8小时而是睡够睡眠周期","860769"
"马苏让黄奕多过两年清净日子","379087"
"疫情致整体入睡时间延迟2到3小时","349115"
"章子怡 我老公不仅出歌而且产瓜","274752"
"超3亿人存在睡眠障碍","264876"
"shanghai不是上海","233583"
"市民做肛拭子核酸检测秒变企鹅系谣言","192378"
"黄奕 我跟雨绮剧本有点雷同","184121"
"因防疫不力哈尔滨12名干部被追责问责","161824"
"遇害少女家属称驾校未尽到保护义务","155248"
"周传雄","154693"
"马思纯模仿张东升","148452"
"我国将试行以经常居住地登记户口制度","125032"
"毛晓彤让汪峰多发歌","124399"
"网格员哭到一半工作一来秒变坚强","123169"
"大张伟","122991"
"刘浩存 国家宝藏","121225"
"美国亿万富豪被散户威胁退出推特","121039"
"2020年GDP十强城市","120511"
"还以为是厕所炸了","119277"
"王一博法警训练太飒了","118443"
"杨惠婷","117669"
"彭冠英哭红眼","116887"
"新西游记","111144"
"你以为内向的人不一定内向","109315"
"王源好像豌豆射手","94754"
"重疾险老产品将全下架","87324"
"高德地图微博评论","83878"
"纽约年轻人计划重新占领华尔街","83299"
"合成大西瓜改名大赛","82898"
"人可以自信到什么程度","82255"
"年轻人为什么越来越爱熬夜","78083"
"山西临汾公安局原副局长涉黑调查","74939"
"重疾险新规明起实施","74087"
"倪萍回应和宋丹丹和解","73797"
"琉璃怼人小天才","72874"
"天天向上","70900"
"琉璃参加斗花大会","64350"
"南仁东逝世后收到的邮件","58354"
"特斯拉","56258"
"日本首现变异病毒聚集性感染","54297"
"JackeyLove莎弥拉","53797"
"不可思议的爱情开播","52319"
"小学生用衣服摆人形假装学习","49149"
"上阳赋","48314"
"还以为肌肉快过期了","48060"
"尼泊尔雪崩震撼全过程","43671"
"家属证实学车后失联大学生遇害","40583"
"教育部回应春季学期能否正常开学","40260"
"玲珑","40232"
