"hot_word","hot_word_num"
"他们是为我而死","2403731"
"加勒万河谷冲突现场视频公开","2172446"
"印度","1832746"
"茶颜悦色道歉","1366169"
"沈腾在马丽贾玲之间选了马丽","1204911"
"专业 请就位","1056293"
"卫国戍边烈士遗骸交接现场画面","780286"
"顶楼","582983"
"我国应急批准16个新冠疫苗临床试验","563881"
"杨幂让沈腾说出华晨宇的三首歌","561448"
"4名牺牲边防英雄的照片","472080"
"王祖蓝是阿朵本朵吧","438940"
"重庆政法委副书记谭晓荣主动投案","398600"
"祖国山河寸土不让","394039"
"蔡国庆模仿易烊千玺","392843"
"华晨宇关晓彤演我的少女时代","386944"
"网友喊话金晨是不是拿错行李箱","382181"
"五年前的沈腾","377385"
"丈夫去世了债该不该还","375105"
"戍边英雄面对数倍外军张开双臂阻拦","362000"
"关晓彤 我的假发亮到想对着它许愿","358286"
"肇庆一中学前桥梁断裂","263479"
"青你3记者会是李宇春的点子","255599"
"当鸟类都长了屁股","245604"
"士兵突击剧组重聚","240015"
"南京雨花台梅花盛开","231271"
"永远的第一名","228185"
"檀健次祝时代少年团永远不糊","206241"
"火币","200365"
"西部战区陆军发布视频致敬戍边卫士","198556"
"虞书欣的伴舞好漂亮","197568"
"华春莹称种族灭绝在中国是世纪谎言","183174"
"禁止寄递钢丝棉烟花冷光烟花","160593"
"韩国发现一条神秘地道","157022"
"一切矛盾用四个字可以平息","142203"
"至少8位外国元首首脑接种中国疫苗","140541"
"重伤的戍边英雄曾为受伤战友落泪","137449"
"丁程鑫刘耀文river","137094"
"那英的嘟嘴","136846"
"赘婿","106922"
"民航局对多个航班发出熔断指令","104168"
"陕西一95后拒服兵役被罚7.2万","98197"
"特斯拉美国调价","95898"
"面试时手机响了怎么办","91939"
"2021网上年货节零售额超9000亿元","84898"
"Kimi身高离林志颖只差一个手机","84630"
"人潮汹涌票房破2亿","84372"
"百变大咖秀","73650"
"5名戍边英雄的战地誓言","73476"
"比特币涨破53000美元","72970"
