"hot_word","hot_word_num"
"收货地址为兰州市烈士陵园的鲜花外卖","3803948"
"春节后机票价格大跳水","1770974"
"姚策生母回应被指偷换孩子","1691201"
"咸素媛陈华分手","1324849"
"滴滴崩了","924685"
"周冬雨 同款白","744636"
"2032奥运会首选布里斯班举办","699623"
"趵突泉将6万余元硬币上交财政","596825"
"蜘蛛侠3片名","546976"
"玻利维亚总统赴机场迎接中国疫苗","544568"
"广东双月湾蓝眼泪","543653"
"国家医保局曝光9起欺诈骗保案件","537662"
"杨紫井柏然海边吻戏路透","440745"
"大庆一客车坠桥致2死7伤","434516"
"宁静回应单方面宣布退团","392550"
"又一国产新冠疫苗附条件上市获受理","392541"
"张小斐加盟湖南卫视元宵喜乐会","391978"
"地球太喜欢孙亦航了","390989"
"张智霖喊话袁咏仪要换手机","390756"
"广州地铁22号线将延伸至深圳","390309"
"赵磊凡尔赛式晒体脂","389564"
"宁毅苏檀儿被迫分别","389386"
"朴智妍收到死亡威胁","379743"
"朴灿烈向粉丝道歉","349498"
"裴行俭报了恋爱补习班","338622"
"一次过量饮酒对大脑影响长达6周","334660"
"央视主播谈货拉拉安全事件","300123"
"上海大学考研成绩","299250"
"昆明劫持人质案6名伤者出院","297392"
"11人涉菅义伟长子不当宴请被处分","259115"
"法硕成绩","258299"
"游族网络新董事长","233600"
"卫星拍摄的青海湖证件照","229522"
"故意在父母面前吃外卖","219020"
"外交部点名BBC","213004"
"山西发布最高级别暴雪预警","209341"
"吴白输给王浩","206527"
"人类幼崽的温柔时刻","185832"
"周深谈网红歌手和职业歌手","167616"
"吉利和沃尔沃宣布合并","165137"
"大学生抢不到票骑行200公里返校","150745"
"牛年以来最大规模雨雪上线","150246"
"Gofun回应汽车座位现4枚钢针","148325"
"布克顶替浓眉参加全明星","146866"
"粉丝告诉庆怜房子塌了","146407"
"共享汽车座位现4枚钢针扎伤用户","143515"
"睿佳李晒与魏宏宇合照","141904"
"欧文建议NBA标志换成科比","141782"
"陈乔恩","141735"
"广州沿路万株紫荆花盛开","140817"
