"hot_word","hot_word_num"
"坠洱海牺牲的4名同志被批准为烈士","2341166"
"90后夫妻离婚都不要女儿被判不许离","1323703"
"往酒店水壶撒尿游戏主播已被封号","995601"
"刘诗诗成都","989908"
"16岁熊孩子在自家后院用激光照射飞机","961546"
"湖北恩施发现一安徽病例密接者","873986"
"投资者教育",""
"祝融","729810"
"辽宁营口5例感染病例均未注射新冠疫苗","727141"
"杨幂黑袍披风造型","703950"
"最坦诚的炸串店因为客人变多歇业","702923"
"合肥1例确诊患者在兰州密接17人","645008"
"刘宇林墨模仿还珠格格","627017"
"科比大女儿替科比穿上名人堂夹克","588074"
"切尔诺贝利核电站内或发生核裂变","571325"
"周迅氛围感","545481"
"中国97%的成年人患有牙结石","536606"
"刘诗雯","533546"
"领证前发现跟对象三观不合","525874"
"印度700余名教师协助选举后感染死亡","514882"
"武汉龙卷风已致8死280伤","495460"
"青春环游记 嘉宾","456843"
"南京设如厕车位15分钟内免费","348102"
"狗狗求知的眼神","327488"
"警方通报男乘客不戴口罩殴打司机","305180"
"俄罗斯举办户外挖坟大赛","295045"
"天问一号","257329"
"植物人丈夫醒来对妻子唱爱你一万年","246734"
"会做瑜伽的狗子","243445"
"猫猫为了这个家操碎了心","240540"
"教资面试","236928"
"双层咸蛋黄榴莲钵仔糕","235582"
"韩国车友以270公里时速飙车","211496"
"悬崖之上","208526"
"合肥肥西核酸检测10万多人均为阴性","207909"
"火星上首次留下中国印迹","203168"
"天问一号总设计师张荣桥激动落泪","202882"
"御赐小仵作","201467"
"过去的神话变成今天的现实","194091"
"冰摇仙桃啵啵冰淇淋","189422"
"涉嫌枪杀耶鲁华裔学生的嫌犯被捕","171031"
"3000次按压救回心脏骤停32分钟患者","160348"
"苏州龙卷风最大风力17级","155078"
"多芒百香果雪糕","152256"
"你好火星中国来了","152180"
"高空摄像头拍下江苏多地闪电瞬间","151937"
"初级会计","151708"
"法院回应夫妻离婚都不要女儿被判不准","136392"
"科比正式进入名人堂","130901"
"郑恺请北体女飞人看电影","130080"
