"hot_word","hot_word_num"
"Amber 我曾经就是个实验","2129682"
"全球首次发现人感染H5N8型禽流感病毒","1778904"
"周深写评价像老中医开单子","1769828"
"海底捞练习生","1769201"
"王焯冉牺牲全村瞒奶奶8个月","1707692"
"韩美娟的嘴能不能留到决赛","1340869"
"南极发现全球首只金色企鹅","1131221"
"你好李焕英票房破38亿","1078714"
"四位戍边烈士遗属优待抚恤细节","922508"
"2021考研查分时间表","841762"
"易烊千玺踩高跷分玺","813975"
"宁静 就是要一水有本事的漂亮男生","781980"
"中国货船在直布罗陀水域发生爆炸","647064"
"卫健委称东北放开生育限制需做全面研究","635546"
"有头发的梁森","635316"
"李梦 终于被淘汰了","635184"
"网恋奔现需要多大勇气","565054"
"吉利确认成立新电动车实体公司","466703"
"比特币突破57000美元关口","456046"
"你好李焕英位列中国影史票房第六名","455012"
"符龙飞黄小蕾异父异母亲姐弟","454919"
"李梅导演刺激张艺凡","425765"
"晴天晚上味的香水","424384"
"中纪委评辣笔小球被拘","401884"
"祁发宝戍边20多年13次与死神擦肩","391112"
"付辛博听到光荣时的表情","377146"
"烈士肖思远的微信头像","335372"
"库里缺席比赛","326906"
"辽宁省考公告","324430"
"国内最大鳇鱼标本108岁重1128斤","323239"
"虞书欣吐槽彦希油腻","288927"
"重庆的哥智擒贩毒乘客","275254"
"堀与宫村","268785"
"医学科研人员无实质贡献不得挂名论文","227319"
"被刺死男童家属回应凶手死刑","215580"
"美国得州进入重大灾难状态","214650"
"美一波音客机起飞后引擎爆炸","209914"
"薛八一 三个人的故事却没有姓名","199433"
"我们能为边防战士做什么","169864"
"见过最奇葩的游乐项目","167609"
"烈士肖思远父亲发声","151803"
"烈士肖思远母校校长发声","149163"
"梁森李俊濠 大灰狼小白兔","115235"
"如何看待求学求职限制性别","100576"
"四川绵阳万亩梅花绽放","99325"
"思诺是秦风的另一面","95424"
"邓超发博求撑腰","95400"
"传销A级老总的自述","90117"
"祁发宝半月吃30多包朝天椒抗寒提神","89830"
"南极又出现西瓜雪","89657"
