"hot_word","hot_word_num"
"大连轿车撞人逃逸肇事者系报复社会","6186168"
"梁晶遇难细节","3911686"
"甘肃山地马拉松事故21人遇难","1613445"
"马拉松遇难者女儿通过视频认出父亲","1485526"
"大连通报轿车撞人逃逸案","1284314"
"袁隆平遗体送别仪式明天举行","1229283"
"浙江莫干山越野赛紧急取消","987932"
"袁隆平雕像前的花海","936415"
"中国人骨子里的浪漫","803248"
"失温","753488"
"营口鲅鱼圈封闭100个小区","753445"
"袁隆平曾梦见自己在稻穗下乘凉","753436"
"残运会冠军黄关军遇难","753380"
"东电确认福岛核废物集装箱泄漏","753316"
"花12万买飞天茅台全是伪劣产品","753273"
"印度要求删除印度变种说法","753235"
"当小朋友见到肌肉猛男","753165"
"见过最离谱的毕业论文致谢","753156"
"乌合麒麟新作缅怀袁隆平","619222"
"市民在吴孟超生前工作医院悼念","576315"
"情书","517270"
"金子涵金曲青春造型","461359"
"御赐小仵作","400202"
"战国时期的豪车到底有多豪","342706"
"人民日报发文追记袁隆平","341202"
"印度近9000人感染毛霉菌病","326811"
"晒光盘照纪念袁隆平","322881"
"黑龙江漠河5月飞雪","314365"
"军队文职考试","249810"
"美国各大企业被迫加薪","241285"
"日本将增设600人特种部队紧盯钓鱼岛","235377"
"吴孟超96岁生日当天还在做手术","214736"
"广西发现雌体金斑喙凤蝶","198558"
"印度一大学教师遭3家医院拒收去世","174648"
"吴孟超院士追悼会今日举行","167132"
"殡仪馆不接待群众悼念袁隆平","156148"
"新闻联播里的袁隆平吴孟超生前影像","154058"
"生活家","149571"
"市民送别袁隆平院士","141270"
"肝胆外科中坚力量八成是吴孟超学生","128071"
"北京一网民侮辱袁隆平被刑拘","124863"
"东风快递超燃MV新征程","123818"
"袁老说没实现的梦想后继有人会实现","120718"
"杜兰特恶意犯规","108585"
"袁老一生耕耘的见证","108035"
"广西洋女婿点赞中国在线医生","105306"
"2021年高考招生新增37个本科专业","97019"
"大佬坐姿的猫咪","90828"
"上海血液中心献血成功印章是奥特曼","90168"
"跑友呼吁山地越野赛事应单独审批","87188"
