"hot_word","hot_word_num"
"黄奕 我的家庭没有爸爸这个角色","2965892"
"成都警方回应四十九中学生坠亡","2189086"
"大学生利用肯德基漏洞诈骗20余万元","1863173"
"尹正喝醉偷吃午餐肉忘了味道","1838482"
"央视评高中生坠亡通报需以更多事实回应","1432603"
"毕业生学位论文查重乱象","1209061"
"祝张哲瀚生日快乐",""
"郭杰瑞称美国故意不报道中国抗疫成果","1017235"
"于敏生前采访中反复说死而后已","987044"
"吴磊范丞丞不敢看钟楚曦","974664"
"李宰镇将结婚","838907"
"张柏芝想为结婚对象再生小孩","838528"
"菅田将晖说利路修的故事像少女漫画","614735"
"华春莹说强征慰安妇是严重反人类罪行","603557"
"印度一ICU供氧量突降致11人死亡","603557"
"深圳已成立深房理联合调查组","603548"
"董明珠看许佳琪跳蝎子舞的表情","603536"
"Sunnee问现在狗仔做得这么大吗","603529"
"吴倩说对待老人只有真诚和耐心","603521"
"老人驾车逆行碾轧小学生后跑了","603519"
"曾黎 我至今未婚","600134"
"吴青峰称苏打绿休团是林暐哲逼的","557948"
"张哲瀚的脸比新浪公仔还小","535064"
"教育部建议家长不跟风报班","518815"
"虞书欣说自己是横店千颂伊","516289"
"后进生偷偷递给我的纸条","457153"
"蔡文静彭冠英双人剧照","381322"
"技嘉道歉","347877"
"京东下架技嘉全部产品","344247"
"中小学原则上采用纸质作业","343419"
"校方否认学生坠亡与化学老师有关","337111"
"吴磊模仿钟楚曦的拍照姿势","328139"
"小猫咪的力气能有多大","321345"
"老师撤离150名学生后大树瞬间倒下","277387"
"洱海坠机牺牲机组人员信息","270062"
"我国仍是世界第一人口大国","261715"
"姜小宁认出顾川是大哥哥","252735"
"瀑布小龙虾盖浇饭","238878"
"印度黑市氧气卖出天价","238297"
"伊朗13艘快艇高速逼近美舰队","236239"
"每学期对课桌椅高度个性化调整","227937"
"华春莹批美国每年花3亿美元抹黑中国","226413"
"12省份进入中度老龄化","226277"
"少年的你日本版新镜头","226175"
"成都学生坠亡事件有哪些疑点","226168"
"功夫熊猫竟然真的存在","223908"
"临沂大学张瑞莹","223080"
"技嘉","222835"
"东莞牺牲民警搏斗时故意往人少处去","222754"
"超200家粉丝后援会呼吁理智追星","222496"
