"hot_word","hot_word_num"
"专家回应别人打了疫苗我就不用打","112169"
"黄明昊泼贾乃亮的水泼到自己身上","102062"
"VaVa说丁太昇吃了文化有限的亏","60965"
"陈乔恩艾伦接吻庆生照","59851"
"沈海高速交通事故4人仍在ICU抢救","55939"
"李菲儿为假唱道歉","49874"
"极限挑战","45979"
"我国接种新冠疫苗为何先年轻人再老人","41848"
"2021年共和国已痛失9位院士","41113"
"iG战胜EG","40746"
"易立竞 提词器是在限制我只能这么吐","40335"
"印度安全部队遭袭已致22人死亡","39964"
"陈祥榕奶奶至今还不知孙子已牺牲","39544"
"汤普森加盟广东男篮","39181"
"肖战玉骨遥定妆路透","38722"
"李一桐晒沙滩照","37972"
"赵露思领养需要特殊照顾的流浪狗","37884"
"米佧邢克垒沙发吻","37253"
"美海军罗斯福号航母进入南海","37006"
"阮青夏束文波结婚","36760"
"迪丽热巴吴磊 般配式演技","36484"
"张彬彬是预言家吧","36255"
"龚俊大喇叭应援创4学员","36015"
"那兔清明特别版","35723"
"5家上市银行个人房贷占比超标","35677"
"陈卓璇钻石星月复古套装","34443"
"15岁男生网络发布不良信息被抓","29675"
"魅族就清明争议文案道歉","29439"
"人民英雄永垂不朽","29370"
"kaka","29337"
"女性展示身材有错吗","28727"
"泰山酒店价高游客挤厕所过夜","26673"
"山河令","26610"
"文森佐","26390"
"八旬烈士母亲跨越千里墓前痛哭","26339"
"黄明昊我想有个家","25576"
"亡命毒贩冲撞民警被开枪击中","25104"
"魏宏宇排名","24677"
"清明","24605"
"长歌行","24573"
"日本已婚女性超四分之一遭家暴","24128"
"米佧邢克垒订婚","21899"
"成年人的累是看不见的","21595"
"HIStory4近距离爱上你","21479"
"安徽农业大学学生拒服兵役被处罚","20150"
"民警牺牲数月女儿还在发微信找爸爸","19477"
"最让人舒服的角落","19320"
"永远记住你","18291"
"如何看待炒鞋热蔓延至国货","18047"
"顶楼","17788"
