"hot_word","hot_word_num"
"奥巴马称绝对会接种新冠疫苗","2554668"
"杨丞琳夸金钟仁跳舞超好看","1414928"
"直播带货三天卖出130万元假口红","1062290"
"元旦多地机票价格比火车票低一半","1006796"
"厂长","958355"
"新浪影视综盛典","950149"
"拜登称将要求美国人戴口罩100天","919276"
"一秒钟票房破亿","855402"
"佟丽娅带朵朵探班陈思诚","819220"
"黄子韬劝被出轨的粉丝分手","723179"
"我国在月球首次实现国旗独立展示","634521"
"我向你敬礼salute","551641"
"黄子韬对自己劝粉丝的视频reaction","550533"
"丁真收到鸡腿抱枕后的表情","549416"
"美国洛杉矶发布紧急防疫命令","548794"
"韩国高考申请人数创新低","547571"
"黄晓明去油成功","545642"
"黄俊捷","544847"
"四川广播电视大学更名为四川开放大学","543618"
"陕西收到羊肉全院将吃羊肉泡馍","524149"
"正确的生育观","468952"
"广州棠下发生地陷","338558"
"许佳琪一晚领9次奖","315605"
"幼儿园回应4岁幼儿趴睡后死亡","302321"
"奚梦瑶发长文谈产后抑郁","284103"
"赵露思南京","266149"
"校方回应网传贫困生网上炫富","264922"
"31省区市新增17例确诊","238843"
"赤狐书生终极预告","234260"
"TheShy将缺席LOL全明星赛","227248"
"徐峥 我是张译的颜粉","216927"
"檀健次","208553"
"黄奕拒绝女儿攀比式购物","207145"
"拜登邀请福奇担任首席医疗顾问","200878"
"当丁真看到字帖","177359"
"嫦娥五号上升器点火起飞","176559"
"国家宪法日","164170"
"东京奥运会日本国内退票81万张","161593"
"杜江把霍思燕搂在怀里挡风","160918"
"干饭人寝室被查现场","157700"
"Angelababy麦穗纹纱裙","155528"
"蒙古国捐赠羊肉到达四川","150202"
"威少改穿4号球衣","149068"
"赤狐书生","148881"
"必胜客联合创始人去世","148786"
"九尾狐传大结局","146584"
"尚纬股份终止收购罗永浩直播公司","145629"
"如何戴口罩眼镜不起雾","145470"
"日本正考虑2035年禁售燃油车","135886"
"陈卓璇回应是我站的不够高吗","135625"
