"hot_word","hot_word_num"
"广西致3人死亡命案嫌犯已自首","2156961"
"关晓彤2个月午餐打卡","1239880"
"护士人群中多看一眼救人一命","881419"
"曾毅又没被认出来","878680"
"沈梦辰说跟杜海涛该结婚了","858905"
"五年级弟弟发的微信消息","831320"
"韩国减肥霜再生贴被曝虚假宣传","688406"
"2600万美元中奖彩票被扔进洗衣机","678904"
"这年头连鸭子都会演戏了","677895"
"急寻5月8日D3058次12车厢乘客","677313"
"张柏芝生图","677177"
"安徽公布最早感染者基本轨迹","673383"
"美疾控中心规定接种疫苗后不必戴口罩","666719"
"梅琳达宣布离婚后已获得30亿美元","664639"
"王毅将主持安理会巴以冲突紧急公开会","656450"
"李一桐粉丝关站","653944"
"孙莉晒多多自制戒指","647307"
"宋妍霏 我妈的身材我都夸累了","645121"
"初级会计","545473"
"高中语文教资面试","520858"
"孙俪字帖展出","511492"
"男生的奇怪友谊","446200"
"董又霖每天都要量头发","432607"
"欧阳娜娜小碎花吊带","419259"
"北京晚霞","327625"
"长沙一红头文件漏洞百出","317767"
"奶奶喂猫有多生猛","309741"
"辽宁营口新增2例本土确诊","296097"
"刘诗雯无缘东京奥运会单打","278227"
"如何看待刘诗雯无缘奥运单打","270560"
"鞠婧祎初恋感写真","270525"
"和有洁癖的人同居是什么体验","266580"
"全球多国爆发反以游行","261125"
"安徽新增确诊2例","250828"
"林墨让张嘉元离他的房间远一点","230974"
"见过最少女心的老师","215359"
"以总理称将继续袭击加沙","200207"
"李雪琴停车停了半小时","195676"
"心动的信号第四季路透","195596"
"男子深夜开车撞上200斤野猪","173632"
"诛仙CCTV6第一季度国产影片收视率第一","173587"
"MSI","160454"
"女子酒后爬豪车蹦迪致车损28万","149931"
"禁忌女孩","147198"
"差点被这首歌送走","145870"
"粉丝坐在男朋友肩上看蔡徐坤","141355"
"公安部团圆系统5年找回4707名儿童","140783"
"4AM吃鸡","121275"
"如何看待花钱谈虚拟恋爱","120966"
"你心中科比的精神是什么","110464"
