"hot_word","hot_word_num"
"王者荣耀点券没了","2922908"
"女子丢猪腿找回时已被腌制好","1795130"
"虞书欣魔术穿帮","1598241"
"牛年央视春晚节目单","880186"
"郭冬临到底喝了多少瓶水","870652"
"地球自转加快一天已不足24小时","761493"
"宋小宝plus 潘长江plus","644822"
"中共中央国务院举行春节团拜会","542339"
"迪丽热巴化妆师","530244"
"张鹤伦发文","504370"
"郭冬临小品里男人可以生孩子了","452096"
"谢可寅和孔雪儿给喻言留了位置","442638"
"英国发现的变异新冠病毒致死风险更高","441403"
"王者荣耀充值BUG","440290"
"和平精英","434897"
"刘雨昕看刘谦洗牌的反应","428360"
"淘宝红包雨","418772"
"天问一号成功实施火星捕获","412971"
"印小天太适合春晚了","407109"
"胡兵眼部手术全记录","373338"
"李子柒添福添年味","357591"
"百万分之一的几率发生的事","300412"
"外婆用筐装80万给家人发压岁钱","291756"
"艾情拒绝吴白","290721"
"安装空调外机有多危险","273456"
"成都精准打击煽动抱团涨价重点人员","263695"
"韩国12岁男孩炒股一年赚43％","262945"
"上海市原副市长龚道安被双开","262502"
"辣目洋子贾冰小品好笑","262357"
"脏脏年糕冰淇淋","212073"
"山东年味最浓的地方","197440"
"吴白又哭了","182962"
"外交部发言人给大家拜年了","175985"
"风起霓裳","172524"
"德云团舞运镜","153350"
"天津卫视相声春晚","140974"
"浙江卫视喜剧春晚","138267"
"2月14日恰逢春节可以婚姻登记吗","137733"
"牛年壁纸","137331"
"新疆蝶湖冰裂纹","133575"
"数字人民币","129469"
"不同省份不追星的原因","126180"
"马鹤琪","123741"
"裴行俭我不是男人","121068"
"麦当劳因香草冰激凌不含香草被起诉","116706"
"久诚直播发声","97082"
"英国又发现两种新变异毒株","70353"
"为赚钱制售假新冠疫苗约5.8万支","65038"
"东方卫视新春潮乐会","64821"
"满汉全席年夜饭","60197"
