"hot_word","hot_word_num"
"在上海的张韶涵和在吉林的张韶涵","186704"
"杭州狂犬病脑死亡女生父亲发声","162997"
"有翡湖北影视开播","159963"
"丁真说想来北京看升国旗","132617"
"年轻人情绪衰竭的征兆","93285"
"杜华朋友圈道歉","78364"
"嫪毐终于领盒饭了","59246"
"希拉里称应该废除选举人团制度","52702"
"四川逐步取消现场宰杀销售活禽","49201"
"张丹峰 洪欣","49199"
"马赛克在AI面前可能不安全了","48641"
"世卫组织建议成年人应限制久坐时间","39677"
"时尚芭莎拉郎届翘楚","38620"
"四川确诊飞行员轨迹通报","36059"
"罗永浩发视频称供货方蓄意欺诈","35986"
"李易峰无人机应援","35952"
"腾讯娱乐年度盛典","35908"
"超三成日本人希望东京奥运会被取消","35838"
"巡回检察组","35822"
"邓子昂焦佳人同居太甜了","35786"
"假如ins妆有段位","35701"
"薇娅服饰公司被列入经营异常名单","35683"
"重庆一冷冻牛肉外包装核酸阳性","35641"
"了不起的儿科医生","35585"
"在狗子面前晕倒有多惨","34725"
"京东金融就争议短视频致歉","33954"
"外交部回应外媒称中共党员渗透西方机构","33322"
"谷爱凌为北京冬奥推迟入学斯坦福","33316"
"北京新增病例所住酒店4件环境样本阳性","33315"
"毕滢","32192"
"吉林林场第6次拍到野生东北虎","31512"
"大连开发区","29881"
"中俄相互通报弹道导弹发射协定延期","29844"
"圣诞美甲","29830"
"撩爆朋友圈的拽姐妆","29595"
"警方通报外卖员被保安用防爆叉套脖子","27688"
"2020人类幼崽行为图鉴","27665"
"人间沙雕张国伟","27653"
"有翡定档","27161"
"嫪毐戏份多","27067"
"患儿家属拒为网约车司机作证系乌龙","25995"
"刁顺子兄弟去世","22583"
"于和伟巡回检查错别字","22225"
"新版身体活动和久坐行为指南","22024"
"密室的微恐和川渝火锅的微辣","21501"
"赵姬嬴政决裂","20450"
"薇娅方回应","19285"
"纯金版iPhone12 Pro每部80万元","18245"
"杨幂 骂你的人都是草船借来的箭","17978"
"wap","17931"
