"hot_word","hot_word_num"
"医生讲述跳车窗女孩送医时伤情细节","3621546"
"张小斐对贾玲说我们还有好久好久","2950767"
"男子称被顶替教师岗22年","1273338"
"这才是真正的海景房","1171750"
"美国疫情","845300"
"货拉拉跳窗身亡女孩搬家视频曝光","691883"
"比特币大跌","588887"
"全职太太重返职场有多难","565660"
"科兴新冠疫苗获菲律宾紧急使用许可","504111"
"1月70城房价","502416"
"开往春天的轻轨撞上无人机","495707"
"拜登下令降半旗哀悼美国50万新冠死者","451328"
"陈红军和妻子的最后一次通话","440101"
"法官回应全职太太离婚获5万家务补偿","383836"
"海上酒店责令停业3个月后仍营业","381606"
"张杰被聘为成都大运会形象大使","381457"
"张萌说旗下练习生可以原地出道","374401"
"丁真工作室维权声明","373598"
"第五人格","367103"
"人潮汹涌票房破3亿","367021"
"北京下雪","340479"
"韩国食品价格大幅上涨","321763"
"宁毅带苏檀儿度蜜月","298879"
"福岛近海捕捞鱼放射性物质超标","266032"
"12只红腿小隼同框","257167"
"洛阳首次发现完整西汉陶仕女俑","241737"
"男子回应假装自杀女友相救溺亡","229702"
"Daft Punk解散","222113"
"严禁城里人利用农村宅基地建别墅会馆","208366"
"锦心似玉定档","194762"
"女兵网上初选审核结果","188149"
"张馨予陪袁姗姗过生日","173978"
"梦幻草莓果冻包子","151594"
"农民收入增速连续11年快于城镇居民","146950"
"不得要求家长检查批改作业","146884"
"我的时代你的时代加更","145643"
"C罗梅开二度","129524"
"美股","128801"
"张小斐路演服装品牌变化","125256"
"张艺兴工作室捐赠粉丝匿名红包","122562"
"冷空气杀回马枪","115439"
"宁毅苏檀儿圆房","113492"
"驻港部队培训港警中式步操","104300"
"男子旅居国外诋毁戍边英雄被上网追逃","104140"
"春季学期正常安全错峰开学","102843"
"顶楼","102317"
"原来剧本杀是这样玩的","98679"
"Uzi加入小象大鹅","98650"
"家属回应女孩跳货拉拉车窗身亡","98346"
"日本超小公寓受年轻人青睐","97711"
