"hot_word","hot_word_num"
"国航一航班32人检出阳性被立即熔断","913488"
"张予曦全家颜值","529578"
"中国疫苗成为入境多国有效证明","451111"
"麦当劳下班回魂快闪",""
"孔雪儿 门面","418041"
"大二男生骨质疏松比老年人还严重","257096"
"张彬彬壁咚景甜","257048"
"选择强大昂扬宇宙",""
"让医生崩溃的瞬间","256913"
"女网红为吸粉站隧道内拍视频","222562"
"洛基","205217"
"驴友探险发现20公里地缝","161723"
"刘宇宁张碧晨合唱天问 不搭","161476"
"许佳琪拔发簪","160415"
"李大钊行刑时的绞刑台","150815"
"利路修散步舞","150651"
"普京与拜登举行会晤","150525"
"Angelababy说十年前我就挺火的","150105"
"心惊肉跳的同居","149792"
"雪梨说朱正廷的画很可爱","149646"
"庆怜说自己是米卡","149471"
"减肥糖果售价1380元成本1块5","149091"
"殷世航套路璐分手","148656"
"张柏芝秦沛邓萃雯谈明星和演员区别","148404"
"小丸子下跪","148353"
"徐州通报垃圾中转站操作工失踪","143952"
"情侣分手后要做的事","139439"
"利路修无效打工","137367"
"白敬亭说井柏然羞于表达对他的崇拜","128729"
"王一博眼神戏","127608"
"欧洲杯","122923"
"桂林酸笋风味板烧鸡腿堡","106675"
"催卖家发货的新方式","106289"
"心动的信号","99346"
"宋祖儿叫Angelababy鼻姐","95999"
"外交部回应美国捐赠80瓶疫苗","95727"
"当长辈是扶弟魔有多窒息","95569"
"保罗将无限期休战","95559"
"深圳疫情","95495"
"荣耀50发布会","88559"
"印度普通人家一半花销用在吃饭","88395"
"神舟十二号瞄准17日9时22分发射","87092"
"觉醒年代编剧新作主角是陈延年","86662"
"婚礼上被迫营业的小朋友","83491"
"大范甘迪下课","80541"
"荣耀回应未来是否会使用鸿蒙系统","76427"
"小象洗澡遇险象群捣毁鱼塘","68468"
"任何组织个人不得以电话短信等侵扰他人","65733"
"种在空中的西瓜熟了","63195"
"林楠笙顾慎言谈心","61513"
