"hot_word","hot_word_num"
"微信新表情","4559843"
"北方暴雪南方多地气温超31度","3938801"
"不一样的父亲","3639941"
"萧亚轩 分手后还可以做朋友","3440700"
"丁真","1948548"
"登场了敦煌开播","1263907"
"年轻人为什么不愿意谈恋爱了","1179288"
"张雨绮回应朱正廷","1047566"
"如果天官赐福拍真人版","740663"
"外交部用两个五概括中国疫苗研发进展","661494"
"反向凡尔赛大师","614766"
"金晨张继科吃饭仪式感分歧","564118"
"马保国也难逃真香定律","524181"
"情侣可以做同事吗","521786"
"天津新增本土无症状感染者1例","498333"
"我是怎么定义一周七天的","487747"
"周深工作室注册少管我商标","475642"
"杨奇函","470072"
"R1SE硬糖互抄文案","458020"
"硕士论文研究董明珠自恋","445684"
"不这么穿我睡不着","407258"
"秦霄贤妈妈","405971"
"娱乐圈中的高情商对话","386608"
"撒野","339053"
"校方回应女教师上电视道歉","338293"
"闺蜜送的生日蛋糕","338260"
"柯洁 陶欣然","330221"
"东北的冬天能有多解压","322200"
"字节跳动申请抖音电商商标","306984"
"外交部回应孟晚舟案关键证人拒绝出庭作证","302010"
"陈奕迅全球分迅","300137"
"申花","279209"
"凡尔赛人怎么吃火锅","255763"
"2.9元买头绳收3元好评返现卡","253116"
"特朗普宣布解雇美国网络安全局局长","252736"
"时代少年团演唱会门票","252392"
"女子因不孕被夫家虐待致死案重审","243764"
"得物崩了","228740"
"金莎拒绝盛况","221759"
"天津东疆港区瞰海轩小区升为中风险","215250"
"湖南汨罗一餐馆爆炸34人受伤","214466"
"刘宪华新歌Radio","213378"
"凡尔赛人是怎么上厕所的","205322"
"不希望被翻拍的剧","198837"
"厦门2份进口牛肉包装核酸阳性","191898"
"贵州茅台原副总经理被移送检察机关","179521"
"女儿们的恋爱","166527"
"Ben退役","151817"
"普陀山景区饭店天价便饭1900元","151633"
"山东枣庄出台菜煎饼制作标准","150090"
