"hot_word","hot_word_num"
"周也 冷脸美女","3554048"
"女子被骗31万后又被同一人骗4万","1072487"
"黑龙江一河边发现AWM狙击枪","1065261"
"陈飞宇瘦了15斤","1024221"
"意大利国家队颜值低谷","922340"
"刘昊然周也红毯互动","921316"
"看热带往事不敢大声呼吸",""
"微博电影之夜红毯","815032"
"两名省外来肥确诊患者绿码返程","805312"
"店员跪拜磕头气走乞讨者","800778"
"佛山机场暂停运营","800429"
"陈伟霆外公外婆照片","800403"
"刘浩存对镜头挑眉","772128"
"卖鱼为什么要遮住眼睛","771067"
"和女友吵架男子赌气举报自己醉驾","769580"
"端午是我国别名最多的传统节日","766793"
"金靖男朋友","765224"
"被讨厌的男同事身材羞辱","764359"
"耳背不一定是耳朵的问题","681223"
"张小斐上班图氛围感","600774"
"六级答案","579549"
"快乐大本营","576509"
"陈志朋晒在大陆接种疫苗视频","532536"
"官方通报7人河边喝酒4人溺亡","523400"
"桥本环奈破吉尼斯世界纪录","470569"
"云南盈江5.0级地震","468714"
"张艺兴直角肩红黑外套造型","468137"
"张哲瀚燕尾服","457891"
"广州病例仍在同一条传播链上","443987"
"苏炳添回应队内竞争","397136"
"Uzi解说","363635"
"邢昭林梁洁一场戏亲了3分钟","360161"
"女生寝室关系能有多僵硬","351965"
"端午奇妙游","325909"
"粽子","278153"
"2030年前后实施火星取样返回","275345"
"利路修 四六级预言家","273973"
"车被上锁物业开锁收2500元","201351"
"粽子界天花板","187507"
"张哲瀚年度最受关注演员","180146"
"大象吃庄稼村民说它又不是故意的","177021"
"为自己普通话苦恼的东北人","159302"
"这届网友有多会怼人","130596"
"欧洲杯","126564"
"小胖镜四杀","126155"
"六级翻译 青海湖","126152"
"火星探测总师说还有更精彩的","125927"
"班主任为中考学生送定制版高铁票","125855"
"少年因车祸截肢自强不息冲刺清华","125771"
"淘汰现存的10种高毒农药","125464"
