"hot_word","hot_word_num"
"丁真的舅舅像疯了的郑伊健","3940209"
"很多美国网友称去年12月已感染新冠","1457920"
"刘雯在走廊走出秀场的感觉","1147208"
"丁真给家里买了洗衣机和电瓶车","965195"
"教育局回应17岁男生娶13岁女生","855233"
"宣璐吃播太香了","752747"
"星辰大海计划入选演员合照","737432"
"被父母逼迫考公的年轻人","628519"
"未来5G手机可免费接收电视节目","627085"
"法国前总统德斯坦感染新冠去世","623094"
"离婚冷静期实施条款","620646"
"李玟有多爱美女","619586"
"欧阳娜娜小碎步在逃企鹅","616279"
"苹果因电池门在欧洲多国面临集体诉讼","612846"
"元旦火车票今日开售","608598"
"倪妮造型 钱夫人","608222"
"李沁一米长发","593525"
"李现状告咪咕侵犯肖像权","591581"
"俄罗斯将开始大规模接种新冠疫苗","579923"
"面部烧伤人士用熊爪递咖啡","569263"
"拼多多申请多多拼菜商标","455387"
"秦俊杰侯梦瑶恋情","453762"
"江疏影 求礼服和鞋共计多少斤","448390"
"我就是演员阵容","442761"
"东北73岁老兵用雪堆出一架大飞机","441701"
"女明星走红毯都好拼","441010"
"张子枫吴磊 盛夏未来","423686"
"动物幼崽的眼睛有多清澈","421829"
"你又在山海经的哪一页","320771"
"十三五易地扶贫搬迁任务已全面完成","320009"
"刘诗诗 花中一个瓜一晚跑三家","319650"
"妈妈的语言逻辑有多严谨","319611"
"张萌看见蔡徐坤的样子就是我本人","301981"
"张艺兴上海成立经纪公司","290343"
"每个美国人获得约120个中国口罩","253293"
"磊枫","249414"
"江疏影体重","232944"
"韩式泡菜一口豆腐小饼","191424"
"56岁自驾游阿姨","186233"
"COSMO江湖无惧文案好绝","184863"
"黄俊捷回应恋情","182114"
"和姐妹打游戏的样子","176449"
"综艺里的爆笑coser","175606"
"距考研还有不到一个月","166009"
"COSMO各家女明星出图质量","127012"
"有翡侠气翡然特辑","126192"
"如何确认自己今年进步了","116403"
"嫦娥五号完成月面自动采样封装","116102"
"波音737MAX首次载客试飞","107394"
"广州在建洛溪大桥人行桥垮塌","107167"
