"hot_word","hot_word_num"
"高以翔女友晒合照悼念","3727649"
"武汉3份冻品外包装样本核酸阳性","2804645"
"黄子韬 我需要蹭什么你告诉我","2209362"
"让王冰冰采访丁真","1526985"
"高校寒假时间","1498009"
"法考","1470780"
"天官赐福","1447709"
"丹麦首相为扑杀水貂而含泪道歉","1409362"
"2021年起我国将全面禁止进口固体废物","1404111"
"科比瓦妮莎一见钟情21周年","1375981"
"道枝骏佑 创4","1350198"
"李现以为自己发型被吹乱了","895581"
"人民日报评马保国","873468"
"绿皮车应该全列禁烟吗","855455"
"青海加班加点选出的帅小伙","828229"
"武汉万达一小区吊装玻璃从40楼坠落","791604"
"杨丞琳为黄鸿升庆冥诞","742506"
"原来亲热戏是这样拍的","737237"
"谢娜为易烊千玺庆生","732253"
"巴黎歌剧院首次对华直播","633911"
"请完假感觉身体好多了","590288"
"新垣结衣当选2020日本国民女神","562756"
"吉林市一男子做核酸检测竟殴打护士","499036"
"红楼梦的选角有多绝","495883"
"黄子韬要去四川找丁真","427639"
"张一山工作室声明","384777"
"东风快递后来的我们","366586"
"苹果回应产品难维修","356498"
"一名伊朗核科学家在德黑兰附近被暗杀","354795"
"陕西文旅连夜打手电找丁真","354262"
"广州深圳还没入秋","338155"
"当彝绣遇上百褶裙","324899"
"智利进口冷冻帝王蟹外包装检出阳性","299680"
"正当防卫不捕不诉典型案例","294855"
"赖冠霖张采采","292433"
"杨紫戴鱼头面具喝水","255283"
"芋圆柿子奶冻慕斯","235846"
"星辰大海","221997"
"雪后哈尔滨南站仿佛银色雪国","212488"
"丁真说不要再p了","190756"
"丁真的字里有珍珠的影子","186791"
"斗罗大陆","186656"
"芯片行业出现盲目投资和烂尾项目","167611"
"阅读理解有多难","167147"
"什么是意定监护","166236"
"疫情下的美国黑色星期五","165857"
"牛骏峰发长文告别赵志勇","153248"
"旅加大熊猫将返回中国","116060"
"术后6年收到医生手写问候信","115797"
"漫天雪景能有多漂亮","115788"
