"hot_word","hot_word_num"
"王思聪评论半藏森林","6953236"
"钟南山说新冠病毒溯源尚未完成","2783723"
"张一山方回应演技争议","2119432"
"邓家佳","2088794"
"圆通内鬼致40万条个人信息泄露","1895193"
"厚乳拿铁降价了","1785892"
"萧胡辇怀孕","1667481"
"新鹿鼎记鳌拜家写了鳌府","916842"
"韦小宝在小郡主脸上画画","812943"
"特朗普发推称赢了大选","545729"
"林黛玉倒拔垂杨柳","543789"
"金莎 追星女孩单身的原因","539724"
"潘长江cos陈奕迅","533954"
"乐华娱乐否认王富贵是公司职粉","530621"
"马明被双开","526556"
"顾耀东 我关心是因为我喜欢你","517488"
"李现","513502"
"大学生订婚假批语有多温柔","511727"
"化学老师制作49支唇膏送学生","505232"
"麦当劳中国投资25亿卖咖啡","499490"
"美国大选正式结果何时官宣","497073"
"理工男将宿舍门锁改成智能锁","493458"
"6起交通死亡案例全是骑车人和行人全责","469014"
"阴阳师","447207"
"LPL全明星投票","445752"
"做家教不小心暴露土味鞋垫","445460"
"考完试从考场出来的我","445005"
"杭州拍到一丘之貉中的貉","425084"
"蒙古族新兵首次实弹射击50环","402972"
"台军部署导弹有重大故障缺陷","399605"
"王源20岁首封","396684"
"孟子义发型师发文","381207"
"千万不要让男朋友折纸鹤","379574"
"演员被绑架后的演技有多绝","372847"
"哈尔滨警方通报法官被刺死","371253"
"顶楼","370787"
"沈青禾男友力","311022"
"耶律贤吃醋","307245"
"水母组被团灭","305542"
"新冠2019年或已在意大利传播","303574"
"人类能懒到什么程度","302937"
"河南农家6口被杀家里8岁女孩仍失踪","281081"
"古代四大美女影视图鉴","275226"
"爱的厘米","270271"
"周震南父亲回应","262391"
"分别时偷偷挥手的老人","245956"
"英国驻重庆总领事救落水女大学生","238466"
"浙江义乌一法拉利撞上飞机","237460"
"奥巴马否认会在美国新政府任职","138558"
"天下足球","138141"
