"hot_word","hot_word_num"
"杨丞琳边唱边接住耳环","4698591"
"国产宫颈癌疫苗落地北京","2226298"
"阿絮老温下午茶彩蛋","2211891"
"周杰伦 哥刮胡子了请问大家满意吗","2199114"
"江映蓉张馨予袁姗姗淘汰","2106356"
"孙艺珍郑秀晶太A了","1986264"
"南京大学","1182570"
"奔跑吧9官宣","957569"
"东京奥运会火炬又灭了","763677"
"全面查找改革开放以来失踪被拐儿童","725084"
"安踏净利润超越阿迪达斯","712891"
"李宁官宣肖战","712800"
"拜登称任期内不会让中国超过美国","712520"
"起风了好适合杨丞琳杨钰莹","712186"
"公安部新闻发布会","711759"
"古天乐捐赠的第133所学校","711532"
"崔天凯称西方涉疆报道成见偏见极深","711337"
"景甜让吴彤把司藤作为头像","710782"
"B站将百度写进公司资料表","710548"
"苹果疯狂收购25家AI公司","710274"
"实习生眼里的张翰","710147"
"MMAQL自曝交往过十几个爱豆","675282"
"雷军","632093"
"宋茜ins评论","519639"
"联合国点赞中国女性科学家","507411"
"陈学冬说不要每次都让我来辟谣","502078"
"罗一舟起腰","496762"
"奔跑吧9没有郭麒麟","445660"
"王牌对王牌预告","396682"
"世界最大油画4亿元人民币成交","396222"
"司藤","376971"
"青你3二公舞台直拍","361903"
"乘风破浪的姐姐","359645"
"如燕 开口跪","347178"
"新疆半年拿出近300万吨棉花战疫","302384"
"小龙虾炒螺蛳粉","294267"
"小米汽车被抢注商标","273777"
"顶楼","271019"
"甘孜文旅局长谈与丁真谁更帅","266045"
"新疆就美英加无理制裁发表严正声明","240082"
"江西新增无症状为此前确诊密接者","234668"
"换季式变丑","217066"
"皮肤科医生谈春季补水误区","207019"
"骑士买断德拉蒙德","186661"
"车组要解散了","176182"
"欧文因未婚妻生产缺席比赛","172432"
"拜登上任以来首场新闻记者会","168722"
"男子带领200村民将抹布缝成艺术品","155808"
"苏伊士运河大塞船后果","145870"
"棉花珍珠","134052"
