"hot_word","hot_word_num"
"董璇称不后悔帮高云翔","3345763"
"中纪委评女子称支书草包被行拘","2401618"
"合成大西瓜","2312046"
"姚晨 嘴虽然大但一口确实吞不下","2307711"
"吴磊张子枫泳池戏路透","2073236"
"打工人春节转运指南","1341933"
"一千年前小朋友写的字","948154"
"央视网络春晚阵容官宣","910655"
"春运","698779"
"杭州杀妻案已移送检察院审查起诉","607408"
"Halsey怀孕","579146"
"猫舌口罩","522207"
"基金","508316"
"白宇姚晨吻戏","426232"
"李嗣镕","407177"
"明星大侦探","402920"
"辽宁是最崇拜ins风的地方","396663"
"花呗借呗上线额度管理新功能","396494"
"重庆一批进口冻鸡脚内外包装阳性","387585"
"周深加盟创4","385142"
"青你3训练生破纸初印象","376513"
"刘耀文戴胖头鱼头套","375394"
"无故推倒老人女子患有精神疾病","373378"
"福州回应公交司机猝死不被认定工伤","373101"
"蔡徐坤加盟央视网络春晚","373052"
"霍建华为林心如庆生照","346039"
"深圳部分银行上调房贷利率","344272"
"生态环境部回应敦煌毁林事件","344135"
"苹果设备全球超过16.5亿部","344070"
"反感亲戚的四大原因","344056"
"领导向你招手你该怎么做","303585"
"无羁","274409"
"春节期间小客车免收高速通行费","265606"
"美国将在气候问题上与中国合作","264038"
"林周京素颜去学校","262526"
"春运第一天","246446"
"车厘子等进口水果清洗办法","242610"
"过年就是大型凡尔赛现场","231144"
"山海情","218214"
"车银优的笑眼","208212"
"假日暖洋洋","205308"
"上阳赋","202563"
"珍珠奶茶瀑布舒芙蕾","190654"
"福建猝死公交司机被认定为工伤","183923"
"爆浆水果糯米糍","183023"
"一副眼镜攻破19款手机人脸识别","183013"
"世卫溯源专家组今日解除隔离","183011"
"椒盐鸡肉条","175380"
"库里潇洒转身三分","165716"
"科学家发现1亿年前萤火虫祖先","165271"
