"hot_word","hot_word_num"
"王大陆把李沁嘴巴亲变形了","2933707"
"浦东机场所有相关工作人员连夜核酸检测","2344176"
"张雨绮美出强大的底气","2061493"
"温碧霞有意向参加浪姐2","1934490"
"胡先煦买的超多黄大闸蟹","1595107"
"不想上班","1073131"
"哈工程师生用积雪造雪舰","533065"
"湖北新冠疫情专家李十月逝世","518524"
"改革开放以来中国7亿多人摆脱贫困","479800"
"上海新增2例本地确诊病例","470292"
"请回答1988余晖扮演者白血病复发","468999"
"乔诗语道歉","468262"
"TF练习生扮鬼玩把私生吓跑了","466248"
"香港新增68例确诊病例","464581"
"梅德韦杰夫夺总决赛冠军","462854"
"李若彤肌肉线条","461815"
"满洲里","461329"
"白敬亭回复泥塑粉","459843"
"说天津话的凡尔赛人","449085"
"上海南站辟谣停运消杀","448255"
"张梓琳4岁女儿腿长","448253"
"王俊凯体重","397251"
"狼殿下 训鹰师","319982"
"特斯拉回应车辆行驶中天窗脱落","306911"
"小加索尔签约湖人","285595"
"安雨 赵梦","270575"
"国考准考证","262643"
"8年前航母style走红","255646"
"特朗普竞选总部要求再次重新计票","244619"
"法考","244584"
"安徽多地充电桩成摆设","229849"
"埃塞俄比亚中国同胞安全撤离","220059"
"31省区市新增确诊11例","218773"
"多伦多将再度封城","217720"
"火锅店要求用餐必须有女伴","217304"
"小学生班上表演手舞看哭父母","214479"
"高铁打冰人","199377"
"股市","187709"
"物理老师雪中用脚印画公式","181764"
"官方回应家用自来水可点燃","165861"
"前三季度城市GDP50强","141013"
"王源抢答说没出生","135111"
"美国新冠肺炎超1218万例","134601"
"白宇 我站在永宁门想着你","127036"
"村民在自家超市办图书馆请孩子们看书","125991"
"大不了回家开个店","125307"
"棋魂","123581"
"张伯礼建议建立冷冻进口食品熔断机制","115992"
"法国首次发现养殖水貂感染新冠病毒","115973"
"天天向上","115039"
