"hot_word","hot_word_num"
"加勒万河谷冲突现场视频公开","4491252"
"茶颜悦色道歉","3158103"
"沈腾在马丽贾玲之间选了马丽","2851189"
"印度","2605358"
"顶楼","1807193"
"杨幂让沈腾说出华晨宇的三首歌","1754751"
"祖国山河寸土不让","1582348"
"王祖蓝是阿朵本朵吧","1088698"
"卫国戍边烈士遗骸交接现场画面","879725"
"华春莹称种族灭绝在中国是世纪谎言","841567"
"华晨宇关晓彤演我的少女时代","816742"
"金巧巧 想翻红失败","715505"
"那英的嘟嘴","632158"
"人潮汹涌票房破2亿","621607"
"戍边英雄面对数倍外军张开双臂阻拦","611123"
"网友喊话金晨是不是拿错行李箱","602363"
"关晓彤 我的假发亮到想对着它许愿","591419"
"4名牺牲边防英雄的照片","589197"
"永远的第一名","578896"
"丈夫去世了债该不该还","568831"
"虞书欣的伴舞好漂亮","559908"
"外交部回应中方公布中印边境报道","549891"
"西部战区陆军发布视频致敬戍边卫士","534417"
"火币","520875"
"海霞低头念稿","514389"
"郭晓东让程莉莎赶紧回家做饭","507911"
"刘嘉玲章子怡合照","480392"
"李佳琦时代少年团直播","479574"
"陕西一95后拒服兵役被罚7.2万","467010"
"郭嘉语","465138"
"韩国发现一条神秘地道","393753"
"至少8位外国元首首脑接种中国疫苗","384080"
"士兵突击剧组重聚","365957"
"百变大咖秀","307019"
"重伤的戍边英雄曾为受伤战友落泪","301346"
"一切矛盾用四个字可以平息","298768"
"琉璃","294631"
"面试时手机响了怎么办","289734"
"赘婿","276568"
"民航局对多个航班发出熔断指令","268913"
"创4的滤镜","231618"
"边境线上的中国军人","216451"
"比特币涨破53000美元","201369"
"当鸟类都长了屁股","197879"
"5名戍边英雄的战地誓言","196642"
"赘婿开分","193872"
"巴西被曝有医护给老人打空气疫苗","182933"
"全国大回暖进程地图","177976"
"李慧珍安又琪刘烨苗鼓版无价之姐","177516"
"中纪委评论你好李焕英","176598"
