"hot_word","hot_word_num"
"黄俊捷道歉","2996041"
"上完20天班又是小长假","2032380"
"尹正第三周吃了什么","1594773"
"韩美娟最想和甘望星交换身体","1355814"
"怎么暗示领导这礼物很贵","1096429"
"不要一次性拔掉四颗智齿","1087791"
"越来越多美国人假装疫情结束","784491"
"密室大逃脱路透","714976"
"人类减贫的中国实践白皮书将发布","571838"
"充气城堡被吹翻致1女童身亡","547027"
"张子枫 我做不到不真诚拍每一条","539070"
"花儿超级乖","532401"
"万人迷 两性博主","523416"
"苏伊士运河肇事货轮面临10亿美元索赔","507995"
"虞书欣还原顶火锅事件","503972"
"皓嫣","503169"
"利路修粉丝摩天轮应援","487271"
"律师表示炒鞋可能涉嫌多项违法","476850"
"芒果降价了","462755"
"阚清子哭也不忘干饭","437651"
"司藤直播","436829"
"沙僧被贬下界真的不冤","412453"
"宋仲基李光洙现身友人婚礼","377343"
"专家回应过敏体质能否打新冠疫苗","318870"
"于洋发长文","318480"
"西藏雪崩震撼全过程","309679"
"徐杰受伤","305901"
"广汽菲克3年亏50亿","304884"
"王毅回应美方对华反复提竞争合作对抗","304675"
"鹿晗吃播","304487"
"我的姐姐票房破4亿","300866"
"长歌行","296139"
"北京动物园清明游客爆满","289149"
"人民英雄永垂不朽","275921"
"忘摘口罩引发的社死现场","268390"
"石璐 滚圈是浪子聚集地","249428"
"男朋友礼物图鉴","247278"
"我的姐姐","233339"
"郭德纲解说曹操身世之谜","220651"
"2021LPL","218183"
"京粤大战","210159"
"Wendy新歌","196635"
"安然姑妈对着套娃说俄语","191162"
"王焯冉曾写如能上场杀敌我愿站排头","179400"
"新冠疫苗保护期只管半年是误读","179025"
"头套也藏不住的拽","174258"
"网约车不合规竟超9成","169932"
"如梦之梦彩排照","168771"
"14名伊拉克妇女前往当地雷区排雷","167999"
"主人脚臭对猫的伤害","164942"
