"hot_word","hot_word_num"
"吴尊女儿在文莱国王面前演奏大提琴","693539"
"上海抽检奶茶店全部存在问题","289444"
"货拉拉司机家属回应女孩跳窗身亡","217238"
"杨幂说自己是一个会喷队友的人","206235"
"货拉拉涉事司机被刑拘","197230"
"乔欣能穿20年的大衣推荐","171674"
"世界最胖男孩减重200斤","169762"
"成都发放4000万元数字人民币红包","141102"
"中央一号文件里的时间表","122093"
"你好李焕英票房破42亿","119240"
"孟佳要给韩美娟定制不会掉的假发片","114342"
"趵突泉景区近3年打捞出钱币6万余元","113326"
"国家卫健委答复为何单身女性不可冻卵","108945"
"检方回应男子假装自杀女友相救溺亡","103766"
"赘婿","103766"
"基金暴跌年轻人为什么躲不过被割","103765"
"魏大勋敷衍式营业","103764"
"路人镜头下的金莎","103764"
"宁毅试探楼舒婉","103764"
"丁真阿朵为民族文化助力","103763"
"宋亚轩凡尔赛式吃螃蟹","103763"
"原来孙悟空的仙气是烟雾","103762"
"鲍威尔","93570"
"日本任命首位孤独大臣应对自杀率上升","92979"
"吴白把岳父喝成兄弟","92455"
"理个发居然被理崩溃了","91156"
"谭松韵胶片感生活照","90243"
"特斯拉比特币获利超过卖车","88479"
"科兴新冠疫苗获菲律宾紧急使用许可","87289"
"张大仙","86890"
"岳云鹏饺子爱好者","86405"
"暴风眼","78179"
"基金","69322"
"严禁城里人利用农村宅基地建别墅会馆","68174"
"陈宥维 会有衣服替我来青你","67140"
"宁毅误会苏檀儿","64071"
"正青春大结局","63129"
"风起霓裳","63073"
"教育部要求给家长减负","48732"
"杭州一区通知寒假作业不规定必须完成","47413"
"吴白醉酒对艾情撒娇","45970"
"我的时代你的时代","44280"
"易方达中小盘停止申购","43927"
"顶楼吴允熙夏允哲婚纱照","41935"
"唐宫夜宴舞者打卡郑州地标","40655"
"易烊千玺十分钟vlog","36969"
"山河令","34930"
"暴风眼开播","33559"
"中方向53国无偿援助新冠疫苗","33170"
"斗罗大陆","32288"
