"hot_word","hot_word_num"
"黄子韬威胁要拉黑朋友反被拉黑","4960947"
"上海近期不建议学生参加线下培训","1917353"
"牛言牛语过牛年","1914956"
"墨茶生前就诊医院回应","1910874"
"昆明女记者","1863335"
"网传确诊病例教授百余钢琴学生不属实","1478061"
"B站回应UP主死亡事件","1165468"
"2NE1四人合体","1000486"
"何洁怼丁太昇","900233"
"特朗普离任后首次发声","899954"
"女性怎么学会和自己和解","898967"
"上海宝山一小区升为中风险","898285"
"东京奥运会若无观众将损失900亿日元","896765"
"村民搬离后的小果庄村","896069"
"昆明劫持人质案细节","895270"
"培训APP破产前还在大促销","893719"
"张碧晨微博评论","893101"
"周笔畅希望杜华这次少道几个歉","891798"
"就挺突然的","891534"
"青你3给经纪公司送锦旗","890568"
"四川一高校捞5000斤鱼给教职工当年货","847830"
"黄子韬还没更新微信","812168"
"小女孩被困火场教科书式自救","627549"
"西安市场染色橘子","589012"
"剧本杀成90后00后社交新潮流","527993"
"男子尾随多名女孩泼红油墨被刑拘","518498"
"李斯丹妮孟佳听姐姐唱再见哭了","518318"
"高原驻训官兵吃铜锅涮肉","515095"
"美国史上首位非裔国防部长","514715"
"北京人均GDP约2.4万美元","514658"
"青柠手撕鸡","514656"
"陀枪师姐2021定档","416318"
"杨丞琳隔离结束","379627"
"新冠核酸检测为何增加肛拭子采样","358436"
"拜登向国民警卫队道歉","296418"
"年夜饭油炸黄金丸子","278355"
"有翡播放量破40亿","232529"
"哈尔滨下架正大1月1日后出厂产品","225380"
"非常孕事立项","204651"
"上阳赋","200545"
"假日暖洋洋定档","194129"
"山海情评分","186790"
"新冠病毒3D图像","176526"
"美国开出10亿美元大奖","174764"
"篮网三巨头沉默不语","174260"
"武汉火神山治愈患者为河北捐物资","158776"
"罕见血雀现身云南德宏","152881"
"刘耀文拔智齿脸还没消肿","150669"
"输入法会窥探隐私吗","149698"
"荣耀CEO赵明感谢任正非和华为","148966"
