"hot_word","hot_word_num"
"张翰吴宣仪加盟妻子的浪漫旅行5","2241421"
"女子用身体挡住失控轮椅","1523719"
"团委书记强奸女企业家案二审维持原判","1518348"
"董子健写给女儿的话","1240260"
"岳云鹏 请叫我题库","805242"
"最美家乡大赛","796280"
"女生道歉专用头像","766276"
"菅义伟决定取消访问印度","652148"
"假装路人去妈妈摊位买鸡排","579875"
"陕西大学生为研发锅巴延毕","517112"
"佟大为发长文谈教育孩子","514159"
"台媒称许玮甯离婚","498693"
"中小学教材不得夹带广告和二维码","477225"
"印度飞香港一航班机上53人确诊","451261"
"董明珠要求食堂给员工降价","442453"
"陈乔恩 有没有求婚是我们私人的事","421471"
"大雄静香婚礼前奏预告","415928"
"朱朝阳严良普普又唱歌了","401311"
"iPhone12紫色","388597"
"迪丽热巴龚俊 帝皇书","364607"
"周柯宇哥哥发长文回应","362473"
"向往的生活深情版海报","360734"
"宿舍的学霸姐妹全部上岸","356688"
"老师用两人站一凳化解学生矛盾","349530"
"刘宇宁八零九零主题曲","345314"
"一鹿彤行","344799"
"一饼茶叶可以买一辆宝马","307601"
"肖万获罪美国民众激动流泪","294490"
"苹果发布会","283979"
"报警电话还未挂断贼就抓到了","282137"
"脱粉","258490"
"祁连山拍到赤狐一家6口","237995"
"黑人之死案宣判后拜登发表讲话","236695"
"美国国防部称阿富汗主权应该被尊重","233410"
"肿瘤治疗黑幕患者家属发声","230858"
"宝洁将涨价","225768"
"小舍得","223200"
"丁真世界地球日大片","221635"
"鹿晗关晓彤 新合照","219547"
"秘密访客","211132"
"警方回应广州一特斯拉失控起火","173193"
"云南大学食堂推出玫瑰宴","163665"
"我们的新时代杀青","161466"
"山西出土2700年前猫爪金饰","152892"
"收费小姐姐温柔劝返限高货车","149618"
"非洲男子深情背诵将进酒","147118"
"指尖少年定档","144328"
"我国首辆火星车名称24日揭晓","133112"
"弗洛伊德案宣判","126293"
"乔治罚球绝杀","125347"
