"hot_word","hot_word_num"
"马思纯谢谢杨紫最难时候的陪伴","3593292"
"缅甸仰光部分地区实施军事管制","3095642"
"今天在吗是一句表白","3022982"
"吴倩","2899261"
"周冬雨 马思纯","2162782"
"二月二抢红包讨彩头","1933214"
"官方通报陕西6岁男童遭13岁邻居杀害","1342893"
"四川一野生大熊猫经救治无效死亡","793045"
"格莱美","672285"
"国际消费者权益日","588067"
"金莎说女人有男闺蜜很正常","575077"
"女辅警敲诈公职人员案一审律师发声","536164"
"顶楼","525340"
"你好李焕英即将全球上映","518778"
"唐校长说自己的刷屏发言只是讲了常识","502149"
"马思纯回应自己胖了","489317"
"梅根或准备竞选美国总统","479117"
"高校应届毕业生数量再创新高","476311"
"重庆二手房存量超20万套","456627"
"揭秘电商直播带货乱象","453599"
"北京沙尘","450055"
"应聘被要求写保证怀孕主动辞职","446670"
"刘宇","445651"
"窦骁晒何超莲做的雪花酥","441654"
"李雪琴择偶标准是郭麒麟","440012"
"邓孝慈 投票","430763"
"大虞海棠","398057"
"背娘上大学小伙回应曾拒绝55万年薪","375106"
"王一博体验食品安全检测工作","308977"
"桃叭崩了","304620"
"张颜齐cos太阳花","302758"
"勇士战胜爵士","290435"
"加拿大法院拒收孟晚舟方提交新证据","282510"
"金烔完回应Eric","278909"
"司藤秦放男女主拿错剧本","264847"
"消防员出警救火发现着火的是自己家","250276"
"进击的巨人","235393"
"白敬亭马思纯 一眼万年","220431"
"币圈首富比特币投资收益100倍","214499"
"巴西前总统接种中国新冠疫苗","212601"
"日本变异新冠病毒迅猛蔓延","212481"
"女子发帖编造扶摔倒老人送医被讹","212457"
"温客行顾湘兄妹情","209248"
"男子用绘画让万物隐身","208326"
"C罗半场帽子戏法","206817"
"阿凡达","205731"
"四川全面禁止从省外违规调运生猪","172804"
"天津沙尘","172276"
"2021314众多情侣打卡连理枝","171767"
"法国女演员脱衣抗议防疫政策","166088"
