"hot_word","hot_word_num"
"王子文 为什么叫我小丸","1719694"
"央视曝光主播卖惨带货","988487"
"龚俊今夏最爱天空蓝","987080"
"央视主播说熟蛋孵小鸡侮辱极强伤害更大","984222"
"印度黑市一瓶氧气600美元","900012"
"赵丽颖维权案胜诉","751117"
"司藤庆功宴","683692"
"小舍得","669842"
"全国社保卡持卡人数13.4亿","629852"
"熟蛋返生论文第二作者后悔参与","625515"
"iOS14.5正式版","532475"
"张恒语音聊天记录","531633"
"中科院回应熟蛋返生课程","524107"
"切尔诺贝利核事故35年","521284"
"俄罗斯驱逐一名意大利外交官","520638"
"我爸给狗穿上了我的衣服","507069"
"林阳确诊新冠","500365"
"海口小学生触电倒入积水","493595"
"湖南省博物馆预约","488995"
"餐馆老板吐槽注水牛蛙如气球","482930"
"当你在健身房被骚扰","461007"
"日薪208万","434699"
"任嘉伦演技","390461"
"美驻印度使领馆2名雇员感染新冠死亡","324286"
"鸡蛋返生论文作者还教木遁火遁","246268"
"刘烨胡军 望道","236395"
"虎牙崩了","236096"
"四川冕宁森林大火已被扑灭","235557"
"北京无印良品再诉日本無印良品","235363"
"广州最大新冠疫苗临时接种点启动","234928"
"小学生被3条恶犬咬死双方和解","234479"
"刘宇粉丝拼字车祸现场","189066"
"皓嫣","189030"
"印度疫情失控会影响到中国吗","188022"
"假如一天赚两百万你会干什么","187978"
"李光洙将从RM下车","142374"
"当代年轻人眼中的一百万","134918"
"李斯丹妮金晨连麦","131907"
"赵让 曾淑岩","127920"
"吴宇恒字好看","123544"
"INTO1声明","117509"
"晋江月逝水录音","115862"
"湖人 魔术","112865"
"娜扎演的周子萱好飒","112607"
"最缺工100个职业排行","110270"
"歌隼","109587"
"庆怜 机场","105752"
"新疆红外线相机实拍狼出没","102675"
"妈妈给了我说喜欢的勇气","100245"
"印度单日新增确诊或超50万例","100003"
