"hot_word","hot_word_num"
"缅甸","2176625"
"左小青离婚","2153666"
"谢娜为跳跳俏俏庆生","2026123"
"伊能静 写稿的人请学会尊重女性","1719950"
"记者拽着代孕中介直接报警","1107741"
"丢手机后必做的五件事","964461"
"央视春晚首次大联排","745582"
"新疆欢迎外国各界人士来走走看看","744506"
"我是党员 需要什么奖","742934"
"刘亦菲二次元粉发","740721"
"杜淳和老婆合照","738444"
"贾静雯女儿咘咘被查出先天弱视","736664"
"新疆小伙托记者给蓬佩奥带个话","736450"
"世界最长玻璃桥晒168米巨幅春联","734173"
"北京仅留10个烟花爆竹零售点","731385"
"把玉米煮成了艺术品","731039"
"Clubhouse","727846"
"五福","726384"
"央视评管好中小学生手机的第一步","725873"
"宋妍霏散落在娱乐圈的考生","717986"
"李小冉平行时空两个自己","582781"
"emoji版合成大西瓜","457202"
"实拍缅甸仰光现状","444907"
"李现 没有CP那就自己组一个","424168"
"许佳琪暂时缺席THE9团体行程","391502"
"王一博现身央视春晚联排","381045"
"股市","354476"
"上海机场跌停","347636"
"小柿","343544"
"90后上海聋人女孩学说话成人气主播","323313"
"你真的了解什么叫失眠吗","315801"
"张艺兴joker","299033"
"缅甸副总统敏瑞就任代总统","283484"
"阳光之下","271303"
"草莓爆浆啵啵雪媚娘","269609"
"创造营春日少年初亮相预告","267657"
"王冰冰采访蔡徐坤","267260"
"绍兴可坐地铁到杭州","266787"
"跳舞丸子头","265344"
"明日方舟","264960"
"韩国散户对空头宣战","263521"
"复印机可以有多离谱","262537"
"涉疫奶枣新闻发布会","262445"
"春节假期非必要非紧急不出国","261088"
"斗罗大陆","260803"
"篮协将包机送中国男篮前往多哈","225361"
"1000元在杭大红包今起申领","221577"
"青你3训练生自我介绍","218224"
"山村小学里的二人世界","217281"
"福特中国就马年广告一事致歉","206646"
