"hot_word","hot_word_num"
"沈腾把假发笑掉了","2345790"
"延迟退休不会一刀切","1734971"
"教资","1211978"
"范丞丞回应没认出张小斐","1178417"
"称林书豪为新冠病毒球员身份确认","868306"
"宋亚轩把王一博认成吴君如","867085"
"骂学生笨支教老师被取消研究生资格","858991"
"3人祭祀烧毁山林被罚种2000棵树","795862"
"十四五规划和2035年远景目标纲要全文","758835"
"ipad猎巫","736604"
"关晓彤开衩红裙","716225"
"温客行 美强惨","671213"
"武汉最高礼遇迎接援鄂医护赏樱","662064"
"多地婚姻登记窗口3月14日加班","652059"
"弗洛伊德家人获赔2700万美元","642952"
"创4全员主题曲舞台爷青回","634316"
"李佳琦晒妹妹奈娃同框图","623883"
"直播武大樱花季抗疫专场","572327"
"延迟退休","571170"
"原来咖啡真的能提神","571063"
"发朋友圈要屏蔽父母吗","518767"
"俄罗斯被禁止奥运会用喀秋莎替代国歌","454625"
"王祖蓝杜海涛涛妈眼睛连成一条线","408996"
"地铁小哥10秒救回误入电梯口萌娃","397278"
"教资 高山滑雪","378738"
"光明日报 996和007是违法不是奋斗","345403"
"精神出轨该不该选择原谅","344318"
"这日语也太正宗了","338824"
"日本外务省发言人发表不当涉港言论","317453"
"那英胡静眼神交流","302719"
"延迟退休改革原则确定","271976"
"喜欢的话请响铃第二季评分","270323"
"如何看待正月里不让理发","261045"
"公寓油烟机藏摄像头正对着床","259414"
"何炅看宋亚轩的眼神","255685"
"教师资格证作文","233621"
"宋亚轩夜礼服假面","217029"
"世卫称新冠病毒将会出现更多变异","214830"
"用家有儿女的方式打开山河令","214579"
"大字号的中小学教材","214384"
"把廉价的东西穿出高级感","214260"
"高晓松","213907"
"南京婚姻登记自助机","213607"
"2020中国古生物学十大进展","213376"
"卡鲁索摔到后脑勺","212977"
"鸡鸣寺樱花","212868"
"司藤","212590"
"教资选择题","200685"
"辽宁省政协原副主席刘国强被公诉","200206"
"张伯礼对谈董明珠","200206"
