"hot_word","hot_word_num"
"爱奇艺把李诞奖杯收回去了","3989362"
"印尼收到了首批来自中国的新冠疫苗","3473734"
"素媛案罪犯一小时可做1000个俯卧撑","2972479"
"刘亦菲优越的颅顶","2920151"
"金请夏感染新冠肺炎","2206243"
"RM","1975613"
"成都郫都区","1728243"
"大学教师用不雅图文讲授日语","1577369"
"特朗普称其私人律师新冠检测阳性","1372922"
"大雪","1264041"
"焉栩嘉为97庆生音频","1184997"
"尖叫之夜奖杯 切片猕猴桃","1179806"
"老师带学生应援明星违反职业道德","1160771"
"错换人生28年案一审宣判","1159494"
"央视主播评安徽女孩轻生溺亡","1144588"
"辛巴燕窝部分消费者暂未获赔","1132138"
"没事千万不要踢柿子树","1122137"
"赵丽颖暖阳野餐大片","1062833"
"有翡新剧照","967364"
"焉栩嘉把粉丝打投拍立得送小盒鱼","930377"
"藏族仿妆可以有多绝","779128"
"刘亦菲为唐嫣庆生","712047"
"哈登夜店狂撒钞票","626058"
"湖南一混凝土搅拌车与救护车相撞","564791"
"美得像人鱼公主的仙女裙","527673"
"北京正研究拥堵费和郊区牌照事宜","478653"
"安徽考研生考前14天须每日测体温","451822"
"深圳公共场所已装3500台AED","435977"
"基金","384088"
"大学女足省赛因染发球员过多被判负","353656"
"被叫做脂肪陛下的小海豹","302448"
"罗云熙时尚COSMO封面","297580"
"勤深深回归我们的歌","290196"
"港警回应许智峰银行账户被冻结","285020"
"深圳西丽空气","281665"
"赵让成功追星张艺兴","260676"
"专家称延迟退休男女同龄为好","250314"
"你离真正的大雪有多远","232617"
"刘诗诗复古皮夹克","231284"
"英文版难念的经","227306"
"MAMA获奖名单","203946"
"巨人","200207"
"新疆大雪时节冰花美如画","197788"
"奇葩说第七季导师阵容","196474"
"成都地铁5条新线车站亮相","196381"
"苏州地铁","189066"
"大雪过后贪吃蛇出动","186714"
"茅台股价创新高","184969"
"美国新冠肺炎超1470万例","184293"
"贾玲回应刘德华喊她演夫人","183423"
