"hot_word","hot_word_num"
"艾克里里是怎么变白的","3435810"
"华春莹批加拿大贼喊捉贼","1774847"
"4名解放军官兵在中印边境冲突中牺牲","1699858"
"王灿主动追求杜淳","1265199"
"虞书欣加上了Lisa微信","807875"
"日本发现一种新型变异新冠病毒","610414"
"夫妻的家就是婆婆的家吗","516195"
"得州一度电约65元","494937"
"赘婿","493200"
"NBA全明星首发名单","488110"
"唐九洲不愧是文化人","483294"
"贾玲 让你妈给你跳行不","480700"
"张小斐跳舞真好看","475940"
"上海野生动物园熊群致人死亡调查报告","472429"
"毅力号成功登陆火星","466133"
"扬州一11岁女孩坠楼身亡","462298"
"在日本遇到最恐怖的事","460562"
"任重求导演AI换脸","457345"
"对亲戚最无语的一次","451863"
"你好李焕英路演","449113"
"员工回家过年拒带电脑工作被开除","445449"
"顶楼第二季开播","445320"
"吴秀波被女友敲诈案宣判","382848"
"张萌说和婆婆之间也要有一定界限感","324013"
"北京朝霞","314170"
"孟佳点赞力丸赞多舞台","306057"
"以前选秀是怎么投票的","302846"
"国家文物局督办翁丁村火灾事故","274095"
"爱奇艺会员数下降","271476"
"王源emoji文案是什么意思","269831"
"日本汽车零部件巨头曝大规模造假","246269"
"娜扎眼神太虐了","232686"
"鸟类能有多侧颜杀","195671"
"华春莹说中方让疫苗成为全球公共产品","190960"
"吴白神仙男友","190810"
"官方回应东北地区率先全面放开生育限制","180779"
"上阳赋","155791"
"贾玲高情商接梗名场面","155230"
"卫健委答复解决东北地区人口减少问题","152514"
"海清最惨角色","151947"
"全村人都姓操","147136"
"青春有你","146883"
"哈士奇肾衰竭安乐死","145816"
"张敬华任江苏省委副书记","131806"
"何同学采访苹果CEO","131159"
"上海最新四大姓","113952"
"正确的修容方法","97547"
"西安咸阳机场为啥能发现扎堆古墓","92185"
"基金","91823"
"兄弟姐妹7人还原24年前照片","91747"
