"hot_word","hot_word_num"
"谈莉娜 未等到的东西会等到嘛","847357"
"河北本轮疫情仍是境外输入病毒","667573"
"发光吧2021","661535"
"石家庄疫情","650319"
"石家庄为延迟发布会道歉","618343"
"顶楼大结局","565355"
"王俊凯毕业大戏","494229"
"山东发现首例新冠变异毒株感染确诊患者","480658"
"猫 老虎 被雨淋湿的狗狗","436780"
"中疾控和卫健委专家组已到石家庄和邢台","396925"
"姐妹交往三大忌","372016"
"石家庄全市核酸检测","334620"
"有翡","305102"
"石家庄疫情发布会","281190"
"韩国出生271天女童遭养父母虐死","277568"
"酷我音乐因会员广告被罚5万元","277007"
"木子洋被认成辣目洋子","276325"
"杨洋你是我的荣耀杀青","275124"
"王者荣耀","274608"
"石家庄中小学幼儿园暂停线下教育","274036"
"柯以敏","273273"
"易烊千玺空军招飞宣传片完整版","272510"
"无证驾驶儿子新车连撞10车","252610"
"小红花里父亲的背影","243782"
"吴宣仪被烟花烫到头发的反应","233490"
"陈晓 跳楼那个是专业的武行兄弟","221760"
"西安市民石家庄参加婚礼成密接","211423"
"浙江考研上百名考生违规被处理","208524"
"上海试点使用数字人民币","206772"
"华春莹问蓬佩奥美国到南海有多远","206133"
"阳光之下","206127"
"流金岁月","204715"
"鞠婧祎 过去完成时","190712"
"谢允 你就是我心里的天下第一","183040"
"直击英国第三次全境封锁","177278"
"总裁文看多了的后果","176662"
"山西警方通报无名男婴尸源身份","168626"
"王俊凯台词功底","168085"
"朱锁锁被谢宏祖求婚","161578"
"巡回检察组","147899"
"河北大学紧急放假现场","143763"
"肖战光点数字专辑畅销榜年冠","138954"
"柯滢雨中找杨雨泽断指","135663"
"顶楼","133835"
"周深在溶洞里唱传奇","131132"
"如何把白衬衫穿出时髦感","130482"
"日版微微一笑很倾城","128864"
"周翡得知谢允没死","124473"
"我们的大脑还可以被开发吗","123369"
"赖小民一审被判死刑","122822"
