"hot_word","hot_word_num"
"黄奕 我的家庭没有爸爸这个角色","2952010"
"成都警方回应四十九中学生坠亡","1886269"
"大学生利用肯德基漏洞诈骗20余万元","1621448"
"吴磊范丞丞不敢看钟楚曦","1269675"
"于敏生前采访中反复说死而后已","1262366"
"张柏芝想为结婚对象再生小孩","1153235"
"毕业生学位论文查重乱象","1046445"
"华春莹说强征慰安妇是严重反人类罪行","936600"
"郭杰瑞称美国故意不报道中国抗疫成果","790157"
"教育部建议家长不跟风报班","668547"
"校方否认学生坠亡与化学老师有关","585206"
"印度黑市氧气卖出天价","502166"
"我国仍是世界第一人口大国","488056"
"技嘉道歉","456269"
"每学期对课桌椅高度个性化调整","425286"
"董明珠看许佳琪跳蝎子舞的表情","424789"
"吴倩说对待老人只有真诚和耐心","423081"
"曾黎 我至今未婚","421251"
"张哲瀚的脸比新浪公仔还小","419981"
"虞书欣说自己是横店千颂伊","417405"
"蔡文静彭冠英双人剧照","415263"
"东莞牺牲民警搏斗时故意往人少处去","414876"
"姜小宁认出顾川是大哥哥","404462"
"小猫咪的力气能有多大","380205"
"洱海坠机牺牲机组人员信息","375887"
"老师撤离150名学生后大树瞬间倒下","370956"
"京东下架技嘉全部产品","356759"
"技嘉","356217"
"超200家粉丝后援会呼吁理智追星","356116"
"印度一ICU供氧量突降致11人死亡","328745"
"伊朗13艘快艇高速逼近美舰队","328299"
"菅田将晖说利路修的故事像少女漫画","323419"
"成都学生坠亡事件有哪些疑点","290040"
"大熊猫向展馆外熊猫玩偶求抱抱","281365"
"河北涿鹿县发现草原狼","273783"
"一生一世首支预告","271747"
"御赐小仵作","249677"
"瀑布小龙虾盖浇饭","238220"
"口腔溃疡有多烦","238031"
"迪丽热巴说四个长歌可绕地球一圈","219807"
"爆柠茶","216018"
"老人驾车逆行碾轧小学生后跑了","208225"
"没想到还能这样通过答辩","208184"
"新华社调查网络招嫖出口转内销","207017"
"中小学原则上采用纸质作业","206595"
"中小学用电子产品开展教学不超30%","205993"
"深圳已成立深房理联合调查组","205020"
"悬崖之上","204941"
"成都坠亡学生家属不认同教育局通报","204423"
"假如国货有段位","204384"
