"hot_word","hot_word_num"
"央视评谁偷逃税谁就得凉凉","206211"
"严厉打击代孕等违法行为","107346"
"realme真我Q3","103567"
"北京试点对超市连卷袋收费","89349"
"明星工作室接连注销","89314"
"国办要求惩处用网络对儿童隔空猥亵","88300"
"汪峰定律","80659"
"今年高校毕业生规模达909万人","76828"
"郑爽涉嫌签订阴阳合同被调查","71997"
"马思纯 减肥以健康为重","60906"
"国办要求加强出生人口性别比综合治理","56686"
"熟蛋返生论文校长辞职","51496"
"印度疫情","49994"
"杜淳被王灿拉黑过25次以上","45975"
"龚俊姚安娜加入中餐厅5","45876"
"余生请多指教双人海报","44625"
"女硕士因残疾未通过教师资格认定","44084"
"张杰让何炅把冻龄秘诀传授给大家","43743"
"闲鱼崩了","42766"
"2021湖南卫视综艺片单","42320"
"机票盲盒为什么吸引年轻人","41823"
"被罗志祥耍了","41684"
"章子怡 峰哥发博要谨慎啊","40930"
"王一博演的陈宇","39495"
"过三爽好会说话","38882"
"你能接受孩子将来不如自己吗","36783"
"18元一日游被带去参观墓地","30948"
"炒房客囤的小产权房最终谁买单","30696"
"CBA总决赛G1裁判报告","30690"
"夫妻吵架最伤人的话是什么","30688"
"印度政府官员深夜突袭婚礼现场","30465"
"印度一新郎新冠阳性仍举行婚礼","30069"
"小朋友之间能有多甜","29507"
"刘宇直播","29269"
"张若昀正式起诉父亲张健","28477"
"烨斯","28336"
"任嘉伦工作室辟谣网传新剧","27568"
"猫咪的智商是个谜","26521"
"邢菲让姜小宁把嘴闭上","24214"
"学生时代难忘的社死名场面","21705"
"二手新能源车难卖","21441"
"广西北流市民自愿排长队献血","20930"
"男子遛狗不栓绳被罚款2500元","20392"
"高考那个夏天有多难忘","19593"
"往后余生片花","19232"
"十九届中央第七轮巡视名单","19132"
"男子车展长时间操作中控被骂","18177"
"长歌行","17410"
"美团回应副处长当骑手1天赚41块","17398"
"2021湖南卫视大剧片单","17176"
