"hot_word","hot_word_num"
"郭碧婷复出","4546680"
"印度拒绝联合国物资驰援","1713039"
"白敬亭 叫老公不回叫老婆直接拉黑","1706501"
"你的婚礼","1368103"
"利路修什么时候回复张欣尧","1172097"
"不好的全抛光","1135498"
"打针居然也能买一送一","928102"
"波兰发现2000年前孕妇木乃伊","915418"
"造谣取快递女子出轨两人获刑","912519"
"赵丽颖搬离与冯绍峰的家","912313"
"税务总局回应郑爽涉嫌偷逃税","911795"
"腾讯因垄断问题被罚50万","907757"
"赞多晒与INTO1成员合照","886410"
"国产首例临时心脏起搏器","876126"
"堵车","865982"
"三亚市委原书记童道驰被双开","842225"
"殴打强奸14岁少女7人被刑拘","834679"
"杭州东站","821188"
"专升本","811230"
"姐姐天生有义务照看妹妹吗","798027"
"男子买到假毒品报警","596384"
"吴倩手绘一桌子武汉美食","589144"
"酒店该不该帮未入住旅客收快递","578582"
"鹿晗 一人之下","526330"
"龚俊剧透五四晚会节目","508987"
"有效搞垮身体的五种姿势","508842"
"烨斯","434681"
"云南30天无理由退货","401439"
"北京文化被停牌","390334"
"再摸1天鱼就放假了","380454"
"杨幂黄明昊wink","327946"
"诺基亚壁纸","308387"
"白敬亭生图","286861"
"我国成功发射遥感三十四号卫星","270905"
"镜子里就是你的真实颜值","266106"
"日晕","257743"
"乌龙奶冻葡萄冰","255795"
"秘密访客","246865"
"美国要求所有在印公民尽快离境","219339"
"国家电影局强调以郑爽涉嫌问题为戒","200443"
"像极了对象爸妈在家的你","196807"
"袁弘儿子在国际不打小孩日捣蛋","180018"
"特朗普确认将再次参选总统","179260"
"国家电影局强调坚决抵制天价片酬","179193"
"桂林同时出现日晕七彩云","179173"
"新冠疫苗接种不得按户籍一刀切","169663"
"苹果中国官网上线官方翻新产品","163872"
"18个国家和地区发现印度变异毒株","159462"
"制播暴饮暴食视频最高罚10万","158710"
"写真地理负责人被责令辞职","158416"
