"hot_word","hot_word_num"
"邢菲走红毯时假发片掉了","3984411"
"不准以任何方式强迫毕业生签就业协议","2738481"
"颜控必入限量气垫","2673223"
"杨超越 还有多少一次来个痛快","2441852"
"丁真妈妈回应儿子入职国企","2035984"
"日本成辣条最大进口国","1143756"
"东南大学本科生支教踹倒小学生","864751"
"哈尔滨性侵4岁女童嫌犯被判死刑","860821"
"澳大利亚","839669"
"香港浸大学生会会长方仲贤被捕","772878"
"排长队买奶茶值得吗","728524"
"邱淑贞女儿气质","728308"
"林更新怼打一星的网友","727776"
"金晨和陈一鸣约会害羞了","709729"
"周庭入狱10个月","668057"
"COSMO时尚盛典红毯","632484"
"罗志祥","601255"
"原来雪花真的长这样","583804"
"日本将允许大规模海外游客入境","555841"
"世界只剩中国FAST一只天眼","547909"
"黄之锋涉非法集结案被判刑","544926"
"来自牙医的朋友圈哭诉","543028"
"薇娅","519833"
"活带鱼有多惊艳","504838"
"什么原因阻碍了你生娃","399954"
"应统一男女退休年龄吗","399642"
"教育部发通知部署今冬明春防疫工作","398766"
"这些微信表情默默消失了","396467"
"高通总裁称已与荣耀对话","356898"
"捡走一块泰山石最高罚2万","346851"
"东莞图书馆留言走红农民工离职","345178"
"COSMO时尚盛典","333457"
"国航回应成都至上海航班返航","329431"
"胡一天扯乔欣衣服撒娇","314007"
"香奈儿发布虚假广告被罚款20万","303281"
"体育差生图鉴","302154"
"耿斯汉表白金莎","299778"
"张宁被下放至CBDL","294532"
"段静涛","286981"
"外交部回应美国将限制中企在美上市","270450"
"丁真的愿望是看完网友寄的书","263554"
"胡锡进","263091"
"姜磊投票","260029"
"每个美国人获得约120个中国口罩","259894"
"剑网三","259852"
"西蒙斯正式加盟辽宁男篮","259830"
"女儿们的恋爱","254883"
"外交部回应美去年12月已出现疫情","229804"
"吴谨言洪尧","211277"
"何洛洛回应和女生玩密室","210707"
