"hot_word","hot_word_num"
"摩尔庄园","1390865"
"长沙一律所因收费过低被警告处分","865485"
"王一博直播状态","733881"
"保持年轻的黄金法则",""
"石恩隆 聊天记录","692287"
"特朗普自称将于今年8月重回白宫掌权","576602"
"高圆圆张鲁一演夫妻","490971"
"郎平眼睛肿了","435752"
"浙江男子打110举报自己酒驾","396757"
"HarmonyOS界面","370979"
"广州首例确诊郭阿婆将出院","335950"
"吴亦凡 都美竹","335665"
"张雨绮红毯走出谐星的感觉","335055"
"饭店员工给17棵行道树投毒","295878"
"华为P50","245618"
"瑞丽抓获一挖洞钻入偷渡入境人员","231045"
"热心市民范丞丞","229078"
"吴亦凡","227673"
"张天爱 今天是张公子","223305"
"黄景瑜跟李沁学自拍","221743"
"华为为什么坚持鸿蒙系统","219560"
"嘉人群像照 姬圈盛宴","219218"
"唐嫣的腿yyds","217958"
"庆怜 我不喜欢标准体重概念","216609"
"刘诗诗杨幂坐一起","215418"
"中国共产党组织工作条例","213526"
"成都暴雨","213336"
"中国女排不敌土耳其女排","211221"
"需要支付违约金的offer","193554"
"家中积水过膝男子淡定看动画片","178644"
"顶楼3预告","154309"
"狗狗偷吃外卖被教育后一脸委屈","153677"
"广州一大叔坐地铁口罩武装到眼","149342"
"山东一养老院院长恐吓给老人打哑巴针","148737"
"衡水中学回应学霸演讲视频","135594"
"建议免费为中学女生接种HPV疫苗","135346"
"郑秀晶腹肌","135270"
"象群距昆明晋宁仅300米","124941"
"来自农村需要自卑吗","123642"
"杨幂刘诗诗唐嫣同框 梦回仙剑","116167"
"当我把全班同学写进小说里","115029"
"北大回应韦东奕走红网络","111153"
"中国女排 土耳其女排","105957"
"没想到打疫苗也社死","103665"
"哪些食物可以护眼","102709"
"文淇 手背打招呼","89852"
"爱上特种兵","76136"
"嘉人深V内卷","73414"
"女生因过度吃甜食近视1500度","65930"
"自卑型人格有多累","65025"
