"hot_word","hot_word_num"
"袁隆平遗照确定","1876777"
"男子侮辱袁老被采取刑事强制措施","970568"
"甘肃山地马拉松16名参赛选手遇难","789032"
"袁花花还没长大","767707"
"快乐大本营停播一期","746565"
"联合国悼念袁隆平","739729"
"大连车祸司机已被抓获","607125"
"湘雅医院门口的三束水稻","599297"
"安徽六安新增1例确诊病例","585826"
"袁隆平病危之际还关心稻子长势","563079"
"一刷微博就想哭","551002"
"三天痛失四位国之栋梁","542900"
"吴孟超院士年轻时的照片","515928"
"钟南山悼念袁隆平","506448"
"深圳新增1例本土无症状","478356"
"一个人能低调到什么程度","470814"
"网友拍到了稻穗状的云","438671"
"亿万只地下蛰伏17年的蝉在美破土","374248"
"马竞夺得西甲冠军","343457"
"独行侠战胜快船","333587"
"袁隆平追悼会后天举行","328297"
"薇娅发长文纪念袁隆平","326012"
"袁隆平多年在路边小店理发","310442"
"河北献县5名孩子坑塘中溺亡","306143"
"市民围着袁隆平灵车失声痛哭","228782"
"李佳琦直播","219503"
"浙江卫视编排调整","189824"
"美韩领导人表示愿与朝鲜进行外交接触","181396"
"山东事业编考试","179554"
"思政大课","179350"
"刚毕业爸妈就让我寄钱回家","179320"
"吴孟超长时间握手术刀手关节变形","151295"
"我好像和他有一面之缘","141926"
"动画片能多具有教育意义","124869"
"袁隆平逝世","118985"
"新闻联播","117228"
"北京下雨","109634"
"小行星17606去陪小行星8117了","102992"
"MSI","99098"
"御赐小仵作","97880"
"吴孟超逝世","78965"
"西藏和平解放70周年","77521"
"秦岭受伤大熊猫唐唐回家了","76736"
"加沙遭空袭前后卫星对比图","76646"
"大理漾濞超市货物散落顾客慌忙逃生","76562"
"五十公里桃花坞延播","71986"
"袁隆平给妈妈写的歌","60018"
"厦门七彩云","57034"
"LadyGaga自曝19岁时被性侵致怀孕","56777"
"月光变奏曲","55369"
