"hot_word","hot_word_num"
"张若昀脑门上出现正方形","3236663"
"四川新增4例本土病例","3131192"
"邓紫棋男友","3102697"
"万茜回应红毯被催","1751980"
"四川是唯一女多男少的地区","1186572"
"未成年女生被诱导陪酒校长被免职","1114666"
"罗永浩 劳资是时尚先生","1112182"
"文在寅电视讲话以黑白画面呈现","1082669"
"中国31省份性别比盘点","1076564"
"许凯帮杨幂拧瓶盖","1057234"
"许光汉 隔离了14天就是来领这个奖的","1043849"
"刘亦菲cos奥黛丽赫本","998334"
"巴西确认首例新冠二次感染病例","829308"
"迪士尼宣布50部新影视","771327"
"李佳琦戴眼镜好帅","734583"
"德云社","715172"
"西南交大","695674"
"黑龙江多地中小学寒假提前至元旦前后","550181"
"湖北居民网上采购进口冷链食品被处罚","539151"
"车银优好帅","537164"
"THE9 Lion彩排","479120"
"吴宣仪被记者叫姐姐的表情","454440"
"成都已累计追踪到密接者504人","443562"
"郭采洁 小麻花辫没测出风速","438806"
"龙丹妮与09届快女聚餐","399363"
"人民军队2020十大名场面","381949"
"宁波调整二套房首付比例","373341"
"华春莹说就做战狼又何妨","373012"
"杨幂蝴蝶结好大","372893"
"辽宁自来水可燃事件13人被问责","323838"
"多部漫威新片预告","318047"
"湖南辣条专业班首次考核","275961"
"中国驻美大使馆推特账号被黑客攻击","273230"
"女神降临","271110"
"丁辉发长文回应淘汰","214676"
"2020年只剩20天","202805"
"猎鹰与冬兵预告","193791"
"芬兰核电站发生严重故障","177356"
"12岁男孩被巨型风筝带上天","171163"
"张雨绮 希望我明年不会塌房","168334"
"31省区市新增15例确诊","163220"
"宋轶带苹果走红毯","157792"
"四川观察","141630"
"邓伦的腿长到无处安放","137049"
"泡泡玛特市值破1000亿","125439"
"北京研考生须提供考前7日内核酸报告","117181"
"考研倒计时15天","117140"
"在显微镜下清理手机","117125"
"TGA","116422"
"四川通报4例本土新增病例详情","116278"
