"hot_word","hot_word_num"
"官方回应击毙外逃老虎原因","1885456"
"易烊千玺入围华鼎奖最佳男主","1208952"
"中国女排 韩国女排","601626"
"和不喜欢的人结婚是啥体验","595423"
"为袁隆平拍照24年存500多张照片","463520"
"王珞丹 退圈","446267"
"名创优品火星列车",""
"徐仁国朴宝英吻戏","426769"
"台北市长称8成新冠确诊者不用住院","422708"
"小区电梯突然加速撞顶楼致1死","419285"
"LV老板重返世界首富","417785"
"INTO1应援色和粉丝名","411817"
"曝光彦希偷戒指的店家道歉","409026"
"吴孟超遗体告别","401183"
"以袁隆平Q版形象为主角的科普动画片","397489"
"安徽一工地发生溺水事故4人死亡","393605"
"发现自己生性薄凉的瞬间","388785"
"张歆艺分享儿子可爱趣事","386335"
"被医学专业耽误的影帝","379209"
"黄小蕾 没有人是天生的气氛担当","378702"
"黑暗中看手机对眼睛伤害有多大","372920"
"那些最毁三观的广告","356097"
"帝皇书","304713"
"李斯丹妮 黑暗是艺人的必修课","280013"
"被姜云升笑死","249410"
"男子冒充美女主播骗打赏超1000万","249007"
"普京与拜登将于6月16日举行会晤","216866"
"龙王流萤成婚","205877"
"美国人将蝉做成巧克力","197577"
"中国女排战胜韩国女排","190352"
"王梦洁躲一传","187724"
"黄景瑜跳情人","187497"
"夫妻拒养听障儿被判不许离婚","180609"
"辣目洋子社死现场","176275"
"两只蜜蜂合伙拧开瓶盖","162489"
"甘肃马拉松遇难者家属获赔95万元","146300"
"广州夜空画出袁隆平","134190"
"喻言回应缺席节目录制","128485"
"特斯拉已在中国建立数据中心","120197"
"原来荔枝也有排名","114037"
"追爱吧哥哥 男星追素女","103092"
"2021LPL夏季转会期","97309"
"现在的直播到了什么程度","94480"
"深圳本轮疫情累计报告7例无症状","87637"
"华鼎奖提名名单","84873"
"女孩247天拍摄56个民族服饰","83519"
"广东新增3例本土无症状","83023"
"皓衣行剧照","82838"
"全国哪里能看到超级红月亮","66783"
"世界女排联赛","66054"
