"hot_word","hot_word_num"
"吴尊女儿在文莱国王面前演奏大提琴","3106349"
"超1800人牺牲在脱贫攻坚一线","2425856"
"年味回味大放送","2358425"
"伍兹遭遇严重车祸","2070956"
"基金暴跌年轻人为什么躲不过被割","1048140"
"货拉拉司机家属回应女孩跳窗身亡","840126"
"上海抽检奶茶店全部存在问题","537741"
"趵突泉景区近3年打捞出钱币6万余元","533328"
"顶楼周丹泰千瑞珍婚纱照","514593"
"杨幂说自己是一个会喷队友的人","509628"
"国家卫健委答复为何单身女性不可冻卵","450721"
"乔欣能穿20年的大衣推荐","425346"
"检方回应男子假装自杀女友相救溺亡","324960"
"美国新冠肺炎超2823万例","323400"
"成都发放4000万元数字人民币红包","321841"
"顶楼","320708"
"中国人寿","318370"
"魏大勋敷衍式营业","317564"
"原来孙悟空的仙气是烟雾","316527"
"宁毅试探楼舒婉","294907"
"丁真阿朵为民族文化助力","287830"
"路人镜头下的金莎","249903"
"吴白把岳父喝成兄弟","243327"
"岳云鹏饺子爱好者","231620"
"日本任命首位孤独大臣应对自杀率上升","230366"
"宋亚轩凡尔赛式吃螃蟹","229651"
"特斯拉比特币获利超过卖车","226003"
"谭松韵胶片感生活照","209737"
"理个发居然被理崩溃了","171473"
"我驻英使馆回应卫报错误配发涉华图片","151318"
"宁毅误会苏檀儿","139237"
"货拉拉涉事司机被刑拘","131312"
"张大仙","125350"
"世界最胖男孩减重200斤","120697"
"中央一号文件里的时间表","115641"
"陈宥维 会有衣服替我来青你","111124"
"欧冠","107603"
"正青春大结局","100103"
"鲍威尔","95645"
"唐宫夜宴舞者打卡郑州地标","95018"
"你好李焕英票房破42亿","85821"
"吴白醉酒对艾情撒娇","78529"
"三人撬锁进入三里屯某楼顶拍照被行拘","78298"
"四川盐亭发现三星堆时期大型聚落遗址","75854"
"易方达中小盘停止申购","74408"
"孟佳要给韩美娟定制不会掉的假发片","71694"
"山河令","66658"
"新规下首只1元退市股","65260"
"教育部要求给家长减负","59527"
"风起霓裳","58725"
