"hot_word","hot_word_num"
"岳云鹏 老婆是俄罗斯方块里那个竖","1109435"
"央视直击湖南操场埋尸案侦办幕后","621925"
"杨丞琳唱功被低估了","367014"
"斯凯奇声明中国供应商没有强制劳工","359240"
"大张伟模仿papi酱","299496"
"黄牛外挂软件侵入上海交警APP","237597"
"顶楼2","234982"
"外交部提醒北约还欠着中国人民的血债","225783"
"肉眼可见的流星穿越大气层","224019"
"小李琳 这是最后一次扮演杜冰雁","223881"
"黄奕聂远再现掀盖头名场面","223582"
"外交部回应拜登称不会让中国超越","180315"
"埃及火车相撞致32死66伤","173972"
"王牌对王牌剪辑","173357"
"哥斯拉大战金刚","172944"
"王智晒三岁女儿生日照","165788"
"刘维模仿lisa","163115"
"山东苹果冷库库存达新高","157944"
"发现学生迟到老师救下祖孙3人","154722"
"张柏芝再跳樱花舞","149388"
"高校学生宿舍烧小龙虾消防找上门","147503"
"安又琪金子涵国风扇子舞","142293"
"人贩称梅姨真实存在","140003"
"男子制造2次车祸杀妻骗保","132722"
"奇奇怪怪的文化输出","131116"
"直播间1666元买的翡翠手镯是假货","120192"
"为参加冬奥会白天训练晚上送外卖","113421"
"官方称成都大运会取消为不实消息","112897"
"许佳琪领带wave","112694"
"女孩自学榫卯技术建故宫同款亭子","107161"
"Lion音画不同步","102529"
"小朋友的灵气是怎么消退的","94979"
"华春莹说中国的目标从不是超越美国","93174"
"王牌对王牌","92457"
"警方通报老人坐轮椅进隧道被撞身亡","91168"
"10岁女孩被强奸怀孕医生强制报告","88601"
"米佧心疼邢克垒","86932"
"陈小纭选队长时的表现","83838"
"第二名的逆袭","80528"
"武警小哥哥问班长要巧克力","71130"
"新疆赛里木湖蓝冰","69030"
"Doinb和小天握手","64704"
"卡斯柏徐艺洋合唱TA","64161"
"山河令","61756"
"最强大脑","61710"
"THE9演唱会","59509"
"创4宣传委员招募","59461"
"BCI上海代表处发布声明","52612"
"顶楼","51909"
"华春莹给记者播视频揭批美涉疆图谋","51276"
