"hot_word","hot_word_num"
"沈梦辰说跟杜海涛该结婚了","4655693"
"急寻5月8日D3058次12车厢乘客","2038547"
"梅琳达宣布离婚后已获得30亿美元","1773286"
"五年级弟弟发的微信消息","1633045"
"全球多国爆发反以游行","1282490"
"郑合惠子否认拍夏至未至加戏","718989"
"和成毅毅起聊天庆生",""
"利路修大雄同款睡姿","667875"
"六安两家医疗机构擅自接诊发热病人","632319"
"怎么老是你们仨","587145"
"北京上空同时出现日华日晕环地平弧","586913"
"李莎旻子隔壁老樊手挽手","586684"
"白宫就以色列炸毁媒体大楼表态","585822"
"台湾单日新增206例本土病例","578425"
"蔡徐坤接机名改成颜文字了","567814"
"辣条专业班学生开发辣条粽子","564479"
"李雪琴停车停了半小时","559900"
"诛仙CCTV6第一季度国产影片收视率第一","547532"
"赵丽颖粉色挑染直发","541416"
"初级会计","538832"
"刘诗雯无缘东京奥运会单打","533933"
"孙怡晒妈妈节目前后对比照","521409"
"女子酒后爬豪车蹦迪致车损28万","521138"
"原来奥特曼里还有小学生","424388"
"韶关通报6学生骑1辆共享电动车","411367"
"禁忌女孩","384991"
"舞蹈教室","373697"
"成毅被问指甲油色号","329859"
"张哲瀚珍珠朦胧感大片","316690"
"高中语文教资面试","282525"
"如何看待刘诗雯无缘奥运单打","270642"
"确诊病例及密接曾乘航班火车汇总","259320"
"天问一号着陆90后女调度淡定指令","253109"
"力丸撞衫机场工作人员","223057"
"湖南岳阳局地出现12级大风","208779"
"群众雨中迎2名洱海坠机烈士回家","192777"
"ITZY新歌 孔雪儿solo曲","190277"
"70岁超模奶奶登台走秀9年","180523"
"皮囊之下","176819"
"鲅鱼圈区初中小学封校停课","159376"
"7座面包车竟塞下28名幼童","154401"
"武功山的风到底有多大","152753"
"胡兵自责落泪","146897"
"赞多力丸比心","125272"
"沈阳新增确诊排查密接59人","125097"
"凯里520当天暂停办理离婚业务","125030"
"义勇军进行曲发表86周年","118329"
"御赐小仵作","116928"
"加沙被炸大楼负责人曾央求多给10分钟","116453"
"你心中科比的精神是什么","116150"
