"hot_word","hot_word_num"
"Angelababy蔡徐坤同框","265461"
"大连24例感染者经4次以上核酸后呈阳性","173913"
"开新宝典","147120"
"小鹿 为什么不能有灯牌里的妈妈","143116"
"范丞丞妈妈就是我妈妈本人","110660"
"航拍今晚的石家庄站","102068"
"女生想拥抱的男生的穿搭","97618"
"石家庄疫情","87399"
"美国国会确认拜登胜选","85429"
"流金岁月","84525"
"女神降临","64408"
"谢允向周翡求婚","54477"
"发型对颜值的重要性","49225"
"伊拉克司法机构对特朗普发逮捕令","48667"
"黄子韬想和性转后的自己结婚","48400"
"奇葩说","47893"
"徐梦洁像踩着平衡车领的奖","47201"
"河南大学","46248"
"涪陵榨菜被列为被执行人","46140"
"王骁曾后悔参加节目","46092"
"有翡","45933"
"新郎结完婚把新娘忘在酒店","45830"
"不能在北方说找块豆腐撞死","45732"
"美国国会骚乱中枪身亡女子系退伍女兵","45691"
"山东春晚官宣张韶涵刘雨昕","41874"
"华信信托董事长用锤子打伤总经理","40462"
"刘宇宁直播","40285"
"健康码的温度在哪","38273"
"多家银行着手清理个人睡眠账户","38004"
"河北南宫新增2例阳性","37972"
"了不起的女孩大结局","37953"
"西单大悦城全部餐饮商户闭店整改","34894"
"女子零下17度吹泡泡变水晶球","34238"
"特朗普承诺有序进行政权交接","33853"
"爱你的人才会帮你做的事","33847"
"蒋南孙遭遇职场性骚扰","31816"
"时光褚嬴再相遇","31813"
"假如你可以养一头牛","29733"
"该不该阻拦妈妈疯狂应援男明星","29638"
"文咏珊演技","29137"
"江苏省级医疗队驰援河北","27960"
"詹秋怡律政佳人","27801"
"大江大河","26579"
"李晋晔王骁詹秋怡拿offer","25674"
"巡回检察组","25480"
"虞书欣淡绿色连衣裙","25291"
"吴宣仪提着长裙小碎步","24514"
"基金","23141"
"暴乱后美国国会内部","20984"
"R1SE年度人气团体","20686"
