"hot_word","hot_word_num"
"李晟问为什么她天天被遛","4766097"
"特朗普明年1月将失去推特特别保护","3552822"
"华晨宇开夜猫子盲盒","3189096"
"喻言为过去言行之失道歉","2595646"
"上上谦火锅店关联公司成被执行人","2469590"
"李钟硕近照","1675788"
"外交部回应拜登胜选","1303619"
"初中女生跑出国家一级运动员水平","1110841"
"上海浦东","955928"
"北京严打假结婚过户京牌刑拘124人","705914"
"韩国女团成员涉嫌诈骗被起诉","693258"
"作业批出了手帐的感觉","629183"
"英国女王首次戴口罩亮相","410819"
"武汉派专车去接羊了","384421"
"一女子为过户京牌结离婚28次","380675"
"凡尔赛文学","362928"
"张彬彬","361780"
"罗永浩直播公司四成股权卖近6亿","360023"
"班主任回应高三生大汗淋漓背书","359559"
"婴儿从摇床摔下爸爸瞬间接住","358180"
"燕云台评分","356872"
"谢娜发问号表情包","356681"
"拜登再给已故长子扫墓","356301"
"卧底出身的网店老板","355623"
"公交司机拒绝有异味老人上车","355259"
"谢娜 快本","354798"
"周震南父亲股权被冻结3年","354703"
"大爷骑电动撞上保时捷豪转一万五赔偿","354163"
"央视喊话商家促销多些真诚","353646"
"TES经理回应S10失利","353259"
"曹颖一点没变","352583"
"胡兵100片玻璃拼接服造型","352535"
"天官赐福","337523"
"当狗狗偷吃了地瓜","287352"
"衢州","282994"
"明星版凡尔赛文学","271759"
"最高人民法院将王书金案发回重审","238644"
"综艺里明星下厨会是啥画面","229935"
"为踩点上班可以多拼","222450"
"凡尔赛人怎么过双十一","206741"
"杨超越 早知道我也收拾一下","205916"
"张大大发文告别演员请就位","205788"
"上海市疫情防控发布会","204801"
"快乐大本营贴吧辟谣谢娜退出","199931"
"水星年内最后一次大距","191749"
"马来西亚两直升机空中相撞","189571"
"2020福布斯中国30岁以下精英","188138"
"浙江衢州一工厂发生火灾","186732"
"天津新增1例无症状感染为货车司机","180406"
"伊利申请嗨皮牛夜商标","179441"
