"hot_word","hot_word_num"
"李行亮女儿喂王一博吃糖","3292416"
"刚果金医务人员确诊埃博拉","2204646"
"初四","1597758"
"谈恋爱要在朋友圈公开吗","1508939"
"埃博拉","1403133"
"云同学会怎么玩","1096601"
"雷佳音邓伦牵手照","988900"
"黄子韬的车在情人节抛锚了","981395"
"研究称美国去年7月已出现变异新冠病毒","863350"
"没抢副总裁发的红包差点被辞退","785619"
"石家庄新增1例本地确诊病例","535798"
"为何这个牛年仅有354天","512048"
"大佬撒狗粮名场面","474078"
"31省区市新增确诊9例","434408"
"宋轶好美","428089"
"杨超越侯明昊喜剧之王式告别","362582"
"袁姗姗 张小斐","361231"
"威少罚球三不沾","354665"
"威少战斧暴扣","349853"
"Girls help girls","343353"
"娜扎 姐被勒秃噜皮了","338369"
"陆虎和女友合作雪落下的声音","329952"
"熬夜一定会影响睡眠质量吗","326562"
"汉语是如何逼疯外国人的","319327"
"太奶奶温暖解释重男轻女","311680"
"Angelababy还好我是南方人","310223"
"上海就地过年带动酒店业","291978"
"低卡年夜饭","289897"
"佛首是2020年回归第100件流失文物","289241"
"毛不易翻唱想见你","289158"
"唐探3票房","278125"
"杜兰特受伤","277582"
"你好李焕英票房破10亿","248201"
"辣妹五分钟薄背训练","248069"
"张大大 原来让人讨厌这么难","212206"
"黄明昊依然爱你","212072"
"斗罗大陆","190258"
"邓超送给孙俪自己种的花","176431"
"另一半向你借钱怎么办","168581"
"大年初四接灶王","161878"
"郭麒麟演技","151440"
"为何新冠疫苗研发速度史上最快","147344"
"琉璃裴行俭情人吻","145968"
"云南翁丁村老寨火灾已初步控制","145646"
"两千年前的浪漫","143203"
"壶口瀑布冰河解封映彩虹","142517"
"女婿跟老丈人告状","142321"
"苏檀儿主动吻宁毅","141440"
"俄批准与中国合建月球科研站计划","135171"
"偶像要不要官宣恋情","134692"
