"hot_word","hot_word_num"
"天天向上节目组声明","2279029"
"林墨为看到工作人员摔倒大笑道歉","2060187"
"我国35岁以下高血压患者超7000万","1241108"
"牛堡厚汁新时代",""
"印官方首次承认恒河浮尸有新冠死者","1067606"
"粉丝坐在男朋友肩上看蔡徐坤","738928"
"沈月直播插不上嘴","704176"
"天猫美食趋势榜单",""
"御赐小仵作","685134"
"福岛核电站储水罐已多次泄漏","622897"
"库里掀衣庆祝","607209"
"全球多国爆发反以游行","604937"
"王俊凯像极了在ktv的我","604902"
"曾毅又没被认出来","601197"
"沈梦辰说跟杜海涛该结婚了","589128"
"专家研判李某某吕某可能不是零号病人","579365"
"天天向上","562903"
"张小斐 35岁也有很好的一面","561676"
"年轻人适合过低欲望生活吗","550376"
"你很喜欢但穿不出去的衣服","540232"
"贾乃亮说假话好好笑","414118"
"库里常规赛得分王","404743"
"印度疫情","404517"
"合肥一确诊病例合作公司老板发声","403331"
"张彬彬大半夜加餐被工作人员抓包","389776"
"小偷吃力背走五六十斤硬币","363443"
"三爽表白小妹成功","273249"
"香兰素","237633"
"肖战诛仙拍摄特辑","233075"
"微软董事决定盖茨应离开董事会","220162"
"勇士锁定西部第八","211414"
"辽宁营口疫情问责情况通报","210890"
"邓伦在线求助网友安排行程","210815"
"张大仙晒照片","206949"
"内蒙古曾接收3000多名南方孤儿","196413"
"李宇春拍的云","179814"
"王毅将主持安理会巴以冲突紧急公开会","176640"
"RNG战胜PGG","175533"
"王力宏脏辫络腮胡","168180"
"RNG输了","160258"
"雅培奶粉检出微量香兰素被罚909万","159868"
"飞机飞过云层有多美","147098"
"修文物时脚手架倒塌他大喊抓好壁画","144319"
"还有3周高考","143055"
"阿娇 婚姻比爱情更需要承诺","142261"
"新研究发现冠状病毒致命弱点","127568"
"恰好是少年","125207"
"奶奶喂猫有多生猛","123842"
"下班遇堵车便衣民警亮证指挥","113376"
"护士人群中多看一眼救人一命","94742"
