"hot_word","hot_word_num"
"考生因太紧张连续2天丢失身份证","976757"
"面具男孩要高考啦","646672"
"易烊千玺抱胖虎女儿","420186"
"小鬼发色为啥不掉",""
"加好友是想看你们越过越好","395557"
"袁咏琳小时候曾被霸凌","332422"
"3个动作消除富贵包","301378"
"夏之光微博热评","235445"
"专家提醒亚洲象会不惜代价保护小象","230634"
"黑龙江鸡西煤矿事故失联8人全部幸存","228675"
"高三老师入住学生宿舍全程伴考","227304"
"女子超市偷4000元巧克力只嚼不咽","226785"
"粗心父亲半年时间两次丢娃","189509"
"男子隔玻璃给猩猩送吻被回吻","183472"
"宁夏女生教室戏腔清唱自如","175878"
"被公司要求转发朋友圈","154121"
"李荣浩连续六年的高考祝福","153915"
"汪小菲太有趣了","153201"
"邓伦发微博有多严谨","152357"
"林志玲晒照纪念结婚两周年","151118"
"一诺状态","150728"
"杨紫哭戏秒落泪","149862"
"张颜齐","148897"
"高三晚自习遇上夏夜晚霞","148535"
"看完电影能直接走吗","147386"
"张彬彬把隐形眼镜哭掉了","147305"
"刘涛许凯吃西瓜沾盐的表情","146556"
"李现晒重庆大学打卡照","137242"
"初晨的露娜","130690"
"高考祝福","129608"
"东风快递员夏日烧烤晚会","129016"
"大S妈妈透露大S仍在生气","128948"
"有些人比狗还要狗","128239"
"连打疫苗都有内卷了","123054"
"广州地铁好空","120994"
"白俄总理称准备放弃欧美技术","107517"
"看把小象给摔的","106325"
"觉醒年代","99832"
"论文人在导师面前有多卑微","99123"
"恰好是少年","98935"
"假发社死现场","98933"
"明天都给我好好考","97201"
"张哲瀚ins更新","89103"
"陕西有一块985和211路牌","86800"
"中山全市开展大规模核酸检测","77860"
"巴西消费者告赢苹果公司","71905"
"校长为高考生送1个火腿2鸡蛋","66634"
"邓伦假扮岳云鹏给蔡明打电话","66262"
"女孩高考前坐末班车给司机留纸条","63365"
"天天向上","62814"
