"hot_word","hot_word_num"
"孔刘 我不是女人喜欢的类型","760235"
"女保洁误入男浴室撞见领导被罚2000元","271784"
"疫情或使全球女性地位倒退25年","258913"
"杨幂钻石口罩","252568"
"王嘉尔回应萧敬腾想吻自己","245590"
"福奇称如被邀请会加入拜登疫情团队","229680"
"尾号888888手机号85万元拍出","221833"
"微博新表情裂开了","215500"
"明星社会性死亡现场","215060"
"艾福杰尼被陈志朋错认成工作人员","154607"
"山东将免费乘公交老人年龄降低5岁","153532"
"追光吧哥哥","152541"
"中国人民解放军仪仗大队荣立一等功","150619"
"棋魂大结局","150495"
"燕云台大结局","147967"
"流浪地球2","147165"
"专家称自发热内衣是宣传噱头","146391"
"假如在可可西里迷路了","128174"
"南科大李淼","126935"
"医院回应金龙泉创始人术后脑死亡","124401"
"宋茜","118463"
"北京住房公积金提取政策拟修订","114200"
"王牌部队","98933"
"九尾狐传","97611"
"金龙泉创始人听障手术后脑死亡","96156"
"崖上的波妞确认引进","91820"
"天津天塔致敬马拉多纳","90536"
"外交部回应中方是否计划接触拜登团队","89842"
"暗恋视角下的明星有多绝","89562"
"爱情公寓式的梗源于欧美剧","86899"
"孟美岐 Mute","82843"
"Cat发声不放弃","79458"
"国防部回应蔡英文争取美对台支持","74627"
"马拉多纳粉丝与警方爆发冲突","74233"
"陆律师","67549"
"朱一龙跳舞踩到童瑶","63955"
"仙侠剧演员信念感有多强","62830"
"用周杰伦专辑命名5亿年前三叶虫","61110"
"顾耀东营救沈青禾","59261"
"那些长在审美点上的男生","59105"
"央视新剧片单","58319"
"我国宠物市场规模或超2400亿","55609"
"杀破狼","53760"
"马拉多纳死因","51994"
"红米Note9","48048"
"冰上的尤里剧场版特报","45846"
"马拉多纳遗体告别仪式","43922"
"四川有什么","42440"
"感恩节","41881"
"一入冬东北就成了冷冽仙境","40308"
