"hot_word","hot_word_num"
"吴彤收到十万条私信不敢看","186266"
"特斯拉再次深夜发声","168502"
"和朱婷一起享受健康生活","140064"
"赵露思工作室声明","128448"
"特斯拉提供刹车事故前1分钟数据","90637"
"许晴肖战吻戏","90028"
"每年约1000万吨塑料垃圾流入海洋","86554"
"如梦之梦直播","77125"
"共同构建人与自然生命共同体","71046"
"顺丰财务负责人辞职","65211"
"佟大为 父亲会影响女儿的择偶标准","63735"
"仝卓诉山西招考中心案开庭","62872"
"赵露思点赞","61603"
"西安某高校发生持刀劫持事件","61528"
"付国豪离职","61494"
"蔡徐坤进被窝速度","61476"
"原来胃病不能喝粥","61179"
"一万年前的水母湖是怎么形成的","59729"
"许凯腰疼","52055"
"八零九零","48061"
"张艺兴用彩灯的手机壳","47745"
"程莉莎婆婆情商","44962"
"龚俊直播","39667"
"湖北女子4年7次诉讼离婚未果","35094"
"对象向自己奔来是什么体验","34982"
"王源冲天辫","34285"
"鹿晗黑色指甲","32799"
"硬盘3天狂降2000元","32411"
"广东第16次杀进总决赛","32393"
"国产芯片订单量井喷","32385"
"倪大红白敬亭爷孙cp","32125"
"杨超越回眸","31424"
"小舍得","30068"
"特斯拉称将配合调查接受监督","29871"
"青春有你","29754"
"河南家长自费百万在校门口建天桥","29719"
"长歌行","26620"
"过三爽教过爷谈恋爱","25574"
"东航辟谣员工不雅聊天记录","25220"
"火烧云晚霞有多惊艳","25148"
"BO道歉","25131"
"妈妈教给我的婚姻观","24686"
"创造营25强决赛倒计时采访","24283"
"杜富国清唱夜空中最亮的星","24054"
"花21万元补数学考59分","22806"
"梁辰陆景门后壁咚吻","21029"
"林巧稚75年前的手写病历","20825"
"原来你是这样的人民海军","20242"
"胡明轩赵睿鼓励高诗岩","17739"
"支持有条件地方和重点行业企业率先达峰","17471"
