"hot_word","hot_word_num"
"蔡康永向大S道歉","3269888"
"北京新增8个月大确诊女婴详情","1442330"
"麦当劳 真能装","1371030"
"女孩考第一被老师质疑后溺亡","1187687"
"金莎回应跨界演戏","1042777"
"中了5000万会立刻离职吗","1034512"
"丁真舅舅超话简介","926653"
"张桂梅被云南省委书记搀扶入座","925534"
"河北邢台发现核酸检测阳性患者","825150"
"数百人不戴口罩参加特朗普跨年派对","727480"
"创造营slogan","710295"
"滴滴花小猪快的暂停黑河服务","615354"
"石家庄新增1例本土确诊","572967"
"小伙因买内衣不合适迎亲被拒","559400"
"沈阳吊销两家医疗机构执业许可证","541415"
"晴雅集","537838"
"池子说赵小棠是女中大张伟","535853"
"原来宋朝就能点外卖","534886"
"王一博 激动的我不知道说什么好","532952"
"民宿价格虚高吗","528381"
"送你一朵小红花","528281"
"西安3箱冰峰饮料瓶盖被冻飞","489882"
"奥特曼灭绝的原因找到了","485923"
"天官赐福","483384"
"马嘉祺曾把邻居家的狗踩骨折","465788"
"送你一朵小红花里的妈妈","441597"
"鹿晗天官赐福动画主题曲","429379"
"阳光信用","397534"
"起底明星健康宝倒卖产业链","389934"
"林郑月娥谈到香港国安法满脸欣慰","387924"
"王力宏说王一博这孩子不得了","387866"
"Newbee俱乐部被永久禁赛","369637"
"流金岁月穿搭","353253"
"黄明昊模仿杜海涛撒娇","309234"
"爱立信称继续禁华为将离开瑞典","298160"
"女神的裙摆冰钻美甲","297879"
"送你一朵小红花票房破7亿","297675"
"沈阳幼儿园暂时停园","280462"
"阳光之下","278585"
"留学生在东北有多难","275883"
"重庆的高铁也能穿楼","247482"
"北京顺义4地环境样本检测阳性","247041"
"北京已接种新冠疫苗73537剂","243962"
"撸猫和恋爱哪个更快乐","241630"
"大连通报此次局部聚集性疫情源头","240163"
"酥脆鲜肉锅贴","238580"
"有翡配乐","237570"
"金子涵水袖舞好飒","230225"
"海南多家房企中介被取消备案资格","226285"
"全国多地检出汽车零部件阳性","225839"
