"hot_word","hot_word_num"
"科兴疫苗正式通过世卫紧急使用认证","313217"
"罗晋吐槽女儿六一被唐嫣安排上课","146424"
"学校可禁止学生携带手机进入学校","98005"
"百事迪士尼惊喜联名可乐",""
"吴亦凡 等你超过我","97999"
"教育部要求学校开展性教育","97964"
"黄景瑜身材","84548"
"赵继伟求婚成功","80651"
"双世宠妃3","68501"
"摩尔庄园烟花","64709"
"云南15头野象被食诱进深山","60379"
"澳门龙吸水","59828"
"爱上特种兵","57721"
"陈伟霆 是的我又晒黑了","55442"
"肖战六一表情包","54438"
"建议延长产假至3年","49645"
"李荣浩送杨丞琳麦克风","49388"
"奥斯卡给胡烨韬侄女买书包","49350"
"举铁","48997"
"女孩每天吃4个馒头为妈妈移植骨髓","48839"
"Angelababy演的童英","48496"
"素颜不化妆被领导说邋遢","48087"
"原来老虎的耳朵这么可爱","48068"
"北大韦东奕婉拒媒体采访","46322"
"喻言金色短发","45439"
"梁洁双世宠妃3分饰三角","44484"
"内蒙古姑娘遛边牧遛到俄罗斯","41024"
"广州如何应对印度发现的变异病毒株","39840"
"官方回应儿童动画现成人化内容","38704"
"网红帐篷民宿被无限期停业","38617"
"六一晚会","37759"
"男子篡改传播三孩政策新闻被处罚","37429"
"越南多家芯片工厂停工","36247"
"李沁在线求合租室友","34744"
"独居老人门口外卖没动物业报警救人","33279"
"野象群吃掉投食区玉米留下菠萝","33039"
"中小学不得聘用虐待性骚扰体罚者","32476"
"中国女排 加拿大女排","32136"
"民政局回应墓地推销员祝大家满载而归","31910"
"当鲸头鹳突然跟你打招呼","29875"
"电梯失灵女子28楼直坠14楼","28544"
"六一礼物","27612"
"许魏洲光头造型","26679"
"云南象群吃饱喝足继续北上","25591"
"小朋友的沉浸式护肤","24929"
"摘星少年致敬中国航天","24862"
"延迟退休","23830"
"哈尔滨巨型龙卷风","23393"
"男生的晾衣服方式","23339"
"精准广告真是手机App偷听用户来的吗","23034"
