"hot_word","hot_word_num"
"等等让孙俪去医院看看头脑","1981418"
"台铁列车脱轨事故已35人无生命迹象","1829546"
"酵母美白时代开启","1822599"
"林依轮两个儿子同台走秀","1817967"
"陈小纭 讨论抨击我都接受","1632260"
"支付宝回忆杀","1295983"
"十年一品温如言选角","1071797"
"变形计尚成苍爷爷去世","876312"
"多名证人称弗洛伊德在案发现场已死亡","844495"
"华春莹要求日方停止搬弄是非","816477"
"蒋勤勤 建斌诗集随手一翻好多错字","813148"
"那英容祖儿陈梓童 达尔文","782259"
"教育部明确3个重要时间保睡眠","650796"
"男子微信群聊中辱骂烈士被刑拘","647650"
"我国每68名孩子中约有1名患自闭症","637503"
"新疆问题教材使用长达13年","630660"
"刘昊然王俊凯董子健合唱对比","616941"
"深圳茶颜悦色","611529"
"南京禄口机场候机厅浓烟弥漫","608272"
"汪东城 希望我明年是真的公开了","596155"
"向往的生活中国风概念海报","550647"
"创造营预告","493669"
"乘风破浪的姐姐五公","420636"
"脸书将删除所有带特朗普声音的内容","406751"
"极端分子脑中的天堂什么样","403469"
"刘芸把起飞时间记成了起床时间","402679"
"司藤","401948"
"ATM机一年减少8万台","380714"
"戏说党史国史军史读物不能进校园","371553"
"中棉协邀请国外行业协会赴新疆调研","364094"
"王者荣耀艾琳重塑","363981"
"山河表里开机","355475"
"虞书欣为赵小棠庆生","319271"
"papi酱新电影台词","313007"
"杨丞琳说心疼吴青峰","309013"
"张柏芝粤语独白","305764"
"长歌行","293298"
"恰好是少年发布会","280574"
"第十一回","238503"
"华春莹说香港发展不靠外国恩赐施舍","236580"
"台铁列车脱轨","235889"
"我的姐姐","235460"
"那英组达尔文全季最高分","193820"
"清明假期全国天气预报地图","175081"
"温孤好惨","173919"
"网游22点后不得为未成年人服务","173781"
"追星星的人官宣","172932"
"台铁列车脱轨车厢内画面","172162"
"自闭症早期五不行为","170701"
"毒品被混入饼干身体乳试图入境","166700"
