"hot_word","hot_word_num"
"郑爽回应直播失控","789680"
"成都确诊病例家中冰箱和门把手阳性","493554"
"邻居称坠楼女婴已是二次坠楼","406892"
"李现 我就是喜欢看小姐姐","259932"
"毛戈平又出裸妆大法","229853"
"潘成然被公司解约","227128"
"印度已有超300人感染不明原因怪病","201860"
"梅婷7岁女儿登杂志封面","198597"
"华春莹感谢世界各国祝贺嫦五奔月","170852"
"成都再新增1例确诊病例","169602"
"官方回应石家庄女婴坠楼事件","165061"
"小风暴","156983"
"德云社文案太会了","156593"
"北京疫情影响仨月无收入可领救助金","155999"
"东莞公厕停用人脸识别供纸机","155253"
"坐女童身上玩手机幼师被拘留","154908"
"年过的有点突然","154568"
"美香","153597"
"染发球员过多被判负学校回应","153041"
"爸爸送给女儿的出嫁礼物","152823"
"央视曝儿童平衡车安全风险","151026"
"肖战一键变装","141268"
"陈卓璇连名牌也站得高","126686"
"汪涵狂野波波头","108426"
"郭德纲于谦20周年专场","87362"
"欧洲最大时装网站CEO为妻辞职","85295"
"外交部回应美对中方统战部官员签证限制","84529"
"iOS14.2或导致电池续航变短","84422"
"河南警方揭穿免费美容骗局","84387"
"坠楼女婴父亲回应拒绝治疗","84383"
"大秦赋","83546"
"反向凡尔赛语录模仿大赏","83470"
"进击的巨人","75305"
"外交部回应美将制裁12名中国官员","73141"
"爱的厘米","72694"
"焉栩嘉妈妈把他微信推给了小盒鱼","71486"
"纪录片中国","68318"
"澳大利亚山火烧了七周","65213"
"顶楼","61468"
"美术老师9万颗钉子复原宋代山水画","58055"
"了不起的儿科医生","54091"
"厨师用白菜叶雕人物头像","53760"
"网友初次约会点2万多火锅","52523"
"谷佳人表白邓子昂又失败","51983"
"是否愿意一键重启你的2020","51282"
"CBA","46076"
"丁飞俊","45910"
"今夕何夕","44000"
"中国纪录片里的神仙文案","43699"
"女婴坠楼受伤父亲拒绝治疗","43677"
