"hot_word","hot_word_num"
"没被蔡依林邀请当嘉宾的小S","3328430"
"进村东北虎麻醉针醒了","2144505"
"独一无二汤唯在CT","1967441"
"张哲瀚 娱乐圈在逃拉面师傅","1512132"
"武松真的能打过老虎吗","1064451"
"和仙女酵母一起守护地球","1059019"
"专家说东北虎可能是受伤后进村","1056906"
"创造营花墙","937719"
"吴磊骑车下班","924014"
"钟南山称正全力研发针对变异毒株疫苗","839301"
"知情人还原广州特斯拉撞墙致死事故","734928"
"任嘉伦和呼兰同年","623317"
"中国首辆火星车命名祝融号","592382"
"杨洋航天制服造型","591718"
"北京东城明确租房上学不占房东学位","591236"
"被狗狗骗得好惨","589759"
"共享充电宝进入3元时代","589541"
"小象洗澡有多可爱","588666"
"女子刮蹭奔驰后遭两男子掌掴","587752"
"张伟丽称重过关","586980"
"清华校庆请师生品尝110种面点","586096"
"任嘉伦不会在大众面前掉眼泪","564987"
"小偷被警察追吐了","528691"
"罗小黑战记开播","486731"
"库里升至MVP榜第五位","472596"
"肖战晒玫瑰花","464982"
"你是我的荣耀航天特辑","428670"
"爸爸是如何安慰失业的妈妈","369937"
"2020年中小学肥胖率超10%","360593"
"全国大学生英语竞赛","354579"
"节目组给黄磊设规则设了个寂寞","353525"
"觉醒年代上头","312086"
"张艺兴与彩灯的安全距离","297101"
"彭昱畅划船表情包","295303"
"今明两年中国载人航天将迎高密度发射","273963"
"中俄将合建国际月球科研站","230457"
"龚俊花衬衫配粉裤子","214535"
"美国有人打强生疫苗后出现血栓死亡","207788"
"王毅称民主不是可口可乐","205399"
"日本政府第三次发布紧急事态宣言","185804"
"专八考试","182697"
"三成大学生体质健康不及格","179287"
"押运枪支走火击中同伴","168074"
"掘金 勇士","164064"
"喻言翻唱伤痕","163012"
"沪牌拍卖","156868"
"窥探","156796"
"美国队长将拍第四部","151296"
"向往的生活","148443"
"广东省考面试","145877"
