"hot_word","hot_word_num"
"贤合庄声明","2729446"
"中央巡视组原副组长董宏涉嫌受贿被公诉","1992063"
"杨幂下班图氛围感","1882502"
"狗子住院把医院拆了","1238395"
"南京胖哥已转入普通病房","951513"
"高考平均680分的婚礼","863617"
"肖战青岛特色小吃vlog","850365"
"假如让郭敬明来写家有儿女","660437"
"英国罕见食羊树15年首次开花","595895"
"神舟十二号船箭组合体转运至发射区","587826"
"618锦鲤称不想成为信小呆","583401"
"被漫威刀了","552714"
"朱一龙童瑶三手联弹","513885"
"女孩脑出血离世捐献全部器官救7人","508897"
"姐姐辟谣弟弟藏自己准考证","502094"
"黄磊晒小女儿绘画作品","498615"
"周扬青与男子雨中撑伞相依","491368"
"谭松韵生图","483285"
"金莎过度按摩导致筋膜黏连","481104"
"想实名安利的专业","474690"
"陈小纭一箭十环","469781"
"丁程鑫高考完与同学合照","448300"
"眉山理发店持刀伤人案嫌犯已抓获","401242"
"上课睡觉能有多爽","398351"
"大白跪姿为老人小孩做核酸","366175"
"周冬雨上海电影节金爵奖评委","361921"
"高校无人跳蚤市场24小时营业","354838"
"外交部回应日本资助中国个人赴日考察","350452"
"Lwx预判","349944"
"河南大学教授毕业演讲金句燃爆全场","349722"
"当我妈说在家里她就是天","349645"
"猫猫卷有多可爱","343501"
"觉醒年代","342330"
"为考好学校多次复读值得吗","338413"
"外交部 美国最大的威胁是美国自己","310448"
"喻言晒新发色","303345"
"梁牧泽送夏初樱桃伞","277988"
"粉丝带录取通知书见郑恺","265003"
"拜登签署行政令撤销对TikTok及微信禁令","251746"
"高圆圆新剧状态","250356"
"小朋友的共情能力有多高","249180"
"嘴里叼着鼠兔蜜汁微笑的藏狐","241062"
"这就是来自学霸的凡尔赛吗","239852"
"好可爱的一个群回复","234328"
"日本推出菠萝包口罩","229005"
"能气倒数学老师的逻辑鬼才","228932"
"山东临沂一社区免费为适婚青年分婚房","228820"
"驴嫂天语手机再被指山寨","228742"
"一整颗青柠气泡咖","228302"
"一入境男子逃避闭环转运被行拘","228285"
