"hot_word","hot_word_num"
"陈伟霆演张东升","2463964"
"世卫称可能永远不会发现新冠零号病例","1664645"
"艺台画中画中画中画晚会","1663211"
"全球唯一白色大熊猫长大变金白色","1521220"
"浙江的农村能有多豪华","1449703"
"如何趣往2021","1156227"
"石家庄继续居家防疫到1月19日","1119954"
"外交部回应两名世卫专家未能顺利来华","977184"
"支付宝等平台不许再卖互联网存款产品","827651"
"隐秘的角落番外","821518"
"尹正说黄晓明裤衩都小了吧","645733"
"3至17岁人群有望3月前接种新冠疫苗","636467"
"倪妮画房子告别朱锁锁","471012"
"北京新增2例本土确诊","467773"
"吴彤的头是王霏霏的两个大","460034"
"杨祐宁替蒋南孙喊话王永正","418133"
"大使馆回应中国情侣柬埔寨遇害","409140"
"北方人会不会天天洗澡","400243"
"胡彦斌看孟美岐露出老父亲的微笑","383689"
"AI神还原苏东坡","345196"
"孟美岐小翘裙","330432"
"只有潘玮柏在后台认真吃火锅","321854"
"叶谨言朱锁锁大结局","321023"
"李诞 搏一搏飞机变摩托","246673"
"小鬼被选召的孩子","233792"
"VAVA呛丁太昇","229411"
"缅甸帅和尚","221664"
"央视记者实录美国国会山现状","220757"
"欧文被罚款5万美元","220634"
"鲁尼退役","220604"
"你好对方辩友好笑","220581"
"沈腾贾玲像跳广场舞","216616"
"李现金棕色西装","206293"
"哈哈哈哈哈","202788"
"湖北省委巡视组原副组长黄学军被查","201236"
"孟美岐VAVA燕尾蝶","200220"
"把活动办成了酒席的样子","193811"
"全球第一家七星级酒店","193569"
"流金岁月","184237"
"焦茶去世","177006"
"奔跑吧","165544"
"卧龙发布全球唯一白色大熊猫影像","149512"
"青3录制在厕所水箱里发现手机","130890"
"流金岁月大结局","108669"
"童朝晖谈石家庄疫情拐点何时出现","101310"
"山东栖霞市委书记和市长被免职","99249"
"上海发布首套沪语防护海报","89333"
"原来花滑选手不穿冰鞋也能原地转圈","76951"
"队长温柔一踹换岗消防员陪女友","74983"
"汽油柴油价格五连涨","73104"
