"hot_word","hot_word_num"
"在上海的张韶涵和在吉林的张韶涵","267966"
"杭州狂犬病脑死亡女生父亲发声","214955"
"王菲的有机生活","205896"
"丁真说想来北京看升国旗","178719"
"有翡湖北影视开播","176142"
"年轻人情绪衰竭的征兆","135087"
"杜华朋友圈道歉","128676"
"四川逐步取消现场宰杀销售活禽","82153"
"希拉里称应该废除选举人团制度","71026"
"嫪毐戏份多","70764"
"张丹峰 洪欣","70413"
"马赛克在AI面前可能不安全了","64386"
"世卫组织建议成年人应限制久坐时间","60538"
"超三成日本人希望东京奥运会被取消","57654"
"嫪毐终于领盒饭了","57271"
"圣诞美甲","56684"
"腾讯娱乐年度盛典","56125"
"李易峰无人机应援","56026"
"巡回检察组","54751"
"在狗子面前晕倒有多惨","52510"
"薇娅服饰公司被列入经营异常名单","52179"
"重庆一冷冻牛肉外包装核酸阳性","51832"
"警方通报外卖员被保安用防爆叉套脖子","51241"
"四川确诊飞行员轨迹通报","47422"
"罗永浩发视频称供货方蓄意欺诈","46647"
"时尚芭莎拉郎届翘楚","46337"
"中俄相互通报弹道导弹发射协定延期","45737"
"京东金融就争议短视频致歉","45621"
"谷爱凌为北京冬奥推迟入学斯坦福","45616"
"刁顺子兄弟去世","45611"
"假如ins妆有段位","44374"
"北京新增病例所住酒店4件环境样本阳性","43722"
"人间沙雕张国伟","43676"
"外交部回应外媒称中共党员渗透西方机构","42971"
"邓子昂焦佳人同居太甜了","42936"
"了不起的儿科医生","41338"
"撩爆朋友圈的拽姐妆","39232"
"毕滢","38073"
"胡雪娥一家太惨了","36495"
"患儿家属拒为网约车司机作证系乌龙","35697"
"新版身体活动和久坐行为指南","34597"
"有翡定档","34191"
"大连开发区","33339"
"吉林林场第6次拍到野生东北虎","32514"
"北京明确不发展电动自行车租赁","31367"
"赵姬嬴政决裂","29963"
"密室的微恐和川渝火锅的微辣","26399"
"薇娅方回应","25914"
"纯金版iPhone12 Pro每部80万元","22704"
"冯夕悔婚","22433"
