"hot_word","hot_word_num"
"谈莉娜被记者问哭","2343675"
"女子被造谣出轨快递员后患抑郁","1966915"
"筷子兄弟工作室注销","1703861"
"内卷","1482090"
"加方要求删除孟晚舟案对美加不利证词","1340842"
"仝卓被AI换脸","1101331"
"GQ年度人物盛典","975547"
"困在花呗里的年轻人","849704"
"离婚冷静期一方不同意离婚怎么办","620999"
"甄子丹16岁女儿腿长110","616785"
"胡一天牛奶泡面教程","558494"
"何猷君家保姆中过三千万","500765"
"2020年度十大流行语","457347"
"外交部称孟晚舟事件是严重的政治事件","411859"
"美国将约4亿美元失业补助金错发","401724"
"肖战","401475"
"孟美岐冷得下巴在抖","399309"
"西藏首例克隆藏猪诞生","398777"
"海南交警","397691"
"张萌加上了杨幂微信","395830"
"见过最没面子的化妆品","395272"
"费启鸣走红毯带大哥大手机摆拍","393686"
"这才是真正的冰箱","393169"
"花儿超级乖","383874"
"杜江把霍思燕搂在怀里挡风","364461"
"李梦的裙子看出上海的风有多大","348165"
"少儿编程课是不是智商税","343717"
"百度申请注册度娘商标","343489"
"多人持双阴性证明自英国来华后确诊","343335"
"冷血狂宴","335154"
"比伯发文维护海莉","324035"
"香港取消除夕烟花汇演和花车巡游","317540"
"最高法回应蛋壳公寓爆雷事件","312634"
"李佳航 等一手自己的瓜","306623"
"GQ盛典红毯","254820"
"五星红旗再次闪耀月球","237415"
"天津通报31只东方白鹳死因","232274"
"央视国家宝藏首发阵容","227810"
"赤狐书生莲花妖仿妆","222610"
"肖战看表情猜动画和电影","190604"
"冷静期不适用于诉讼离婚","168082"
"蛋黄酱汁油条虾","162532"
"谭松韵礼裙上有口袋","157950"
"赤狐书生","156068"
"邮政投递员因见义勇为落户杭州","148354"
"英雄联盟全明星赛LPL赛区阵容","143417"
"中芯国际回应被美列入涉军企业名单","142884"
"金沙咸蛋黄乳酪蛋糕","142755"
"佟丽娅带朵朵探班陈思诚","142305"
"中国电动滑板车欧洲订单暴涨","136466"
