"hot_word","hot_word_num"
"Angelababy蔡徐坤同框","3532249"
"大连24例感染者经4次以上核酸后呈阳性","2059488"
"realme真我V15","2040131"
"范丞丞妈妈就是我妈妈本人","1736866"
"小鹿 为什么不能有灯牌里的妈妈","1470300"
"石家庄疫情","1037815"
"女生想拥抱的男生的穿搭","1021656"
"航拍今晚的石家庄站","1001131"
"美国国会确认拜登胜选","754844"
"健康码的温度在哪","659354"
"黄子韬想和性转后的自己结婚","642741"
"李晋晔王骁詹秋怡拿offer","616744"
"流金岁月","596244"
"河北疫情现状如何","584516"
"发型对颜值的重要性","584282"
"谈莉娜方回应穿的衣服是假货","572577"
"河南大学","568681"
"新郎结完婚把新娘忘在酒店","553476"
"涪陵榨菜被列为被执行人","532772"
"李一桐金晨687手势拍照","524649"
"周深曾和父母一年只通一次电话","514106"
"刘煜成没拿到offer","497430"
"郑爽粉色纱裙","464594"
"首都国际机场燕郊线暂停运营","439806"
"虞书欣淡绿色连衣裙","439311"
"R1SE年度人气团体","427852"
"文咏珊演技","419688"
"百度被判赔偿优酷百万余元","415775"
"暴乱后美国国会内部","415115"
"西单大悦城全部餐饮商户闭店整改","415003"
"黄执中谈饭圈","404381"
"山东春晚官宣张韶涵刘雨昕","398332"
"赘婿原作者发文","377300"
"特朗普承诺有序进行政权交接","372872"
"女子零下17度吹泡泡变水晶球","370495"
"美国国会骚乱中枪身亡女子系退伍女兵","354786"
"男女生对待颜值的区别","339886"
"乱世名伶礼裙","338934"
"时光褚嬴再相遇","338284"
"益芙灵开心森林婴儿霜","337543"
"不能在北方说找块豆腐撞死","336043"
"荣耀典藏至尊封面","335472"
"大橘大利新年妆","333985"
"喜欢的人给我写的信","333327"
"如何不让猫侵占你的电脑","332060"
"30问了解新冠疫苗接种要点","331037"
"爱你的人才会帮你做的事","330941"
"有翡","290237"
"瞎嗑cp时的真实想法","288583"
"多家银行着手清理个人睡眠账户","288250"
