"hot_word","hot_word_num"
"张国立 发了就还会着骂","2208730"
"印度疫苗厂商CEO逃往英国","1956765"
"女儿结婚父亲边吃东西边流泪","1710765"
"宋仲基 文森佐","1403541"
"朋友超级有钱是什么体验","1095332"
"偶遇利路修 没人敢上前","624166"
"新娘闺蜜拉横幅喊话新郎","523742"
"全球新增确诊近半数来自印度","415737"
"景区汉服女子抱着电脑游园","353856"
"印度女子为确诊母亲做人工呼吸","352999"
"于和伟魅力","352792"
"五四奖章","351011"
"今年五一档影片数量创新高","347002"
"张哲瀚晒彩排照","325056"
"R1SE演唱会上的INTO1","319219"
"王俊凯说再熬夜就会梦到蓝色古堡","316856"
"拙政园门票被炒到240元","314833"
"詹姆斯右脚踝酸痛","311396"
"广州3万球迷雨中高歌我和我的祖国","309602"
"娜扎害怕江疏影要吃她","305191"
"老板说你上班就是为了钱吗","304000"
"丁真 可爱","299955"
"长歌行 皓嫣","296272"
"灵笼成都太古里裸眼3D","295548"
"一家人穿都可以的T恤","292456"
"济南五三惨案93周年","289444"
"张家界蜘蛛人攀爬千米崖壁捡垃圾","287039"
"比特币大佬看衰狗狗币","286112"
"猛龙 湖人","284236"
"白虎够不着树枝气坏了","282408"
"警方通报司机猝死交警仍贴罚单","282092"
"五一前夕南京一民警倒在工作岗位","280588"
"印度","275345"
"YOLO音乐节","266931"
"重庆特大雷暴雨出租车被淹仅露车顶","255728"
"林墨手机屏保","229803"
"韩国将从印度撤侨近400人","225880"
"埃博拉前线杀青","224919"
"9位国之脊梁的青年照","224504"
"姚策妻子称割肝救子是炒作","222156"
"西蒙斯绝杀","221501"
"余依婷刷新世界纪录","217604"
"川大华西留学生印度抗疫","214788"
"真实的悬崖之上","214534"
"专家提醒五一假期防疫要点","213274"
"第25届中国青年五四奖章评选结果揭晓","213125"
"印度部分地区新冠阳性检出率高达50%","205606"
"山河令主题演唱会彩排花絮","200537"
"安徽景区凌晨公告希望游客改天再来","200130"
"美国一海岸船只倾覆疑为人口走私案件","193786"
