"hot_word","hot_word_num"
"天天向上节目组声明","289997"
"印官方首次承认恒河浮尸有新冠死者","160188"
"沈月直播插不上嘴","115890"
"粉丝坐在男朋友肩上看蔡徐坤","97938"
"王俊凯像极了在ktv的我","92768"
"天天向上","76665"
"万宝龙品牌大使辛芷蕾",""
"御赐小仵作","76309"
"福岛核电站储水罐已多次泄漏","69899"
"极限挑战","66736"
"王毅将主持安理会巴以冲突紧急公开会","65545"
"沈梦辰说跟杜海涛该结婚了","65347"
"曾毅又没被认出来","60521"
"RNG输了","60222"
"广西致3人死亡命案嫌犯已自首","59556"
"王俊凯董子健海边相处好浪漫","59362"
"年轻人适合过低欲望生活吗","58583"
"你很喜欢但穿不出去的衣服","58309"
"贾乃亮说假话好好笑","57596"
"初级会计","56673"
"刘诗雯无缘东京奥运会单打","56157"
"张彬彬大半夜加餐被工作人员抓包","55858"
"张大仙晒照片","55567"
"合肥一确诊病例合作公司老板发声","54859"
"小偷吃力背走五六十斤硬币","52076"
"李宇春拍的云","47420"
"恰好是少年","45171"
"邓伦在线求助网友安排行程","43452"
"全球多国爆发反以游行","41725"
"如何看待刘诗雯无缘奥运单打","40370"
"高中语文教资面试","40287"
"护士人群中多看一眼救人一命","40278"
"肖战诛仙拍摄特辑","38411"
"飞机飞过云层有多美","38267"
"内蒙古曾接收3000多名南方孤儿","37799"
"急寻5月8日D3058次12车厢乘客","36080"
"专家研判李某某吕某可能不是零号病人","35835"
"雅培奶粉检出微量香兰素被罚909万","34669"
"八零九零大结局","32166"
"MSI","31822"
"修文物时脚手架倒塌他大喊抓好壁画","31107"
"米卡直播清唱","30593"
"下班遇堵车便衣民警亮证指挥","28361"
"52岁男子骑行2000公里到天津看女儿","26173"
"你为了生活做过什么妥协","25824"
"RNG PSG","24989"
"洛克王国手游","22650"
"奶奶喂猫有多生猛","21338"
"男生的奇怪友谊","20996"
"这年头连鸭子都会演戏了","20784"
