"hot_word","hot_word_num"
"米卡鞠婧祎 牵手壁咚下跪","2444138"
"同一套住房6年内只享有1个小学学位","1303603"
"27年前自考北大保安如今已是校长","1263974"
"毛晓彤 元气甜妹","1158649"
"男子欲家暴反被老婆打进医院","824932"
"华晨宇穿吾适回应挑战","824716"
"张哲瀚发红包让龚俊给吴宇恒打call","823946"
"你好李焕英票房破54亿","739254"
"重庆必胜客","700367"
"乒乓外交五十年","679753"
"创造营三公","677221"
"谭松韵晒景甜张彬彬合照","665501"
"周笔畅肚脐眼不冷吗","652610"
"快乐大本营","618880"
"西安一中学设置情绪宣泄室","602301"
"倪妮羽毛束腰黑裙","588950"
"老师的朋友圈有多好玩","588599"
"当林小宅遇上婚恋销售","587571"
"22岁大学生在看守所完成论文答辩","584851"
"解放军喊话台军你们很快就适应了","583925"
"夏之光刘也水星记双人舞","582976"
"辛选公司否认辛巴退网","582107"
"会韩妆也太棒了吧","535250"
"中国人均月流量十年后或达100GB","529605"
"二手手机恢复出厂设置数据仍可恢复","527391"
"青春有你排名","526255"
"退役军人三亚吃海鲜遭遇宰客","381452"
"JKL小炮","378837"
"人气韩妆防晒被举报造假","378520"
"商务部回应美方打压7家中国超算实体","378450"
"青春有你","378412"
"刺杀小说家","367573"
"我是女演员先导片","341483"
"景甜张彬彬仰卧起坐吻","330073"
"幼儿园不得设学前班","329480"
"因近视而引发的社死瞬间","328906"
"南京大屠杀幸存者仅剩68位","324853"
"苏醒奚彬带娃看病","307615"
"唐僧的通关文谍上写了什么","271864"
"警方回应必胜客员工与顾客起冲突","243489"
"艾克里里淘汰","232577"
"余景天排名第一","230406"
"王嘉尔看了都要楞两秒","230068"
"LPL","205057"
"专家建议每天保证1.5升以上饮水量","197035"
"西安人有多会排队","185094"
"力丸刘些宁开场舞 武片打戏","176818"
"南京大屠杀幸存者生前哭诉家人遭遇","174119"
"刘宇孟美岐双人舞 神仙打架","169821"
"我国玩具企业一年暴增百万家","169313"
