"hot_word","hot_word_num"
"总理记者会","1914860"
"代表建议种牙纳入医保","1836347"
"OPPO Find X3发布","1818865"
"中国灵活就业已涉及2亿多人","1795690"
"司藤","1652044"
"你是我的城池营垒好好笑","1587038"
"今年高校毕业生909万创历史新高","1529391"
"总理叮嘱青年学生打牢基本功","1425261"
"十三届全国人大四次会议闭幕会","1330820"
"完善香港特区选举制度决定表决通过","1290836"
"主播卖的牛肉干实为鸭肉干","1211624"
"戚薇提醒粉丝网购要看清价格","1154332"
"李济仁逝世","987804"
"山河令","794933"
"青春有你","794549"
"不期而至","778197"
"龚俊腹肌","772324"
"龚俊微博背景图是人五画的","760842"
"郭麒麟跳女团舞","740931"
"加大对县乡教师培训投入","722954"
"彭冠英蔡文静二度合作","701330"
"王祖蓝晒小女儿百天照","696306"
"孟美岐绑带高跟鞋","620138"
"三大百亿基金大幅放宽限购","513559"
"动漫之家被高限处罚","502916"
"佟丽娅被俞灏明深夜投喂","501701"
"朱一龙拍戏滚了17次","496703"
"张璐翻译","458355"
"锦心似玉","426566"
"中国毛豆风靡西班牙","405079"
"涉港决定通过后会场响起超长掌声","393116"
"比特币暴涨将加剧缺芯","369919"
"中国发展的根本目的","322119"
"十一娘刺伤徐令宜","320686"
"陶勇说应将学生视力纳入教育卫生考核","317678"
"总理称应推动中美关系向前看","304605"
"12306对60岁以上老人优先安排下铺","303558"
"顶楼","296987"
"如何看待赘婿现象","289187"
"李现直播","287521"
"今年将扩大跨省直接报销范围","258744"
"2000多只羊排队过冰湖","243136"
"总理谈经济增长预期目标","233302"
"EDG LNG","230623"
"总理回应完善香港选举制度决定通过","229622"
"何泓姗想演好人","225043"
"王嘉尔 感谢一直支持我的你们","212353"
"NASA","209700"
"国际奥委会将从中国采购疫苗","209228"
"总理分享的就业故事","209120"
