"hot_word","hot_word_num"
"上海提倡家庭个人聚会聚餐不超10人","2699136"
"中方已向美方提供口罩约420多亿只","1871164"
"罗永浩招合伙人","1701834"
"基金","1477373"
"张文宏称上海本土病例几周内或控制","1251422"
"全国100趟航班车次急寻同乘人","868243"
"坂本龙一确诊直肠癌","866987"
"央行严肃整治拒收人民币现金行为","823578"
"微博新表情牛轰轰","808871"
"姐姐2全阵容","760617"
"上阳赋致歉信","620605"
"上海新增3例本土确诊","570249"
"苹果降低iPhone12 mini产量","513433"
"外交部祝贺拜登就职","507298"
"广电时评称不会给郑爽发声露脸机会","502752"
"明星大侦探","501751"
"王思聪被上海金融法院强制执行","500611"
"张翰焰火大片","498241"
"陈小纭为姐姐2的自我管理","494406"
"半夜被猫打了四个小时","493412"
"张恒朋友发声","491787"
"染什么发色才显瘦","488851"
"吴昕东北话版寻夫启事","486936"
"新任白宫发言人上班第一天就口误","486057"
"抖音bug","483727"
"张新成唱曾经我也想过一了百了","481843"
"宁波一老师与初中生发生关系被逮捕","481838"
"徐静蕾","479578"
"周笔畅粉丝问需要上街拉票吗","390368"
"张馨予画乘风破浪","373684"
"鲜奶麻薯坚果杯","342752"
"东北财经大学包机送大学生回家","325196"
"娜娜海报","324738"
"刘雨昕废墟封面","264952"
"邓紫棋凌乱美封面","260620"
"关晓彤帅不过三秒","247674"
"石家庄隔离点有个雷神山小分队","245976"
"花式柿饼吃法","241250"
"北京大兴疫情与顺义疫情无关联","236034"
"警方通报公安刑侦队长发死亡威胁","234456"
"接招吧前辈群像官宣","219344"
"当水龙头不灵时","182475"
"赖小民案二审维持死刑判决","182104"
"NaNa翻拍","181846"
"k4","181350"
"冬天的静电有多爆炸","181093"
"早春营业穿搭公式","180645"
"美国将重返世卫组织","180455"
"晁然的洛枳","179540"
"山海情","178543"
