"hot_word","hot_word_num"
"向太晒向佐郭碧婷北京豪宅","3207603"
"武汉1小时内密集上演气象大片","1568831"
"向天歌刘泽煊","1465453"
"魏大勋蓝色寸头","1227129"
"萧燕燕儿子被下毒","1042280"
"滴滴首款定制网约车发布","1023772"
"基辛格警告美国下任总统","1011939"
"韦小宝双儿破庙相遇","842619"
"中央气象台三预警齐发","800850"
"爱马仕将建最大鳄鱼养殖场","661363"
"你有容貌焦虑吗","590748"
"刘泽煊发文","587226"
"jasper对着每个镜头道歉","578171"
"韦小宝向皇上表明身份","568751"
"央视调查湖北荆州巨型关公雕像违建始末","525475"
"鹿鼎记","524490"
"向天歌回应刘泽煊","520972"
"打了瘦脸针的GAI","519417"
"王智签约赵薇工作室","517979"
"专家建议养老金领取早减晚增","513999"
"河北省原副省长李谦受贿案一审开庭","511809"
"R1SE合照回应只有一个座位","510072"
"妇联回应女子无法怀孕被夫家人虐待致死","507964"
"麻辣豆浆毛肚火锅","504049"
"OPPO卷轴屏概念机","501574"
"晚上不要在天台晾衣服","501344"
"SM新女团aespa风格","491551"
"钟睒睒再次成为中国首富","489809"
"英国男子自称去年9月感染新冠","369628"
"保定高校毕业生落户即奖励1000元","359176"
"CNBLUE回归","349216"
"刘雨昕咪咕汇solo舞台","338415"
"爱的厘米","304878"
"高校回收双11快递箱做猫窝","289484"
"中方已设立疫苗研发中国中心","289147"
"成年人必修班","288897"
"蔡徐坤咪咕汇金海","288832"
"龚琳娜签不假唱协议","284438"
"舒畅否认隐婚生子","264971"
"宋茜风起洛阳开机图","257355"
"赵志勇打小报告举报顾耀东","256860"
"如何看待医生术后喝葡萄糖水遭质疑","256822"
"中国蓝盔撒哈拉沙漠种出绿洲","256807"
"R1SE只有一个座位","256803"
"校方回应学生自办宽带遭强拆","248100"
"追光吧哥哥路透","246224"
"台军一架战机夜航时失联","246038"
"天津2名冷链从业人员隔离期核酸阳性","228234"
"杨紫谈演员的信念感","227157"
"凡尔赛文学梗为何能爆火","226904"
