"hot_word","hot_word_num"
"贤合庄声明","135371"
"云南离群独象掉队12公里","75042"
"杨幂下班图氛围感","74635"
"狗子住院把医院拆了","74045"
"被漫威刀了","73879"
"拜登签署行政令撤销对TikTok及微信禁令","56456"
"英国罕见食羊树15年首次开花","49808"
"南京胖哥已转入普通病房","48980"
"觉醒年代","46886"
"神舟十二号船箭组合体转运至发射区","43223"
"中央巡视组原副组长董宏涉嫌受贿被公诉","43018"
"高考平均680分的婚礼","42050"
"白玉兰提名酒会","42022"
"假如让郭敬明来写家有儿女","42010"
"女孩脑出血离世捐献全部器官救7人","41965"
"金莎过度按摩导致筋膜黏连","41929"
"周扬青与男子雨中撑伞相依","41899"
"黄磊晒小女儿绘画作品","41872"
"胡一天感慨臭豆腐不好卖","41836"
"想实名安利的专业","41808"
"张哲瀚到底有多怕晒","41776"
"任敏生图","41749"
"李佳琦条纹衬衫","41741"
"谭松韵生图","39311"
"外交部回应日本资助中国个人赴日考察","36722"
"当我妈说在家里她就是天","36001"
"梁牧泽送夏初樱桃伞","35619"
"高圆圆新剧状态","35220"
"河南大学教授毕业演讲金句燃爆全场","31973"
"Lwx预判","31775"
"朱一龙童瑶三手联弹","31623"
"周柯宇采耳","30828"
"肖战青岛特色小吃vlog","30399"
"好可爱的一个群回复","30161"
"外交部 美国最大的威胁是美国自己","27612"
"延乔兄弟俩就义镜头","27395"
"618锦鲤称不想成为信小呆","27091"
"高校无人跳蚤市场24小时营业","25981"
"嘴里叼着鼠兔蜜汁微笑的藏狐","25260"
"驴嫂天语手机再被指山寨","24946"
"叛逆者","24829"
"猫猫卷有多可爱","24240"
"丁程鑫高考完与同学合照","24193"
"上课睡觉能有多爽","23379"
"济公之降龙降世定档","23092"
"山东临沂一社区免费为适婚青年分婚房","22187"
"姐姐辟谣弟弟藏自己准考证","20794"
"李健毛不易互推新歌","20788"
"00后新兵授枪仪式","20484"
"学生资助管理中心致毕业生的信","20094"
