"hot_word","hot_word_num"
"总理记者会","95518"
"陶勇说应将学生视力纳入教育卫生考核","95508"
"代表建议种牙纳入医保","95435"
"香港警察踢正步配分列式进行曲","95376"
"医院副院长回应张文荣免职","95347"
"共享充电宝每小时从1元涨至4元","95286"
"60多个国家将中国公民纳入疫苗接种体系","95250"
"NASA火星船票","95211"
"总理记者会要点梳理","95166"
"中国灵活就业已涉及2亿多人","95094"
"想见你原班人马拍电影版","95051"
"又一医院取消张文荣门诊","95021"
"司藤","94990"
"虞书欣给Lisa科普凡尔赛","94919"
"日本母亲每天给地震失踪独女发短信","94875"
"阿富汗禁止女学生在有男性场所唱歌","94827"
"考研国家线","94796"
"天官赐福","94752"
"青春有你","94704"
"韩国31所女校限制内衣颜色","94668"
"毛晓彤杨玏工作室辟谣恋情","94477"
"主播卖的牛肉干实为鸭肉干","85740"
"皓衣行","81816"
"Lisa导师舞台选情人的原因","76462"
"王祖蓝晒小女儿百天照","76211"
"OPPO发布会","73427"
"你是我的城池营垒","73096"
"美四名前总统拍新冠疫苗广告","71120"
"白敬亭给自己劝架","70260"
"荣耀乒乓","70238"
"黄圣依杨子教育分歧","65639"
"李宇春生日粉丝公益捐款破百万","57735"
"山河令","56490"
"徐令宜十一娘怎么还不体面","55801"
"锦心似玉","55414"
"唐九洲没选到想选的歌哭了","53391"
"连淮伟解脱舞台","51937"
"丹麦暂停使用阿斯利康新冠疫苗","45706"
"林骁然给狗讲戏","45504"
"刘耀文是等比放大的吧","44690"
"张哲瀚考验显微镜女孩","43872"
"戚薇提醒粉丝网购要看清价格","42069"
"郭麒麟跳女团舞","41626"
"暴风眼","37190"
"今年高校毕业生909万创历史新高","36896"
"延长放学能解决接送问题吗","35654"
"彭冠英蔡文静二度合作","34351"
"代表建议推进公民个人身份证件合一","32558"
"三大百亿基金大幅放宽限购","32312"
"我让朋友们试着翻唱莫扎特的魔笛","32277"
