"hot_word","hot_word_num"
"赵英俊没告诉妈妈自己得病","4228290"
"深圳茶颜悦色已排队3万号","1733194"
"酵母美白时代开启","1366996"
"陈小纭 讨论抨击我都接受","1122864"
"郭老师","998389"
"支付宝回忆杀","943811"
"爬个长城爬到一半还得加班","907425"
"塞尔维亚总统采访中力挺中国","760837"
"十年一品温如言选角","553933"
"瑞丽急需流调人员和缅语翻译","433635"
"刘昊然说袜子不同色是fashion","429775"
"台铁事故原因","424336"
"北京市新冠疫苗接种突破1000万人","422657"
"蒋勤勤 建斌诗集随手一翻好多错字","420626"
"华春莹质问美国对台是真关心还是当棋子","418875"
"多名证人称弗洛伊德在案发现场已死亡","417091"
"清明假期全国天气预报地图","415349"
"宋妍霏科目一考了两次都没过","413740"
"国际泳联取消跳水世界杯","411403"
"教育部明确3个重要时间保睡眠","410051"
"沈铁部分火车允许农民摆摊","408513"
"王俊凯因高反错过看流星","406485"
"娜扎侧颜","404721"
"深圳茶颜悦色","403733"
"外地户籍迁入温州购房可领5万补助","402525"
"创4学员二创涂鸦海星鹅","396968"
"董明珠三十年没休过假","366659"
"刘涛 我不端水我举缸","359828"
"新疆问题教材使用长达13年","314188"
"ATM机一年减少8万台","306553"
"李长歌狠强惨","301665"
"汪东城 希望我明年是真的公开了","291912"
"平板支撑有点费脚趾头","286754"
"如何反击别人说你胖了","280672"
"保持对侮辱英雄烈士等行为的打击震慑","270567"
"秦岚醉酒演技","261765"
"马来西亚外长用中文称呼王毅大哥","251675"
"青你3先导片","238570"
"向往的生活中国风概念海报","227626"
"长歌行","218791"
"王鸥对姐姐的理解","215202"
"哥斯拉大战金刚细节","210831"
"华春莹希望国外各界人士到新疆看一看","208114"
"吴磊台词 攻或不攻我自有考量","205555"
"恰好是少年发布会","202399"
"最爱的广式茶点","186199"
"台铁脱轨列车司机确认殉职","153233"
"云中君纤云弄巧仿妆","151586"
"芹菜青椒降价30%","143655"
"等等让孙俪去医院看看头脑","140546"
