"hot_word","hot_word_num"
"应采儿 人要害怕变老","1280960"
"西藏发现多座吐蕃时期高级墓葬","915418"
"撒贝宁一人办厂","903242"
"余景天 国籍","897512"
"白瘦幼审美是一种pua吗","843791"
"利路修没学成团夜舞蹈","781070"
"西藏考古发现唐风黄金挖耳勺","753678"
"河南网红小吃街环卫工凌晨下班","712496"
"爷爷在孙子婚礼上说的话","649488"
"广东汕尾发生一起事故致4人死亡","530830"
"巴菲特承认卖出苹果股票是错误","496949"
"baby带小海绵赶飞机","495440"
"INTO1出席R1SE演唱会","493461"
"剧组给古天乐找的替身是个黑人","491839"
"澳大利亚暂禁本国公民从印度回国","491532"
"创4成团夜幕后记录","488362"
"岳云鹏要把双皮奶寄到北京","486687"
"会嫁给自己爸爸那样的人吗","485307"
"女子因与男子通电话被塔利班鞭刑40下","483403"
"苹果或面临1777亿反垄断罚款","482127"
"苍蝇为什么会搓手","479507"
"杨紫芭莎礁石瀑布大片","479279"
"谭松韵风中凌乱游客照","470916"
"米卡以为营业就是工作的意思","458204"
"待飞航班为救断臂男童二次开门","432363"
"恋爱结婚和收入有关吗","426182"
"如何停止自我PUA","425091"
"苹果应用商店利润率近80%","405485"
"湖人跌至西部第六","396465"
"福奇建议印度政府学习中国抗疫经验","392628"
"澳门回归后各省送的礼物","391323"
"医生连续4个月为一位病人提前上班","383780"
"广州天气","312415"
"印度","308991"
"朝鲜外务省批评拜登演讲","299612"
"90岁老人过寿儿孙79人列队跪拜","294908"
"刘雯教吴昕妈妈性感眼神","268948"
"R1SE演唱会应援","265378"
"狗狗承受了我小时候的痛","264286"
"人可以抠门到什么程度","253520"
"张颂文7分钟无剧本独白","240637"
"程潇妹妹舞蹈","165912"
"小舍得","164266"
"五一假期国内航班客流超疫情前水平","163188"
"安赛龙新冠检测阳性","160857"
"年轻人到底可以有多抠","159976"
"茶卡盐湖景区回应卖2次门票","158239"
"三星堆出品青铜面具冰激凌","146947"
"90岁巴菲特股东大会喝低糖版可乐","129863"
"官方回应服务区一次性碗收15元","129414"
