"hot_word","hot_word_num"
"西安一7岁男童拔牙后昏迷99天","2425931"
"初中女生想当韩国练习生被骗2.5万","1368896"
"小欢喜每四年拍一部续集","1282192"
"白敬亭是去鞋厂上班了吗","958708"
"温州发现2例阳性病例","904334"
"白玉兰颁奖典礼","884760"
"非遗传承向新而生",""
"广州疫情","760230"
"钟楚曦问cc是不是宋妍霏","713305"
"蓝黑还是白金","578125"
"外交部回应菅义伟将台湾称为所谓国家","576575"
"存款20万裸辞的年轻人","568475"
"2匹百万宝马出逃偷吃玉米","564289"
"因为发音妈妈被服务员笑话","559965"
"赵丽颖生图","554914"
"被精神富养的孩子是什么样","550387"
"洪永城结婚","544479"
"因为一个滤镜被男友删除了","539771"
"你知道顺产到底有多痛吗","536007"
"高考失利可以靠考研翻身吗","515481"
"黑蒜粽子","495626"
"广州新冠阳性考生首发声","485272"
"上海暴雨","480534"
"谁能想到这是祖孙三代","478817"
"鞠婧祎红丝绒肩带礼裙","466157"
"王一博想做一个对社会有帮助的人","462940"
"黄子韬理想型是大乔","444156"
"女孩子有多喜欢照镜子","427109"
"最后一天高考结束","403759"
"ofo关联公司已无财产可供执行","400608"
"豆瓣崩了","400494"
"网友送彭昱畅园林机械使用规范","400468"
"美国援助韩国疫苗大部分将过期","334320"
"姜贞羽野蛮生长大片","311547"
"张宥浩的微博热转","310480"
"我国通过印花税法","292330"
"青涩时期的张哲瀚","288304"
"保卫科爷爷找丁程鑫合照","264812"
"军人地位和权益保障法","254855"
"没回消息被领导群里警告","238530"
"南医大女生被杀案罪犯被执行死刑","217024"
"大学生核酸采样太配合下巴脱臼","216102"
"李斯丹妮沈梦辰相声式香水测评","216097"
"迪丽热巴身材","215995"
"KPL","215598"
"爸妈眼中的自然美","215095"
"你能接受孩子平庸吗","214790"
"考驾照的人鞋子都不敢换","214438"
"东北小伙给奶奶网购手绘配送地图","214087"
"除了过生日的都很快乐","213270"
