"hot_word","hot_word_num"
"央视评谁偷逃税谁就得凉凉","798361"
"马思纯 减肥以健康为重","369346"
"快手66场嗨嗨星朋友直播","349473"
"郑爽涉嫌签订阴阳合同被调查","339235"
"明星工作室接连注销","317402"
"国办要求加强出生人口性别比综合治理","225383"
"北京试点对超市连卷袋收费","200539"
"今年高校毕业生规模达909万人","187408"
"国办要求惩处用网络对儿童隔空猥亵","173188"
"汪峰定律","168821"
"杜淳被王灿拉黑过25次以上","168173"
"龚俊姚安娜加入中餐厅5","142175"
"余生请多指教双人海报","139017"
"印度一新郎新冠阳性仍举行婚礼","131322"
"严厉打击代孕等违法行为","131191"
"印度疫情","130155"
"女硕士因残疾未通过教师资格认定","129701"
"张杰让何炅把冻龄秘诀传授给大家","129554"
"闲鱼崩了","128561"
"你能接受孩子将来不如自己吗","128167"
"机票盲盒为什么吸引年轻人","127491"
"被罗志祥耍了","126806"
"章子怡 峰哥发博要谨慎啊","126489"
"2021湖南卫视综艺片单","125859"
"王一博演的陈宇","125396"
"印度政府官员深夜突袭婚礼现场","124840"
"夫妻吵架最伤人的话是什么","121529"
"炒房客囤的小产权房最终谁买单","113627"
"CBA总决赛G1裁判报告","108824"
"过三爽好会说话","108364"
"邢菲让姜小宁把嘴闭上","107172"
"18元一日游被带去参观墓地","88379"
"猫咪的智商是个谜","87462"
"往后余生片花","86602"
"任嘉伦工作室辟谣网传新剧","83436"
"小朋友之间能有多甜","82683"
"张若昀正式起诉父亲张健","80541"
"熟蛋返生论文校长辞职","74987"
"二手新能源车难卖","72893"
"刘宇直播","71254"
"广西北流市民自愿排长队献血","70862"
"烨斯","70616"
"高考那个夏天有多难忘","70509"
"男子车展长时间操作中控被骂","57405"
"2021湖南卫视大剧片单","55718"
"学生时代难忘的社死名场面","54680"
"男子遛狗不栓绳被罚款2500元","51672"
"推文被日方抗议后赵立坚索性将其置顶了","48963"
"美团回应副处长当骑手1天赚41块","43769"
"十九届中央第七轮巡视名单","43473"
