"hot_word","hot_word_num"
"张雪迎发长文回应粉丝","2597668"
"艺人向粉丝商业集资将受惩戒","1849818"
"猪坚强老主人带食物探望","1243060"
"杜海涛沈梦辰","1239037"
"内卷就该这么卷","1218373"
"榴莲贵不是没有原因的","1150858"
"姐弟遛狗捡到钱不是26万是51万","905799"
"06版神雕黄晓明眼泪里有刘亦菲","789381"
"华春莹说56个FBI监督中国留学生太少了","750462"
"江西一医院院长收红包被停职","747747"
"原瑞幸董事长陆正耀再创业","636815"
"吴尊分享隔离14天心得","576025"
"黄景瑜给考研粉丝发回误删资料","571615"
"教授让太行山140万亩荒山由秃变绿","532235"
"杭州第二只金钱豹粪便检出竹叶","526174"
"抽屉里发现了父母的情书","519051"
"黄龄 胡洋","496230"
"昵称太像人名而痛失真名","494146"
"公牛集团涉嫌垄断被调查","477233"
"当你接受了社交上的缺陷","460422"
"90后的三十岁过得好吗","447465"
"ZARA因以次充好被行政处罚","432131"
"男孩70天打赏女主播158万","429521"
"以色列对加沙地带发动空袭","429442"
"遇龙","429365"
"刘涛 我不能让任何人看低我","426095"
"没见过世面的鲨鱼","420507"
"华春莹批西方老字号记者在中国骗访","413049"
"小米起诉美国政府诉讼达成和解","412377"
"汶川地震唯一在世搜救犬14岁了","411836"
"皮囊之下","378662"
"印度一大学20天内19名教授因新冠去世","291329"
"女生坐地铁意外收获老爷爷的速写","275379"
"卫星看汶川地震极重灾区新貌","263665"
"秦海璐说张馨月矫情","263583"
"小朋友打针能有多害怕","251036"
"禁忌女孩","250211"
"地铁偶遇龚俊","226132"
"消防员70米烟囱救下男子手抖不停","198001"
"NASA公布绝美项链星云影像","194457"
"哪个瞬间你开始不想结婚","192062"
"偶遇邓伦打篮球","186013"
"小学生遛狗捡到26万","185015"
"印度变异毒株已传至40多国和地区","184212"
"如何看待金曲奖入围名单","184036"
"明星天价片酬四大洗钱招数","148369"
"离职了你会和领导说什么","144744"
"日本推出温泉外卖","144446"
"华为鸿蒙商标被驳回复审","144123"
"喝茶在南方人心中的地位","144121"
