"hot_word","hot_word_num"
"章若楠否认有高管男友","700771"
"御赐小仵作","434546"
"中国塞尔维亚驾照互认","352868"
"自在发光无惧坠落",""
"被爸妈要走的钱弟弟还我了","351971"
"突然觉得读书真有用的瞬间","350533"
"上海中学出了57位两院院士","348664"
"赵丽颖演的雷金玉","285559"
"赵立坚称美要求调查病毒来源是政治操弄","285531"
"北大教授吐槽给女儿辅导作业","285503"
"团伙涉嫌走私白糖超2.4万吨","285498"
"高校回应教室内不雅视频泄露","285467"
"李子柒新视频","285433"
"广州4例确诊病例属于同一感染链条","285415"
"Jennifer和David回忆当年对彼此的crush","285379"
"上物理课不认真的后果","285352"
"金莎 从前的玉女形象大家都忘了吧","285314"
"吴宣仪微博评论","285309"
"女警抓捕现场发现嫌疑人是老同学","269746"
"徐璐直播状态","251800"
"荔枝价格大跳水","225221"
"张子枫绿色西装氛围大片","220632"
"上海白蚁","215309"
"雪糕为何越卖越贵","207618"
"上课趴着睡能有多费手","153585"
"张天爱蝴蝶结镂空裙","152939"
"广州卫健委提醒务必先预约后接种","145273"
"这3类人最吸引蚊子","142264"
"逆天奇案","139511"
"齐达内在足球圈是什么水平","137075"
"历届高考作文的惊艳句段","136986"
"儿子酒驾被查父亲酒驾来接","136899"
"高中老师3年没收108部手机","129669"
"当代年轻人的颈椎","103218"
"周柯宇晒腾讯工牌","96050"
"赵立坚说美国不反思抗疫却甩锅中国","89365"
"当密室NPC捡到你的身份证","89358"
"甘望星晒游客照","86758"
"甜宠剧男主可以有多苏","84631"
"上海推扫码撸警犬宣传反诈","83818"
"张柏芝红色薄纱长裙","74181"
"美国暗示不优先给台湾疫苗","74139"
"红外相机在高黎贡山拍到大量珍稀动物","68551"
"被辞退后把同事删除了","63830"
"荔枝的常见种类","58512"
"舍得酒业多名董事监事集体辞职","58028"
"哪个瞬间你后悔高考没努力","56065"
"理想照耀中国","55549"
"月光变奏曲","49429"
"整容机构诈骗千万12人被刑拘","48799"
