"hot_word","hot_word_num"
"舅舅介绍丁真走红经过","4117055"
"青岛新增2例本地无症状感染者","2697471"
"颜值控与实力派","2371916"
"张国立回复网友评论","2180717"
"吴谨言洪尧","1919891"
"唐僧的拉踩能力有多强","1432341"
"小米集团在香港暂停交易","807706"
"拜登受伤后首次公开露面","611244"
"学生成绩排名应该公开吗","536401"
"拔河比赛绳子被50名体育生拔断","414178"
"韩国N号房主犯提起上诉","405201"
"艾伦佩吉宣布为跨性别者","404235"
"中国驻法国使馆发言人回应","403831"
"电子竞技员国家职业技能标准","402077"
"张文宏称艾滋病病毒比新冠病毒更狡猾","400385"
"虞书欣工作室再发文","399425"
"黄俊捷恋情","397870"
"相辱以墨","397518"
"阿富汗时报发表社论","395989"
"南方装地暖降价近半","394574"
"郭德纲 我现在看谁都是郭麒麟","393998"
"张亮儿子13岁近照","359075"
"减肥人都不是真正的快乐","351774"
"把中古店当菜市场逛","321757"
"苹果因防水问题被罚1000万欧元","320444"
"毛笔画出了打印机的效果","319164"
"佳偶天橙","292577"
"假装自己戴了口罩","292371"
"英国83岁老人因放音乐声太大坐牢","291828"
"2020全球独角兽500强","280250"
"重庆这装置有一种诡异的朋克感","270227"
"COSMO时尚盛典","261427"
"骁龙888","248258"
"Crown退役","244021"
"华春莹回应泡菜问题","237021"
"超鬼王","230107"
"嫦娥五号着陆月球","200584"
"工科学校的水龙头","198294"
"2020中国最具影响力商界女性","195013"
"2020那些触目惊心的交通事故","187665"
"教体局通报老师强迫学生摔手机","187663"
"乌合麒麟","180696"
"嫦娥五号完成月球钻取采样封装","164811"
"嫦娥五号","161809"
"比手办还精致的coser","158208"
"我国每年都发生近20万起交通事故","152593"
"阿富汗村民回忆澳军暴行","150805"
"湖南卫视跨年首波阵容","145383"
"吃个方便面太不容易了","143064"
"2020只剩最后30天","142242"
