"hot_word","hot_word_num"
"向往的生活凌晨两点抢购好离谱","300317"
"世卫将国药新冠疫苗列入紧急使用清单","167829"
"李莎旻子 我恋爱了","166226"
"孟美岐为角色增肥15斤","155386"
"女子小区坠亡一层楼的人都搬走","148556"
"味全每日Cxemoji联名","126574"
"陈铭建议空姐名牌做到肩膀","114208"
"马来西亚小伙中国打疫苗被告知免费","90334"
"林小清回应被曝性骚扰女患者","89888"
"向往的生活","70664"
"警方通报特斯拉车主追尾后身亡","67063"
"安以轩 我已经是大人不能再依赖孩子","66678"
"GAI经纪公司声明","62389"
"杨洋喝酒漏了","59152"
"皮肤科医生林小清被停职调查","50239"
"澳大利亚5月15日将解除对印旅行禁令","49675"
"童星退圈后能有多优秀","49668"
"张艺兴半夜刮胡子","49549"
"奥运模拟赛陈梦夺冠","49461"
"中信银行禁止账户用于比特币交易","49347"
"女子跳舞坠楼民宿未在社区登记","49321"
"蔡徐坤邓紫棋狼人杀完美配合","49037"
"杨笠说永远18岁很可怕","48500"
"郎朗吉娜庆祝儿子百天","47452"
"全世界约有3.5亿地贫基因携带者","46713"
"姚策养母谈错换人生案伤害","46425"
"利路修纪录片","44518"
"恋爱中分享欲很重要吗","43958"
"周启豪战胜樊振东夺冠","40569"
"中学老师开分数银行借分凑整","40444"
"特斯拉回应追尾货车事故","40430"
"为社恐发明的社交方式","39831"
"如何看待中国人寿拿逝者营销","37283"
"MSI","36724"
"张桂梅是177个福利院孩子的妈妈","35735"
"利路修的规划是好好学中文","35052"
"上海高校8分钟毕设动画惊艳网友","34268"
"当地通报小女孩景区卖气球被驱赶","34089"
"禁忌女孩第二季","33950"
"皮肤科医生林小清","33158"
"为什么大家都爱谐音梗","33062"
"御赐小仵作","32573"
"谁是宝藏歌手","31452"
"大妈吵架的方式有多好笑","31177"
"11岁男孩面部烧伤戴奥特曼面具卖樱桃","30815"
"奔跑吧","30159"
"UOL RNG","29063"
"驻塞尔维亚使馆纪念北约轰炸中牺牲烈士","27091"
"韶关一辆特斯拉追尾货车","24641"
"成都摇号新规","24407"
