"hot_word","hot_word_num"
"张文宏称艾滋病病毒比新冠病毒更狡猾","3039757"
"张若昀瘦了好多","2478336"
"张一山 有一种猴感是很正常的","1890130"
"关晓彤 都特别好只有我不够好","1460611"
"故意传播艾滋病将受法律制裁","1081753"
"杜蕾斯防艾你了没","1042095"
"12月","985024"
"举全村之力把最硬的鳞给你","940796"
"拜登首次听取总统每日简报","725671"
"马首回归圆明园","702497"
"爷爷幼儿园接孙女每天隔空比心","612441"
"杨丞琳晒李荣浩与柴犬对比图","587706"
"李荣浩问杨丞琳从哪找那么多狗","580921"
"77岁奶奶给23岁自己的信","514313"
"每100秒就有一名孩子感染艾滋病","495739"
"官方回应零下4度洒水致路面结冰","408083"
"武汉茶颜悦色门外排起长队","404409"
"丁真同款耳环在家乡走红","403485"
"中学请108名优秀学生吃牛排","396324"
"花呗们该为年轻人陷网贷背锅吗","392749"
"送你一朵小红花珍惜版预告","387218"
"青岛一小区全面禁养宠物","385965"
"12月你好","366475"
"2020最后1个月","345763"
"漠河男子用500块冰搭冰屋吃火锅","343539"
"十二月文案","316846"
"满洲里","281626"
"伊朗革命卫队高级指挥官在伊拉克身亡","280745"
"中国高收入城市排行榜","280392"
"博古特退役","280317"
"我国每年约3000青年学生感染艾滋病","280262"
"我国报告现存艾滋病感染者104.5万例","263630"
"两行白泪上青天","238980"
"救场反应超强的艺人","209125"
"韩前总统全斗焕获刑8个月缓刑2年","208048"
"驻加大使同孟晚舟通电话","208032"
"人的休息刚需","206675"
"共用餐具不会传染艾滋病","188340"
"如何识别有家暴倾向的人","171907"
"光遇","164361"
"内蒙古新增4例本土确诊","155612"
"每天一个离职小技巧","136786"
"脱发程度自测方法","132236"
"上海部分高校配备HIV匿名检测机","132052"
"一个词总结你的2020","132050"
"丁真登上日本电视台","132046"
"王俊凯 少点关注我年轻的时候","123941"
"刚刚好的感觉太美妙了","122651"
"美股","121899"
"曹格儿子长大了","121266"
