"hot_word","hot_word_num"
"乃万网易云","3283847"
"第二只被麻醉的金钱豹正在恢复","2210611"
"张艺兴向往的不二之选","2063651"
"李佳航发文呼吁互相理解","2029178"
"赵薇 居然有人来祝我生日快乐","1995934"
"第二只豹子","1033371"
"比特犬","729783"
"杭州野生动物世界主要负责人已被控制","659250"
"海底捞市值56天跌2000亿","650012"
"医院称未给林小清配备助理","596809"
"男子走路看手机坠桥溺亡","479131"
"宋祖儿给杨幂做手机壳","449908"
"42岁李晨演17岁中学生","415091"
"严厉打击炒作劣迹艺人行为","391381"
"杭州野生动物园负责人或被判刑","373633"
"张镇麟被男球迷偷吻","373478"
"盖茨婚后与前女友度假豪宅","372224"
"那英cos长公主","370492"
"学历造假被判返还工资30万","370109"
"林墨喊话官博","368243"
"段宜恩 回国","367538"
"没想到称体重也要社死","366163"
"夹睫毛时手滑了","364712"
"伯远晒INTO1成员休息日常","363473"
"居民楼前建鬼城住户吓得不敢睡","362377"
"刘耀文晒一箱作业","361521"
"一个急刹车后我社死了","361082"
"纽约有数百遗体仍存放在冷藏车中","358903"
"上海老洋房标价上亿元","340642"
"辽宁男篮83分大胜澳门男篮","332960"
"吴亦凡骑车上班","328225"
"母亲节礼物","280937"
"杭州搜救队员澄清猎犬未咬豹子","274006"
"杭州野生动物世界第二只外逃豹子找到","254286"
"妈妈的教育方式有多惊艳","248510"
"猫科专家解读杭州金钱豹抓捕","243271"
"印度民众为接种新冠疫苗发生争抢","237453"
"禁忌女孩","214350"
"GAI私信女方发文","206760"
"母亲节鲜花预订量首次反超情人节","192932"
"老外眼里的真香国货","174912"
"尼泊尔是否会变成下一个印度","168929"
"我是女演员阵容","160567"
"如何看待妈妈带男童进女厕","158522"
"杭州野生动物世界道歉","157549"
"朱挺红牌","157270"
"11岁男孩面部烧伤戴奥特曼面具卖樱桃","157006"
"论文研究情趣内衣被嘲不务正业","145550"
"上海警方通报男子持刀杀一人","136812"
"杭州野生动物园三只出逃金钱豹追回一只","136503"
