"hot_word","hot_word_num"
"angelababy ins配图","693450"
"电视剧女主睡在我家床案一审判决","233365"
"随时见证 我值得拥有","233341"
"日媒称江宏杰语言暴力福原爱","233093"
"和马的眼睛太好看了","218491"
"纪梵希品牌代言人 欧阳娜娜","214693"
"水城威尼斯严重缺水","183962"
"3分钟了解今年两会为何如此重要","147603"
"赘婿","147591"
"杭州3月14日可领结婚证","147405"
"福原爱回应与男子约会","147379"
"中国最大恐龙足迹点在四川","147289"
"外交部回应中美关系民调","147093"
"杭州规定开学一个月内不考试","147003"
"创造营","146916"
"天津大学南开大学校际互选课程开放","146803"
"办案坠楼杭州民警初步脱离危险","146774"
"孙俪尝试做没有面粉的华夫饼","146632"
"刘西瓜","146575"
"宁毅苏檀儿第二次大婚","132051"
"刘英三观好正","106408"
"FBI局长称国会暴力是本土恐怖主义","100405"
"徐令宜十一娘今天体面了吗","100073"
"1.1亿年前蟑螂亲戚","90205"
"吴白艾情被外公催生","89412"
"3D还原货拉拉坠车事件经过","83765"
"被吉吉国王笑死","81271"
"虞书欣祝赵妈妈生日快乐","77961"
"多种家电涨价","75807"
"东京奥运会计划不接待国外观众","75202"
"央视专访玻璃大王曹德旺","74995"
"婚姻是恋爱的终极目标吗","70437"
"刘耀文牛油果绿造型","69781"
"替朋友接孩子致其意外受伤被告上法庭","69617"
"代表建议毕业生体检档案建立共享机制","58860"
"杨幂想跟安静学心理学","58579"
"锦心似玉","57077"
"力丸刘宇不是撑腰王","54287"
"近50%的人使用视听设备音量超标","52415"
"玻利维亚一大学楼道护栏断裂学生坠亡","52124"
"刚刚过去的冬季为暖冬","52049"
"锦心似玉预告","51026"
"蔡徐坤旋转楼梯","49534"
"周子舒喝酒晒太阳","48514"
"暴风眼","47588"
"奥利奥的神奇吃法","46571"
"北大获10亿元个人捐赠","42093"
"货拉拉涉事司机被批捕","41289"
"付豪18分","39822"
"长沙一小学签晚9点后不做作业协议","38303"
