"hot_word","hot_word_num"
"张雨绮回应朱正廷","2661715"
"北方暴雪南方多地气温超31度","1057349"
"罗永浩papi庞博群聊截图","1033781"
"金晨张继科吃饭仪式感分歧","1032007"
"反向凡尔赛大师","908666"
"周深工作室注册少管我商标","830401"
"情侣可以做同事吗","708226"
"年轻人为什么不愿意谈恋爱了","618857"
"外交部用两个五概括中国疫苗研发进展","598761"
"2.9元买头绳收3元好评返现卡","591750"
"金莎拒绝盛况","589385"
"厦门2份进口牛肉包装核酸阳性","579959"
"熊梓淇雨天遇车祸","460457"
"女子因不孕被夫家虐待致死案重审","441746"
"和喜欢的人一起去海洋馆","441391"
"湖南汨罗一餐馆爆炸34人受伤","437262"
"丁真","436111"
"硕士论文研究董明珠自恋","432407"
"字节跳动申请抖音电商商标","430816"
"秦霄贤妈妈","427413"
"柯洁 陶欣然","425995"
"不这么穿我睡不着","423971"
"陈奕迅全球分迅","421030"
"校方回应女教师上电视道歉","419635"
"凡尔赛人怎么吃火锅","389713"
"得物崩了","385996"
"不希望被翻拍的剧","319514"
"山东枣庄出台菜煎饼制作标准","315257"
"外交部回应孟晚舟案关键证人拒绝出庭作证","308404"
"逍遥散人","305975"
"体育生的拿水方式","305050"
"女儿们的恋爱","304636"
"学校表白墙能有多好笑","300002"
"特朗普宣布解雇美国网络安全局局长","290135"
"孙正义出售软银800亿美元资产","288026"
"刘宪华新歌Radio","271474"
"我是怎么定义一周七天的","268606"
"普陀山景区饭店天价便饭1900元","259727"
"谭卓 展示性感是女人的权利","249661"
"综艺中的神仙舞蹈场面","233017"
"笨贼上班玩手机被抓","226296"
"凡尔赛人是怎么上厕所的","205212"
"申花","197364"
"日本40岁男性成化妆品市场主力","191963"
"如果天官赐福拍真人版","183410"
"全球约6亿人患有慢阻肺","181869"
"3岁男童去世捐器官救4人","169950"
"撒钱派出所所长涉嫌违纪违法被查","167310"
"监控下狗子的迷惑行为","164121"
"林小宅 高昕","163429"
