"hot_word","hot_word_num"
"孔刘 我不是女人喜欢的类型","504208"
"女保洁误入男浴室撞见领导被罚2000元","259789"
"易烊千玺代言特仑苏","258547"
"疫情或使全球女性地位倒退25年","256135"
"杨幂钻石口罩","231430"
"王嘉尔回应萧敬腾想吻自己","170318"
"尾号888888手机号85万元拍出","166774"
"棋魂大结局","141568"
"微博新表情裂开了","114675"
"福奇称如被邀请会加入拜登疫情团队","114647"
"燕云台大结局","114355"
"明星社会性死亡现场","114254"
"艾福杰尼被陈志朋错认成工作人员","113871"
"中国人民解放军仪仗大队荣立一等功","113771"
"山东将免费乘公交老人年龄降低5岁","113484"
"追光吧哥哥","113370"
"流浪地球2","113212"
"宋茜","113029"
"南科大李淼","112851"
"假如在可可西里迷路了","105664"
"医院回应金龙泉创始人术后脑死亡","105618"
"孟美岐 Mute","95119"
"崖上的波妞确认引进","92934"
"爱情公寓式的梗源于欧美剧","87845"
"九尾狐传","87246"
"Cat发声不放弃","84691"
"暗恋视角下的明星有多绝","83800"
"北京住房公积金提取政策拟修订","83065"
"天津天塔致敬马拉多纳","83054"
"外交部回应中方是否计划接触拜登团队","83052"
"金龙泉创始人听障手术后脑死亡","83051"
"王牌部队","81660"
"专家称自发热内衣是宣传噱头","79118"
"陆律师","70942"
"国防部回应蔡英文争取美对台支持","67712"
"杀破狼","67579"
"我国宠物市场规模或超2400亿","65007"
"用周杰伦专辑命名5亿年前三叶虫","60480"
"朱一龙跳舞踩到童瑶","60050"
"马拉多纳死因","56885"
"冰上的尤里剧场版特报","55694"
"仙侠剧演员信念感有多强","54807"
"央视新剧片单","53564"
"那些长在审美点上的男生","52784"
"东北高校自制风火轮扫雪车","52565"
"四川有什么","47584"
"马拉多纳遗体告别仪式","46579"
"顾耀东营救沈青禾","44858"
"红米Note9","44481"
"感恩节","44068"
