"hot_word","hot_word_num"
"宁静回应单方面宣布退团","183087"
"上海海关查获406只活体蚂蚁","182102"
"咸素媛陈华分手","181381"
"杨紫井柏然海边吻戏路透","165355"
"山西发布最高级别暴雪预警","102213"
"周冬雨 同款白","102145"
"暴风眼","102128"
"创造营","102091"
"山河令","102000"
"外交部点名BBC","101873"
"看李焕英感动不是因为共情","101762"
"朴灿烈向粉丝道歉","101692"
"周深谈网红歌手和职业歌手","101520"
"驻华韩文化院成立纠错改正团","101496"
"周震南被问哇唧唧哇成团概率","101299"
"赘婿","101269"
"张智霖喊话袁咏仪要换手机","101138"
"朴智妍收到死亡威胁","101086"
"上海大学考研成绩","100769"
"中国人寿被举报人去年已离职","100693"
"一次过量饮酒对大脑影响长达6周","100689"
"吉利和沃尔沃宣布合并","90084"
"郑州下雪","74794"
"故意在父母面前吃外卖","68853"
"老大爷用1万多双筷子搭出天坛","59285"
"共享汽车座位现4枚钢针扎伤用户","59107"
"宁毅苏檀儿被迫分别","58883"
"基金大跌","56099"
"拼多多关联公司申请拼刀刀商标","55709"
"国家法律法规数据库已开通","55494"
"粉丝告诉庆怜房子塌了","55373"
"喻言翻唱Therefore I Am","49739"
"大学生抢不到票骑行200公里返校","46853"
"青你3一公造型","43047"
"圆明园发布365张老照片","42297"
"吴白输给王浩","41789"
"人类幼崽的温柔时刻","40444"
"小伙用瓜子壳摆出孙悟空刘德华","40246"
"辣条馅元宵","35845"
"斗罗大陆片场照","34257"
"余景天模仿生气的唐老鸭","30217"
"弑母骗保案罪犯被执行死刑","29971"
"斗罗大陆","28384"
"人的肉眼能看多远","27444"
"不想努力的原因找到了","23622"
"中纪委评货拉拉事件","22749"
"想看琉璃开副本","22739"
"家属不能进手术室的原因","22736"
"国乒退出WTT中东赛","20046"
"济南新增确诊病例曾乘G882次高铁","19844"
