"hot_word","hot_word_num"
"张雨绮 希望我明年不会塌房","561144"
"成都新增2例本土确诊","336772"
"宋轶带苹果走红毯","280500"
"杨幂蝴蝶结好大","265274"
"成都确诊新冠女孩首度公开视频","227038"
"时尚先生盛典","199962"
"台湾地震","188315"
"华春莹说就做战狼又何妨","181514"
"刘诗诗背影","177136"
"金晨把自己包装成了礼物","170157"
"小鬼催提词器翻快一点","153923"
"成都本起疫情累计报告确诊8例","147118"
"中宣部授予张桂梅时代楷模称号","141688"
"吉娜怀孕7个月状态","141384"
"爱的厘米","140741"
"星巴克要在中国新开600家店","140733"
"教练体罚学生用便池水洗脸","140725"
"专家建议小学到研究生缩短两年","127800"
"欧阳娜娜星河入梦裙","122172"
"邓伦的大片是在冷冻柜旁拍的","120579"
"在显微镜下清理手机","110413"
"谭松韵立体花朵裙","109203"
"女子20楼遥控指挥同事停车","105072"
"宋祖儿港风白天鹅","101052"
"天津大学推出可订制健身餐","86485"
"阿塞拜疆阅兵","81596"
"小黄车等退押金还要988年","80525"
"中国驻美大使馆推特账号被黑客攻击","80509"
"吴宣仪好像人鱼公主","80501"
"央视评演员不背台词念数字","76293"
"郫都复检发现4例阳性","75101"
"杨幂重回小时代拍摄地","70660"
"外交部宣布对美对等制裁","70436"
"绥芬河青云小区升为中风险","70350"
"大秦赋","67195"
"李佳琦直播","64326"
"关震雷李贝复合","63041"
"王者荣耀新峡谷","62742"
"了不起的儿科医生","58825"
"小风暴","55648"
"霉霉新专辑","55045"
"沐浴之王","54474"
"郫都中铁奥维尔二期三期升级为中风险","52667"
"薇娅直播间","51924"
"终极笔记","49202"
"福建震感","47283"
"装台","44718"
"亚冠","42240"
"萧敬腾说周杰伦眼睛好大","41757"
"武夷山纪念币","41213"
