"hot_word","hot_word_num"
"杨幂 100%粉丝对工作室都不满意","3588568"
"迟到了57年的焦裕禄全家福","2301674"
"大河之北","2073574"
"白冰打约会电话耳朵都红了","1908397"
"刘也 能别打电话了吗","1695408"
"2021牛起来","1342061"
"玩合成大西瓜一次被骗19.9元","1342061"
"马金瑜丈夫扎西回应家暴出轨","1257406"
"乐视回应App欠122亿","1185142"
"协和等知名医院字号不得擅自使用","1163845"
"意大利现新冠病毒变种感染聚集性疫情","1129643"
"肖战自拍","1106069"
"胡歌方辟谣与刘亦菲结婚","1070027"
"邓伦头发错位图","1065145"
"青海妇联回应前女记者自述遭家暴","829890"
"假日暖洋洋道歉","711601"
"杨迪衣服被时代少年团扯破","702403"
"河南一家族八角凳坐出30余位高材生","698531"
"假如跟父母提相亲对象的标准","599524"
"库里57分","590536"
"朱正廷曝光跟车视频","587289"
"吴彤发文","583110"
"网红口罩颗粒过滤性能仅16.5%","478947"
"Clubhouse","392747"
"活塞 湖人","389261"
"金毛小心翼翼给金鱼换水","388426"
"柯蓝发文退出我就是演员","386439"
"警方介入金瑜遭丈夫家暴事件","341268"
"多国央行放水点燃房地产市场","340003"
"杨洁篪同美国国务卿布林肯通电话","340000"
"时代少年团回应扯破杨迪衣服","339998"
"周深 我先做好一个歌手","319668"
"中疾控成功研发冷链消毒剂配方","290759"
"章子怡袁弘上阳赋双人舞","273386"
"人民日报评英方撤销CGTN播出执照","254546"
"见过最委屈的作文","252483"
"印度农民在全国发起堵路运动","241707"
"杭州人行道能弹出钢琴曲","209059"
"吴彤回复严浩翔高仿号","183016"
"斗罗大陆片头制作公司致歉","172530"
"中央政法委评金瑜被家暴","156447"
"北京发放5万个数字人民币红包","145970"
"旅客乘火车进京须持7日内核酸检测证明","145449"
"爷爷奶奶的追梦图鉴","145386"
"台湾地震","127066"
"广东各地方言能有多好笑","121845"
"31省区市新增确诊病例11例","112843"
"乐视 欠122亿","100868"
"奥运会拳击冠军斯宾克斯去世","84149"
"库里半场7记三分","75878"
