"hot_word","hot_word_num"
"鞠婧祎 备忘录","2833513"
"数字人民币增加6个试点测试地区","2201937"
"张柏芝 肿是什么螺蛳粉真的告诉我","1906609"
"张雨绮 李柄熹","1809389"
"当我问妈妈不结婚可以吗","1665898"
"摆脱路人感穿搭","1583749"
"头发乱竟然是种病","919085"
"从小帅到大是什么体验","913557"
"贾跃亭被罚款2.41亿","737042"
"外卖员被救护车二次碾压","734818"
"朱亚文刘浩存演恋人","733060"
"因吴磊骑行引发的家庭危机","731195"
"萧亚轩晒被狗咬伤疤痕","727161"
"外交部湖北全球推介会","726317"
"瑞士厕所的灯光有多瘆人","724034"
"司藤","721023"
"利路修是电视剧在逃男主吧","718823"
"张小寒","716362"
"蚂蚁集团回应再次被约谈","686263"
"苏醒林芸芸和好","682416"
"章子怡亲儿子亲出双下巴","619567"
"DIOR大秀","562462"
"美国3岁男孩玩枪误杀8月大弟弟","501872"
"王者荣耀","499189"
"吴磊 养成系演员","498956"
"入职前中彩票是什么体验","498457"
"菅义伟回应福岛核污水排入大海","442236"
"悦诗风吟陷假环保风波","438425"
"8000多海南离岛免税黄牛被拉黑三年","437246"
"中国移动回应收43个月漫游费","436343"
"上海市原市长杨雄逝世","398269"
"奶狗音有多让人尴尬","388692"
"龚俊万一粉丝三千万会出唱片","381152"
"向往的生活","358796"
"邹韵","354631"
"宋亚轩复古印花衬衫","352023"
"小舍得","319137"
"罗一舟被军歌叫醒","289918"
"碾压伤者救护车驾驶员被停职","274241"
"猫咪当拍摄背景有多高级","245435"
"儿童化妆品多数无资质","241336"
"迪士尼早就想好了","223576"
"金融管理部门再约谈蚂蚁集团","212184"
"王子文吴永恩牵手走红毯","196806"
"黑猫警长的真名","195808"
"如何看待大城市打拼小城市安家","190542"
"巴西男子花7年整成魔戒半兽人","174458"
"长歌行","151305"
"顺丰控股再度跌停","150983"
"外交部回应日本拟决定核废水排海","149996"
