"hot_word","hot_word_num"
"刘诗诗叮嘱袁弘帮吴奇隆带衣服","2020969"
"广州疫情病毒传播快传播力强","1904510"
"道德绑架式表白女网红道歉","984334"
"你对原生力量一无所知",""
"山河令导演争取全员二搭","853794"
"本地人绝对不在网上买的东西","752461"
"美国人真的不懂英语","736574"
"工程师提到我国水电站忍不住凡尔赛","729218"
"全国新冠疫苗接种剂次超6亿","613196"
"加拿大一学校旧址发现215具孩童遗骸","492618"
"26岁女孩当职业陪诊陪人看病","485206"
"邓伦在直播镜头下的腿长","484472"
"小猪洗澡有多可爱","481445"
"韩国医疗业被曝代做手术现象普遍","420156"
"成为院士有多难","372650"
"二建法规","328395"
"没事真的不要闻臭袜子","327982"
"剪了刘海的孟美岐","327669"
"这疫苗打的太合适了","326911"
"连淮伟改微博名","326278"
"美团坚决禁止任何形式二选一","326137"
"为什么孩子会突然抑郁","325509"
"高考700分和700万你选哪个","325083"
"张哲瀚推眼镜","324284"
"邓伦宁波","323734"
"吴亦凡做美甲","323438"
"是高三累还是大学累","322778"
"佛山南海区1地升为中风险","322383"
"6月1日起儿童安全座椅纳入全国性立法","317810"
"阿里云成立浙江猫精人工智能公司","315328"
"知网的定价权为何如此稳固","315318"
"为什么说人的悲欢不相通","315316"
"李宇春月光高叉鱼尾裙","272168"
"袁弘镜头下的张歆艺","268066"
"印度报告的变异新冠病毒在英国加速蔓延","259562"
"世卫组织称病毒溯源被政治毒化","239685"
"刻在萨摩亚女性手上的刺青","229065"
"哆啦A梦伴我同行2评分","225529"
"为什么飞机滑行过程中不能起身","223821"
"唐三小舞拥吻","218567"
"如何判断意面有没有煮熟","205105"
"老友记","195992"
"宋茜跪在地上和粉丝合影","190946"
"黄子韬凭一人之力逼疯杨迪沙溢","186285"
"请发猫猫狗狗图给我","184694"
"84岁院士说要坚持健身搞科研","183865"
"广州天气","183210"
"粉丝疯狂追星的法律边界在哪","179021"
"我和爸妈能接受的男友范围","167009"
"美国面临极高的通货膨胀风险","166640"
