"hot_word","hot_word_num"
"哈尔滨性侵4岁女童嫌犯被判死刑","3330616"
"阿富汗时报发表社论","2187370"
"粉丝认证号","1940538"
"金晨和陈一鸣约会害羞了","1839718"
"澳大利亚","1226592"
"焕脸太刺激了","1120336"
"胡一天扯乔欣衣服撒娇","1086781"
"林更新怼打一星的网友","1036599"
"湖南卫视跨年首波阵容","906544"
"满洲里东山街道办事处升为高风险地区","874587"
"上海业主招女性生活助理年薪百万","872619"
"耿斯汉表白金莎","872181"
"舅舅介绍丁真走红经过","871643"
"吴谨言洪尧","817467"
"青岛新增2例本地无症状感染者","633655"
"如何温柔的提出分手","486442"
"唐僧的拉踩能力有多强","432768"
"罗志祥","432662"
"学生成绩排名应该公开吗","432481"
"小米集团在香港暂停交易","432182"
"薇娅","431875"
"这些微信表情默默消失了","431628"
"张国立回复网友评论","431307"
"何洛洛回应和女生玩密室","431061"
"官方回应火车站地下通道竣工4年未开","430874"
"女儿们的恋爱","430796"
"黄俊捷恋情","426037"
"香奈儿发布虚假广告被罚款20万","409924"
"骁龙888","405045"
"中国驻法国使馆发言人回应","401235"
"邦邦竟然还表白冷冷","400823"
"长岛冰茶碎花美甲","349060"
"电焊专业在寝室赶作业","292030"
"我们恋爱吧","291761"
"华春莹回应泡菜问题","277606"
"冬天里的第一双鞋","270801"
"吃个方便面太不容易了","243936"
"拔河比赛绳子被50名体育生拔断","235985"
"2020全球独角兽500强","233451"
"天津立法禁止采集人脸识别信息","232946"
"用直男思维打败直男","232696"
"世界只剩中国FAST一只天眼","228817"
"南方装地暖降价近半","226048"
"艾伦佩吉宣布为跨性别者","225300"
"胡锡进","213523"
"日本新冠疫苗接种费用由国家承担","209254"
"陈立农哈妮克孜直播","206142"
"因为身高吃过的亏","199665"
"黄子韬摘头盔","195476"
"英国两大零售业巨头一天内倒闭","187662"
