"hot_word","hot_word_num"
"企查查辟谣李维嘉开代孕公司","2500472"
"低龄未成年人刑责范围再调整","2196637"
"买年货要看薇娅直播","2154478"
"林依轮 早恋晚恋不给孩子下规矩","1948639"
"李维嘉","1863798"
"刘涛帮粉丝实现新年愿望","1326798"
"唐僧离开女儿国的原因","1147797"
"考研英语二","1000992"
"羽绒服买大点的好处","958931"
"吴谢宇老家亲属发声","940078"
"王一博银发撕漫感大片","939169"
"北京一本地确诊病例曾拒绝发热门诊留观","937895"
"考研英语一","873986"
"明道烟熏妆","731495"
"北京2确诊病例5名密接核酸阳性","722545"
"金莎 看破不说破","698341"
"考研英语","695409"
"以为李泽锋亲到了于朦胧","672876"
"银行回应90岁老太取钱需自证身份","663021"
"中国疾控发布双节防疫提示","657119"
"郑钧Jagger为刘芸庆生","656668"
"原来口罩还能这么用","594749"
"吴磊的杯子蛋糕比头大","528012"
"王彦霖水下拍戏脸泡肿","516165"
"金骨朵盛典因疫情取消","512415"
"酒店回应温泉里放辣椒被指浪费","493736"
"罗志祥发文总结2020","490500"
"考研日语","453175"
"看到英语阅读FCC满脑子范丞丞","427177"
"2021两会召开时间","414502"
"团伙用铁锤砸断女孩手指演戏碰瓷","406255"
"考研第一天的状态","403565"
"有翡隐藏细节","387785"
"倪妮一秒落泪","382447"
"美国准许伊朗转账买新冠疫苗","363750"
"杨幂郭京飞CP名叫the10","356944"
"蔡依林一字马","339055"
"遇到同事甩锅怎么办","338735"
"鬼灭之刃票房超越千与千寻","329733"
"真正的朋友是啥样","325266"
"北京顺义进入战时状态","298383"
"紧急救援","287906"
"心灵奇旅","276998"
"被苗族姑娘围着敬酒的尤长靖","275681"
"唐嫣首支vlog","249161"
"彭冠英好适合傅慎行","222935"
"比特币价格突破25000美元","203192"
"女子被造谣出轨事件两人被立案侦查","202925"
"美国企业加速逃离硅谷","200758"
"祖国大陆距台湾最近铁路通车运营","192103"
