"hot_word","hot_word_num"
"孔刘 我不是女人喜欢的类型","1663328"
"女保洁误入男浴室撞见领导被罚2000元","755439"
"周杰伦 20年再粉一次","707024"
"疫情或使全球女性地位倒退25年","665781"
"杨幂钻石口罩","657146"
"王嘉尔回应萧敬腾想吻自己","589750"
"尾号888888手机号85万元拍出","476865"
"微博新表情裂开了","404655"
"福奇称如被邀请会加入拜登疫情团队","389537"
"明星社会性死亡现场","388365"
"艾福杰尼被陈志朋错认成工作人员","385931"
"棋魂大结局","384054"
"朱一龙跳舞踩到童瑶","371802"
"山东将免费乘公交老人年龄降低5岁","358070"
"追光吧哥哥","347411"
"中国人民解放军仪仗大队荣立一等功","338820"
"流浪地球2","318916"
"宋茜","310024"
"南科大李淼","298234"
"假如在可可西里迷路了","296547"
"暗恋视角下的明星有多绝","291726"
"陆律师","277621"
"爱情公寓式的梗源于欧美剧","268813"
"医院回应金龙泉创始人术后脑死亡","244255"
"孟美岐 Mute","234076"
"九尾狐传","229159"
"北京住房公积金提取政策拟修订","228386"
"天津天塔致敬马拉多纳","228198"
"外交部回应中方是否计划接触拜登团队","228174"
"Cat发声不放弃","228173"
"崖上的波妞确认引进","225777"
"专家称自发热内衣是宣传噱头","202565"
"王牌部队","189858"
"国防部回应蔡英文争取美对台支持","185099"
"金龙泉创始人听障手术后脑死亡","183633"
"杀破狼","178686"
"燕云台大结局","169308"
"用周杰伦专辑命名5亿年前三叶虫","164722"
"马拉多纳死因","159230"
"仙侠剧演员信念感有多强","147135"
"那些长在审美点上的男生","146944"
"东北高校自制风火轮扫雪车","136629"
"当玩手机不小心点了投屏","129782"
"我国宠物市场规模或超2400亿","128558"
"央视新剧片单","124143"
"四川有什么","122182"
"演员母丹称不认识张颜齐","99745"
"李易峰对同人创作的接受度","99671"
"红米Note9","91795"
"马拉多纳遗体告别仪式","91126"
