"hot_word","hot_word_num"
"中美高层战略对话","4552050"
"31省结婚离婚大数据","1453858"
"周迅代言一加手机","1378591"
"蔡徐坤生图","1300251"
"中美高层战略对话看点","1299205"
"王者荣耀瑶新皮肤","1144266"
"朱珠婚礼现场照","1089636"
"朝鲜马来西亚断交","1029372"
"王毅说美国干涉中国的老毛病要改改了","896260"
"西安确诊病例系意外暴露造成偶发感染","769306"
"潘长江称蔡明好着呢","613916"
"普京回应被拜登称为凶手","574945"
"蔡明胆结石突发后报平安","552812"
"司藤","452914"
"火锅调料老板加超标明矾终身禁业","451865"
"杭州巨响","443291"
"南京草莓音乐节阵容","433116"
"九江银行就彩礼贷道歉","406071"
"多地公务员省考招录规模压缩","405526"
"程晨","404066"
"很贵但绝对很值的东西","402370"
"张艺兴学拖拉机","400760"
"合肥心形公路走一圈13.14公里","400398"
"忘川风华录","382037"
"德云社门票","375884"
"清明节和复活节是同一天","365727"
"东南大学樱花教室","347709"
"威少三双","344887"
"不公布考试成绩和排名","344692"
"男子侵占公款获刑出狱再卷走1900万","344526"
"小马云回家后现状","334303"
"放弃生育的女人不完美吗","313273"
"广东一幼儿园校车与货车相撞","300132"
"大宋宫词群像","295576"
"广州猎德大桥","279143"
"淘宝崩了","278338"
"Lisa唐九洲对话镜头","271839"
"殷桃问想发个微博为什么这么难","267645"
"洛基海报","264356"
"美工人美工魂","248604"
"杨洁篪说希望中美对话是真诚坦率的","243602"
"敦煌阳关林场防护林被毁调查结果","242423"
"乘风破浪的姐姐四公","241751"
"普京建议与拜登直播形式对话","241304"
"我的姐姐成为姐弟特辑","229892"
"马背上的副县长回应低学历质疑","216323"
"春暖花开踏青妆","194646"
"詹姆斯库兹马撞胸庆祝","189150"
"华裔老太自述反击袭击者经过","188074"
"西安已检测3090人结果全部阴性","187122"
