"hot_word","hot_word_num"
"肖战更博","4039135"
"中国工程院撤销李宁院士称号","1724441"
"阿云嘎玩转音乐盒","1572753"
"袁弘调侃自己3天领2顿盒饭","1363279"
"外甥女眼里的小姨","1297504"
"周杰伦 我的女孩觉得这台可以","1214052"
"意大利女子19年11月已感染新冠","1133912"
"大头娃娃涉事店铺被罚4000元","1010672"
"河北三河全员免费核酸检测","923628"
"FBI警告全美50州或面临武装抗议","753391"
"三原新冠肺炎疑似病例系11岁儿童","731185"
"除夕火车票1月13日开售","682153"
"王源摘手套细节","630939"
"萧綦王儇 先婚后爱","588641"
"骑手出车祸躺地打电话求顾客谅解","513708"
"河北新增40例本土确诊","507415"
"杨洋迪丽热巴互送杀青礼物","481144"
"白酒股","454384"
"最新16个超大特大城市榜单","453571"
"10岁男孩往窨井扔鞭炮被炸身亡","451529"
"你好李焕英1981留念海报","450730"
"郭老师","448310"
"Nuguri首发","447081"
"Keep最快今年IPO","445020"
"关晓彤侯明昊CP感","442900"
"你是我的荣耀杀青","441380"
"戈登隔扣字母哥","439404"
"杭州城区人口规模超越南京","438681"
"李子柒做泡菜遭韩国网友围攻","437277"
"特朗普批准华盛顿进入紧急状态","435593"
"为爱尖叫官宣","424833"
"滞留石家庄遇困人员24小时救助热线","393485"
"四川启用统一健康码","360673"
"大学生放假前自制装备给盆栽浇水","359178"
"流金岁月","352253"
"金韩彬要回来了","337385"
"2021年全球无法实现群体免疫","321369"
"售票员卖票时偷偷搭售保险","311742"
"这萨摩耶怎么熊里熊气的","293526"
"肺部健康测试","289469"
"黑龙江伊春新增1例无症状","288420"
"警方通报福建一副县长落水失联","286962"
"刘雨昕插兜插了个寂寞","286399"
"光遇","283996"
"河北新增一确诊在火车站上班","282467"
"比尔超级拉杆","281127"
"家长该如何应对孩子厌学","280481"
"想看大江大河3","279107"
"北京网约车暂停拼车业务","258098"
"刘柏辛新歌有吗炒面","257194"
