"hot_word","hot_word_num"
"节目组给黄磊设规则设了个寂寞","2151371"
"进村东北虎已被控制","1486402"
"张艺兴与彩灯的安全距离","1164831"
"皓嫣","762139"
"国家一级运动员酒驾狂奔没跑过交警","732089"
"满江认不出来了","504206"
"大学生炒鞋诈骗百万获刑10年半","392932"
"向往的生活","380895"
"江歌母亲称赔偿款将全部捐给社会","376066"
"看向往的生活想泡脚","353202"
"宋佳 我妈可能就是南俪的原型","348615"
"张艺兴套路导演组","339825"
"王源 总有人永远都不会懂你","308255"
"利比亚沉船事故致至少100名偷渡者身亡","301214"
"专八考试","300977"
"专家称鸡西东北虎或来自俄罗斯","300910"
"男子反杀入室歹徒被认定正当防卫","287583"
"蔡徐坤 没说不能拿电脑啊","265051"
"工作中被领导骂哭丢人吗","251261"
"防止翘二郎腿做的努力","220317"
"福原爱感谢江宏杰提供协议场合","220299"
"黑龙江老虎入村一村民虎口逃生","212933"
"肖战工作室提议观众把花带走送人","188282"
"朱旭航爆粗口","169118"
"过三爽什么都吃","162189"
"东北虎拍碎车窗亲历者发声","152851"
"王嘉尔裸眼3D舞台","144542"
"龚俊生图","134642"
"辽宁男篮58次罚球","132497"
"张雨绮夸粉丝手机壳上的刘耀文帅","131917"
"韩外长提醒美国莫忘当初援助之情","126584"
"杨丞琳被罗一舟唐九洲友情感动哭","120025"
"故宫抢票","117651"
"2020年度中国好书","117592"
"大理通报男子命案出狱再杀人","117539"
"妈妈无时无刻不在爱你","115044"
"女孩摆摊将看完的书送给路人","111146"
"买东西不看尺寸的后果","110450"
"利路修 感谢你们让我下班","107916"
"广州特斯拉","99245"
"广州交警辟谣禁止特斯拉上高速","90736"
"杨国福员工辞职讨薪被打","90404"
"五一调休","90390"
"奔跑吧","88507"
"国信证券回应5万炒股变500万","86402"
"宝藏歌手","80724"
"字节跳动否认将上市","73138"
"因为哪句话爱上一本书","67850"
"直播带货不得删除屏蔽不利评价","67162"
"小舍得","61288"
