"hot_word","hot_word_num"
"冯绍峰 细手腕和细脚腕终于被发现了","2078520"
"疫苗接种证明不能代替核酸检测报告","1937120"
"科颜氏170周年","1925088"
"井柏然 杨紫从小妹妹变成大妹妹了","1861920"
"专家称王俊凯泡脚方式是无效养生","1739017"
"当我看到男友和兄弟的对话","1138254"
"可口可乐将涨价","820845"
"韩国学生削发抗议日本核污水入海","691216"
"调戏女子并追砍其丈夫男子被刑拘","688597"
"中央政法委评特斯拉车展维权","687720"
"井柏然 我现在爱的是李荣浩","687526"
"张雨绮丁程鑫加入快乐大本营","534270"
"食堂师傅曾资助中科院走红博士","532910"
"中国国画院20套违建别墅被没收","526470"
"工信部今年组织下架107款拒不整改APP","525778"
"3000万剂疫苗在美国仓库里吃灰","518325"
"关晓彤父母公司新增行政处罚","516346"
"雪碧拌面","512639"
"干细胞注射竟长出牙槽骨","509733"
"就医时令人窒息的社死瞬间","505911"
"青春环游记3拟邀嘉宾","453122"
"拍照时一定要把腿并好","439082"
"北京草莓音乐节阵容","430754"
"吴昕问周柯宇是不是又长高了","365983"
"肖战 小面包又来害我了","352441"
"范丞丞学院风游客照","348738"
"我真是大明星官宣","325846"
"董明珠谈格力接班人","269292"
"非法集资公司女出纳挪用1600多万","267111"
"日本复兴相为氚吉祥物低头致歉","267037"
"赵露思起诉黑粉","264433"
"鬼屋里最恐怖的事","263905"
"乃万发88红包请宋妍霏出演MV","250409"
"在宿舍演出了大片的感觉","249965"
"新疆的小学什么样","249446"
"关晓彤","226510"
"老人边看英文版高数边卖鸡蛋","219344"
"济南拟规定每户居民仅养1只小型犬","218837"
"迪丽热巴给吴磊整理头发","214419"
"爸爸是浪漫第一名","204407"
"林郑月娥说要让香港人更有国民意识","194067"
"男子帮助曾春亮逃匿获刑2年","172947"
"济南拟对遗弃犬只罚款2000元","165665"
"侮辱智商的消费经历","164014"
"9名大学生吸网购电子烟后入院","153328"
"今日头条状告今日油条案开庭","150981"
"阴阳师帝释天","144586"
"黑龙江省考成绩","140372"
"高校自研新型小麦请全校吃馒头","139744"
"郭采洁伊德尔牵手","139416"
