"hot_word","hot_word_num"
"山东菏泽发现156座连片汉墓","150061"
"王子文吴永恩牵手走红毯","107999"
"菅义伟回应福岛核污水排入大海","90284"
"张雨绮 李柄熹","87162"
"当我问妈妈不结婚可以吗","77795"
"广本极限挑战赛最新成绩","71011"
"鞠婧祎 备忘录","49525"
"董宏被开除党籍","48509"
"从小帅到大是什么体验","46226"
"佛山交警发布高速路口情况通报","44820"
"外交部湖北全球推介会","42435"
"张柏芝 肿是什么螺蛳粉真的告诉我","40828"
"白敬亭每一根头发都有自己的想法","39004"
"张哲瀚被粉丝送书直呼看不完了","37037"
"数字人民币增加6个试点测试地区","36868"
"贾跃亭被罚款2.41亿","36662"
"秦岚晒王鹤棣点的外卖","36383"
"见过最离谱的吻戏","36274"
"乐嫣","36089"
"扎克伯格1年安保费2300万美元","35940"
"蔡徐坤一个镜头拍了十六遍","35591"
"美国3岁男孩玩枪误杀8月大弟弟","35504"
"沈阳野禽H5N6亚型高致病性禽流感疫情","32762"
"龚俊 我当然像边牧啦","32098"
"许魏洲被鸟拉屎在胳膊上","31042"
"DIOR大秀","30163"
"警方总结骗子冒充熟人的话术","29775"
"李长歌到底有几个好妹妹","28252"
"蚂蚁集团回应再次被约谈","28063"
"如何看待俞长栋王少杰技犯申诉成功","28059"
"林芸芸跪求顾家伟","28058"
"景甜黑纱百花刺绣礼服","27482"
"当寝室有个山东室友时","26414"
"皓都询问乐嫣行踪时的语气变化","25692"
"张彬彬腿长106","24961"
"王者荣耀","23957"
"长歌行预告","23858"
"缉毒犬完成最后一次巡逻后离世","23284"
"小舍得","23160"
"头发乱竟然是种病","22993"
"朱亚文刘浩存演恋人","22198"
"中国人工智能专利申请量世界第1","21968"
"苏醒林芸芸和好","21756"
"尹浩宇四国语言说我爱你","21664"
"恰好是少年加字游戏","20122"
"奶狗音有多让人尴尬","19585"
"外卖员被救护车二次碾压","19583"
"鲜厨100官宣","19147"
"入职前中彩票是什么体验","18238"
"俞长栋王少杰技术犯规申诉成功","18009"
