"hot_word","hot_word_num"
"谈莉娜被记者问哭","3571015"
"多人持双阴性证明自英国来华后确诊","1273626"
"仝卓被AI换脸","1211443"
"何猷君家保姆中过三千万","1116149"
"离婚冷静期一方不同意离婚怎么办","923008"
"欧阳娜娜的ootd","629083"
"华纳兄弟宣布取消院线窗口期","619992"
"冷静期不适用于诉讼离婚","489324"
"拜登称将要求美国人戴口罩100天","430073"
"赤狐书生","403403"
"杜江把霍思燕搂在怀里挡风","375805"
"比伯发文维护海莉","350269"
"李佳航 等一手自己的瓜","340116"
"年内将有6亿支灭活疫苗获批上市","304628"
"潮流合伙人开播","282058"
"直播带货三天卖出130万元假口红","274349"
"张萌加上了杨幂微信","274107"
"花儿超级乖","273873"
"白酒股","272646"
"全职高手2大结局","271602"
"佟丽娅带朵朵探班陈思诚","271433"
"肖战看表情猜动画和电影","271192"
"郭敬明无量预告","270927"
"山西进口冷冻带鱼外包装检出弱阳性","262840"
"黄晓明去油成功","261476"
"黄俊捷","231231"
"日月同辉","216493"
"ofo创始人戴威再收限制消费令","202464"
"国家宪法日","199659"
"易烊千玺爱的箴言MV","199622"
"正确的生育观","198956"
"杨丞琳夸金钟仁跳舞超好看","183725"
"公厕取纸靠人脸识别","181070"
"哈里斯高级幕僚团队全为女性","179938"
"钟南山深情回忆母亲","179543"
"邮政投递员因见义勇为落户杭州","175762"
"沙狐现身内蒙古额尔古纳","171950"
"元旦多地机票价格比火车票低一半","170867"
"冷血狂宴终极预告","168820"
"西藏阿里地区接入国家电网","160878"
"赤狐书生终极预告","154341"
"广州男篮绝杀新疆男篮","153534"
"60岁老伯帮400多位烈士找到家人","147775"
"2020年度十大流行语","143226"
"如果声音不记得","140976"
"咬木棍写小说残疾女孩破格加入作协","131123"
"huanfeng将缺席LPL全明星","130678"
"央视国家宝藏首发阵容","117621"
"一秒钟票房破亿","116485"
"陕西收到羊肉全院将吃羊肉泡馍","115669"
