"hot_word","hot_word_num"
"华晨宇关晓彤演我的少女时代","4155778"
"加勒万河谷冲突现场视频公开","2246905"
"2021我的年","2246552"
"杨幂让沈腾说出华晨宇的三首歌","2246183"
"祖国山河寸土不让","1987876"
"华春莹称种族灭绝在中国是世纪谎言","1853000"
"郭晓东让程莉莎赶紧回家做饭","1465602"
"人潮汹涌票房破2亿","1140645"
"海霞低头念稿","958463"
"外交部回应中方公布中印边境报道","918121"
"顶楼","914396"
"金巧巧 想翻红失败","913180"
"至少8位外国元首首脑接种中国疫苗","902686"
"王鸥的wink","731479"
"刘嘉玲章子怡合照","718505"
"王牌对王牌","670366"
"关晓彤 我的假发亮到想对着它许愿","669063"
"4名牺牲边防英雄的照片","654929"
"永远的第一名","642291"
"西部战区陆军发布视频致敬戍边卫士","630230"
"虞书欣的伴舞好漂亮","606275"
"韩国发现一条神秘地道","604043"
"赘婿开分","499642"
"戍边英雄面对数倍外军张开双臂阻拦","494518"
"小米 车","492713"
"重伤的戍边英雄曾为受伤战友落泪","491313"
"陈妍希晒浪姐2合照","475179"
"曾黎下车镜头","465072"
"面试时手机响了怎么办","373428"
"边境线上的中国军人","370516"
"琉璃","370481"
"一切矛盾用四个字可以平息","367523"
"李多海否认结婚","356000"
"创4的滤镜","325897"
"陕西一95后拒服兵役被罚7.2万","322708"
"和马怼脸镜头好帅","304670"
"赘婿","301783"
"那英的嘟嘴","300376"
"中纪委评论你好李焕英","297089"
"巴西被曝有医护给老人打空气疫苗","207406"
"海军陆战队女狙击手","204374"
"土耳其男子与孕妻自拍后将其推下悬崖","200691"
"男孩吃饺子吞下2枚硬币1年后取出","194246"
"北京双星拱月","189489"
"新华社评东北放开生育限制","187372"
"顶楼发布会","184959"
"李慧珍安又琪刘烨苗鼓版无价之姐","163803"
"人潮汹涌","155576"
"全国大回暖进程地图","128998"
"芬兰发现一种新型变异毒株","128592"
