"hot_word","hot_word_num"
"黄轩终止与HM合作","4277635"
"养母称未见到姚策最后一面","4206685"
"范丞丞有你刚好","4195057"
"姚明明道歉","4165153"
"姚明明与女生亲吻","3003564"
"5杯水如何分给6个领导","1116785"
"尾号55555手机号120万拍出","888967"
"我们玩的都是老祖宗剩下的","785835"
"华春莹表示五眼联盟显然搞错了时代","775238"
"涉嫌猥亵女童13岁男孩被家属接回","774199"
"MMAQL","739976"
"妹妹长大了","691931"
"十年硬汉无人知 一朝老婆天下闻","688260"
"我国计划3年内新建机场超30个","683372"
"美国25%亚裔年轻人成种族欺凌目标","672510"
"郑州财经学院一男生在公寓死亡","663164"
"阚清子说不想再压抑自己了","655892"
"海底捞人均消费超110元","642249"
"马斯克点赞中国碳达峰目标","630592"
"戚薇 谁说医生不可以时尚","621352"
"男子离婚330万元房产仅得2.8万元","613766"
"情侣玩密室逃脱吓得抱错女朋友","599739"
"辛巴宣布复出","598581"
"妇联回应女子疑遭多人暴力侵害视频","588995"
"阿米尔汗感染新冠","586323"
"彭于晏 单身的请举手","559751"
"极限挑战录制","470385"
"特斯拉美国官网支持比特币付款","458499"
"特斯拉ModelY涨价","450390"
"山河令制片人 请放过我们编剧吧","449359"
"张彬彬觉得景甜是甜甜的小女生","422973"
"郑允浩退出Kingdom","377857"
"美国侵犯人权报告","336809"
"中国坚决反对疫苗民族主义","319083"
"台媒称福原爱通过视频电话提离婚","306694"
"吐槽大会体育专场下半场","292317"
"原来兔八哥是这个意思","278056"
"警方通报安徽霍邱11岁男孩上吊自杀","266288"
"山河令","239776"
"司藤心动开花妆","228962"
"南宁警方调查女子疑遭多人暴力侵害","228331"
"抓捕现场民警选择集体说谎","225744"
"听姐说","220589"
"成都熊猫专列自带麻将机","216660"
"特斯拉回应支持比特币付款","213108"
"去年美国平均每天110多人死于枪击","213021"
"考察组回应三星堆纵目人后裔研究","190456"
"全球最大油画拍获6200万美元","181105"
"操场埋尸案校长狱中忏悔","175200"
"司藤","174864"
