"hot_word","hot_word_num"
"刘浩存年龄","1976739"
"谭德塞建议暂时放弃新冠疫苗知识产权","1682316"
"苏妙玲十年后重回舞台","1598165"
"黄子韬 是我的问题我改","1264467"
"对比家长收入歧视学生老师道歉","929772"
"朴槿惠未交1亿人民币罚款","897711"
"我的时代你的时代世纪婚礼","525358"
"取快递被造谣出轨女子回应两人被公诉","524917"
"陈薇说针对变异株的疫苗研究早已启动","518187"
"李雪琴孟鹤堂撒娇情头","505789"
"华晨宇猜热依扎为迪丽热扎","498734"
"杨紫佟年回归","498224"
"单针接种新冠疫苗年产能或达5亿","493421"
"比特币排进全球前30耗电大户","478902"
"我国在轨运行应用卫星数量超300颗","474877"
"Angelababy晒小海绵吃元宵","464657"
"谭松韵 脸圆不代表我好拿捏","452256"
"吴白回应恋情","444443"
"一句话证明你在追赘婿","401997"
"沈梦辰模仿宁静","384677"
"差点以为凤凰传奇解散了","374718"
"汤怡麦秋成婚礼","344900"
"十五圆月壁纸","327213"
"沈腾贾玲宋亚轩唱凉凉","326417"
"林更新偷偷扔石头","322384"
"江苏苏宁","305263"
"高瓴资本减持良品铺子","302374"
"汪文斌说欧方新疆访问团不应是调查团","301997"
"斗罗大陆直播间观看人次破1000万","301875"
"大连海域现18米长鲸鱼尸体","286217"
"董卿缺席央视元宵晚会","219205"
"十一娘情商","208807"
"外交部回应美军空袭叙利亚","204482"
"河南豫剧演员大雪中演出","203008"
"杜兰特因伤缺席全明星赛","178404"
"高考倒计时一百天","169608"
"美国新冠肺炎超2846万例","159560"
"华晨宇唱杀破狼","150772"
"微博年度十大MV","143078"
"王牌对王牌","118982"
"顶楼","112486"
"佟年结婚空隙还在改论文","103718"
"看见银河升起的那一刻","101670"
"十五圆月穿过故宫角楼","100445"
"教师平均工资低于公务员将问责当地","64542"
"古人怎么过元宵节","63822"
"成都339元宵AR灯光秀","63771"
"造谣取快递女子出轨两人被提起公诉","63708"
"锦心似玉","62873"
"美国近3成居民因新冠疫情失去亲友","62683"
