"hot_word","hot_word_num"
"秦昊问伊能静快递有他几件","150995"
"拜登竟称美日安保条约适用钓鱼岛","102934"
"女装品牌艾格破产","100002"
"乔诗语","98675"
"孟鹤堂因于谦结识现任妻子","89995"
"美食真香现场","89771"
"心疼林医生","67522"
"苏宁首夺中超冠军","63785"
"汕头一自建房被人为纵火致1死4伤","51436"
"快递员育儿嫂也能评职称了","47018"
"藏族的康巴汉子有多帅","46893"
"唐嫣回应萧燕燕人设争议","46070"
"李易峰眼神戏","43781"
"武汉光谷沿街居民楼发生爆炸","40717"
"新郎接亲被测试雅思听力","39213"
"顾耀东脱粉","38910"
"腾讯员工平均月薪7.6万","38389"
"熊顿病情加重","37640"
"爱康国宾实名举报国信证券分析师","36878"
"虞书欣 其实我的戏路是非常广的","36692"
"鹿晗绿色西装","36241"
"湖南一中学操场上期中考试","35986"
"疫苗精神药品等不得通过网络销售","34722"
"张若昀繁丽复古大片","34492"
"我国已从92个国家接回7万余中国公民","34136"
"今年已查处5000多名非法入境外籍人员","33433"
"世界最大的紫粉色钻石拍出2660万美元","32495"
"恒大 苏宁","31424"
"丁震","30900"
"青春创世纪","30722"
"大爷买35元渔具误付13万多元","30077"
"原来佟湘玉也是凡尔赛大师","29563"
"闪耀暖暖","29292"
"张艺兴采访","29104"
"薇娅直播","29016"
"韦世豪怒砸球员通道","28741"
"如意芳霏","28149"
"萧燕燕耶律贤吵架","27900"
"不为人知的女性力量","27109"
"尾款人你的快递坐高铁来了","26890"
"周深 鼓掌机器","26851"
"武汉各校不得要求家长代评改作业","25979"
"百香果女孩","25748"
"以你的心诠释我的爱","25709"
"腾讯公布第三季度财报","25132"
"伊能静双十一买900件商品","24553"
"苏州奶奶查siri户口","24264"
"向阳而生","23869"
"独臂快递哥双11每天送千件快递","23577"
"男子被叫下车三分钟后大货车撞上","23248"
