"hot_word","hot_word_num"
"张亮为前妻寇静庆生","3226942"
"李梓萌不由自主把打疫苗标语唱了出来","1716503"
"周迅离开月球","1162906"
"龚俊曾以粉丝名义做公益","1065212"
"原来iPhone可以称重","1062228"
"美国儿童频道删除两集海绵宝宝","901164"
"毛里求斯岛的水下瀑布","669891"
"黄子韬 我解放了多少在减肥的朋友","637907"
"专家解读延迟退休如何进行","581165"
"日版101第二季主题曲舞台","546268"
"挖掘机卖到脱销","520591"
"南大碎尸案家属正式起诉学校","501722"
"包钢通报职工跳入高炉钢水","474012"
"红火蚁已传播至我国435个县市区","323644"
"患艾滋男子性侵15岁女生改判10年","322158"
"已有43艘货船顺利通过苏伊士运河","319326"
"抑郁症与躁郁症的区别","318575"
"间歇性午睡综合征","318160"
"印小天微博评论","317108"
"安徽师大校内捞鱼做全鱼宴","316151"
"王者荣耀","315043"
"李依晓演技","314656"
"退休人员养老金涨多少","313327"
"谁该为苏伊士运河大塞船损失负责","312921"
"林芸芸被顾家伟拿捏死死的","312185"
"法国证实阿斯利康疫苗可造成罕见血栓","306427"
"林芸芸卑微","295999"
"森林狼 篮网","271516"
"赵立坚问美方我们是强迫机器劳动了吗","268265"
"巴基斯坦总统新冠病毒检测阳性","267143"
"卖家称可批量破解各地家庭摄像头","261492"
"从未见过如此形象的单词","257536"
"胡静 我的人生价值不是豪门阔太","230839"
"赵立坚回应中方操纵世卫溯源报告","223612"
"嫌疑人质疑警察不懂技术偷删代码","222000"
"如何看待南大碎尸案时隔25年未破","190814"
"一支笔含十种毒","187817"
"司藤向秦放表白","169163"
"央视批校外培训乱象","145014"
"威少连续三分","140533"
"2000年前的小熊高压锅","136781"
"马尚跟腱断裂","131567"
"皓衣行","127054"
"数万条偷拍隐私视频网上叫卖","117799"
"包钢","112803"
"白英好惨","112151"
"邓紫棋手抄四页能力","108116"
"奚梦瑶肚子","98536"
"香港放宽部分抵港人士限制","89756"
"张嘉元","89119"
