"hot_word","hot_word_num"
"Amber 我曾经就是个实验","2175286"
"全球首次发现人感染H5N8型禽流感病毒","1885803"
"韩美娟的嘴能不能留到决赛","1884220"
"南极发现全球首只金色企鹅","1672075"
"付辛博听到光荣时的表情","1045870"
"四位戍边烈士遗属优待抚恤细节","807336"
"卫健委称东北放开生育限制需做全面研究","797640"
"你好李焕英位列中国影史票房第六名","671161"
"烈士肖思远的微信头像","583774"
"美国得州进入重大灾难状态","417666"
"周深写评价像老中医开单子","413886"
"王霏霏演的娜娜","406283"
"Lisa问梁森有没有在头上抹化妆品","401634"
"中纪委评辣笔小球被拘","399762"
"王焯冉牺牲全村瞒奶奶8个月","392147"
"海底捞练习生","389468"
"李梦 终于被淘汰了","385715"
"比特币突破57000美元关口","381502"
"比特币","377473"
"烈士肖思远父亲发声","371756"
"符龙飞黄小蕾异父异母亲姐弟","365510"
"李梅导演刺激张艺凡","362900"
"邓超发博求撑腰","358376"
"医学科研人员无实质贡献不得挂名论文","348141"
"虞书欣吐槽彦希油腻","346604"
"谢可寅 这把火已经把我烧起来了","308548"
"见过最奇葩的游乐项目","250314"
"辽宁省考公告","231966"
"祁发宝半月吃30多包朝天椒抗寒提神","227661"
"周震南 选秀就像找工作","223949"
"网恋奔现需要多大勇气","220137"
"堀与宫村","196017"
"四川绵阳万亩梅花绽放","173989"
"我们能为边防战士做什么","150331"
"南极又出现西瓜雪","137571"
"思诺是秦风的另一面","129300"
"4岁甘孜小卓玛的雪地微笑","122514"
"吉利确认成立新电动车实体公司","119849"
"刺死女儿9岁同桌男子被执行死刑","117312"
"寻龙传说定档","115789"
"祁发宝戍边20多年13次与死神擦肩","114933"
"重庆的哥智擒贩毒乘客","103370"
"刺杀小说家","102562"
"唐人街探案3票房破39亿","98396"
"晴天晚上味的香水","96721"
"李宇春 暖心","95783"
"传销A级老总的自述","95433"
"32名在柬中国公民确诊新冠","90409"
"边防官兵的御寒三件套","90044"
"河南建业改名为河南嵩山龙门","89981"
