"hot_word","hot_word_num"
"吴彤收到十万条私信不敢看","293820"
"特斯拉再次深夜发声","181173"
"和朱婷一起享受健康生活","172650"
"赵露思工作室声明","169168"
"如梦之梦直播","115628"
"顺丰财务负责人辞职","105406"
"许晴肖战吻戏","100441"
"西安某高校发生持刀劫持事件","92932"
"特斯拉提供刹车事故前1分钟数据","87876"
"付国豪离职","82690"
"佟大为 父亲会影响女儿的择偶标准","81021"
"张艺兴用彩灯的手机壳","75920"
"许凯腰疼","72416"
"每年约1000万吨塑料垃圾流入海洋","71751"
"河南家长自费百万在校门口建天桥","71509"
"仝卓诉山西招考中心案开庭","71449"
"原来胃病不能喝粥","70848"
"程莉莎婆婆情商","69350"
"国产芯片订单量井喷","68368"
"一万年前的水母湖是怎么形成的","67630"
"蔡徐坤进被窝速度","66713"
"湖北女子4年7次诉讼离婚未果","55257"
"对象向自己奔来是什么体验","51071"
"鹿晗黑色指甲","50776"
"赵露思点赞","48049"
"林巧稚75年前的手写病历","45331"
"梁辰陆景门后壁咚吻","44494"
"硬盘3天狂降2000元","44171"
"广东第16次杀进总决赛","44054"
"龚俊直播","44023"
"东航辟谣员工不雅聊天记录","42547"
"共同构建人与自然生命共同体","41461"
"过三爽教过爷谈恋爱","40146"
"八零九零","38449"
"杨超越回眸","38430"
"创造营25强决赛倒计时采访","37723"
"小舍得","37535"
"倪大红白敬亭爷孙cp","36050"
"支持有条件地方和重点行业企业率先达峰","35921"
"BO道歉","35512"
"花21万元补数学考59分","35165"
"胡明轩赵睿鼓励高诗岩","34893"
"妈妈教给我的婚姻观","34864"
"张哲瀚 我在我生命每个阶段都尽力了","34594"
"蔡菊英大闹南俪公司","34533"
"杜富国清唱夜空中最亮的星","33282"
"火烧云晚霞有多惊艳","32510"
"原来你是这样的人民海军","31425"
"长歌行","31049"
"青春有你","30615"
