"hot_word","hot_word_num"
"毛晓彤杨玏情侣拍照模版","2274129"
"9000名乘客因鼻拭子重复使用受害","1372390"
"群星共庆科颜氏170周年","1349012"
"男子以妻子出轨生女诉离婚遭驳","1334683"
"除了道歉真果粒还能做什么","1261790"
"出游不出油","1132694"
"奥特曼被捏屁股","1042982"
"抖音火山版被判赔偿腾讯800万","996926"
"肖战杨紫聚餐","908412"
"濮存昕谈艺人人设崩塌","850611"
"一女游客在河南新乡失足坠崖","756792"
"Gucci回应唯品会腰带被得物鉴定为假","704934"
"南部战区登陆舰火力全开演练","695176"
"乃万","695160"
"上海武康路蝴蝶结奶奶被家人接走","692391"
"吴京用屁股帮跟拍关车门","555202"
"米卡沙滩照","506217"
"皮肤科医生林小清","505665"
"G7版岳不群来了","497680"
"茅台回应应聘者需体测","488688"
"王霏霏母女时光交错大片","488482"
"真果粒道歉","486638"
"底盘最低的猫咪","483109"
"倒奶事件","405172"
"乌合麒麟","403709"
"中国人寿回应宣传客户死亡获赔120万","388288"
"沈阳一女孩暴打虐猫男被判刑","355905"
"王俊凯又没按照剧本走","319639"
"韩国前总统李明博房产被强制拍卖","273444"
"重庆专升本","266870"
"印度派出9艘军舰全球运氧","261597"
"INTO1黑白质感大片","244507"
"超模冰激凌","240982"
"印度民众正设法筹款逃离印度","233613"
"家庭暴力犯罪典型案例","233347"
"听过关于死亡最暖的解释","233189"
"印度农村病人不敢去医院躺在路边输液","222898"
"91岁爷爷打卡自己设计的清华教学楼","208730"
"如何看待相亲中的学历鄙视","208523"
"怎样看待教师体罚屡禁不止","207988"
"谁在粉丝疯狂倒奶中获利","207510"
"41岁民警推开战友身中数刀牺牲","206809"
"夏日苦瓜柠檬茶","206411"
"尼泊尔新冠阳性检出率达44%","205742"
"陈伟霆冬天滑雪夏天划水","205737"
"周六别忘去上班","203731"
"高考倒计时一个月","203727"
"莫文蔚献唱电影我要我们在一起","203726"
"懒人麻辣龙虾尾火鸡面","197566"
"马尔代夫议长纳希德在爆炸事件中受伤","195536"
