"hot_word","hot_word_num"
"肖战自拍","3351123"
"婴儿游泳池溺水挣扎3分钟","2485171"
"王刚关注的第一个人是张国立","1624116"
"孟佳沈梦辰金莎拼单给黄晓明买蛋糕","1499012"
"跟高铁座椅撞衫了","1016147"
"林允自制减脂菠萝干","896929"
"外交部向拜登和哈里斯表示祝贺","845835"
"广州图书馆欲跳楼男子被刑拘","835378"
"夕阳下的小奶猫","833565"
"男子冒充007还有军情六处工作证","822670"
"救跳楼女子被砸伤男子失忆","806491"
"撒贝宁翘课打篮球还能考29名","797269"
"张萌去年买的口红还没收到","785559"
"宋茜粉丝潜伏anti吧十年","780256"
"教育局回应老师发满意度调查标准答案","746044"
"VG处罚乐言","732275"
"父子反杀夜闯家门者被判死缓","731446"
"黄峥身家一夜暴涨529亿","720363"
"杨幂台词","654250"
"河北新型冠状病毒检测费收费标准","512339"
"狗妈妈往返6次教小狗过桥","476085"
"陈法蓉愿为刘德华放弃环球小姐","470794"
"敖犬手部受伤","424279"
"胡定欣离开TVB","380075"
"南非发现200万年前头骨化石","376303"
"哈里斯丈夫将辞职支持妻子事业","376268"
"吃了CD的明星清唱","376233"
"高通已获准向华为出售4G芯片","364708"
"丁真 创4","358405"
"华晨汽车被申请破产重整","328043"
"公交司机给外卖小哥送热饭获鞠躬回谢","322565"
"意大利一养老院设拥抱屋","305059"
"明星大侦探回归","287569"
"如何判断护士的工作年限","274113"
"特朗普政府公布行政命令","259828"
"张沫凡公布新恋情","254866"
"小男孩数学考试磨刀式演算","242301"
"angelababy","221941"
"见过最长的裤子","210181"
"妈妈家长会上表演武术","199082"
"邓伦黑瞳天眼","192717"
"露华浓达成避免破产协议","175136"
"浙江舟山一载10人渔船失联","166905"
"兰州一冷链食品标本新冠检测阳性","166500"
"深圳市考","166394"
"李宇春被老奶奶轮流摸脸","166366"
"日本全面推行去印章化","162466"
"买恐怖片模型的坏处","154832"
"保安大叔做核酸检测做出表情包","152388"
"小海绵第一次给黄晓明唱生日歌","152006"
