"hot_word","hot_word_num"
"东京奥运会已基本确定闭门举办","1739062"
"315晚会","966689"
"景甜张彬彬好像一对新人","862711"
"单身人设","706481"
"少年的你提名奥斯卡","538312"
"科勒卫浴回应门店装人脸识别摄像头","521907"
"英菲尼迪致歉","396603"
"外交部回应中方是否从缅甸撤侨","373177"
"文淇工作室辟谣恋情","346244"
"近5成进口婴童消费品不合格","336601"
"张雨剑承认有女儿","329635"
"谭松韵辟谣结了婚又离婚","323620"
"部分应用商店下架智联招聘前程无忧","317054"
"沧州市长要求彻查瘦肉精羊肉","295695"
"如何表明一个男明星要火了","293504"
"徐令宜十一娘圆房","292150"
"刘昊然","290111"
"徐璐直播","287210"
"张哲瀚想去街舞4当队长","285851"
"UC浏览器致歉","284583"
"成都集中供暖已有超1万户报名","260693"
"王昭君凤凰于飞优化","259955"
"我只喜欢你","236625"
"钟汉良哭戏","224400"
"斗罗大陆央八经典剧场收官","191224"
"杜猛牺牲","184399"
"360搜索UC浏览器被多个应用市场下架","182319"
"任嘉伦女团舞","179856"
"外交部提醒在缅中国公民注意安全","179845"
"315晚会揭名表维修内幕","179844"
"这个世界对胖女孩的恶意有多大","179843"
"北京市场监管连夜赶赴360总部调查","174511"
"海狮不想游泳跳上轮船搭便车","162671"
"缅甸仰光部分地区实施军事管制","158844"
"司藤","156283"
"315晚会提醒老人慎用手机清理类软件","146083"
"360搜索致歉","143421"
"线下购物七日无理由退货","125229"
"你是我的城池营垒","121812"
"UC浏览器回应虚假医药广告","118062"
"周子舒含泪自责","116803"
"万达放弃对美国最大院线AMC控股权","116268"
"带货直播视频应至少保存三年","107018"
"智联招聘前程无忧猎聘售卖简历","94297"
"山河令","91440"
"小龙坎火锅致歉","86992"
"龚俊被男粉喊老公","79661"
"多家知名商店安装人脸识别摄像头","74174"
"你遭遇过快递不告而投吗","73337"
"徐令宜十一娘体面吻","71329"
