"hot_word","hot_word_num"
"李诚儒也有个站了","1873811"
"94岁老人被抱起进行激活社保卡","952462"
"张文宏称目前疫情都在可控范围","942837"
"日本地震","932538"
"下雪天就不要去爬长城了","918924"
"男子趁老板患新冠挪用59万打赏赌博","863629"
"辛巴燕窝","708720"
"穿拖鞋到漠河","708643"
"危地马拉爆发大规模示威","708259"
"展昭像极了ID被注册的你","707664"
"下雪后的物理老师","707196"
"陈梦追平张怡宁记录","706978"
"狼殿下","706399"
"宁波紧急排查406名天津病例接触人员","706223"
"李雪琴回应被中消协点名","705720"
"乔诗语","705306"
"十年一品温如言","704925"
"7岁女孩双手同时写字","704822"
"东京银座店面空置率攀升","641230"
"被爸妈宠的孩子有多幸福","626734"
"女子办移动靓号被签833年套餐","606821"
"美国疫情","512563"
"狗绳被电梯夹住小狗悬空10秒","488417"
"清华学姐","418081"
"那些年为肖战挡刀的女孩","392932"
"网友模仿马保国能有多像","388364"
"多伦多将再度封城","373707"
"乒联总决赛马龙夺冠","369832"
"恒大 水原三星","369561"
"大不了回家开个店","369494"
"衣服被雕像穿走了","336750"
"智商全用在干饭上的二哈","307685"
"九寨沟下雪","251506"
"孟晚舟引渡案多名证人接受询问","241264"
"杨紫打卡亲爱的热爱的拍摄地","237480"
"aespa人气歌谣舞台","236082"
"央视曝光存话费送手机骗局","218330"
"杭州家长们建了个校服共享群","178430"
"张江川杨新苑","175797"
"外地人在上海生存有多难","175048"
"蔡依林JonyJ合作曲我是谁上线","171085"
"辽宁居民家中自来水可点燃","153302"
"央视调查天价搬家费","153044"
"时代少年团线下演唱会取消","153038"
"心型瀑布","149698"
"王者荣耀","147285"
"小雪","123851"
"白岩松评景区天价便饭反转事件","122772"
"四川多个景区下雪","122382"
"宇宙打歌中心","107648"
