"hot_word","hot_word_num"
"赖冠霖街边抽烟吐痰","3826030"
"吴尊友说新冠病毒在冬季会更严重","3201665"
"赖冠霖粉丝让他去扫街","2779798"
"老人冒雨用现金交医保被拒","1766114"
"火箭发射前为啥要吃包子","1743440"
"湖北护士拿斧头分蒙古国羊肉","1694287"
"王书金奸杀案重审","1634838"
"拜登宣布国安及外交团队首批内阁成员","1595139"
"万豪旗下五星酒店用浴巾擦马桶","1551349"
"满洲里公交车暂停运营","1498331"
"李钟硕将退伍","1466887"
"林青霞和粉丝互动太好笑了","1428554"
"李若彤穿17岁时同款校服","1020596"
"雪中的中国是什么样子","907231"
"安雨否认与赵梦恋情","873142"
"金鸡奖所有人员需做核酸检测","872841"
"耗子尾汁公司成立","866426"
"松鼠吃发酵梨子后酩酊大醉","714489"
"体育生最后一次领奖亮出所有奖牌","627315"
"骗子打电话给民警念出地址秒挂断","528119"
"火车票上学生变学彘","511723"
"基金","416322"
"上海地铁","389104"
"郑州一烂尾楼业主苦等7年无法进户","367879"
"看到男生炫腹时的真实想法","354664"
"凡尔撒","320244"
"一直以为鸳鸯锅只能煮火锅","310220"
"马斯克超盖茨成全球第二大富豪","279735"
"美国总务管理局通知拜登开始交接","276378"
"被教练移出了群聊","276032"
"黄金","275534"
"从结婚开始恋爱","260549"
"包茂高速40余车相撞多人被困","257371"
"全美今年已发生575起大规模枪击事件","254670"
"京深海鲜市场不再向个人消费者开放","254414"
"成都热点楼盘优先卖给无房家庭","245020"
"自来水可燃事件有关部门人员将被问责","228969"
"74只珍稀鹦鹉被塞进塑料瓶走私","218048"
"苹果首席安全官被指控行贿","216950"
"天津上海各新增1例本地确诊","198859"
"LOL新英雄芮尔","189932"
"嫦娥五号为啥要去月球挖土","188280"
"盘锦自来水可燃系地下天然气混入","178731"
"旅美大熊猫幼崽取名小奇迹","168995"
"球场变演唱会现场的瞬间","166657"
"当代女生为了脱单有多努力","163123"
"加现任国会议员公开支持释放孟晚舟","162437"
"谢可寅不敢站中间","162182"
"嫦娥五号","161375"
"王书金案发回重审后一审宣判","148798"
