"hot_word","hot_word_num"
"章子怡 我老公不仅出歌而且产瓜","4759388"
"疫情致整体入睡时间延迟2到3小时","2644336"
"网格员哭到一半工作一来秒变坚强","2550278"
"杨惠婷","2546957"
"shanghai不是上海","2339841"
"陈妍希同款双马尾教学","2078750"
"周传雄","2009345"
"市民做肛拭子核酸检测秒变企鹅系谣言","1981396"
"难听","903175"
"因防疫不力哈尔滨12名干部被追责问责","877947"
"JackeyLove莎弥拉","870809"
"毛晓彤让汪峰多发歌","868116"
"王源好像豌豆射手","863890"
"Lisa立麦","852579"
"家属证实学车后失联大学生遇害","843767"
"元一求婚玲珑","818017"
"倪萍回应和宋丹丹和解","808107"
"你以为内向的人不一定内向","785683"
"重疾险老产品将全下架","764389"
"教育部回应春季学期能否正常开学","748034"
"合成大西瓜改名大赛","740188"
"R1SE起哄刘也当众跳舞","695416"
"超3亿人存在睡眠障碍","684249"
"人可以自信到什么程度","546534"
"丁程鑫叫辣目洋子辣子姐","532719"
"西红柿ovo","497960"
"特斯拉","487598"
"三球27分","470749"
"高德地图微博评论","468166"
"重疾险新规明起实施","439830"
"江疏影被同事说是内娱反黑第一人","439276"
"尼泊尔雪崩震撼全过程","429239"
"还以为肌肉快过期了","408324"
"黄奕 我跟雨绮剧本有点雷同","406312"
"纽约年轻人计划重新占领华尔街","348718"
"巴基斯坦派专机赴中国接收首批疫苗","329238"
"小学生用衣服摆人形假装学习","316659"
"老人靠卖石头供两个孙子读完大学","295678"
"年轻人为什么越来越爱熬夜","293933"
"bkpp","262226"
"吐槽大会战队pk赛好刺激","236431"
"我国将研究制定重大市场风险冲击应对预案","235134"
"央视评疫情之下互相理解格外珍贵","234862"
"赵睿崴脚","233505"
"上阳赋","231270"
"还以为是厕所炸了","230861"
"汪峰工作室回应新歌封面争议","228674"
"检出阳性的食品有传染性吗","228528"
"合成小芝麻","228467"
"中文语法有多简单","228170"
