"hot_word","hot_word_num"
"陈妍希谈和陈晓的夫妻相处之道","3699594"
"美国将放弃新冠疫苗知识产权专利","1854863"
"韩东君的RS6","1818898"
"上班第一天","1255444"
"今年将发放1000万张职业培训券","1059860"
"你的婚礼","989239"
"五一假期人均出游4.18天","966502"
"山东平度发现1例入境确诊治愈后复阳","700388"
"边伯贤入伍","588297"
"上班前一天晚上失眠","534502"
"全球1.55亿人面临重度粮食不安全","490249"
"五一假期云南一辅警倒在工作岗位","463583"
"央视批商家平台在倒奶事件中难辞其咎","366170"
"世卫称印度疫情向周边扩散","331995"
"恶意抹黑滴滴司机短视频作者道歉","331717"
"张萌 我道歉每次都是真心的","330767"
"彭于晏瘦到脊椎骨凸起","330342"
"利路修 天天散步身体健康","329772"
"欧文和篮网被各罚款35000美元","329306"
"SN15着陆成功","329056"
"虞书欣苍兰诀婚服路透","328961"
"陈青青","328747"
"小熊猫藏进大巴车被捉回","328468"
"诸葛亮太惨了","328029"
"迪丽热巴帮李长歌P男装比武","327852"
"杨紫P土味表情包为张一山庆生","327475"
"张柏芝上海给孩子择校","327362"
"谢楠 中了周深的毒","326918"
"阿扎尔状态","326652"
"贝索斯太空冒险公司将发送首位游客","326560"
"赵奕欢拍游客照帽子被风刮走了","326336"
"关于人性的实验有多恐怖","320755"
"新生儿科医护深夜有多忙碌","320613"
"在家吃火锅有多窒息","298059"
"程潇下腰","259388"
"叶小妹撞见过三爽和前女友","249239"
"农民老党员10年来交4次特殊党费","245279"
"橘猫愣是养成了海豹","236702"
"JackeyLove","236066"
"杨笠回应爆红","203826"
"这不在一起很难收场吧","203486"
"盖茨将价值超18亿美元股票转给梅琳达","187720"
"张杰分享和谢娜配音片段为谢娜庆生","186068"
"一不小心就社死了","186062"
"导游飞奔跳水救起女孩","185406"
"95后女兵回忆被海盗枪口对准经历","185282"
"窥探","185174"
"切尔西淘汰皇马","144526"
"欧冠","138376"
"龙门石窟一佛像实现身首合璧","137696"
