"hot_word","hot_word_num"
"丁真和老板合照故事感","2550577"
"不得故意安排学生单独坐最后一排","1987444"
"香奈儿诉华为logo侵权败诉","1385330"
"吴磊为一场戏健身四个月","944859"
"女演员发言可以有多绝","816617"
"刘亦菲做针灸","754083"
"孟晚舟引渡案延期到8月初审理","527368"
"南京被困电梯30分钟可获赔200元","494275"
"15岁黑人少女被警察枪杀案报警录音","442726"
"白敬亭 全世界都知道我不干净了","430146"
"烧饼二胎得子","427943"
"职工医保可支付家庭成员在定点医院费用","395753"
"警惕明星代言金融产品风险","372786"
"广电总局整治超时超量播放广告","348982"
"FPX关于选手周杨博处罚结果公告","345823"
"肖战如梦之梦首演","341469"
"王者荣耀新英雄云缨","337924"
"亚马逊考虑接受狗狗币支付","332966"
"星巴克自带杯免费喝咖啡","324869"
"特斯拉面商标被注册","324737"
"宋佳我要抱着你MV","319926"
"作者介绍的差别有多大","316431"
"当猫咪偷亲成功后","314987"
"王灿回忆生产过程","309000"
"韩寒新片四海","308901"
"李振宁回应与工作人员恋情","294685"
"小米科技被法院强制执行","263066"
"B站小电视商标遭驳回","247027"
"世界地球日","246419"
"刘宇宁剧透皓嫣大婚","245959"
"王俊凯爬墙技术","245731"
"窥探","245506"
"人民英雄纪念碑建成63周年","245067"
"热辣龙虾尾拌火鸡面","233879"
"3分钟了解该不该打HPV疫苗","226792"
"小伙忙工作饥一顿饱一顿患胃癌","214175"
"长歌行","214015"
"小朋友的嘴有多甜","205469"
"王俊凯一秒入戏","203333"
"郑州市监局称不指定第三方检测机构","203201"
"加强恶意抢注囤积商标等行为惩治","203106"
"人类首次在地外行星制氧","202946"
"以色列核设施附近遭导弹袭击","202663"
"中南大学一硕士生坠楼身亡","202488"
"伟大友谊姐妹的开端","202309"
"可可芋泥低卡蛋糕","202153"
"外交部回应澳方撕毁一带一路协议","202116"
"龚俊丁程鑫四川话版山河令","192566"
"海关截获5只活体海格力斯长戟大兜虫","191863"
"驻印使馆提示在印公民非必要不出行","190273"
