"hot_word","hot_word_num"
"512","3872026"
"警方通报成都四十九中学生坠亡","1416385"
"当地回应中学生坠亡关键六问","1022841"
"猪坚强","978389"
"中国从不以超越美国为目标但不回避竞争","933823"
"向佐回应药水哥","858899"
"王霏霏因为李佳琦变成大嗓门","857366"
"杜海涛回应被沈梦辰催婚催不动","643281"
"重庆德牧壮壮","592877"
"吊篮撞楼死者家属发声","469010"
"13年前的地震少年现在都怎么样了","413539"
"医院院长被举报接受下属排队送礼","338019"
"央视评高中生坠亡通报需以更多事实回应","327758"
"13年后看汶川","315801"
"博主食用二级保护动物法螺被刑拘","289337"
"男子狂追网约车搭讪女乘客被行拘","288037"
"丈夫隐瞒患癌女子要求撤婚被驳","282961"
"福建专升本","280490"
"山东黑科技防电动车爆燃事故","277649"
"梁建章建议生1个孩子奖励100万","274066"
"何洛洛演技","269777"
"老师教室内淡定喝茶看暴雨","266270"
"5天走失58名儿童","264573"
"黄子韬公司回应存款被冻结","249882"
"李现中国刑警路透","237320"
"禁忌女孩","230801"
"512大地震十三周年","207758"
"毕业生学位论文查重乱象","200923"
"PIG币下跌","198557"
"如何看待薅羊毛的行为","198081"
"进击的巨人","184263"
"谁没有一个有趣的老师呢","174248"
"临沂大学张瑞莹","173957"
"重庆涪陵","166449"
"MSI","160661"
"乐华娱乐理智追星倡导书","134268"
"哇唧唧哇理智追星倡导书","133467"
"中国留学生讲述印度抗疫生活","129690"
"一图速览31个省区市常住人口数","129032"
"悬崖之上","127896"
"护士节","127253"
"高中生坠亡通报请少一些硬邦邦","125947"
"钱镠墓被盗","125923"
"肖战工作室理智追星倡导书","118031"
"故宫日晕","116737"
"极限运动社死现场","116255"
"吴青峰回应著作权纠纷","114620"
"马斯克发起狗狗币支付特斯拉投票","114126"
"警方通报多名幼儿身上现针眼","113813"
"华春莹说中国不是威胁美国才是威胁","111573"
