"hot_word","hot_word_num"
"隐秘的角落番外","259933"
"核酸检测排查揪出潜逃21年杀人嫌犯","225537"
"2021第一件羽绒服","220187"
"支付宝等平台不许再卖互联网存款产品","208276"
"尹正说黄晓明裤衩都小了吧","156857"
"大使馆回应中国情侣柬埔寨遇害","137032"
"倪妮画房子告别朱锁锁","121064"
"VAVA呛丁太昇","117969"
"山东栖霞市委书记和市长被免职","110952"
"卧龙发布全球唯一白色大熊猫影像","105470"
"杨祐宁替蒋南孙喊话王永正","104712"
"吴彤的头是王霏霏的两个大","96832"
"石家庄阳性病例没有在社区蔓延","92243"
"央视记者实录美国国会山现状","92030"
"只有潘玮柏在后台认真吃火锅","91988"
"流金岁月大结局","89963"
"胡彦斌看孟美岐露出老父亲的微笑","87800"
"哈哈哈哈哈","86358"
"鲁尼退役","82077"
"叶谨言朱锁锁大结局","81615"
"小鬼被选召的孩子","74484"
"李诞 搏一搏飞机变摩托","66358"
"缅甸帅和尚","60525"
"外交部回应两名世卫专家未能顺利来华","57534"
"焦茶去世","57116"
"肖战为爱尖叫彩排","55873"
"全球第一家七星级酒店","55016"
"AI神还原苏东坡","54259"
"原来花滑选手不穿冰鞋也能原地转圈","53869"
"沈腾贾玲像跳广场舞","53713"
"湖北省委巡视组原副组长黄学军被查","51786"
"奔跑吧","50036"
"天赐的声音","49530"
"肖战冻得搓手","49374"
"吉林出现超级传播","48138"
"孟美岐VAVA燕尾蝶","47978"
"上海发布首套沪语防护海报","47237"
"蔡徐坤 我笑了我装的","47201"
"赵立坚说周五不想浪费时间批蓬佩奥","45618"
"把活动办成了酒席的样子","44996"
"阳光之下","40861"
"重庆两拉石子货车侧翻多人被埋","40473"
"最强大脑","40262"
"青3录制在厕所水箱里发现手机","38510"
"队长温柔一踹换岗消防员陪女友","37046"
"重庆才是真的赛博朋克2077","36773"
"蒋南孙朱锁锁又住一起了","36515"
"女团都在剪的胎毛刘海","35978"
"朝鲜举行阅兵式展示多种新型武器","33197"
"杭州大剧院","32688"
