"hot_word","hot_word_num"
"曹格儿子长大了","3067186"
"日本10月自杀人数超新冠死亡人数","1957558"
"丁真所在国企负责人回应拒绝选秀","1921313"
"丁真登上日本电视台","1496154"
"顶楼","907943"
"89岁韩国前总统全斗焕出庭受审","741763"
"教育部推出首批国家级一流本科课程","738720"
"央视评主播卖假燕窝事件","725837"
"被家长举报索贿老师获党内严重警告处分","718545"
"李佳琦直播","711967"
"康辉第一次跳街舞","702557"
"蔡依林小S感谢对方让自己再红了一次","689937"
"云南腾冲热气球故障致工作人员坠亡","679708"
"半影月食","668989"
"青年大学习","662849"
"郑爽林更新客串刘老根4","650242"
"陈奕迅想和易烊千玺组男团","649829"
"日本给雄鳗鱼变性迎合市场偏好","614718"
"东京奥运申请退票截止","605844"
"狼殿下","570333"
"跪守病母男孩母亲已去世","561565"
"谋女郎刘浩存首封","540771"
"常州12只自主繁育小熊猫亮相","434859"
"这才是真正的鹅毛大雪","399137"
"今夕何夕","387400"
"黄子韬新歌朋友圈","384647"
"深圳官方回应代持炒房","293452"
"华春莹回应美国对台军售","266756"
"王俊凯 少点关注我年轻的时候","262954"
"男子上班路上被冰溜子砸中身亡","253911"
"河南4名儿童被埋质监站长被公诉","220331"
"全程憋笑考完试有多难","208816"
"伊朗为遇害核科学家举行国葬","207680"
"冬日里的小橘灯","207427"
"北京设百余个蛋壳公寓接待点","199359"
"Peanut加入DYN","194159"
"陈铭","177684"
"华春莹四个反问回击澳总理","171515"
"李心草溺亡案维持原判","160583"
"绿皮火车内抽烟现状","158735"
"虎鲸世仇座头鲸","158634"
"哈尔滨继红小学出现诺如病毒患者","158298"
"苹果被意大利反垄断机构罚款1000万欧元","155512"
"大四男生用蜡烛做出腊梅","153422"
"亚冠","143765"
"今天是蟹老板78岁生日","138946"
"被爸妈感动哭的瞬间","138702"
"章子怡章泽天合影","129061"
"陈铭 结辩总要一点时间","128099"
"伊朗发布杀害核科学家4名嫌犯照片","117052"
