"hot_word","hot_word_num"
"丁真获理塘永久赛马王子奖","212444"
"菲律宾外长已向王毅道歉","110488"
"一万个理由爱小白管","109491"
"李易峰出门衣服穿反了","109355"
"辰亦儒原来是真瓜主","109009"
"8400亿人民币是什么概念","107129"
"央视五四晚会","95291"
"曹德旺出资100亿建福耀科技大学","83213"
"中通快递通报宠物盲盒","77852"
"中国将与阿根廷合作生产国药新冠疫苗","77803"
"小马自己跑第一","77668"
"窦骁探班何超莲","77655"
"利路修上海散步","77546"
"山河令演唱会","77455"
"海南离岛免税两天卖出2.94亿元","77379"
"张艺兴我和我的祖国舞台","77208"
"电梯按钮失效13岁男孩自救失败坠亡","77155"
"邓伦景甜重现甄嬛传剧情","77049"
"见过最不想营业的老板","77018"
"超级富豪离婚代价有多大","74369"
"张哲瀚龚俊背影杀","71020"
"李沁樱花公主裙","62440"
"利特姐姐将结婚","59895"
"拜登执政100天美国富豪财富骤增","59323"
"团长钻平台漏洞薅羊毛被刑拘","55337"
"郑珍云朴景丽分手","53651"
"小鬼粉色朋克造型","52948"
"宋茜粉紫渐变发色","43151"
"云南瑞丽中高风险地区清零","39563"
"爸爸10年给儿子建了个图书馆","38879"
"美传染病专家赴印度感染新冠去世","38072"
"丁太昇道歉","37792"
"官方回应成都现宠物盲盒","37443"
"狗狗币大涨","32695"
"十九岁男学生的日常","30465"
"印度一动物园8头狮子确诊新冠","29641"
"贵州铜仁铁索桥暴风雨中扭成麻花","28458"
"中通快递回应成都宠物盲盒事件","27207"
"令人意想不到的转场","26470"
"小孩子打架家长要不要插手","26139"
"悬崖之上","26021"
"闪光公孙离四杀","24608"
"云台山音乐节","24482"
"官方回应坡子街派出所成打卡地","23859"
"丁太升","22883"
"还以为是伞成精了","22814"
"多地发布海虹织纹螺预警","22221"
"恋爱应该听父母的意见吗","20619"
"张稀哲梅开二度","19792"
"五四青年节","19539"
