"hot_word","hot_word_num"
"肖战自拍","3901918"
"婴儿游泳池溺水挣扎3分钟","2222125"
"王刚关注的第一个人是张国立","1998812"
"张萌去年买的口红还没收到","1510422"
"跟高铁座椅撞衫了","1138676"
"爆笑哈哈哈哈哈","1129295"
"外交部向拜登和哈里斯表示祝贺","982323"
"广州图书馆欲跳楼男子被刑拘","852244"
"男子冒充007还有军情六处工作证","850032"
"救跳楼女子被砸伤男子失忆","847076"
"VG处罚乐言","838702"
"孟佳沈梦辰金莎拼单给黄晓明买蛋糕","837085"
"撒贝宁翘课打篮球还能考29名","831928"
"宋茜粉丝潜伏anti吧十年","824839"
"哈里斯丈夫将辞职支持妻子事业","820853"
"夕阳下的小奶猫","818480"
"黄峥身家一夜暴涨529亿","815188"
"河北新型冠状病毒检测费收费标准","660904"
"杨幂台词","652257"
"狗妈妈往返6次教小狗过桥","616543"
"敖犬手部受伤","582477"
"陈法蓉愿为刘德华放弃环球小姐","514059"
"胡定欣离开TVB","425259"
"丁真 创4","417569"
"父子反杀夜闯家门者被判死缓","377151"
"南非发现200万年前头骨化石","366458"
"明星大侦探回归","345532"
"小男孩数学考试磨刀式演算","322785"
"高通已获准向华为出售4G芯片","320491"
"华晨汽车被申请破产重整","319622"
"吃了CD的明星清唱","319568"
"张沫凡公布新恋情","314355"
"如何判断护士的工作年限","291267"
"angelababy","266168"
"特朗普政府公布行政命令","254853"
"浙江舟山一载10人渔船失联","245456"
"见过最长的裤子","229218"
"日本全面推行去印章化","218804"
"公交司机给外卖小哥送热饭获鞠躬回谢","217302"
"意大利一养老院设拥抱屋","216376"
"露华浓达成避免破产协议","210935"
"邓伦黑瞳天眼","208232"
"妈妈家长会上表演武术","197674"
"小海绵第一次给黄晓明唱生日歌","193301"
"人间彩虹制造机","185971"
"李宇春被老奶奶轮流摸脸","185825"
"保安大叔做核酸检测做出表情包","180783"
"买恐怖片模型的坏处","173299"
"安徽颍上核酸检测149371人阴性","144261"
"颜真卿真迹首次考古发现","143558"
