"hot_word","hot_word_num"
"韩美娟看王嘉尔的表情是我了","3651256"
"被进村东北虎扑倒女子手术结束","2657976"
"罗一舟连淮伟唐九洲上场","2518688"
"创造营成团夜","2450082"
"印度疫情","2193388"
"张嘉元在干嘛","2023697"
"姚策妻子否认有200多万剩款","1900010"
"创造营决赛撑腰数据丢失","1817386"
"中国国学院大学被取缔","1709517"
"感谢周深 耳朵好了","1701887"
"爸爸回应光腿光脚抱女儿看急诊","1536580"
"定义 难听","1512958"
"五一小长假的真实面目","1489024"
"陕西回应洛南扶贫造假问题","1481110"
"甘望星的刘海都在抖","1476609"
"被田雨岚气死","1471811"
"普吉岛将7月向外国游客开放","1443338"
"苏炳添百米9秒98","1421421"
"中国女排明日前往东京","1395583"
"宁静 何炅有一颗很帅的脖子","1353041"
"硬糖少女伴舞","1347167"
"刘宇 掀扇子像掀盖头","1321504"
"长期不运动的人会怎样","1317632"
"螺蛳粉奶茶鸳鸯锅","1195603"
"高卿尘破音","1097020"
"赞多跳舞用了于洋的歌","994180"
"我的胃镜结果是简笔画","912113"
"平板电视涨价超10%","840039"
"专八改错","808985"
"这是利路修最开心的舞台吧","803336"
"张思源 前二十有很多人我不服","790475"
"青你3第三次排名","687452"
"深圳宝马男隧道别车扔水瓶被拘","685319"
"海军三型主战舰艇交接入列","546227"
"原来变胖是有预兆的","493284"
"快乐大本营","441245"
"美国疫情","436016"
"胡烨韬好辣","385603"
"调查曝光陕西洛南脱贫摘帽掺假","344642"
"为了脱单网购的姻缘伞","320379"
"不修音的米卡","316298"
"金曲青春","308840"
"天津大学回应留学生闯入女更衣室","293383"
"印尼军方称失联潜艇已沉没","240082"
"长歌行","198917"
"进村东北虎已送至饲养繁育中心","196661"
"这周只放假一天","184947"
"女子用金丝银丝编出掐丝珐琅画","150950"
"中小学每天30分钟大课间体育活动","146138"
"中国首个火星车为什么叫祝融","145664"
