"hot_word","hot_word_num"
"没有刘海的段小薇变漂亮了","3678483"
"武汉理工学生发起联署抵制王攀","1577489"
"高以翔去世一周年","969819"
"哈工大","908173"
"男腾讯恋和爱姬艺","821169"
"B站夺冠","708448"
"告诉路人他们很漂亮","639360"
"迪士尼计划裁员32000人","637990"
"特朗普称要离开白宫","629955"
"孔刘 我不是女人喜欢的类型","626782"
"求职被办信用卡大学生已终止合同","565423"
"杨幂钻石口罩","397824"
"山西发生野生天鹅禽流感疫情","377936"
"女保洁误入男浴室撞见领导被罚2000元","310730"
"宿管感恩节送糖遭学生威胁举报","310203"
"全国统一医保信息平台","304273"
"何猷君奚梦瑶摆摊卖奶茶","301677"
"德云社门票","298406"
"流浪地球2","295329"
"330万台老年机被植入木马","287006"
"最反人类的无用设计","283593"
"上海地铁","278303"
"鸡蛋30米高空落地不破","277723"
"首波婴儿潮人口2年后退休","274308"
"薛之谦新歌","271946"
"马拉多纳下葬","270915"
"疫情或使全球女性地位倒退25年","246297"
"高校图书馆为考研学生设朗读专区","232724"
"特朗普推特3天掉粉6万人","228465"
"蛇蛇加入TSM","227920"
"维密更换新CEO","224949"
"北京2022年重点场所AED设施全覆盖","216683"
"有偿错时共享停车你觉得咋样","212147"
"福奇称如被邀请会加入拜登疫情团队","200168"
"暗恋视角下的明星有多绝","199021"
"迄今最小原子存储单元面世","181676"
"南科大李淼","180681"
"宋茜","161916"
"假如在可可西里迷路了","159273"
"王嘉尔回应萧敬腾想吻自己","154235"
"九尾狐传","145268"
"明星社会性死亡现场","142527"
"2021节日日历","140357"
"内蒙古额尔古纳河谷现雾凇奇观","140316"
"挖7亩林地建私人跑道获刑6个月","138878"
"爱情公寓式的梗源于欧美剧","130824"
"崖上的波妞确认引进","117825"
"前阿根廷主帅萨维利亚被紧急送医","111911"
"陆律师","100136"
"艾福杰尼被陈志朋错认成工作人员","99813"
