"hot_word","hot_word_num"
"肖战演的顾一野","2698005"
"合肥确诊病例吕某行程轨迹公布","1056992"
"风起洛阳阵容","963951"
"夏日出逃计划",""
"杭州杀妻碎尸案被告人认罪悔罪","876634"
"上海警方处置曹杨路可疑箱包警情","737326"
"国内灭活疫苗对多数变异株有效","695575"
"尹正 女孩子一定不能断碳水","676385"
"山东禹城虐妻致死案宣判","625570"
"海关截获8只活体长戟大兜虫","561664"
"这就是街舞节目组声明","540401"
"向佐让药水哥买保险","530197"
"王牌部队传承版海报","413242"
"电瓶车电梯燃爆涉事厂家接受调查","410630"
"营口鲅鱼圈人员车辆无特殊原因不离区","408447"
"抑郁症小伙做木偶机走出低谷","404701"
"小龙虾一斤降价十几元","403235"
"安徽疫情","400218"
"北京体育大学百米女飞人","397755"
"邢菲 我挺想让大家叫我老公的","393852"
"宋茜风起洛阳男女装双造型","392198"
"黄景瑜张哲瀚电影定妆照","386645"
"王嘉尔到底说了多少个团结","386554"
"闪耀暖暖 婚纱","383558"
"不要用纸吸管喝罐装可乐","380605"
"李若彤张丰毅健身合照","373809"
"公司白班改夜班10名员工辞职索赔","371443"
"民航局回应机上wifi网速慢","339152"
"成都将下架虚高价格房源","326176"
"你为求婚做过哪些傻事","321874"
"这就是男人至死是少年吗","292943"
"著名数学家王元院士逝世","282357"
"游戏主播酒店热水壶中撒尿","256663"
"华春莹说巴勒斯坦穆斯林的命也是命","255347"
"风起洛阳风云万象先导预告","250367"
"家里狗子收养了只流浪猫","228829"
"萌探探探案阵容","208234"
"觉醒年代","207115"
"新疆姑娘遵父愿坚持治沙16年","205319"
"窥探","176706"
"韩国郑仁养母被判无期徒刑","172027"
"林在范道歉","159774"
"国内油价年内第七次上涨","158337"
"江苏广电起诉爱奇艺","157520"
"8部门约谈滴滴首汽等10家网约车平台","153548"
"杭州杀妻案当庭未宣判","151566"
"彩虹爆浆水果糯米糍","151193"
"爱死机第二季","147940"
"东京奥运相关赴日人员减半","146478"
"敦煌博物馆致歉与电子烟品牌联名","146079"
