"hot_word","hot_word_num"
"刘诗诗称儿子性格很热情","2751524"
"素媛案罪犯所穿羽绒服品牌回应","2515306"
"种草新秀李思思","2424691"
"武汉一小区紧急隔离是在拍电影","1609147"
"陈漫给Angelababy拍照的姿势","1528694"
"黄明昊踩空摔下舞台","1272635"
"司机为救婴儿连闯红灯家属拒绝作证","1003362"
"韩国无住房新婚家庭占比近6成","923680"
"给兵马俑拍照的人","758101"
"默克尔宣布实施硬性封锁令","689410"
"游客凤凰古城租衣服被禁止自拍","634875"
"王一博罗晋给菜取的名字","634046"
"韩国扑杀440多万只家禽","614425"
"为了看潘长江爬上树","489117"
"威廉本特利为争同一个女朋友打架","397471"
"有翡武术特辑","377567"
"周一的网上和现实","376510"
"RM","375828"
"老君山因泡面走红结果垃圾遍地","375431"
"多地出现自称辛巴客服形式诈骗","373777"
"傲慢与偏见背后的故事","370977"
"谷爱凌被斯坦福大学录取","357051"
"村民深夜被带走谈话6小时后昏迷","326600"
"河南濮阳一进口冷冻带鱼核酸阳性","317712"
"宝蓝回应ID事件","317149"
"郑爽瑞丽服饰美容封面花絮","314338"
"上下班的表情管理","282357"
"上海地铁","272935"
"杜兰特威少赛后拥抱","251535"
"乌合麒麟","240841"
"黑龙江新增2例本土病例","235143"
"吴京儿子手臂线条","225924"
"进击的巨人","218727"
"快船 湖人","211810"
"美国选举人团将投票","204702"
"于正分享去油方法","203267"
"男子骑马从新疆伊犁回福建老家","202263"
"山西侯马急寻涉两场所市民","195334"
"长沙下雪","194832"
"股市","183028"
"深圳首次招录港澳籍公务员","172804"
"初雪下的南京城","163534"
"90后用6年写书还原南京大屠杀真相","155299"
"雪后的城市有多美","155207"
"交个朋友直播间答复王海","155206"
"这才是干饭人的勺子","154298"
"忍40年家暴诉讼离婚女子丈夫回应","153768"
"11月70城房价","153462"
"尼日利亚一中学遭袭300多名学生失踪","153457"
"表演艺术家黄宗英去世","152865"
