"hot_word","hot_word_num"
"汪涵何炅谢娜退出芒果关联公司","3781227"
"专家称四川新冠疫苗预计200元每支","1973077"
"郎朗吉娜微电影","1683426"
"杨紫 男人的把戏谁不会","1643928"
"封禁未成年用户直播打赏功能","1041717"
"燕云台脑洞版结局","981206"
"微信新表情的正确打开方式","954019"
"羊驼朝朱一龙吐口水","755683"
"C罗等球员在脸上涂口红反对家暴","712640"
"外交部回应美退出开放天空条约","712595"
"谢霆锋童年女装照撞脸关晓彤","712557"
"美国最快12月11日接种新冠疫苗","712470"
"胡一天给乔欣发12块2毛8分红包","711466"
"心脏支架价格是怎么降下来的","711101"
"黄之锋认罪","710806"
"马龙夺冠后眼眶红了","709727"
"美国护士哭诉同事接连成了自己的病人","709231"
"主人车祸去世狗狗原地痴等11年","709019"
"东北大哥卖雪给南方人","708446"
"冲撞出殡队伍致9死司机被刑拘","707905"
"胡先煦 德云社在逃相声演员","596664"
"朋友太关心你学习怎么办","564544"
"董思成镜头少","487518"
"清华心理学教授揭秘PUA五大套路","426859"
"沈阳网红催眠隧道","410047"
"罗云熙十年前素颜证件照","405398"
"刘谦吞针穿线好吓人","373165"
"以后上网或用网证","353318"
"苹果掉出全球手机市场前三","337151"
"特朗普称巴黎协定旨在扼杀美国经济","333199"
"NCT","329777"
"香菜的终极吃法","313284"
"原来鹅也喜欢撸猫","284260"
"蛋壳套牢的年轻人如何自救","278754"
"改革开放以来中国7亿多人摆脱贫困","254044"
"下雪","249218"
"雪后西安秒变长安","231545"
"全球5G网络三分之一来自中国技术","217926"
"看帅哥的正确姿势","203110"
"塑料普通话到底有多上头","198358"
"基金","197160"
"模仿各科老师上课状态","195239"
"嫦娥五号","186175"
"菜市场的衣服真的绝了","181444"
"GOT7新曲MV","164614"
"如何应对35岁危机","137257"
"KPL常规赛最佳选手","137006"
"东北摊主用猪蹄辣条做糖葫芦","136763"
"上海9日确诊病例曾暴露于一航空集装器","133873"
"张家界现今冬首场雾凇","133596"
