"hot_word","hot_word_num"
"女子被天降大狗砸瘫获赔超百万","261732"
"关晓彤马丽宋亚轩跳爱你","129947"
"谢广坤谢飞机村晚路透","125619"
"男子酒驾致朋友死亡同桌7人被判","113299"
"央视评劣迹艺人想复出没那么容易","112017"
"杏运有喜","111112"
"杨润泽何运晨真的好像双胞胎","109187"
"男子送7个月快递倒欠网点12万","96445"
"张柏芝 划水","83212"
"工信部22条规定保护个人信息","82412"
"演艺人员不得在营业性演出假唱","82325"
"薛之谦悼念赵英俊","82285"
"刘维模仿王一博","81822"
"王牌对王牌","81621"
"永远的第一名","80601"
"天问一号传回首幅火星图","80134"
"劣迹艺人惩戒复出程序业内首次明确","79623"
"华晨宇再唱亲爱的小孩","78874"
"左小青空中劈叉","78368"
"郭艾伦摔倒","77215"
"百变大咖秀","77137"
"袁弘祝天下有情人终成兄妹","76774"
"易烊千玺的字","74026"
"杨迪就是雕塑本人","61264"
"汪小菲晒与子女合照","54338"
"小朋友道歉的时候嘴有多甜","52049"
"旺达幻视","48146"
"上海严禁诱导一次性支付超3个月房租","45269"
"徐杰受伤","43800"
"中国将向叙利亚提供15万剂新冠疫苗援助","43800"
"王力宏指导张真源唱心桥","43799"
"澳洲打人","42309"
"圭亚那终止与台湾设办公室协议","38636"
"过劳死问题困扰日本社会","36387"
"中国春秋时期已有男性美白化妆品","34883"
"lex","33663"
"我的小确幸","33118"
"家族年年年夜FAN","32051"
"你好李焕英王牌首映礼","31681"
"直通春晚","31562"
"斗罗大陆花絮","31168"
"西安一村庄千户分红2290万","31075"
"上阳赋","30575"
"上海浦东新高苑一期小区列为中风险","30474"
"最强大脑","27947"
"成年人也有容易的事","27407"
"证监会回应德勤事件","27197"
"教育部发布2021年第1号留学预警","27046"
"外交部回应拜登称中国是最严峻竞争对手","26959"
"辽宁男篮两连败","26235"
