"hot_word","hot_word_num"
"马拉多纳尸检结果","2910546"
"特朗普宣布赦免前国家安全顾问","1279572"
"周杰伦 20年再粉一次","1260230"
"水果摊主出示遗赠扶养协议","1243752"
"章子怡为小苹果庆生","1089439"
"24岁女孩成文昌发射场最年轻女指挥","1080442"
"万达清空所有海外地产项目","964477"
"上帝收回了上帝之手","722115"
"感恩节","638107"
"韩国N号房主犯一审被判40年","623006"
"林郑月娥首次戴上一国两制徽章","514491"
"内蒙古新增9例本土病例","503748"
"TikTok出售令期限再次延长7天","489625"
"小米已批准王嵋请辞","463334"
"190余名乘客血清抗体检测结果相同","419993"
"山西进口冷冻青虾外包装检出阳性","414587"
"以为丁真在西藏","413453"
"当爸爸得知马拉多纳去世","406385"
"文具店20元1根卖电子烟给小学生","395968"
"黄健翔","390418"
"企业公章盖了1年才发现刻错","379927"
"李晋晔詹秋怡配合默契","377644"
"马拉多纳去世","376296"
"沈群丰发长文","339524"
"工作人员称天然气喷出后不影响水质","280317"
"北京新发地暂停水产冻品销售","271799"
"丁辉是打工人的真实写照","259303"
"日本沿海现九足章或与核辐射有关","235595"
"小米集团回应王嵋错误言论","225931"
"Doublelift退役","225330"
"杨超越回应落户质疑","221750"
"平均每40秒美国就有1人死于新冠","201135"
"考研倒计时1个月","196696"
"感恩节文案","195626"
"京沪高铁启用动态票价","192407"
"狼殿下","185154"
"元旦休3天","178102"
"huanfeng","177900"
"令人心动的offer","164569"
"可点燃自来水服务站站长被停职","155721"
"千岛湖美景好似调色盘","141009"
"小猪先生 韩安冉","135861"
"林青霞回应金莎想嫁给自己","135001"
"南方暖气片销量同比增长300%","130166"
"破除老年人智能鸿沟国家方案思维导图","129409"
"达尔文2本珍贵笔记本或已遭窃","125970"
"共享充电宝为什么越来越贵","120631"
"机场进口货物与其它货物不混装不交集","116361"
"CPTPP是什么","102331"
"九尾狐传","102084"
