"hot_word","hot_word_num"
"张萌 姐的身材是拿命换的","2111945"
"代表建议将幼儿园纳入义务教育","2075231"
"唐嫣说紫萱也是她的初心","2054474"
"北京一女子销售翠鸟制品被刑拘","1664346"
"李现被家里长辈催婚","1384885"
"吉娜的上扬能量","1356550"
"老虎伍兹遭遇车祸后首次发声","1341292"
"白鹿原景区致歉15元四根大碗宽面","1281476"
"全国在学研究生313.96万人","1190319"
"大连暴雪","1182417"
"郭老师 创造营报名表","1119454"
"张雨绮称姐姐没有严格意义上的成团","1009435"
"37个新专业列入本科专业目录","833856"
"2035年我国将实现都市区1小时通勤","787399"
"迪丽热巴说自己私下不像女明星","757643"
"黄子韬 看了第一期我就关电视了","687081"
"吉克隽逸做了通宵的美甲没人看","637854"
"民政局回应智障女孩嫁老人","579073"
"河南一未成年女孩嫁给中年男子","477268"
"山河令","454253"
"吴亦凡会私下使用Salute","450022"
"佘诗曼黎姿同框","434932"
"周柯宇钻石口罩","403892"
"丁真觉得自己不帅","398854"
"景区15元面条仅4根","390416"
"单身都是因为眼光高吗","388853"
"工信部谈稀土为何只卖出土的价格","368519"
"国产大飞机C919全球首单","367439"
"国防部回应外界所谓中国国防政策改变","367024"
"青岛卫健委回应疫苗与榨菜同放冰箱","367019"
"宋丹丹祝贺赵婷获金球奖","349068"
"鹿晗说张真源我肯定知道","334135"
"林俊杰看了都无语","315896"
"我国连续11年位居世界第一制造业大国","300104"
"贾晓玲靠演技抢电视","287793"
"金球奖","278665"
"这个团队人员的名字都能对上就离谱","234463"
"江西一大学培育出38种颜色油菜花","206582"
"人大代表建议放宽公务员报考年龄限制","188923"
"窦文涛说青海湖是一片银子","185277"
"雪后故宫","183537"
"来一杯蜜桃冰沙妆","183196"
"赵婷获金球奖最佳导演","183074"
"谁能不爱温柔姐姐呢","182706"
"宝可梦成为世界最赚钱IP","180916"
"RW EDG","180436"
"旅游民宿星级将改为甲乙丙三等","179446"
"自己是个普通人这句话是用来感受的","178207"
"芋泥麻薯肉松杯","177201"
"大型社死现场图鉴","176400"
