"hot_word","hot_word_num"
"委员建议提升营销号诽谤成本","2721562"
"人民日报评整顿无底线追星","889521"
"腾讯红魔游戏手机6","832132"
"复旦大学女生参军到西藏","738495"
"建议对大学生开展金融知识普及教育","628335"
"未来5年的新职业什么样","511956"
"你好李焕英进入全球票房榜前100","511675"
"十三届全国人大四次会议闭幕","440490"
"建议严惩恶意欺凌他人的青少年","428384"
"陶勇说近视度数不断增加或致盲","349967"
"你的职业是你的兴趣吗","334295"
"沈腾杨洋评论沙溢","332696"
"拉面哥称后悔签合约","331830"
"烧毁原画4倍价格卖出电子版","329637"
"福岛核电站厂房上方发现严重污染","327674"
"比特币市值重回1万亿美元","325911"
"基金反弹","324228"
"杨紫井柏然杀青照","322813"
"和马说我想回中国","320576"
"捡26万元小学生升旗仪式上获颁奖杯","318992"
"小S晒和婆婆合照","316824"
"近三成消费者每月花400元喝新式茶饮","315176"
"山东拉面哥希望回归平静生活","313521"
"杨紫女心理师杀青","312565"
"数字人民币与微信支付宝有何不同","284114"
"原来硬糖少女才是真正男子汉","254968"
"全国两会部长们许下的承诺","242522"
"李宇春过生日喝醪糟","225509"
"盒式磁带发明人去世","213882"
"南向晚怼人精","209456"
"于和伟说的N呢是什么","200161"
"锦心似玉预告","177194"
"龚俊模特时期业务范围好广","176947"
"美国新冠肺炎超2913万例","162694"
"景甜气质","159361"
"电竞培训是网瘾解药吗","155016"
"李兰迪演技","144697"
"山河令","141798"
"利路修采访终结者","140634"
"司藤身世","137586"
"周冬雨海风大片","123817"
"武汉樱花主题灯光秀","123402"
"建议强制平台为外卖小哥买意外险","114420"
"别想打扰我学习","110459"
"在猪肉店起舞的9岁芭蕾女孩","108176"
"113秒回顾日本311大地震","106420"
"上海一教练车坠河致1人死亡","105928"
"如何看待娘系男生","101738"
"美众议院通过1.9万亿美元纾困法案","98253"
"阿德将不会为马刺出战","97901"
