"hot_word","hot_word_num"
"福岛核废水57天可废掉半个太平洋","179594"
"王嘉尔发现自己没戴口罩后的反应","92867"
"倪大爷还是倪大爷","92208"
"韩国各大型超市继续停售日产海鲜","88744"
"吴岱林回应绯闻","88024"
"周笔畅推荐杨幂参加姐姐3","76576"
"疫苗接种方舱来了","67442"
"赵立坚说日本不能将福岛核废水一倒了之","65674"
"中国女足晋级东京奥运会","64710"
"超7成日本民众希望奥运会取消或推迟","64102"
"日本核废水","63885"
"周韦彤一个月瘦了25斤","63472"
"龚俊的rap","62944"
"世界最大兔子被偷","62301"
"首例严重失信所涉药品被暂停挂网交易","61815"
"穆雷十字韧带撕裂","61365"
"吉林市12岁女孩散步至桥上失踪","60550"
"女子5年4次起诉离婚均被驳回","60507"
"刘涛洗脸式哭戏","59638"
"韩国给电视剧取名有多敷衍","59382"
"颖儿 我已经瘦了十年了","59000"
"王霏霏缺席大碗宽面团建","57308"
"从科大讯飞跳槽到腾讯被判赔1200万","53756"
"娜扎 我不知道但我会套","50639"
"山河令演员集体团建","49534"
"官方回应女子动物园猛兽区下车","45221"
"曾涵江 男团成员得为自己行为买账","42756"
"成年人崩溃的真相","41412"
"男足","41405"
"严禁建设丑陋建筑","38748"
"邓超 中国女足谢谢你们","38483"
"4万年前古人食谱有25种肉","36987"
"当医生语文还得学的好","36463"
"香港人讲普通话有多好笑","35077"
"王俊凯宋亚轩同框","32906"
"李长歌大局观","32861"
"中国女足战胜韩国女足","31306"
"策马雪原女副县长贺娇龙已履新","30691"
"JieJie的人马","30510"
"王霜说落后时想冲也要冲垮韩国队","29767"
"小舍得","29258"
"多地楼盘烂尾","29179"
"离小说女主最近的一次","28845"
"你有多久没有静下心看书了","28248"
"吴磊眼神戏","28106"
"管泽元","27831"
"号手就位","27759"
"RNG战胜EDG","27032"
"中国女子三大球全部打进奥运会","26474"
"心肺复苏列入高中军训教学内容","26256"
