"hot_word","hot_word_num"
"angelababy ins配图","260848"
"电视剧女主睡在我家床案一审判决","134266"
"日媒称江宏杰语言暴力福原爱","112048"
"水城威尼斯严重缺水","97856"
"和马的眼睛太好看了","88868"
"3分钟了解今年两会为何如此重要","82866"
"赘婿","67483"
"杭州3月14日可领结婚证","67396"
"福原爱回应与男子约会","67347"
"FBI局长称国会暴力是本土恐怖主义","67244"
"外交部回应中美关系民调","67147"
"力丸刘宇不是撑腰王","67021"
"锦心似玉","66957"
"代表建议毕业生体检档案建立共享机制","66911"
"玻利维亚一大学楼道护栏断裂学生坠亡","66815"
"近50%的人使用视听设备音量超标","66678"
"天津大学南开大学校际互选课程开放","66631"
"多种家电涨价","66499"
"刘西瓜","66459"
"3D还原货拉拉坠车事件经过","63592"
"孙俪尝试做没有面粉的华夫饼","57088"
"央视专访玻璃大王曹德旺","51958"
"1.1亿年前蟑螂亲戚","50623"
"宁毅苏檀儿第二次大婚","45272"
"徐令宜十一娘今天体面了吗","40537"
"蔡徐坤旋转楼梯","38623"
"东京奥运会计划不接待国外观众","38261"
"杭州规定开学一个月内不考试","38232"
"替朋友接孩子致其意外受伤被告上法庭","38223"
"被吉吉国王笑死","35424"
"婚姻是恋爱的终极目标吗","34010"
"杨幂想跟安静学心理学","30950"
"锦心似玉预告","29271"
"吴白艾情被外公催生","28928"
"中国最大恐龙足迹点在四川","28236"
"货拉拉涉事司机被批捕","28065"
"虞书欣祝赵妈妈生日快乐","27635"
"刚刚过去的冬季为暖冬","26812"
"暴风眼","26236"
"办案坠楼杭州民警初步脱离危险","25426"
"周子舒喝酒晒太阳","25306"
"刘英三观好正","24873"
"创造营","23688"
"奥利奥的神奇吃法","21804"
"刘耀文牛油果绿造型","21271"
"耳机音量超标听力损伤或多年后显现","19680"
"警方还原货拉拉乘客跳窗案经过","17437"
"付豪18分","17163"
"超级冠军编舞","16899"
"甘望星 憨憨帅哥","16110"
