"hot_word","hot_word_num"
"这不是杨紫是杜华","3326607"
"确保新冠疫苗第二剂次8周内接种","1939048"
"创新伊利 健康挺你","1923298"
"妈妈暴力逼迫女儿学习被撤销监护权","1906235"
"陈乔恩 有没有求婚是我们私人的事","1082163"
"防脱精华帖","1075675"
"35岁时的杨丽萍","1010067"
"人大附中学生的英语水平怎么样","846773"
"团委书记强奸女企业家案二审维持原判","583138"
"日本要把福岛食材推上奥运会餐桌","505530"
"港警一哥当面怼主持人","462104"
"林峯曾开小号回怼黑张馨月的网友","429035"
"奥运女足中国荷兰巴西赞比亚同组","382945"
"我国建成世界上规模最大社会保障体系","377911"
"运营商内鬼偷取公民信息","357805"
"五一档电影开预售","357104"
"张翰吴宣仪加盟妻子的浪漫旅行5","345593"
"关晓彤ins头像","344182"
"段奥娟发长文悼念爷爷","342342"
"10城公积金个贷率超过95%","340648"
"颖儿说产后不想淘汰就快速复出","339431"
"吴昕说在妈妈身边穿衣服要乖","338519"
"社恐千万不要做的事","336398"
"杭州发现罕见幽灵草","335200"
"西安一医务人员接种后仍感染原因公布","310754"
"岳云鹏 请叫我题库","293079"
"当你有个暴躁的妈妈","286832"
"长歌行","285812"
"双胞胎兄弟同时加入火箭军","282892"
"河北省考成绩","282065"
"见过最笋的狗子","281290"
"山河令","277010"
"伊能静喊话秦昊少损自己","275039"
"青岛金鼎大厦着火","207435"
"全国累计接种新冠疫苗超2亿剂次","196906"
"农大学生上课没少弄吃的","191900"
"妻子的浪漫旅行","185479"
"R1SE告别限定演唱会","182706"
"迪丽热巴龚俊 帝皇书","170936"
"特斯拉被责令提供事故前行车数据","169385"
"女子用身体挡住失控轮椅","161929"
"利路修答案之书暂停营业","158222"
"国粹变装有多帅","156731"
"大量民工封城前连夜离开德里","151195"
"加班是职场里的加分项吗","148101"
"当爸妈得知你失恋时","148007"
"印尼一艘载53人潜艇失踪","141564"
"百香果啵啵鲜奶冻","141062"
"河北被强制种树的耕地开始拔树苗","136722"
"大雄静香婚礼前奏预告","136326"
