"hot_word","hot_word_num"
"米卡鞠婧祎 牵手壁咚下跪","2709302"
"27年前自考北大保安如今已是校长","1432782"
"谢娜说俏俏想喝糖浆演假咳嗽","1379758"
"毛晓彤 元气甜妹","1227146"
"男子欲家暴反被老婆打进医院","844550"
"重庆必胜客","755972"
"你好李焕英票房破54亿","717151"
"创造营三公","713867"
"乒乓外交五十年","481365"
"快乐大本营","467956"
"张哲瀚发红包让龚俊给吴宇恒打call","460485"
"景甜张彬彬仰卧起坐吻","456206"
"警方回应必胜客员工与顾客起冲突","448450"
"西安一中学设置情绪宣泄室","419625"
"打疫苗时都变成了小朋友","414888"
"老师的朋友圈有多好玩","414497"
"LPL","413332"
"22岁大学生在看守所完成论文答辩","409670"
"解放军喊话台军你们很快就适应了","407218"
"谭松韵晒景甜张彬彬合照","404877"
"夏之光刘也水星记双人舞","401426"
"艾克里里淘汰","396696"
"JKL小炮","395010"
"中国人均月流量十年后或达100GB","392650"
"周笔畅肚脐眼不冷吗","387168"
"会韩妆也太棒了吧","383595"
"二手手机恢复出厂设置数据仍可恢复","381564"
"人气韩妆防晒被举报造假","377786"
"商务部回应美方打压7家中国超算实体","374249"
"青春有你排名","373297"
"青春有你","370029"
"退役军人三亚吃海鲜遭遇宰客","366639"
"苏醒奚彬带娃看病","363225"
"力丸刘些宁开场舞 武片打戏","353278"
"同一套住房6年内只享有1个小学学位","352211"
"刺杀小说家","350313"
"我是女演员先导片","345030"
"专家建议每天保证1.5升以上饮水量","342547"
"幼儿园不得设学前班","340450"
"利路修 别爱我没结果","340319"
"西安人有多会排队","311425"
"RNG战胜TES","261269"
"余景天排名第一","260039"
"罗一舟排名第二","200200"
"秦海璐为刘宇打call","200122"
"南京大屠杀幸存者仅剩68位","200105"
"南京大屠杀幸存者生前哭诉家人遭遇","200072"
"南京大屠杀幸存者陈文英逝世","132912"
"我国玩具企业一年暴增百万家","132411"
"因近视而引发的社死瞬间","129953"
