"hot_word","hot_word_num"
"长征七号改遥二运载火箭成功发射","1595418"
"植树节","1444018"
"套路明星自拍","1362107"
"张哲瀚吐槽站姐这种体力还追星","1357795"
"古天乐右眼球曾缝八针","1306342"
"暖春追剧手册","1278581"
"体测不合格不能参加全运会","1167537"
"背母亲上学刘秀祥后续","736769"
"中国古代化妆品首次发现植物精油","531132"
"国新办介绍关于完善香港选举制度决定","500473"
"乌克兰","494259"
"庞麦郎","488311"
"迪拜每年花至少4亿美元进口沙子","475528"
"美国新冠肺炎死亡病例超53万例","473947"
"指环王重映","472503"
"直播平台羽绒服抽检8成不达标","469719"
"想见你原班人马拍电影版","467736"
"江直树","466809"
"这个婚突然不想结了","465111"
"315晚会主题发布","461598"
"可以用电脑刷朋友圈了","460474"
"延迟退休","457461"
"张柏芝夸王霏霏厉害","455996"
"上海警方通报地铁站行李箱装孩子","454712"
"姐弟恋可以有多快乐","452352"
"刘天池谈Angelababy演技争议","451330"
"邓孝慈站姐","403263"
"notability降价","383115"
"韵达被上海消保委点名","382751"
"原来是王阳阳","332523"
"唐宁街首席捕鼠官疫情期间胖了","284555"
"植树节已写入森林法","280186"
"梁森靠在艾克里里肩上哭","268311"
"篮网","263036"
"室友说梦话有多可怕","254337"
"网络算命背后到底有多少生意","230399"
"60岁以上老人优先出下铺票","226897"
"吐口水羊驼能有什么坏心思","201357"
"中国AI虚拟模特取代高价外模","193074"
"阿凡达重映","191175"
"欧洲多国暂停接种阿斯利康疫苗","188290"
"毛晓彤杨玏工作室辟谣恋情","182134"
"安静 这种孤独感你们能理解吧","173857"
"植树节该不该放假","172593"
"父子放大镜实验烧毁2000平草坪","170734"
"大叔碎碎念式救被困猫头鹰","166797"
"意大利检方罚款外卖平台7.33亿欧元","165094"
"代表建议推进公民个人身份证件合一","162638"
"考研国家线","161898"
"委员称空巢青年没有好坏之分","159091"
