"hot_word","hot_word_num"
"央视评谁偷逃税谁就得凉凉","2402526"
"尹正瘦了好多","2188720"
"原来家电还可以这样","1314028"
"机票盲盒","956759"
"明星工作室接连注销","922521"
"马思纯 减肥以健康为重","813440"
"小舍得","614311"
"国办要求加强出生人口性别比综合治理","568516"
"今年高校毕业生规模达909万人","486346"
"郑爽涉嫌签订阴阳合同被调查","481524"
"杜淳被王灿拉黑过25次以上","472344"
"汪峰定律","457531"
"北京试点对超市连卷袋收费","366056"
"龚俊姚安娜加入中餐厅5","315002"
"国办要求惩处用网络对儿童隔空猥亵","286694"
"奶奶的爱容不下时尚","278099"
"女硕士因残疾未通过教师资格认定","277896"
"张杰让何炅把冻龄秘诀传授给大家","277079"
"闲鱼崩了","276841"
"你能接受孩子将来不如自己吗","276369"
"五一期间北京前门地铁站全天封闭","275736"
"被罗志祥耍了","275517"
"章子怡 峰哥发博要谨慎啊","274599"
"2021湖南卫视综艺片单","274478"
"王一博演的陈宇","273990"
"机票盲盒为什么吸引年轻人","259921"
"夫妻吵架最伤人的话是什么","249830"
"炒房客囤的小产权房最终谁买单","246120"
"曼城逆转巴黎","244217"
"印度一新郎新冠阳性仍举行婚礼","242483"
"移动客服诱导老人开套餐","238668"
"余生请多指教双人海报","226208"
"邢菲让姜小宁把嘴闭上","222098"
"印度政府官员深夜突袭婚礼现场","211783"
"夏日友晴天新预告","207639"
"过三爽好会说话","201192"
"猫咪的智商是个谜","181792"
"18元一日游被带去参观墓地","170555"
"严厉打击代孕等违法行为","165859"
"特斯拉","162387"
"余生请多指教预告","153701"
"重点时段学校门口见警察见警车见警灯","149309"
"马友友回答推特网友的大提琴问题","141909"
"高考那个夏天有多难忘","139731"
"消除男尊女卑传宗接代等落后观念","133841"
"印度疫情","129060"
"CBA总决赛G1裁判报告","127861"
"烨斯","126847"
"小朋友之间能有多甜","125174"
"张若昀正式起诉父亲张健","124401"
