"hot_word","hot_word_num"
"虞书欣 其实我的戏路是非常广的","2748561"
"尾款人你的快递坐高铁来了","1493052"
"杨丽萍生日豪购千斤白酒","1458768"
"拜登竟称美日安保条约适用钓鱼岛","1395097"
"鹿晗绿色西装","1293675"
"新郎接亲被测试雅思听力","1268172"
"武汉各校不得要求家长代评改作业","892053"
"原来佟湘玉也是凡尔赛大师","879386"
"世界最大的紫粉色钻石拍出2660万美元","825013"
"百香果女孩","760185"
"THE9队内互评","674997"
"今年已查处5000多名非法入境外籍人员","672433"
"陈学冬谭松韵舞台上找戒指","658610"
"赵雅芝状态","636590"
"演员无实物表演有多绝","628946"
"我国已从92个国家接回7万余中国公民","601096"
"乔诗语","588742"
"苏州奶奶查siri户口","554312"
"杭州地铁","550370"
"张艺兴采访","531372"
"大爷买35元渔具误付13万多元","471250"
"湖南女生手工还原游戏峡谷","402747"
"警方通报2岁女童26楼坠亡","394092"
"iG RNG","354097"
"疙瘩汤做成了泔水的模样","351432"
"男子被叫下车三分钟后大货车撞上","339616"
"傅容入狱","335080"
"日本推出餐饮用口罩","324007"
"腾讯公布第三季度财报","321293"
"诈骗犯称对不起想考警校的女儿","320601"
"明星放弃表情管理是啥画面","317284"
"如何辨别人类幼崽装睡","312477"
"薇娅直播","311282"
"金贤重胜诉","304956"
"陈学冬找戒指谭松韵找路","292717"
"郑秀晶 创4","273844"
"如意芳霏","269539"
"福建一载客中巴翻车致9死5伤","255407"
"特谢拉破门","251924"
"孟美岐暗黑公主风造型","249921"
"武大音乐课上成露天演唱会","211634"
"周深 鼓掌机器","186849"
"时光吃醋","181590"
"全国流感疫苗接种量已达约2500万剂","161312"
"独臂快递哥双11每天送千件快递","161092"
"潜水员深海发现幽灵鱼","160814"
"女子散播崇礼雪场3人确诊谣言被行拘","160749"
"藏族的康巴汉子有多帅","160435"
"苏文谦被拆穿","159994"
"早教班到底有没有必要","159175"
