"hot_word","hot_word_num"
"吉克隽逸 李荣浩结婚跟偶像塌房一样","3214676"
"台湾列车出轨事故确认罹难49人","2103308"
"董子健深藏blue","1766487"
"董子健 你看你们离谱吗","1711655"
"利路修得知自己排名后的反应","1354327"
"看了想付费的神级舞台","1282725"
"永辉超市回应15批次食品抽检不合格","1170730"
"不要在厨房装声控灯","688801"
"FBI前员工6年前就抖出美乱疆阴谋","673768"
"男孩公园遇见长得很像的陌生人","554287"
"科学家用一辈子为枇杷改名","516588"
"前妻曝刘洲成未支付抚养费","511282"
"白敬亭新公司名叫明白乐","505434"
"汪小菲道歉","502536"
"北京欢乐谷设施故障多名儿童倒挂高空","498358"
"外交部回应日本拟决定核废水排海","492728"
"悦诗风吟陷假环保风波","484168"
"徐璐拉横幅送妈妈出道","482917"
"章子怡亲儿子亲出双下巴","481157"
"8000多海南离岛免税黄牛被拉黑三年","478322"
"向往的生活","477800"
"孙怡妈妈征集女儿表情包","474780"
"徐智慧","472883"
"张彬彬唱什么是快乐星球","471182"
"巴西男子花7年整成魔戒半兽人","468540"
"外交部湖北全球推介会","468336"
"为什么我会腰疼","420075"
"王源易烊千玺让王俊凯注意身体","373588"
"拼多多发声明处罚极兔","368970"
"顺丰控股再度跌停","366394"
"WUHAN的五个字母代表什么","364638"
"买烤冷面被迫成为同伙","345525"
"没想到猫咪也会社死","309104"
"魏大勋新歌后来的后来","296888"
"日本称处理福岛核污水不能推迟","288939"
"三星堆元素的风衣","284792"
"刘若英心疼王源","254859"
"朴槿惠闺蜜崔顺实称在看守所被性骚扰","247524"
"今天属于热干面","244408"
"风姑娘在试裙子","228413"
"民警劝离蹭96岁摆摊奶奶流量主播","225429"
"发光的名字路透","198007"
"你的婚礼少年敢MV","196458"
"日本核废水可致癌致畸致突变","195874"
"法医秦明之读心者开机","195543"
"迪士尼早就想好了","188151"
"世界最大蘑菇长了2800多年","187583"
"动物园回应小猫被丢进猴园遭追咬","178951"
"让自己突然开心的方法","178120"
"乔治暴力隔扣","163966"
