"hot_word","hot_word_num"
"周震南父亲回应","3672514"
"特朗普发推称赢了大选","1924183"
"孟子义发型师发文","1919677"
"王富贵","1867884"
"奥巴马否认会在美国新政府任职","1381745"
"厚乳拿铁降价了","1315569"
"四川锦江宾馆已暂停一切经营活动","1243878"
"杀害原阳一家6口嫌犯尸体已找到","923026"
"鹿鼎记评分","801791"
"请回答1988","790573"
"黄明昊母亲银行账号被冻结","790352"
"肖战经纪人回应","778625"
"王富贵回应","761344"
"南京警方通报中学生弑母案","755084"
"藏族女孩在男子足球队当队长","738859"
"裴涩琪婚礼现场照","733663"
"张庭女儿回应长相争议","700537"
"吃蛋糕吃出了干饭的感觉","649613"
"诺安","456566"
"长相干净的初恋脸","442883"
"李沁张檬杨幂蒋梦婕同框旧照","437473"
"黄奕 油腻男不也多的是吗","424647"
"易烊千玺悬疑神秘感大片","405751"
"特朗普发推称2020总统选举违宪","400300"
"青年大学习","400280"
"郑秀晶谈fx","392529"
"蛋壳公寓或将宣布破产","379424"
"腾讯全民K歌涉黄被罚全面整改","339790"
"赵丽颖花间仙意大片","338454"
"工作群里面的四大谎言","330078"
"张晶","305030"
"泰安新增1例境外输入确诊病例","295221"
"鞠婧祎演被绑架像咬化妆棉","292246"
"张伯礼提醒消杀海外高风险地区快递","285071"
"做发型的重要性","282814"
"综艺中出圈名场面","280587"
"王俊凯叉叉勾勾勾","279334"
"如何看待长租公寓模式","276856"
"塑料快递包装99%不能有效利用","268563"
"白酒股","264334"
"仓鼠都比我努力","262272"
"新谋女郎刘浩存素颜照","255071"
"杭州蛋壳公寓公司招牌已撤","238457"
"三行遗愿书","233579"
"新冠2019年或已在意大利传播","231599"
"浙江义乌一法拉利撞上飞机","230864"
"首批加工后的12000只羊到武汉了","230392"
"周迅王一博浪漫光影感大片","230312"
"跳舞跳出了痛苦面具","204553"
"辉瑞疫苗刺激美国冰柜销量激增","203786"
