"hot_word","hot_word_num"
"你好李焕英口碑","2023481"
"石家庄被隔离七次女子回家过年","1591527"
"这么玩早脱单了","1443111"
"黑豹乐队主唱张淇好帅","1366653"
"春晚伪小品甜不甜","1181533"
"沈腾疯狂cue鹿晗","1026002"
"贾老板向布兰妮和珍妮杰克逊道歉","884667"
"鬼牵手","724992"
"世卫组织将发布病毒溯源报告摘要","695668"
"妈妈不仅仅是妈妈 她首先是她自己","686630"
"肖骁秒删","631337"
"社保今年有新调整","574582"
"沈月屈楚萧的戏份","574069"
"牛为什么在12生肖里排第2位","490948"
"唐人街探案3","469036"
"陈坤太适合演晴明了","433540"
"工作细胞","433458"
"边防军人让国旗飘扬在边境线上","431938"
"詹姆斯生涯总收入将突破10亿美元","429230"
"唐家三少回应唐三很完美","428815"
"大年初二踩小人","425872"
"祝无双生日","424772"
"世卫称新冠病毒没被实验室蓄意使用","423686"
"新春脆炸芒果沙沙生蚝","421908"
"看你好李焕英 别画眼妆","420641"
"爷爷的反向带货","419492"
"张小斐旗袍","413037"
"15副省级城市GDP","375994"
"湖人 灰熊","360090"
"熬夜后补觉有用吗","354974"
"初二","302529"
"肖战说他和唐三命运相似","283229"
"拜登和第一夫人发表春节祝福","238113"
"巴基斯坦总统用中文拜年","224960"
"易烊千玺新年自拍","223968"
"丁太昇批评李希侃朱星杰像假唱","223867"
"王源主持能力","222287"
"唐宫disco","194399"
"全球多地点亮中国红","182585"
"李大钊曾孙希望曾祖父看到今日中国","180353"
"上海北极熊过年吃到4斤重大饺子","176003"
"陕西一村上千人都姓醋","175466"
"倪大红演的伏生让人泪目","175292"
"大唐不夜城人流过大演出全部取消","175123"
"李希侃退出天赐的声音","169839"
"成都动物园给动物发红包","135400"
"8000余株洛阳牡丹亮相广州","110388"
"白宫回应多家美企因缺芯致信拜登","83699"
"戈贝尔隔扣字母哥","79333"
"春节八大现象","78710"
