"hot_word","hot_word_num"
"朴灿烈私生活虚假传闻发帖人移送检方","2747509"
"日本冲绳误将生理盐水当疫苗注射","1222794"
"沈阳 鸡架","1016601"
"底妆一遍过",""
"大头儿子的真名叫头太元","948277"
"难听","882592"
"接种第二针新冠疫苗要注意些啥","724731"
"沈月直播连麦好欢乐",""
"飞机延误时的正确处理方式","642111"
"李现 转眼两年啦","618078"
"张哲瀚直播","618078"
"中方支持豁免新冠疫苗知识产权诉求","617570"
"殷世航快手账号被封禁","617086"
"白岩松谈年轻人不愿意生孩子","616773"
"Love is Love","616513"
"全国一季度离婚人数大跌七成多","616293"
"恒河不断出现疑似病患浮尸","615999"
"谢娜","615531"
"孟美岐宋妍霏闺蜜出游拍照指南","615041"
"我要准时下班翻拍剧名","615019"
"安徽特岗","524590"
"饿了么被罚款50万","519847"
"左肩有你路透","519723"
"海关截获3只活体大力神甲虫","517722"
"原来真的有不近视体质","446735"
"请病假去非洲被开除辩称我是去看病","446110"
"奶奶用放置4年冬瓜水喂孙女致中毒","442394"
"董又霖新恋情","432955"
"葡萄奶盖脆啵啵","375059"
"INTO1谈团魂是什么","352863"
"11家遭叶飞点名公司集体暴跌","349411"
"詹姆斯支持库里当选MVP","349408"
"曹县是什么梗","349405"
"李宇春鱼骨高叉透视裙","339210"
"aespa新歌MV","337566"
"米卡全白西装","310503"
"外交部敦促美国对巴以局势承担应尽责任","303284"
"人前是爸人后是狗","301795"
"在公交车上遇到的双向暗恋","267485"
"中方已向80多个国家提供疫苗援助","255754"
"贵州一溶洞群走红后垃圾成堆","231513"
"一封来自去世很久爷爷的信","231193"
"唐艺昕夏日游园会plog","221505"
"张哲瀚浮雕花朵白衬衫","221247"
"无人机插秧","221053"
"广东禁止采集个人生物识别信息","220639"
"见过最舒适的室友关系","220537"
"教育部将进一步规范名校办民校","220098"
"上海一女子持刀伤人致5伤","220043"
"多国祝贺天问一号成功着陆火星","206640"
