"hot_word","hot_word_num"
"谭松韵晒景甜张彬彬合照","2296298"
"上海一男子高空抛垃圾袋获刑8个月","1690334"
"你好李焕英票房破54亿","1455509"
"辛巴 臣退了","1380759"
"王嘉尔看了都要楞两秒","1293634"
"拯救不开心","1186189"
"Angelababy黑玫瑰波边裙","1140141"
"解放军喊话台军你们很快就适应了","836459"
"乒乓外交五十年","798493"
"二手手机恢复出厂设置数据仍可恢复","777473"
"张雨绮想让利路修感受她的快乐","713599"
"龚俊 赚钱为什么不快乐呢","581263"
"刘诗诗 人鱼公主","575122"
"可爱汪先生和他的魔力小单车","546822"
"老一辈的名字有多好听","525214"
"杨迪 鸭子竟是我自己","518273"
"退役军人三亚吃海鲜遭遇宰客","509766"
"余景天后援会 惩罚粉丝","501569"
"三甲医院医生自曝收回扣50多万","439182"
"重庆必胜客","433643"
"李易峰最想尝试但还没做的是结婚","429149"
"利路修粉丝应援排面","413756"
"专家建议每天保证1.5升以上饮水量","398839"
"4人接种强生疫苗后出现血栓","396425"
"粉丝画的孟佳","394463"
"你好李焕英再度延长上映","393208"
"我国玩具企业一年暴增百万家","388877"
"人气韩妆防晒被举报造假","388244"
"商务部回应美方打压7家中国超算实体","387956"
"宋茜暮夜樱花裙","387869"
"高中和初中英语的区别","351846"
"司藤","346935"
"张馨予 这几天馒头主食吃的太多了","293488"
"幼儿连续用电子产品不宜超过15分钟","292120"
"我的姐姐","292051"
"丑得刚刚好的鸭子","245438"
"泰式酸辣青柠虾","224280"
"河南一中学在男厕安装监控","212309"
"当代年轻人的相亲观","201142"
"青你3先导因确信而确幸","197422"
"男子欲家暴反被老婆打进医院","195303"
"西藏发现5个新物种","195269"
"长颈鹿的绝望不过如此","195242"
"Gala卡莎四杀","190904"
"在鬼屋当npc能有多难","185594"
"库里祝贺朱婷","176449"
"张伯礼说重回武汉情绪有点抑制不住","170713"
"植发仍头秃男子状告植发机构败诉","160846"
"医院纪委回应医生自曝收回扣","156730"
"校方回应男厕安装监控","156486"
