"hot_word","hot_word_num"
"看完汪东城舞蹈眼睛进油了","1681835"
"南京大屠杀每隔12秒就有一人遇难","1540060"
"VaVa成为雪佛兰品牌挚友","1486909"
"关晓彤 造型师赖着不走我也没办法","1463029"
"杜淳为什么要跳舞","665952"
"为什么这么多歌手参加我就是演员","473090"
"哈尔滨女护士零下十几度跪地抢救老人","421517"
"沐浴之王票房破亿","394445"
"美国新冠病毒超级传播源","377704"
"素媛案罪犯赵斗淳到家画面","364758"
"泫雅曾给刘维伴舞","364276"
"包头市副市长王美斌坠楼身亡","363298"
"李汶翰头套是不是太紧了","331946"
"郑爽reaction像极了我本人","322092"
"西藏的英文是yalaso","258622"
"锦州通报教练罚学生用便池水洗脸","255704"
"内蒙古大四学生用冰块自制天然冰箱","244638"
"支教老师让学生用劳动换捐赠物","219492"
"浙江足协对飞踹球员禁赛一年","216576"
"江疏影礼服里面穿秋裤","211706"
"赵又廷谢娜把心比成桃","205726"
"檀健次 初代男团的水准","197160"
"南京大屠杀幸存者仅剩73位","192748"
"邓伦情商","189637"
"于正说李汶翰能力太差了","173604"
"张若昀 白宇吃点面就打发了","154405"
"忍受丈夫打骂四十年欲离婚被驳回","152915"
"王骁辉撞倒富兰克林","151342"
"大兴机场港珠澳大桥翻译","150739"
"追光吧哥哥","150641"
"烧饼不是来搞笑的吗","143509"
"迪士尼把雪花和星星都挂在圣诞树上","140574"
"于正跟李汶翰说偶像不能谈恋爱","137707"
"美国制裁中国一派出所民警","136350"
"符龙飞我记住你了","136098"
"我就是演员","118655"
"陈妍希晒照回应","109563"
"女子在冰上摔倒20次后接着摔倒","107856"
"胡夏唱跳","104336"
"南京多处遇难同胞丛葬地摆满鲜花","103312"
"十二兽首其实是时钟","102922"
"欧阳娜娜仙女裙","102247"
"把changes翻译成嫦娥们","93294"
"富兰克林受伤","81910"
"黑龙江新增5例确诊","80587"
"张颂文教科书级即兴表演","80170"
"31件二战文物入藏芷江受降纪念馆","69235"
"湖南小店1年帮送出5万件衣服","69019"
"美国新冠肺炎超1601万例","64913"
"北京下雪","64649"
