"hot_word","hot_word_num"
"加勒万河谷冲突现场视频公开","482287"
"印度","437158"
"看姐姐乘风破浪","432703"
"茶颜悦色道歉","325765"
"沈腾在马丽贾玲之间选了马丽","286049"
"卫国戍边烈士遗骸交接现场画面","210433"
"杨幂让沈腾说出华晨宇的三首歌","170091"
"顶楼","159080"
"祖国山河寸土不让","148171"
"4名牺牲边防英雄的照片","146151"
"王祖蓝是阿朵本朵吧","117307"
"华春莹称种族灭绝在中国是世纪谎言","107975"
"华晨宇关晓彤演我的少女时代","107376"
"士兵突击剧组重聚","90479"
"蔡国庆模仿易烊千玺","85910"
"至少8位外国元首首脑接种中国疫苗","79119"
"网友喊话金晨是不是拿错行李箱","79038"
"丈夫去世了债该不该还","78267"
"戍边英雄面对数倍外军张开双臂阻拦","78027"
"西部战区陆军发布视频致敬戍边卫士","77314"
"关晓彤 我的假发亮到想对着它许愿","77131"
"青你3记者会是李宇春的点子","76514"
"当鸟类都长了屁股","76254"
"檀健次祝时代少年团永远不糊","73208"
"丁程鑫刘耀文river","71887"
"永远的第一名","71706"
"民航局对多个航班发出熔断指令","70328"
"韩国发现一条神秘地道","69429"
"火币","66542"
"比特币涨破53000美元","64839"
"重伤的戍边英雄曾为受伤战友落泪","64242"
"虞书欣的伴舞好漂亮","61216"
"那英的嘟嘴","59675"
"赘婿","54923"
"陕西一95后拒服兵役被罚7.2万","53694"
"百变大咖秀","53496"
"一切矛盾用四个字可以平息","51664"
"琉璃","49757"
"感谢时代少年团的美眉们","47644"
"面试时手机响了怎么办","46603"
"人潮汹涌票房破2亿","46012"
"旺达幻视","45877"
"外交部回应中方公布中印边境报道","43212"
"5名戍边英雄的战地誓言","42508"
"海军陆战队女狙击手","41413"
"小米 车","40673"
"北京双星拱月","40006"
"边境线上的中国军人","39313"
"人潮汹涌","37958"
"斗罗大陆","37488"
