"hot_word","hot_word_num"
"吴宣仪 我就是不想化妆","3599122"
"坠亡学生遗体在父母同意后火化","2680777"
"老师隐瞒身份资助学生3年后被发现","1384942"
"韩艺瑟公布恋情","1372614"
"焉栩嘉演教员","1316734"
"网传警察拖行死者家属系不实消息","984567"
"我是大神仙游戏修仙",""
"央视探访成都49中","839425"
"1921侧颜海报","811621"
"迪丽热巴分享李长歌成长vlog","796515"
"大二男生从上海坐公交到北京","754352"
"局处长陪应届生面试","545982"
"安徽六安发现一例核酸阳性者","545513"
"北京一出租车阻挡救护车被行拘","463746"
"原来北大校徽是鲁迅设计的","460935"
"Angelababy冲浪摔了15次","439061"
"成都九价HPV","438826"
"赵丽颖赤凤姝颜预告","434607"
"喜茶小程序服务器","432838"
"邓伦开密室逃脱的原因","429138"
"俄罗斯驱逐美国驻俄大使馆发言人","428825"
"杜海涛沈梦辰否认分手","426397"
"印度医生警告牛粪疗法无效","423139"
"会议瓶装水浪费普遍","422880"
"懂得尊重的伴侣有多可爱","401319"
"机场设置粉丝接送机专属区域","352685"
"上海破获7亿奶茶店套路诈骗案","342312"
"蚂蚁森林声明","333082"
"世界最薄不锈钢仅0.015毫米厚","330216"
"觉醒年代","329476"
"1921剧组走进北大","328209"
"洗头洗了个寂寞","301827"
"2021年公务员考录时间提前2个月","270478"
"原来哆啦a梦有手指头","263990"
"男童遭双亲弃养自愿与继父生活","262102"
"如何走出失去孩子的伤痛","260413"
"钟南山谈群体免疫","247311"
"华春莹说美国是集中营鼻祖","239321"
"我的漂亮朋友定档","238833"
"汶川地震获救13年后的道谢","232050"
"工信部下架90款侵害用户权益APP","231718"
"画风突变的主持人","223629"
"男性医美消费平均客单价是女性2.75倍","212890"
"遇龙","203351"
"马达加斯加面临严重饥荒","201567"
"打篮球撞倒横穿老人被索赔5万","200183"
"林墨借刘彰充电宝收费","198998"
"Neuralink公司称15年内培育恐龙","194599"
"巴以再起冲突的原因是什么","184571"
"汉服市场爆发","184300"
