"hot_word","hot_word_num"
"美国德特里克堡生物实验室","8167411"
"张根硕母亲偷税漏税被判刑","3255009"
"薇娅年货开抢了","2626231"
"朴槿惠新冠检测呈阴性","2427669"
"Hill","2108686"
"家庭教育不得有任何形式家庭暴力","1921980"
"Prada股价上涨","1726407"
"伊朗宣布制裁特朗普蓬佩奥","1420285"
"上阳赋章子怡穿运动鞋穿帮镜头","1293922"
"吉林超级传播链再加长","1200600"
"郑爽风波后首现身","976914"
"微信将推出自有输入法","960358"
"还有3周就过年了","814842"
"美国德特里克堡生物实验室暗史","799206"
"张豆豆于家翊终于在一起了","769654"
"拜登启程就职告别家乡","765147"
"Prada中国区公关","763243"
"周扬青","758201"
"女儿们的恋爱","748856"
"Gucci红包封面","747649"
"特朗普决定赦免班农","740625"
"揭秘易烊千玺空军招飞宣传片原型人物","734931"
"李佳琦 武汉日夜让我们感激生在中国","728702"
"你好李焕英哈哈哈哈哈哈特辑","723592"
"特朗普发表告别演讲","717731"
"黄轩喝醉像极了我本人","716503"
"孟菲斯动物园熊猫","693510"
"腊八蒜","663858"
"每天有7.8亿人进入朋友圈","657522"
"官方通报藁城区一老人外出被绑在树上","653225"
"查理和巧克力工厂拍前传电影","581929"
"起底德特里克堡","548936"
"逆光镜头下的杨幂","546613"
"朴槿惠密切接触新冠患者","514999"
"陪你一起做饭的男朋友","492643"
"山西人提桶排队打醋过腊八","398318"
"上海地铁11号线","380555"
"最显年轻的接电话声调","369373"
"特斯拉首次回应Model Y降价","347126"
"美媒称拜登上台后将撤销特朗普多项政策","331842"
"腊八","319701"
"迪丽热巴把勺子咬断了","310091"
"拟立法规定必要时国家对家庭教育进行干预","274220"
"欧文离队原因","255897"
"濮泉生是扶二代","250411"
"山东井下被困人员又传来一张纸条","210308"
"侯明昊一秒变脸","202885"
"拼多多关联公司申请拼多多支付商标","199233"
"何凯文","199045"
"成都天府国际机场1月22日试飞","198695"
