"hot_word","hot_word_num"
"张桂梅说女高校训给了孩子们自信","1656351"
"哪吒给你好李焕英的贺图","1568791"
"美美与共","1303976"
"梁振英感叹国家给了香港多少机遇","1127432"
"刘亚仁","1089555"
"护肤品抗老真相","890116"
"小朋友对喜欢的解释","767878"
"建议鼓励大中小学开设学农实践","753451"
"张桂梅跟学生说走出去就不要回头看","682999"
"代表连续4年建议牡丹为国花","586996"
"山河令","586737"
"吴孟达曾带一麻袋现金到汶川救助","586197"
"视障阿姨因导盲犬排尿被邻居投诉2年","585731"
"吴孟达","585142"
"米卡的睫毛比头发还长","584643"
"政协委员回应芯片卡脖子问题","583983"
"建议设立国家汉服日","583395"
"为什么女老板越来越多","582744"
"NBA总裁拒绝更换联盟Logo","582403"
"拉萨舰入列北海舰队","581657"
"听过最凡尔赛的名字","581623"
"王琳口是心非","559619"
"女生节","522750"
"美国钢铁价格高于全球市场价格近七成","510805"
"宋亚东UFC首败","508252"
"宋茜把冉高鸣假发片吹开屏","506679"
"马嘉祺艺考总分186","464089"
"2035年的中国什么样","438691"
"过期霉变食物或可致肝癌","402519"
"代表建议适当延长节假日拉动消费","362755"
"假扮混入马群被识破后","358444"
"梁振英说要把危害国家利益的人排除出去","345721"
"拜仁连进4球逆转多特","342956"
"全国政协十三届四次会议委员通道","341223"
"建议家庭教育立法让父母持证上岗","339784"
"赞多直拍","313658"
"顶楼","310604"
"全国政协十三届四次会议第二次全体会议","285677"
"钟汉良谭松韵互吹彩虹屁","276265"
"UFC","274882"
"委员称不打不成才误导了中国家长","273936"
"00后贫富差距特别大吗","273701"
"建议出台电子烟行业规范","266644"
"杜华给了朱正廷一张愿望支票","262269"
"陈飞宇emoji解读","261564"
"第二场委员通道采访直播","251596"
"你家乡最奇葩的美食","225821"
"思维导图版十四五主要目标","220520"
"政协委员称分数不是教育的全部","219397"
"国际油价连续上涨再创新高","218467"
