"hot_word","hot_word_num"
"特朗普金色头发变得花白","3647103"
"拜登获306张选举人票特朗普获232张","1795890"
"林更新 内娱反黑第一人","1556116"
"曾伟权病逝","1442299"
"特朗普说疫苗最早明年普及但不给纽约州","1293209"
"蒙淇淇承认言论有艺术夸张","1180090"
"四川大学回应清退300余名研究生","1150372"
"天官赐福","1137067"
"复旦版中国医院排行榜","1086383"
"艾格回应破产","1070620"
"81岁刘诗昆再当爸","1052019"
"吴宣仪 骂我可以但别骂我身边的人","904471"
"林更新 只是自我保护意识强了点","901206"
"郑州检出进口冻猪肉外包装阳性","889540"
"全面放开二胎未引发生育高峰","880338"
"钱多多","868843"
"灵超道歉","859363"
"从此外卖不点菜","851349"
"走红藏族小伙想当赛马王子","711758"
"跨界最成功的演员","615577"
"刘昊然拿保温杯上班","560500"
"凡尔赛文学昵称大赛","498979"
"教育局通报老师发满意度调查标准答案","492937"
"中通快递回应快递员被砸身亡","432201"
"论眼妆能有多重要","418507"
"李斯丹妮 万一下面也有女孩子呢","412586"
"刚恋爱时有多甜蜜","393583"
"桂花芋圆奶冻奶茶","368809"
"韩国前两大航空公司或合并","352802"
"新鹿鼎记","347551"
"灵超在电梯里抽烟","333051"
"大学生将五禽戏改成了街舞","319509"
"反向凡尔赛文学大赛","290746"
"旅行中误入了人间仙境","284251"
"易烊千玺厦门","282574"
"丁真旧照","252099"
"警方通报外籍车主拳击渣土车司机","247697"
"陈赫 五哈播完我要瘦20斤","227028"
"花3500元作弊不到10分钟被抓","215038"
"你追过的第一部台剧","211159"
"上海开启落叶不扫景观道","204041"
"优衣库悄悄涨价","197684"
"刘亦菲晒与防疫人员合影","196076"
"程潇柔韧性","191493"
"家门口小水沟里的绝美世界","182954"
"咸蛋黄金甲鸡翅","182034"
"福建男篮11连败","175250"
"鹿方宁凌睿红床吻","173682"
"鹿晗被螃蟹夹到手后姐姐们的关心","173150"
"万亿GDP城市人均可支配收入排名","155507"
