"hot_word","hot_word_num"
"司机出现幻觉致40秒6连撞","2859455"
"妈妈说出李焕英同款台词","1252532"
"中国女子在美失踪2年遗骸被发现","1004496"
"这就是帅哥氛围感吗","956914"
"肖战如梦之梦排练照","888955"
"哥斯拉金刚打戏","866595"
"白敬亭让粉丝醒酒","831620"
"共享充电宝又集体涨价了","641324"
"中方对美加有关人员和实体实施制裁","636247"
"Abbily转性成功","634793"
"MMAQL喊话肖宇梁","633680"
"百变大咖秀上的李维嘉","632520"
"创4二公直拍","598931"
"香港青年怒怼HM应关心衣服质量","596932"
"新疆博士研究报告拆穿涉疆谎言","595202"
"林依轮 爱情鸟一点也不土","590245"
"杭州女子生三孩哺乳期被开除","586072"
"你生日在圆周率第几位","584075"
"计算机二级","579939"
"刘涛晒当妈时间管理","576853"
"福原爱登顶日媒评不伦艺人排行榜","573515"
"中国刑警赴美欧追逃红通逃犯","568797"
"天津天海更博","566549"
"你见过的NBA梦幻阵容","562626"
"姚明明","556653"
"喻言抹口红","556287"
"我才不要和你做兄弟开机","551534"
"C罗绝杀球被判无效","486003"
"埃及列车相撞32死因前车拉紧急制动","475048"
"男子嫌闷热打开应急舱门被行拘","473476"
"奔跑吧珠海路透","434121"
"周杰伦林俊杰合照","406979"
"内卷 绝对权力欲的熬鹰游戏","376655"
"这就是中方态度","358337"
"撒贝宁说有底气当总裁","355870"
"蔡徐坤牛仔套装","321964"
"英警察用烈性警犬驱散示威者","310084"
"南京女孩用红外相机记录城市野生动物","283368"
"新冠疫苗全人群免费接种","280152"
"陪你一起长大开播","261924"
"喻言下意识站军姿","258296"
"小朋友的爱情观有多可爱","238341"
"中使馆提醒在美中国公民加强防范","235870"
"美国爆发亚裔反歧视大游行","231464"
"UFC","230138"
"安徽一汽车落水3名儿童死亡","229614"
"周丹泰的真爱是罗爱乔吗","225576"
"柿柿如意番茄火腿烩饭","193919"
"西安地铁拟禁止使用移动充电物品","188382"
"椰树集团回应争议招生广告","187679"
