"hot_word","hot_word_num"
"鹿晗一到薇娅直播间就变吃播","142471"
"杭州36岁刑警办案时坠楼","125644"
"用汉服证件照登记结婚被拒","119043"
"容祖儿是张小斐的女儿粉","97823"
"代表建议大幅降低微信支付手续费","63045"
"高姿防晒代言人范丞丞","62956"
"赘婿","62831"
"锦心似玉","56942"
"我国最大内陆淡水湖推冰奇观","49849"
"连续强奸15名未成年人被核准死刑","49792"
"安吉小鱼儿胖了","47431"
"被写入判决书的网络表情","42706"
"代表建议医院增设护工岗位","39155"
"泫雅金晓钟算命结果","37767"
"云南拍到双角犀鸟封巢影像","36292"
"建议非法代孕相关组织从业者入刑","36283"
"黑寡妇","36226"
"完美日记母公司将收购Eve Lom","36198"
"耐克北美总经理因儿子炒鞋辞职","36140"
"被吉吉国王笑死","36107"
"赵丽颖直播","36045"
"徐令宜为了圆房有多努力","36006"
"工行要求异性员工避免单独约饭","35959"
"默读","35922"
"太极乐队唐奕聪去世","35914"
"顶楼","34544"
"周子舒受伤吐血","31176"
"香港楼价15年间大涨4倍","28671"
"沈梓捷绝杀","28327"
"赘婿全员奥斯卡","28305"
"李佳琦张韶涵直播","28243"
"人大代表建议停止征收社会抚养费","28088"
"张文宏号召大家打新冠疫苗","27121"
"宋轶揭秘苏檀儿口红色号","27036"
"火箭发射前航天人吃什么","26465"
"常戴耳机会耳聋吗","26072"
"白宫拒绝与邻国分享新冠疫苗","24955"
"孙艺洲代旭失散多年的兄弟","24475"
"林依轮让助理冒充路人拍自己","23562"
"秦昊凡尔赛","23344"
"宇宙音乐之夜艺人禁忌点","23162"
"CBA","22878"
"刚果金暴发未知疾病已致15人死亡","22653"
"爱的理想生活","22230"
"吴宣仪鞠婧祎互关","22114"
"每3个中国菠萝就有1个来自徐闻","20649"
"凤梨","19258"
"离谱说唱","18743"
"教师资格证面试成绩","18528"
"基金","18299"
