"hot_word","hot_word_num"
"科比大女儿签约模特公司","4065361"
"河北核酸10人混检下调至20元","1819107"
"赘婿定档","1208217"
"周深代喝豆汁的表情","1179534"
"混血的后代真的很神奇","1077052"
"乘风破浪奶奶团平均年龄90岁","992930"
"lex","712798"
"外交部回应澳籍记者成蕾被逮捕","663645"
"艾芬实名举报湖北爱尔眼科总院","652713"
"张文宏说新冠病毒会常态化","575961"
"月子会所奶粉勺口水巾混用","513296"
"美国男子拍下雪崩逃命全过程","449432"
"90岁奶奶直播讲述2077万还账历程","365320"
"三吉彩花表白THE9","361758"
"香港终院撤销黎智英保释","351352"
"卢靖姗晒合照为韩庚庆生","343074"
"军工","328193"
"股市","309343"
"周扬青的年夜饭","309035"
"赵丽颖 每天前进一小步让自己幸福","308163"
"年夜饭","307928"
"什么时间最宜贴春联","307358"
"三球7记三分","306131"
"被北极兔的可爱打败了","306037"
"鹿晗为邓超庆生","305442"
"无职转生","303311"
"库里超远压哨三分","303310"
"最新百家姓排名","303310"
"接种新冠疫苗后注意事项","303309"
"肖战唱斗罗大陆插曲","296729"
"岳云鹏晒手写信庆结婚10周年","265064"
"男生家长回应女厕安监控事件","263692"
"2020年全国姓名报告","257394"
"王源春晚和小朋友同台表演","253950"
"李易峰说一起唱歌的人多就不紧张了","249993"
"春节期间有多场天象","244067"
"不可思议的爱情","225824"
"马金瑜回应质疑","172306"
"谁还没有个小侍神呢","167663"
"江苏安徽共同推进南京都市圈","159883"
"余霜 反对任何形式的私生的行为","152883"
"明星大侦探","150960"
"累丑为什么引起共鸣","149250"
"格林强行出手三分","148570"
"GM减肥法","148429"
"石家庄站时隔34天重新开启进站","148358"
"江苏卫视春晚全阵容","148352"
"日本企业和家庭囤积现金","125827"
"全国首个与佩戴口罩有关专项立法","125295"
"二辰","121312"
