"hot_word","hot_word_num"
"陈清如院士逝世","2976310"
"丁禹兮带虞书欣人形立牌扫楼","1659732"
"共和国又痛失一位院士","1324521"
"OPPO Reno6发布",""
"鸡鸣寺到底有多神奇","1191228"
"张嘉倪唱小幸运为买超庆生","1168050"
"迪丽热巴生图","1132988"
"娱乐影像力",""
"中国人能自由吃瓜离不开这位奶奶","1002157"
"棋魂道歉","829064"
"印度首都成群饥民追赶食品车","804620"
"广州辟谣不再接种第一针","804013"
"毛不易 欢迎讨论但不建议提意见","792771"
"福建通报2名民警强奸妇女案","789347"
"贫穷果然限制了我的想象力","779806"
"老友记","777287"
"你为什么拼尽全力","773129"
"宋妍霏15分钟懒人速成妆","766623"
"薇娅 我现在不知道怎么做自己","758213"
"Letme和女友分手","754024"
"骑手接农药订单报警结局暖心","750428"
"刘耀文自曝密码","671686"
"烂尾24年巨人大厦迎来新主人","670607"
"新车牌","498994"
"被蚊子叮过最尴尬的位置","472218"
"曜新皮肤李逍遥","385941"
"中国女排世界排名跌至第二","377556"
"95后女生绝技独竹漂火到国外","370271"
"张艺兴夏日吃瓜大片","369724"
"日本花20亿搞公关美化核事故","352282"
"重庆健康码金色皮肤","336609"
"消费者诉唯品会售假Gucci腰带败诉","327103"
"美国今年已发生232起大规模枪击","326920"
"王冰冰戴上眼镜好A","326783"
"张哲瀚侧颜眼神杀封面","318940"
"吴彦祖晒20年前后对比照为老婆庆生","301575"
"王者荣耀仙剑皮肤","277046"
"刘鹤与美贸易代表戴琪通话","270678"
"密室大逃脱","270658"
"寝室6位同学全是退伍军人","262497"
"Qingtian加入滔搏","257346"
"双世宠妃3先导预告","252271"
"阿里巴巴招募鉴黄体验官","252222"
"通过手机电量拆穿男友伪装","233763"
"郝家伙 怎么源源不断啊","232254"
"白敬亭假扮NPC","214269"
"王鸥挂脖式吊带长裙","212772"
"广州警方海陆空联合办案场面堪比大片","208525"
"御赐小仵作","203827"
"二胎弟弟过的到底有多艰难","203339"
