"hot_word","hot_word_num"
"张彬彬看景甜的眼神","1752611"
"上完20天班又是小长假","1338980"
"尹正第三周吃了什么","1221638"
"张彬彬 甜甜你别动我来找你","1102139"
"章泽天身材","1072026"
"大宋宫词中的职场技能","1037063"
"尾鱼","920009"
"不要一次性拔掉四颗智齿","888323"
"长歌行鹦鹉吻替","721181"
"上合组织秘书长说新疆百闻不如一见","685001"
"司藤大结局","655043"
"黄俊捷道歉","649968"
"王霏霏沈梦辰刘维朋友聚会范本","639924"
"怎么暗示领导这礼物很贵","631808"
"越来越多美国人假装疫情结束","621885"
"肖战朗诵杨靖宇25岁写的诗","604611"
"奥斯卡原名王政熊","602514"
"管泽元","593783"
"律师表示炒鞋可能涉嫌多项违法","579847"
"京粤大战","569188"
"牡蛎居然可以这么励志","567838"
"夏达40岁状态","534277"
"俄新型隐身轰炸机或2027年前列装","495390"
"村民被红火蚁咬后休克","484834"
"张子枫 我做不到不真诚拍每一条","431822"
"你会如何跟孩子讲述死亡","392930"
"皓嫣","390527"
"韩美娟最想和甘望星交换身体","376871"
"芒果降价了","362116"
"人类减贫的中国实践白皮书将发布","361731"
"千瑞珍坐过山车","361703"
"密室大逃脱路透","311170"
"乃万以后都想给孙滢皓写歌","283389"
"安然姑妈对着套娃说俄语","275410"
"王毅回应美方对华反复提竞争合作对抗","261212"
"阚清子哭也不忘干饭","258901"
"花儿超级乖","256960"
"长歌行","255872"
"陪你一起长大妈妈哭戏","186617"
"苏伊士运河肇事货轮面临10亿美元索赔","173426"
"四川洪雅山体崩塌致3人失联","166579"
"司藤番外","159098"
"清明当天全国现场祭扫群众3527万人次","154441"
"赵睿19分","153783"
"万人迷 两性博主","152001"
"希望甘望星教我如何钓男人","150789"
"三国演义与真实的三国差别","148911"
"充气城堡被吹翻致1女童身亡","147040"
"新冠疫苗保护期只管半年是误读","145867"
"沙僧被贬下界真的不冤","145028"
