"hot_word","hot_word_num"
"王者荣耀点券没了","408728"
"英国发现的变异新冠病毒致死风险更高","315928"
"立得万能福送爸妈","297218"
"虞书欣魔术穿帮","271380"
"牛年央视春晚节目单","236471"
"哪吒重生点映","232258"
"丁真等91件商标注册申请被驳回","229079"
"地球自转加快一天已不足24小时","206381"
"郭冬临到底喝了多少瓶水","190222"
"中共中央国务院举行春节团拜会","147453"
"天问一号成功实施火星捕获","137593"
"张鹤伦发文","136413"
"陈玺达回应偷鞋事件","133997"
"谢可寅和孔雪儿给喻言留了位置","115550"
"女子丢猪腿找回时已被腌制好","114418"
"迪丽热巴化妆师","113348"
"天津卫视相声春晚","112093"
"刘雨昕看刘谦洗牌的反应","110606"
"艾情拒绝吴白","109396"
"成都精准打击煽动抱团涨价重点人员","107512"
"安装空调外机有多危险","106106"
"辣目洋子贾冰小品好笑","105721"
"印小天太适合春晚了","98278"
"宋小宝plus 潘长江plus","87865"
"明天除夕","78730"
"胡兵眼部手术全记录","77206"
"百万分之一的几率发生的事","74955"
"数字人民币","72206"
"韩国12岁男孩炒股一年赚43％","71098"
"外交部发言人给大家拜年了","71087"
"郭冬临小品里男人可以生孩子了","71082"
"李子柒添福添年味","69809"
"风起霓裳","58862"
"王者荣耀充值BUG","58506"
"上海市原副市长龚道安被双开","54108"
"山东年味最浓的地方","53065"
"和平精英","50389"
"浙江卫视喜剧春晚","50208"
"裴行俭我不是男人","49073"
"2月14日恰逢春节可以婚姻登记吗","46325"
"德云团舞运镜","46320"
"牛年壁纸","44219"
"东方卫视新春潮乐会","41252"
"脏脏年糕冰淇淋","38862"
"吴白又哭了","38352"
"马鹤琪","31992"
"斗罗大陆","30193"
"淘宝红包雨","29367"
"外婆用筐装80万给家人发压岁钱","27754"
"英国又发现两种新变异毒株","27588"
