"hot_word","hot_word_num"
"台湾新冠确诊男子砍伤3名医护","2570907"
"官方回应粤康码为何变黄","1059401"
"陈建斌蒋勤勤定情信物是麦子","1046188"
"你选原味鸡还是脆皮鸡",""
"摩尔庄园的任务是不是发朋友圈","982751"
"深圳东门","887960"
"刘涛 我现在的偶像是谢娜","877715"
"电梯28楼直坠14楼女子发声","790256"
"无人机坠毁前拍摄的火山岩浆","751615"
"周也是穿了白展堂的衣服吗","699566"
"今年中国快递业务量已突破400亿件","661133"
"乃万确诊肠胃炎","659982"
"1078万人报名高考","654692"
"高圆圆下午茶吃肉夹馍","654350"
"为什么父母不理解你的绝望","559695"
"姚策生母杜新枝控告许敏","546180"
"妈妈用1年记录女儿跟在爸爸身后散步","534832"
"片寄凉太胖了好多","526586"
"女生真的会被土味情话撩到吗","512651"
"高楼失火女子窗外避险坠楼","505035"
"蒋依依对镜自拍","499727"
"玩摩尔庄园像是找了新工作","473270"
"曹县究竟有多好吃","465854"
"杨紫红孩儿造型","457046"
"嘉人 女明星黑白西装","451817"
"中国足协回应承担A组球队差旅费","440668"
"王子文晒与吴永恩对视照","429891"
"安吉小鱼儿录制跑男","400294"
"南京胖哥等10人被认定见义勇为","383486"
"防晒口罩掉地上引发的社死","378210"
"教育部要求学校开展性教育","376512"
"吴磊骑车下班迷路","374871"
"六一晚会上唱错词偷偷捂嘴的小姑娘","317433"
"交通部门回应车厘子不免过路费","297045"
"广州疫情","283679"
"建议延长产假至3年","282556"
"双世宠妃3是喜剧吧","281709"
"猫咪怀疑的眼神是什么样的","273819"
"赵奕欢 不红就没有选择角色的权利","267580"
"薇娅严选被强制执行","266591"
"原来菠萝蜜的核是可以吃的","253598"
"男生用塑料袋胶带自制鱼缸","247532"
"宋妍霏家氛围太好了","239973"
"教育部回应安徽六安读音问题","232752"
"怦然心动20岁","231427"
"美国一州为刺激居民打疫苗开始送枪","212276"
"我国普通话普及率达80.72%","211139"
"黄龄说螺蛳粉好好闻","209646"
"迪丽热巴的腰","206668"
"对已立案的网贷机构追缴明星代言费","206260"
