"hot_word","hot_word_num"
"日本网友请愿删除大雄进静香浴室戏份","2010572"
"拜登将提名美籍华人任贸易代表","1849408"
"OPPO Reno5","1843742"
"李佳琦声音商标被驳回","1808933"
"大学生体测替考被取消学位获得资格","1696597"
"用一部超英大片告别2020","1684469"
"张馨予光头造型","1454036"
"苹果可能考虑移除充电线等配件","1186877"
"尼格买提微博编辑记录","977040"
"默克尔含泪恳求德国人遵守隔离规定","911729"
"黑龙江疫情","899211"
"坠楼女婴父亲承认重男轻女","872555"
"套餐A","849233"
"路人镜头下的章泽天","715594"
"广州严禁断水断电断气驱赶承租人","647118"
"沈梦辰模仿GAI","584990"
"原来溜肩比直角肩更可爱","542561"
"近视一族不要从早到晚都戴眼镜","530784"
"被舞蹈老师的婚礼甜到了","511959"
"紫薇的画像像极了孔慈","427183"
"绥芬河","417441"
"孔雪儿一口气跳五支舞","416249"
"有翡配音","368666"
"广东的早茶是茶吗","366864"
"黑龙江东宁新增1例本土确诊","363805"
"美国疫情","362104"
"陈好41岁状态","346841"
"送你一朵小红花预售","339226"
"抢茅台","297268"
"杜兰特回应哈登交易流言","292380"
"杨天真谈艺人谈恋爱","292093"
"双十二退款","290137"
"遭羁押1277天无罪释放清华博士现状","281857"
"被选秀改变命运的女孩","260681"
"福奇喊话美国人新冠病毒是真的","253092"
"赛博朋克2077","252550"
"犀浦","203936"
"高校回应学生体测作弊取消学位","203712"
"高中阶段教育即将基本普及","201732"
"十年在美发店消费150万","201384"
"哈尔滨中小学生元旦起放寒假","200024"
"编程教育将纳入中小学相关课程","198980"
"拜登儿子接受税务调查","198006"
"山西垣曲发现周代高级贵族墓葬群","196998"
"全球平均寿命超73岁","195545"
"浙江男篮绝杀上海男篮","194108"
"2020温暖图鉴","193349"
"SN处罚huanfeng","192503"
"野生感藏风妆","190580"
"素媛案罪犯居住地家庭将装安心铃","189531"
