"hot_word","hot_word_num"
"唐嫣生图","206369"
"国防部回应美舰非法闯入我西沙领海","119156"
"广州查获50只巨人恐蚁","95817"
"欧阳娜娜官宣了",""
"张国政宣布恋情","95648"
"男子分手后起诉女友还钱胜诉","95003"
"曹县出口棺木占日本市场90%","94207"
"央视主播谈520最佳表白","93961"
"刘宇垫肩","93337"
"赛格大厦实时监测情况续报","92518"
"中疾控回应疫苗中发现絮状物","91662"
"金莎冒充追求者给孟佳送玫瑰花娃娃","91352"
"约每5个中小学生就有1个小胖墩","90492"
"我要我们在一起","89995"
"奥巴马被曝曾脏话攻击特朗普","89228"
"王子文坐吴永恩肩上自拍","89075"
"Lisa获微博年度热点人物奖","88196"
"速度与激情9","87897"
"当舍友买的裙子像手术服","81568"
"腾讯2021年第一季度财报","75150"
"左晖刚被评上地产首富","73409"
"欧阳娜娜王鹤棣祝绪丹偶遇","73377"
"成都一婚姻登记处设在火车上","62437"
"虞书欣演的初礼","50690"
"屈楚萧演技","49538"
"陈立农卡点祝王彦霖新婚快乐","49122"
"发520元红包分手后能要回吗","44250"
"被告白了也别高兴太早","44137"
"我国现有新冠疫苗可应对印度变异株","42851"
"618预售提前","42840"
"深圳多家银行上调房贷利率","42835"
"王源锡纸烫渣苏感","42834"
"韩美娟毕业获奖感言","33743"
"网友称被交警用个人二维码收罚款","33435"
"拆穿同学的伪装反而被骂了","32424"
"赵立坚提到520说祝融号带着爱继续前行","32333"
"8旬爷爷20年为老伴种满墙凌霄花","32291"
"流浪狗吃饭的样子好心疼","31064"
"Kingdom","27491"
"合肥心形公路","24101"
"鲸鲨张开大嘴向渔民讨食","23483"
"留守儿童喊话父母笑着笑着就哭了","22062"
"穿肉色衣服需谨慎","22052"
"儿子送爸爸520贺卡打开变250","21561"
"乔欣晒鲜花蛋糕","21151"
"老师让未捐钱学生录像是道德绑架吗","20931"
"武汉一路面发生爆炸","20587"
"低欲望等于低消费吗","19779"
"自制巧克力翻车18次","18600"
"520","18388"
