"hot_word","hot_word_num"
"马拉多纳尸检结果","3382328"
"TikTok出售令期限再次延长7天","2488326"
"房产微盘点","2427615"
"水果摊主出示遗赠扶养协议","2054669"
"章子怡为小苹果庆生","1315419"
"背后的力量","825464"
"上帝收回了上帝之手","810310"
"190余名乘客血清抗体检测结果相同","784030"
"林郑月娥首次戴上一国两制徽章","761810"
"万达清空所有海外地产项目","700362"
"韩国N号房主犯一审被判40年","679573"
"感恩节","672982"
"内蒙古新增9例本土病例","643944"
"小米已批准王嵋请辞","494370"
"24岁女孩成文昌发射场最年轻女指挥","476974"
"特朗普宣布赦免前国家安全顾问","475582"
"马拉多纳去世","456863"
"当爸爸得知马拉多纳去世","456352"
"文具店20元1根卖电子烟给小学生","456304"
"工作人员称天然气喷出后不影响水质","455825"
"企业公章盖了1年才发现刻错","453146"
"黄健翔","446600"
"以为丁真在西藏","444151"
"李晋晔詹秋怡配合默契","424814"
"北京新发地暂停水产冻品销售","390150"
"小米集团回应王嵋错误言论","384121"
"山西进口冷冻青虾外包装检出阳性","338223"
"丁辉是打工人的真实写照","324350"
"沈群丰发长文","292049"
"日本沿海现九足章或与核辐射有关","284002"
"京沪高铁启用动态票价","267240"
"杨超越回应落户质疑","257720"
"小猪先生 韩安冉","253139"
"Doublelift退役","248368"
"感恩节文案","233418"
"平均每40秒美国就有1人死于新冠","218258"
"元旦休3天","198089"
"南方暖气片销量同比增长300%","183253"
"考研倒计时1个月","182858"
"huanfeng","179479"
"可点燃自来水服务站站长被停职","178034"
"林青霞回应金莎想嫁给自己","170221"
"令人心动的offer","164594"
"狼殿下","163930"
"阿根廷全国哀悼马拉多纳三天","159861"
"千岛湖美景好似调色盘","152047"
"达尔文2本珍贵笔记本或已遭窃","142418"
"共享充电宝为什么越来越贵","139349"
"机场进口货物与其它货物不混装不交集","123365"
"破除老年人智能鸿沟国家方案思维导图","114881"
