"hot_word","hot_word_num"
"向佐郭碧婷一家三口合照","3539526"
"全球7成新冠疫苗已被富裕国家抢购","814812"
"范迪塞尔的新年装备","806245"
"李焕英结尾给妈妈买了敞篷车","786254"
"男朋友抠不出来","765098"
"牛年祝福接力","741656"
"陈法拉生女","741656"
"陈思诚打造唐探宇宙的野心","669801"
"回村听到最劲爆的八卦","654114"
"佛首是2020年回归第100件流失文物","651937"
"贾玲张小斐的神仙友谊","650592"
"舒淇叫林熙蕾老婆","551091"
"邵阳一游乐场飞椅坠落16人受伤","400043"
"日本5.2级地震","389267"
"德国博物馆藏品中发现北宋汝窑瓷器","389167"
"妈妈原来什么都知道","389135"
"唐探3结尾煽情","350529"
"谭松韵眼神","346447"
"詹姆斯库兹马假摔被警告","344533"
"比特币","340952"
"王倦回应斗罗大陆剧情猜测","336392"
"南京鸡鸣寺消息树开花","327855"
"情人节这一天的我","326168"
"潜意识里妈妈的年龄","323125"
"佛首捐赠者收400余条祝福信息","302450"
"传说中的广东红包","291515"
"刺杀小说家","287403"
"全球最大中国股票基金1月减持茅台","248679"
"巴萨","244980"
"世卫组织将发布病毒溯源报告摘要","242688"
"如何让全班同学给你拜年","242685"
"贾玲妈妈","242471"
"唐宫夜宴","231022"
"你好李焕英","225040"
"马克龙用四国语言拜年","216608"
"陕西一村4000人姓第五","216358"
"情人节","215253"
"斗罗大陆","207111"
"苍兰诀开机","179468"
"日本福岛第二核电站冷却水发生轻微泄漏","171731"
"河南春晚总导演回应节目出圈","171075"
"论看电影位置的重要性","167416"
"王子文吴永恩约会好甜","156864"
"阿富汗边境一油罐车爆炸","149396"
"初三","147571"
"情人节清透感初恋妆","145224"
"日本近海7.3级强震已致124人受伤","143914"
"新疆民警徒手挖雪洞躲风雪","140748"
"当代电视机的主要作用","123315"
"天问一号大年初四侧手翻","88397"
