"hot_word","hot_word_num"
"绍兴14岁女孩被德云社录取","3609098"
"男子离婚不要患癌儿子多年后反悔","2195174"
"广州疫情","1439808"
"新机来了",""
"王嘉尔看到男粉戴他同款帽子的反应","1403579"
"老师点名时差点就唱了出来","1062263"
"NASA将128只小鱿鱼送往太空","944784"
"翻到父亲手机里未发送的短信","898796"
"字节回应腾讯副总裁称短视频低智","710241"
"毒品伪装成可乐奶茶跳跳糖","631504"
"美国把59家中企列入投资黑名单","618069"
"兰新线一列车与施工人员相撞9人遇难","617040"
"科目一考了34次","616894"
"阿姨测完核酸霸气帮志愿者举牌","614160"
"男子直播间买到山寨机9倍索赔","538014"
"当小男孩知道钢铁侠真的不在了","529433"
"全智贤老公","528944"
"李荣浩称呼杨丞琳为我的快乐","523468"
"40岁的杨蓉","521352"
"房子租出去被改成了鬼屋","518212"
"15头北上象群掉头向南","513957"
"全智贤婆婆称听到离婚传闻非常生气","510738"
"乔欣龚俊吻戏路透","509261"
"中国邮政成立奶茶店","504024"
"李惠利柳俊烈约会","501298"
"谁听了不想去上班","499540"
"刘亦菲与梦华录演员合照","496015"
"杨丞琳双马尾生日造型大片","493702"
"两男子在贵阳晚报登整版遗失声明","490629"
"保罗计划拒绝4440万美元球员选项","443692"
"马斯克推特心碎表情","429637"
"孙艺珍状态","422391"
"贺峻霖高考日结束前最后一条微博","398844"
"朱一龙 林楠笙背影照","340642"
"致命女人 反转","329457"
"教师救两娃牺牲被追授重庆好人","249719"
"学校给高三生每人发2张5元人民币","248873"
"男子产房外心疼老婆嚎啕大哭","230753"
"叛逆者央视定档","216983"
"福建警方拦截运毒船缴毒655公斤","211076"
"无人机拍到云南北迁象群睡觉画面","206668"
"真正的爱一定不是瞬间的感动","202991"
"男子街头夺刀救人获评见义勇为","202828"
"广州新增确诊和无症状感染者详情","201813"
"央视曝光刷任务赚佣金骗局","201496"
"雎晓雯 我要打破被量化的标准美","201043"
"交警小姐姐超甜劝导违章车辆","200264"
"白蛇传情水墨特效","199481"
"布克单节22分","198723"
"猛男背心变紧身裙","198350"
