"hot_word","hot_word_num"
"赵丽颖黑长直 病娇美人","2957069"
"民政局拒绝3月14日加班建议","2605073"
"任天性全开就现在","2434659"
"黄子韬吐槽王彦霖大学去过非洲度假","2338801"
"蔡少芬录节目时被狗咬伤","1699623"
"柔软的力量","1610678"
"江西坠机事故飞机型号确认","1343843"
"代表建议禁止明星代言网游","1121735"
"基金","677645"
"网友科普广东一县凤梨产量惊到台名嘴","581197"
"张子枫演技","556278"
"王彦霖承认恋情","543796"
"人大代表建议公共场所大量装备AED","517312"
"建议为空巢青年提供身心健康等服务","505123"
"山河令直播","470498"
"刘芸 我太想演一个被爱的角色了","417662"
"美军基地遭伊朗导弹击中画面","399991"
"相亲发生关系被判强奸男子出狱","395065"
"黄子韬要拔两颗智齿","391146"
"常戴耳机会耳聋吗","385250"
"许凯把口罩当发箍","380186"
"教资面试成绩","374652"
"超9成大肠癌源于息肉癌变","373934"
"茅台大跌","325504"
"GQ","307313"
"物理老师室内演示电流","302569"
"凤梨","291062"
"儿童中耳炎发病率上升","278574"
"易烊千玺费加罗封面","259938"
"日系病娇少女妆","257192"
"百度吉利成立集度汽车有限公司","247694"
"北京部分60岁以上老人接种新冠疫苗","246720"
"父亲回应20岁智障女儿嫁55岁男子","231124"
"人大代表第三次建议夫妻合休产假","224570"
"性格会受父母影响吗","220391"
"专家呼吁尽快接种疫苗以实现群体免疫","220315"
"宋轶道歉","214904"
"力丸是种睫毛了吗","210056"
"腾讯机器狗Max","196504"
"草莓麻薯芋泥脆脆杯","181257"
"陈祥榕烈士遗属获授一等功臣之家","180565"
"山河令","179106"
"国美零售已赎回4.84亿元国内债券","167959"
"教师资格证面试成绩","159814"
"理想照耀中国","159268"
"Flyme9","158815"
"丘吉尔名画700万英镑成交","157555"
"张哲瀚演技","157119"
"全球五分之一的人听力受损","156365"
"钟睒睒成全球前十首位中国富豪","156299"
