"hot_word","hot_word_num"
"赵丽颖黑长直 病娇美人","2461094"
"民政局拒绝3月14日加班建议","1951183"
"薇娅解锁早春新趋势","1934750"
"黄子韬吐槽王彦霖大学去过非洲度假","1869016"
"蔡少芬录节目时被狗咬伤","1595348"
"代表建议禁止明星代言网游","859946"
"江西坠机事故飞机型号确认","841926"
"常戴耳机会耳聋吗","766939"
"教师资格证面试成绩","709063"
"张子枫演技","705408"
"力丸是种睫毛了吗","698214"
"3人篡改核酸检测证明被拘","689054"
"王彦霖承认恋情","617127"
"网友科普广东一县凤梨产量惊到台名嘴","512788"
"人大代表建议公共场所大量装备AED","422153"
"基金","421149"
"相亲发生关系被判强奸男子出狱","421124"
"郑乃馨人鱼泡泡裙造型","420944"
"许凯把口罩当发箍","420648"
"芜湖文旅感谢龚俊","391501"
"建议为空巢青年提供身心健康等服务","380568"
"黄子韬要拔两颗智齿","357919"
"山河令直播","304639"
"超9成大肠癌源于息肉癌变","303847"
"丘吉尔名画700万英镑成交","300387"
"茅台大跌","295363"
"杜富国杜富佳讲开学第一课","284353"
"美军基地遭伊朗导弹击中画面","279217"
"凤梨","276355"
"我心飞扬开机","268234"
"刘芸 我太想演一个被爱的角色了","245477"
"易烊千玺费加罗封面","223634"
"GQ","223464"
"人大代表第三次建议夫妻合休产假","216085"
"日系病娇少女妆","215413"
"Flyme9","215156"
"性格会受父母影响吗","208138"
"父亲回应20岁智障女儿嫁55岁男子","188290"
"物理老师室内演示电流","183645"
"安徽省民政厅回应3月14日加班建议","183471"
"2020中国专利申请量世界第一","176944"
"台湾屏东县5.3级地震","176159"
"白酒股走低","172180"
"儿童中耳炎发病率上升","168704"
"全国首部个人破产法规施行","163389"
"每3个中国菠萝就有1个来自徐闻","161265"
"北京部分60岁以上老人接种新冠疫苗","159334"
"人大代表建议实施鼓励生育政策","158315"
"国美零售已赎回4.84亿元国内债券","157643"
"山河令","157340"
