"hot_word","hot_word_num"
"中俄关系处在历史最高水平","3063801"
"张雨绮 请停止继续给我打电话","1340345"
"端午票房陷历史低谷","1197247"
"欧阳娜娜裸眼3D超排面",""
"黄景瑜曾在电台做编辑接电话","1147272"
"对男朋友突然很下头","1034461"
"被室友说冷血","913213"
"高考志愿填报",""
"马斯克决定卖掉最后一处房产","689345"
"尚九熙新恋情","631066"
"81名上海游客去探险被困洪水","572666"
"高校挂牌提醒猫减肥请勿投喂","498267"
"金莎喝咖啡喝到细菌感染","492286"
"林依轮 婚姻26年酸甜苦辣只有甜","490984"
"忘查邮箱错过了入职时间","479953"
"新冠病毒传播速度超过疫苗分发速度","459292"
"美国男子倒80000枚硬币支付抚养费","440489"
"给你一个亿永远不用空调","440041"
"李光洙发文告别RM","439081"
"广州本轮疫情累计147例境内感染者","408028"
"华晨汽车集团原董事长祁玉民被开除党籍","393287"
"姜云升加入活死人","376812"
"孙一宁 王思聪","374662"
"央视给景甜p的裙子","373757"
"你会为了爱情放弃前途吗","371437"
"男子在海底捞自导自演吃出蟑螂","357448"
"我国仍保留着81对公益慢火车","344605"
"吴亦凡时尚COSMO双封面","334180"
"八路军歼灭日寇真实影像","311003"
"大本与洛佩兹热吻","308533"
"何洛洛玫瑰少年大片","289262"
"普京回怼挑拨中俄关系的美国记者","281482"
"一见钟情是一种什么感觉","277436"
"朴叙俊加盟惊奇队长2","267472"
"该让亲戚孩子来家过暑假吗","254542"
"河南共青团 浙江卫视","240924"
"中国百年前后对比照","238439"
"云南离群小象是叛逆期到了","236225"
"迪士尼公主说话方式模仿","233205"
"欧阳娜娜生日写真","224988"
"家长扮四大才子给中考生加油","224255"
"独象不是真正的离群","217398"
"松鼠误入赛道奋起一跃逃过一劫","210306"
"百年百校青春诵读","208846"
"从严处置饭圈职业黑粉","202151"
"电影上甘岭连长原型张计发逝世","198031"
"刑侦日记开播","194663"
"C罗拒绝与可乐同框","177186"
"井冈山斗争平均每天近60人献出生命","177054"
"妈妈包的糊弄粽子","177030"
