"hot_word","hot_word_num"
"尾号888888手机号85万元拍出","3602127"
"微博新表情裂开了","1344472"
"李雪琴卢伟冰说脱口秀","1281119"
"朱一龙跳舞踩到童瑶","1240614"
"杨幂钻石口罩","1110903"
"明星社会性死亡现场","1040531"
"追光吧哥哥","931188"
"央视新剧片单","766174"
"外交部回应中方是否计划接触拜登团队","761564"
"演员母丹称不认识张颜齐","760851"
"李易峰对同人创作的接受度","696899"
"马拉多纳死因","594111"
"丁真商标被抢注","588281"
"自贡一幼儿园50多人感染诺如病毒","585748"
"粉丝寄给丁真的书堆成小山","576462"
"上海查获1.2亿元莆田造假球鞋","572062"
"杀破狼","567444"
"仙侠剧演员信念感有多强","562766"
"韩国明洞销售额不到往年三成","557747"
"女保洁误入男浴室撞见领导被罚2000元","557265"
"用周杰伦专辑命名5亿年前三叶虫","541667"
"微胖男孩可以有多可爱","504169"
"当玩手机不小心点了投屏","468750"
"萧敬腾想吻王嘉尔","437496"
"女子遭虐待致死案重审延期","407963"
"为什么人类不用冬眠","350191"
"D站创始人温博特获刑三年三个月","341334"
"高校男生打造全智能寝室","339992"
"国防部回应蔡英文争取美对台支持","339489"
"马拉多纳去世当天曾感觉不舒服","339326"
"张颜齐","336934"
"那些长在审美点上的男生","297184"
"满洲里2病例是由境外输入引起","296468"
"任国强介绍中印边境最近情况","296288"
"刘浩存","296277"
"丹麦埋葬后的水貂挤回了地面","290469"
"如何辨别正品和高仿鞋","270609"
"一入冬东北就成了冷冽仙境","258091"
"四川有什么","257459"
"两只正在打架的水母","255185"
"美香","233481"
"棋魂大结局","229191"
"汤普森成功接受手术","214407"
"长安如故开机","208266"
"撒野路透","192896"
"你好生活","168379"
"红米Note9","161192"
"99岁老人哭诉被子女强辞保姆","160852"
"名媛语录模仿大赏","160827"
"感恩节","160569"
