"hot_word","hot_word_num"
"王一博换头像","3023158"
"周恩来写人民英雄纪念碑碑文写了40余次","1598559"
"五四高途的片子太好哭了","1594322"
"郭晓东 我愿意当程莉莎的巨婴","1576258"
"结婚当天到底有多累","1519214"
"西安大唐不夜城地铁口排起百米长龙","888285"
"AI修复五四运动现场","844259"
"五四青年节","792138"
"女子为给偶像删帖被骗8000元","672146"
"央视五四晚会节目单出炉","595301"
"姚策养母将起诉网暴用户","585877"
"我让男朋友社死了","574376"
"丁太升","542618"
"五四特别版错位时空","512441"
"美国亚裔女子遭锤子狠砸脑袋","498907"
"浙江一高速6车追尾致6死3伤","450491"
"张哲瀚分享演出图","450474"
"五一酒店外卖订单涨2倍","450425"
"少林寺500多年古碑遭熊孩子刻画","441980"
"诺一霓娜参加斯巴达勇士儿童赛","378800"
"aespa将五月回归","337946"
"INTO1费加罗男士首封预告","311409"
"4名女子抬残疾好友登泰山","295025"
"这才是真正的中国青年","293724"
"印度医生为死亡病患哽咽","288732"
"吴倩军装独白","287900"
"李开复谈比尔盖茨离婚","283027"
"用最硬气的口气说最怂的话","259310"
"我的青春宣言","250260"
"五台山商贩回收香蜡低价4倍售出","244361"
"北大补授学位仪式现场惊喜求婚","239132"
"美媒曝比尔盖茨离婚文件","232511"
"91岁巴菲特选出继任者","230678"
"少女因病辍学4年写下500篇文章","230212"
"比尔盖茨女儿发声","229796"
"刘宇机场","223804"
"宠物盲盒","218463"
"长歌行","177875"
"墨西哥地铁12号线发生垮塌","177145"
"父母年轻的神仙颜值","176458"
"售价2200元的神药成本仅50元","170881"
"五一出游引发的社死现场","153513"
"渔民捕700斤金枪鱼卖出10万元","151611"
"世界上穿越沙漠最长的高速","151390"
"今天是工藤新一的生日","151299"
"龚俊帮张哲瀚找调","140644"
"大学生入伍前后对比照","130723"
"一名无症状感染者密接曾参加两场订婚宴","111299"
"长沙坡子街新晋网红打卡点","108967"
"勇士升至西部第八","108360"
