"hot_word","hot_word_num"
"郭敬明向庄羽道歉","911078"
"美共和党当选议员感染新冠去世","615912"
"刘翔 献给跨过2020的你","593868"
"王俊凯 是时候让大家知道我长大了","340360"
"今天是黄雨萱梦到李子维的日子","261026"
"倪妮30岁之后体重没下过100斤","227419"
"有翡","162785"
"巡回检察组","130160"
"妻子擅自终止妊娠是否侵犯丈夫生育权","128012"
"谢允眼神太虐了","127613"
"彭冠英工作室换头像","127442"
"蒋南孙重男轻女受害者","126884"
"安崎在北京穿短裤","126448"
"中欧投资协定谈判如期完成","124955"
"严查中小学教师到培训机构兼职","124290"
"谢允第一次用推云掌","123534"
"关晓彤真的跨过了2020","122317"
"周深说父母其实也不知道怎么当父母","120750"
"零下8度幼儿园只来了1个学生","120365"
"张云雷首晒相声手稿","120227"
"王冰冰冰上弹钢琴","120158"
"周洁琼自拍了个寂寞","118220"
"杭州西溪路人行道塌陷疑似2人失联","109225"
"女子下班后应酬客户酒精中毒","109194"
"B站跨年晚会预告","109182"
"想见你","109133"
"成都中医药大学","96951"
"市场监管总局处罚京东天猫唯品会","95882"
"股市","94937"
"硬糖少女全开麦唱跳","94932"
"呼格案时任刑警队长自杀身亡","89612"
"迪丽热巴2020年最后一张自拍","88740"
"一张图感受冬天的不舒服","84459"
"阿根廷堕胎合法化","77150"
"特斯拉隐藏式门把手被冻住","73958"
"沈阳疫情","70337"
"黄明昊彩排把麦撞飞了","69769"
"原来鸭子也爱玩滑梯","67583"
"周翡第一次叫李晟哥","66853"
"女神降临","63879"
"易烊千玺回应粉丝为癌症患者捐头发","60929"
"于和伟哭戏感染力","58960"
"稻城亚丁入选国家5A级景区","52356"
"朱锁锁找到工作","49706"
"罗欣然被追杀","49132"
"送你一朵小红花","47387"
"心灵奇旅","46414"
"四川叫停家长批改作业","45511"
"上海将向医院同步推送医闹人员信息","45323"
"全国首套防溺卫士投用","44977"
