"hot_word","hot_word_num"
"金晨 不喜欢就是不喜欢","2838815"
"核酸检测阳性旅客达5个暂停该航线2周","2414938"
"直播还能这么玩儿","2401147"
"朱星杰承认与王岚恋情","2277025"
"胡一天乔欣亲出声","1548808"
"我国超一半人感染幽门螺杆菌","908795"
"哥老官 兽药","905670"
"兔子搓脸脸有多可爱","799957"
"港府官员宣誓效忠香港特区","776031"
"哈尔滨男子晨跑眉毛挂霜变鳌拜","767209"
"尼格买提父母爱情太好哭了","767207"
"王小岚否认自己是视频中的女生","766666"
"于正否认有儿子","749512"
"安徽发现一批次国产鸡腿外包装阳性","728944"
"苹果计划将iPhone产量提升30％","722872"
"糖水燕窝曝光者隐私遭辛选泄露","694765"
"王岚称另有男友","667139"
"朴彩英给金智秀送咖啡车应援","646622"
"QQ或推出已读功能","636126"
"有翡还原度","621583"
"向太晒向佐郭碧婷豪宅内景","573808"
"王一博好会哭","563879"
"国产千元机遭海外疯抢","501120"
"金晨拒绝陈一鸣","461555"
"何炅为了张杰的票戒酒7天","451627"
"于朦胧练舞好像做颈椎复健操","398166"
"小风暴","386653"
"超市查卡拒绝非会员购物","378225"
"国台办称绝不为台独分裂活动留空间","372908"
"恋爱中的男生又拽又可爱","371187"
"明道工作室回应","346354"
"金莎耿斯汉继续约会","344470"
"李汶翰工作室回应初面试嘴里含糖","307840"
"华盛顿国家大教堂敲响300下丧钟","301183"
"著名物理学家冯端院士去世","295135"
"东北虎也扛不住哈尔滨的冷","294813"
"富裕国家已预购超半数新冠疫苗","294116"
"Free C控诉Blow Fever","293935"
"奚梦瑶 烫头是冬天的仪式感","292982"
"我的悲伤无处不在","292560"
"QQ 怎么还当真了","291907"
"嫦娥五号回家时速度有多快","291617"
"蓝色复兴号来了","291054"
"唐艺昕圣诞热红酒vlog","290474"
"漠河95后女快递员极寒下工作","290039"
"狗子玩雪行为大赏","289176"
"一半法国人不愿接种新冠疫苗","288384"
"能让羽绒服冬天滞销的城市","288143"
"你好李焕英新预告","287820"
"生育补贴能提高生育率吗","287353"
