"hot_word","hot_word_num"
"特朗普明年1月将失去推特特别保护","2920133"
"周震南父亲股权被冻结3年","2079246"
"刘涛直播今天又抽海景房","1636159"
"谢娜发问号表情包","1575738"
"上海浦东","1124238"
"双11狂欢夜路透","1041291"
"杨超越 早知道我也收拾一下","990451"
"英国女王首次戴口罩亮相","789342"
"武汉派专车去接羊了","636122"
"班主任回应高三生大汗淋漓背书","543448"
"张大大发文告别演员请就位","530938"
"衢州","514475"
"苹果暂停与和硕新业务合作","471355"
"燕云台评分","437552"
"天津新增1例无症状感染为货车司机","421596"
"天津工业大学停止专升本招生","407584"
"凡尔赛文学","389948"
"谢娜 快本","389812"
"拜登再给已故长子扫墓","389419"
"婴儿从摇床摔下爸爸瞬间接住","389051"
"卧底出身的网店老板","388500"
"曹颖一点没变","388323"
"作业批出了手帐的感觉","387569"
"天官赐福","387524"
"梅拉尼娅建议特朗普接受失败","359176"
"江映蓉 女性不该只有白幼瘦","358058"
"邓超祝陈赫明年生日瘦回原来的样子","357662"
"小霸王被申请破产","356627"
"当狗狗偷吃了地瓜","356231"
"堵住自热火锅透气孔会引发爆炸","345872"
"杨幂后空翻踢腿","344651"
"杨超越醉酒后大喊爸爸妈妈","343973"
"世界最古老银杏树遭雷劈后自愈","343211"
"罗永浩直播公司四成股权卖近6亿","281143"
"浙江衢州一工厂发生火灾","279748"
"李晟","268888"
"韩磊杜江王一博致敬志愿军","256661"
"见过最有礼貌的口罩","255059"
"为踩点上班可以多拼","251419"
"为武汉拼过命的河北大哥走了","248701"
"朱时茂就这么抓住陈佩斯的","233322"
"超过56万韩国5G用户重返4G","231811"
"警方通报女生遭12人公园围殴","226033"
"草莓音乐节","224434"
"快乐大本营贴吧辟谣谢娜退出","180508"
"蒙淇淇77","178393"
"天津男篮算错分差","174623"
"男子凌晨2点江边看景被消防员救下","173634"
"急寻接触阳性进口带鱼包装男子密接者","166400"
"刺杀小说家新预告","166241"
