"hot_word","hot_word_num"
"累丑","4073640"
"最新百家姓排名","1567929"
"拜登谈儿子吸毒史","1366861"
"浙江省内一般人员返乡凭绿码自由流动","903253"
"随母姓与随父姓的比例","890081"
"R1SE发布声明抵制私生","648364"
"斗罗大陆","637266"
"2020年全国姓名报告","502066"
"张雨绮 唯独不怕没作品","498030"
"郝蕾方回应郭家铭","495125"
"火锅店称洗碗工赢40万大奖是游戏","475534"
"郭家铭 我爱的女人叫郝蕾","474630"
"错换人生28年案今日二审宣判","394762"
"李晟敏称秘密拍婚纱照让他很辛苦","379064"
"王者荣耀","374088"
"孙俪庆与邓超领证11周年","374029"
"腾讯回应年终奖发价值超6万元股票","373952"
"基金","373828"
"男高中生在女厕安监控威胁女生","373743"
"爸爸为10岁儿子买玩具拍连续剧","373665"
"妈妈坚持4年为孩子做诗词早餐","373576"
"陈赫为邓超庆生","373484"
"牛年对南方人太不友好了","373468"
"李现将军造型","373388"
"赵磊被私生按门铃","347498"
"耶鲁大学26岁华裔研究生遭枪杀","329294"
"中国亿元资产家庭13万户","323094"
"微信红包封面","322235"
"广东人无法读出来的名字","321640"
"跷二郎腿的后果","317859"
"唐三用昊天锤保护小舞","276719"
"创4脱颖而出制服照","271502"
"1959年到2019年的名字变化","268859"
"杨幂Y2K运动风大片","266743"
"猫和老鼠嗑到了","250015"
"懒人开胃脆藕片","236264"
"王一博时尚芭莎封面","233211"
"刚果东部暴发新一轮埃博拉疫情","233205"
"丁真家书","233194"
"火星为什么是红色的","233166"
"肖战唐三打戏","233156"
"深圳建立二手房成交参考价发布机制","233141"
"农科院和高校研发的美食","233132"
"上海交大3名本科生被勒令退学","226393"
"赵少康宣布参选台湾地区领导人","222384"
"马崇华被执行死刑","220934"
"援鄂护士梁小霞获评定为烈士","220353"
"小伙用中国风巧克力惊艳世界","219448"
"华为开除五名造谣传谣员工","219166"
"宋茜古装","214951"
