"hot_word","hot_word_num"
"蒋凡被中止认定杭州高层次人才","2801987"
"泰国将2021年中国春节定为法定假日","2303925"
"李易峰双男主大片","2296759"
"肖战 不减了吃面包去","2281530"
"肖战杨紫吻戏路透","1704572"
"西藏冒险王坠入冰川画面曝光","1480364"
"王一博眉钉","1396196"
"下雪了","1189855"
"新冠阳性男子篡改核酸报告回国","1011822"
"赵又廷挽救了差点裸泳的邓伦","968127"
"南京近两日学生可弹性上下学","878078"
"皮尔卡丹去世","821445"
"孙悦","768170"
"大连2名确诊新冠的婴儿情况稳定","723719"
"Subs歌词","714907"
"李易峰吓到头发飞起来了","713028"
"张慧雯想恋爱被亲妈打脸","705896"
"北京1月29日前所有老师全员到岗","698902"
"老干妈儿子公司被限制高消费","694551"
"李斯丹妮贾乃亮放空时在想什么","682815"
"张大奕","681984"
"周深 请降低对我的期待值","630257"
"流金岁月","541021"
"北京通报1例境外输入感染由福州入境","523116"
"你们家冷成啥颜色了","522487"
"五月天跨年官宣","508159"
"常山药业称中国1.4亿人阳痿被罚60万","441003"
"外交部回应指责中国隐瞒疫情谬论","440708"
"美团遭遇反垄断诉讼","440362"
"医院确认男生向女生泼洒的是硫酸","439974"
"广东被泼化学物质女孩眼角膜严重损伤","439516"
"福建离婚登记将增加冷静期","439063"
"寒潮","429258"
"乱港分子钟翰林被判4个月监禁","412801"
"有翡","401203"
"阳光之下","385132"
"杭州下雪","355199"
"赵小棠叫范丞丞范老三","352927"
"演唱会上最失控的粉丝","324695"
"官方已成立专班组调查王相军失踪","293590"
"冻手冻脚地图","293291"
"山东选调","293044"
"令人难忘的跨年舞台","292719"
"北辙南辕海报","292564"
"大江大河","292332"
"北京顺义所有小区禁止快递外卖进入","273250"
"全国多地纸巾涨价","272263"
"广东2021新高考方案公布","272086"
"刘诗诗倪妮双生大片","272038"
"晴雅集票房破3亿","271774"
