"hot_word","hot_word_num"
"李雪琴 王一博为什么要有标准","191573"
"卖高仿鞋团伙获刑并被罚1020万元","95670"
"天猫双11","95625"
"霉霉在薇娅直播间送祝福","95579"
"黄景瑜吴谨言座椅抱","94531"
"隐秘而伟大","92063"
"我们的歌","78520"
"美国同时出现抗议示威和上街庆祝","59485"
"郭艾伦被罚115万","46440"
"天津疫情","45863"
"黄绮珊张碧晨是否爱过我","45301"
"被坠楼者砸死的快递员妻子发声","44381"
"天津进入战时状态","38045"
"隐秘而伟大男主人设","32991"
"萧燕燕韩德让私奔","32508"
"周迅丸子头好可爱","31789"
"陆军某特战旅高原寒区潜水集训","31542"
"小霸王法人被限制高消费","30149"
"日本接连出现禽流感疫情","30143"
"天天向上","30055"
"刘昊然考编成功","30038"
"带女儿住桥下的单亲母亲获救助","29963"
"天津涉疫情货物已流向3个地区","29944"
"谨防街头扫一扫骗局","29878"
"公园配10名保安防游客踩粉黛草","29861"
"THE9合体留喻言位置","29037"
"李玟孙楠小鬼你怎么舍得我难过","28456"
"潍坊高新区禁止让家长批改作业","27615"
"特朗普团队正募集6000万美元用于诉讼","27602"
"大爷自制假人拉车在街头行走","27581"
"王源挥手背影","27560"
"綦美合哥哥回应","27560"
"苏宁 恒大","27541"
"谭德塞称期待与拜登团队合作","23386"
"C罗被踢中脚踝","23019"
"李佳琦直播","22557"
"薇娅品冠新歌爱你需要练习","22308"
"韩国脱发人口达1000万","22029"
"用一张图证明你压力比我大","21162"
"恋爱综艺中的意难平","21120"
"杨丞琳李荣浩隔空合唱暧昧","20732"
"谢楠桡骨粉碎性骨折","20514"
"QGhappy","19894"
"武汉一高校食堂员工用脚洗菜","19741"
"顾耀东放走沈青禾","17166"
"多款3000元内5G机型上市","17138"
"苏宁闷平恒大","16129"
"顾耀东追星","15675"
"记者节","15474"
"萧胡辇救太平王","15185"
