"hot_word","hot_word_num"
"易烊千玺问买不","2815470"
"香港特区暂停香港与荷兰移交逃犯协定","2677836"
"华晨宇的水润秘密武器","2570932"
"魏晨和张天爱跳舞害羞了","2562885"
"杨超越表演了个寂寞","2039594"
"掌中之物改名","1915242"
"双十一晚会节目单","1888901"
"居里夫人笔记仍具放射性","1742041"
"确诊病例从1到1000万美国经历了什么","1561158"
"双十一狂欢夜","1457844"
"姚沐希彭措分手","1390563"
"张杰又忘词了","1177181"
"THE9全员芭比粉","1094070"
"两护士救人后抬头发现是同事","949267"
"河北一幼儿园食堂现发臭肉馅","898196"
"周深跳极乐净土太可爱了","886843"
"谁给金子涵化的妆","878150"
"难听","877889"
"中国为什么要大量进口大豆","846544"
"宋茜工作室","785203"
"毛不易好像被伴舞绑架了","718341"
"被郑爽甜到姨母笑","679011"
"骗子把警察当同行还虚心请教","639474"
"格德斯愿意入籍中国","615309"
"富兰克林用中文喊篮板","614850"
"王源伴奏没声音的临场反应","614830"
"李润祺道歉","602973"
"青岛假睫毛订单量增加四成","567097"
"亚美尼亚","564185"
"小李子身材","563004"
"谢谢林志炫提醒我双十一是光棍节","542707"
"邓紫棋唱出演唱会的感觉","487162"
"心动的信号","406921"
"外交部回应巴西暂停对中国疫苗的实验","390332"
"蔡徐坤开场走的太有气势了","390244"
"李佳琦直播","390133"
"一口吃了个火龙果","337245"
"新闻联播","332842"
"华晨宇高音","280611"
"辽宁要求教师必须亲自批改作业","268707"
"被战友珍藏的毛岸英遗物首次公开","236736"
"76岁老人抢夺方向盘获刑","231443"
"湖南卫视超拼夜","228748"
"成都11月10日启动重污染黄色预警","210278"
"陈薇团队为新冠康复者研制新药","205777"
"薇娅直播","202519"
"北京绝杀广厦","185739"
"全世界海拔最高的快递点","174762"
"男子地铁突发癫痫车里恰巧有5名医生","171495"
"时代少年团镜头","170749"
