"hot_word","hot_word_num"
"三孩生育政策来了","4400221"
"广州暂停新冠疫苗社会接种","2147983"
"杨紫免除被告经济赔偿责任","1392643"
"京东618沸腾之夜",""
"面试结束被发朋友圈吐槽","1280863"
"辣笔小球被判八个月","1046962"
"三孩时代需要怎样的配套措施","886216"
"肖战代言倍轻松",""
"粉丝误把身份证和登机牌送给许凯","839233"
"沸腾之夜","772111"
"假如婚后老公不上进","696819"
"钟南山身型","617908"
"巴西200城爆发大规模示威游行","612670"
"张彬彬 上帝视角真的很烦人","611496"
"广州全市大排查发现阳性病例11例","592899"
"看觉醒年代的我","560536"
"三孩政策会带来哪些改变","560310"
"女子割双眼皮失败老公闹离婚","559265"
"关晓彤幼儿时期童年照","557245"
"肖战素颜彩排照","556003"
"印度新娘婚礼上猝死新郎转头娶她妹妹","555042"
"俞敏洪称身上西服100多元","553229"
"男子家暴赶走妻子后又带儿女寻妻","552222"
"男朋友的心思有多细腻","551939"
"见过最吓人的雪糕","532390"
"一家四代是校友","470827"
"10万剂只需打1针的疫苗抵达广州","439906"
"全国爸爸统一的头像","392459"
"35岁患者在病房第一次吃到生日蛋糕","382056"
"小孩假聪明家长该不该夸","372958"
"张艺谋起诉张伟平","365057"
"汤杰将参加NBA选秀","355920"
"完善生育休假与生育保险制度","355052"
"满足什么条件才会考虑三胎","344222"
"你怎么看开放三孩政策","309767"
"六一文案","264300"
"深圳暴雨","245598"
"中国女排 德国女排","245091"
"为什么烟民看上去更沧桑","244109"
"王子异方称简单快乐拖欠克扣演艺报酬","243027"
"紫金陈上1818黄金眼维权","242205"
"东莞暴雨","241559"
"适合儿童节发朋友圈的文案","240691"
"小时候和现在的5月31日","239203"
"尾款人三阶段","238145"
"陈婷 提前完成任务","237534"
"现在学校的设施太体贴了","236363"
"小朋友测完核酸用手势舞感谢医护","235512"
"你能接受孩子考不上高中吗","235229"
"宋祖儿王安宇CP感","234224"
