"hot_word","hot_word_num"
"传杨振宁去世假消息博主道歉","2392625"
"全国共有党员9191.4万名","1743726"
"神奇家电在哪里","1699104"
"白敬亭童年照","1371870"
"突然降温后的海南街头","1358291"
"名爵进入电竞圈","1334523"
"西藏冒险王遗体确认","1310754"
"廖启智 胃癌","852297"
"中共中央将颁发光荣在党50年纪念章","738216"
"三星堆","734317"
"马思纯 张哲轩","674950"
"浙江居家隔离允许外出","605664"
"专家说三星堆绝不可能是外星文明","569945"
"七一勋章","486504"
"推特CEO第一条推文拍出290万美元","442973"
"张京临场翻译高能时刻","429492"
"建党百年庆祝活动没有安排阅兵","403787"
"妲己女仆咖啡","403466"
"浙江师生可以不每日健康申报或打卡","403176"
"央视曝剑桥英语考试天价考位黑幕","402649"
"良品铺子鸡肉肠","402588"
"刘涛 我的身材我做主","401550"
"李晟说李佳航是极品黑","401389"
"为什么现实中看不到帅哥","400761"
"韩国推出抗日游戏","400162"
"张艺谋悬崖之上定档","399066"
"张哲瀚问粉丝明天去哪里见","399012"
"新手画眉的正确方式","398331"
"链家上海下架万套二手房源","398128"
"我国首颗进入日地L1点周期轨道航天器","398027"
"我们为什么需要读书","398011"
"网吧一年倒闭超12000家","360369"
"皓衣行","345238"
"网红零食遇到过哪些坑","324037"
"山东58岁高龄产妇生双胞胎","312112"
"逐渐疏远的友情该挽回吗","300249"
"谭松韵红色朝服造型","298936"
"核酸检测疫苗接种信息将整合入健康码","287871"
"繁盛一时的三星堆文明为何突然消失","245172"
"吉林发现巨型黑曜岩石叶石核","240589"
"郑云龙德龄与慈禧","238417"
"和猫咪的X光合照","219715"
"三星堆最大青铜尊被提取","211748"
"火箭结束20连败","188683"
"中国新冠疫苗海内外接种过亿","184078"
"百度香港上市12岁开发者敲钟","180370"
"王毅会见俄罗斯外长拉夫罗夫","178852"
"欧文因家事缺席客场比赛","164759"
"超浓油柑水果茶","158775"
"延续实施应对疫情部分税费优惠政策","140534"
