"hot_word","hot_word_num"
"微信状态背景图","475167"
"昆明劫持人质案件致1死7伤","202174"
"看姐姐乘风破浪","200421"
"西藏冒险王弟弟回应网传降噪视频","158342"
"新华社评郑爽事件","118896"
"绝美蕾丝限定唇膏","116530"
"赵丽颖工作室声明","116045"
"华晨宇 我们是有一个孩子","110477"
"山海情","107885"
"央视专题片披露孙小果案大量细节","96077"
"为什么这些人上了中方制裁名单","91054"
"张馨予手扶拖拉机斯基舞台","90644"
"陈妍希初舞台为儿子唱歌","88168"
"那英安慰张柏芝说我没投你","87388"
"石家庄第三轮全员核酸检出阳性样本30例","83373"
"5人在凉山林区生火烧烤被刑拘","80179"
"华晨宇张碧晨和女儿合影","74924"
"冯绍峰工作室声明","71829"
"孙小果连续七年被评为劳改积极分子","70622"
"多个网站平台暗藏代孕服务","64936"
"天赐的声音","62156"
"张艺兴方否认恋情","61728"
"李菲儿听孩子话题一脸茫然","59392"
"杨幂工作室辟谣声明","58021"
"内娱辟谣日","56793"
"金巧巧 我的表演可能是个笑话","54916"
"刘卓 严格","54358"
"昆明发生一起劫持人质案件","53462"
"牛年纪念币","46949"
"齐达内新冠检测阳性","45518"
"会理县回应B站UP主墨茶去世","44951"
"杨祐宁聊女儿太暖了","44905"
"法国立法禁止开具处女证明","44816"
"上海居民带上宠物集中隔离","42400"
"拜登要求入境美国旅客隔离7天","40074"
"我的小确幸","39882"
"奶爸当家开播","38312"
"最强大脑","33659"
"上阳赋","29178"
"养猫居然对身体有好处","25888"
"直通春晚","25724"
"网易大厦环境检测阴性","23943"
"干饭人梅菜扣肉","23745"
"大头娃娃面霜评测者发声","22918"
"乘风破浪的姐姐2","22485"
"原神","21797"
"警方通报男子劫持人质被击毙","20468"
"基金","19849"
"于志刚","19584"
"无锡一份进口车厘子表面检测阳性","18719"
