"hot_word","hot_word_num"
"吴彤收到十万条私信不敢看","317267"
"特斯拉再次深夜发声","245884"
"开车挖矿","201445"
"赵露思工作室声明","192343"
"特斯拉提供刹车事故前1分钟数据","158213"
"开出哪儿就去哪儿","155742"
"许晴肖战吻戏","155665"
"每年约1000万吨塑料垃圾流入海洋","153303"
"如梦之梦直播","150708"
"顺丰财务负责人辞职","148189"
"共同构建人与自然生命共同体","145999"
"佟大为 父亲会影响女儿的择偶标准","143131"
"赵露思点赞","116796"
"仝卓诉山西招考中心案开庭","104464"
"西安某高校发生持刀劫持事件","99191"
"支持有条件地方和重点行业企业率先达峰","97685"
"张艺兴用彩灯的手机壳","96231"
"原来胃病不能喝粥","93439"
"蔡徐坤进被窝速度","83933"
"国产芯片订单量井喷","70975"
"付国豪离职","70778"
"程莉莎婆婆情商","70694"
"许凯腰疼","68165"
"王源冲天辫","63544"
"鹿晗黑色指甲","61470"
"龚俊直播","58377"
"杨超越回眸","57059"
"河南家长自费百万在校门口建天桥","56646"
"硬盘3天狂降2000元","52652"
"广东第16次杀进总决赛","50818"
"青春有你","50339"
"过三爽教过爷谈恋爱","50177"
"八零九零","47824"
"对象向自己奔来是什么体验","46701"
"湖北女子4年7次诉讼离婚未果","44616"
"花21万元补数学考59分","44566"
"小舍得","44387"
"东航辟谣员工不雅聊天记录","43347"
"倪大红白敬亭爷孙cp","43221"
"一万年前的水母湖是怎么形成的","41212"
"胡明轩赵睿鼓励高诗岩","40490"
"杜富国清唱夜空中最亮的星","40234"
"BO道歉","39889"
"林巧稚75年前的手写病历","39189"
"妈妈教给我的婚姻观","38154"
"创造营25强决赛倒计时采访","37525"
"特斯拉称将配合调查接受监督","37351"
"长歌行","37274"
"窥探","34838"
"梁辰陆景门后壁咚吻","31099"
