"hot_word","hot_word_num"
"向太晒向佐郭碧婷北京豪宅","4751894"
"外交部回应新冠病毒2019年或已在意传播","2868466"
"jasper对着每个镜头道歉","1567828"
"爱马仕将建最大鳄鱼养殖场","1299210"
"凡尔赛文学梗为何能爆火","929775"
"明星古装群像","916546"
"冯柳","889685"
"你有容貌焦虑吗","848161"
"SM新女团aespa风格","807607"
"基辛格警告美国下任总统","770824"
"央视调查湖北荆州巨型关公雕像违建始末","657748"
"舒畅否认隐婚生子","656741"
"R1SE只有一个座位","588314"
"天津2名冷链从业人员隔离期核酸阳性","584556"
"医生喝葡萄糖遭质疑市民专程送水","577123"
"腾讯发布虚假广告被罚20万","567094"
"魏大勋蓝色寸头","560314"
"打了瘦脸针的GAI","544316"
"龚琳娜签不假唱协议","535429"
"晚上不要在天台晾衣服","532486"
"麻辣豆浆毛肚火锅","484942"
"宋茜风起洛阳开机图","481723"
"CNBLUE回归","447938"
"杨紫谈演员的信念感","430220"
"金惠美手写道歉信","423698"
"KDA","394560"
"高毅","384116"
"OPPO卷轴屏概念机","368028"
"柳智敏镜头多","364016"
"经济独立且自由的人","305136"
"吴尊友提醒海淘要注意这些","297912"
"赵丽颖谈网络评价","297864"
"WINTER好可爱","297819"
"应采儿教育方式","297747"
"外交部回应英国驻重庆总领事跳水救人","288222"
"原来柚子瓤还可以做成软糖","280000"
"aespa出道曲MV","276411"
"中华白海豚迷路误入东江后死亡","270272"
"综艺里明星扮素人名场面","261371"
"钟南山被催睡觉和妻子讨价还价","238451"
"小时候的天赋长大后消失了","238080"
"蜜汁自信wave","232828"
"王智签约赵薇工作室","229174"
"妇联回应女子无法怀孕被夫家人虐待致死","224391"
"中央气象台三预警齐发","220890"
"魔镜","220844"
"白酒","200571"
"蛋壳公寓租户排队退押金","199388"
"武汉彩虹","198590"
"王嘉尔碎发长刘海造型","197900"
