"hot_word","hot_word_num"
"张子枫帮王圣迪整理头发","1709242"
"向台湾列车出轨事故遇难同胞表示哀悼","1050254"
"倪妮来杯宇宙摩卡","1005156"
"接种新冠疫苗女性应注意什么","971133"
"张彬彬 明天不更新可以吗","966767"
"倪妮生图","942765"
"男子月薪5万征婚被骂过于自信","934758"
"瑞丽一市民不执行居家隔离令被罚","834837"
"原来派大星的坐姿是真的","602776"
"我国已接种新冠疫苗13380.1万剂次","553843"
"独居女生坐电梯的小心机","415690"
"杨幂 姐姐就是嘴甜","413125"
"黄英儿子给Lucky写信","410160"
"酒泉一班主任被曝对学生罚款数万","405612"
"迪丽热巴吴磊屋顶抱","383086"
"司藤就要大结局了","347928"
"赵一曼给7岁儿子的绝笔信","347104"
"杨幂抹胸绸缎羽毛裙","346297"
"加拿大运动员入籍中国","345474"
"张馨予的开馨农场","344133"
"DWG皮肤","343165"
"非正式会谈录制","342144"
"吴磊把粉丝送的笋吃了","340993"
"如何不提雪字描述雪很大","300255"
"哥斯拉大战金刚","289596"
"刘嘉玲问大张伟为什么一直模仿梁朝伟","271600"
"被校园恋爱甜到了","247723"
"2020年因公牺牲民警名单","244461"
"微软天价合同为美军打造AR头盔","239247"
"杜兰特因不当言论被罚款5万","238426"
"狗勾走路翻车现场","237626"
"陈祥榕烈士孩子们带了你爱吃的橘子","222215"
"赵丽颖的自拍没有人","212730"
"李银河评我的姐姐","200172"
"福建一小车坠溪致3人死亡","197040"
"白敬亭脱鞋脱了个寂寞","191770"
"我的姐姐票房破亿","178911"
"山河令","168520"
"顶楼锡京仿妆","160481"
"Angelababy晒樱花自拍","156449"
"陈红军墓前孩子第一次见到爸爸","149465"
"我的姐姐开分","141515"
"我的姐姐","137816"
"美式咖啡用英语怎么说","134203"
"雷佳音贾乃亮邓伦翻旧账","123753"
"科研人员发现中医经络存在证据","123445"
"QG赢了","122291"
"妻子的浪漫旅行5定档","121929"
"芝士流沙爆珠青团","110259"
"教育部要求提高师生疫苗接种意愿","109652"
