"hot_word","hot_word_num"
"建议应届生身份保留延长至5年","716387"
"建议提高来华留学生招生标准","240127"
"王鸥连空气都要保鲜","235749"
"董建华梁振英发表声明","212759"
"建议新生儿指纹采集为身份登记必备流程","207365"
"田雨把自己的西装披在倪妮身上","206180"
"华晨宇模仿汪峰被章子怡认证","204657"
"张雨绮又没赶上红毯","153614"
"河南博物院复原古乐器演绎清平乐","148042"
"百变大咖秀","147540"
"印度法官建议强奸犯娶受害者换免罪","147538"
"关晓彤宋亚轩跳十面埋伏","140672"
"山河令","140596"
"冬梦之约","140472"
"建议制定大学数理化水平等级考试","140093"
"世界首家太空酒店预计2027年营运","140020"
"露娜摔下楼","139820"
"韩美娟说参加创4少赚了600万","139684"
"樊振东荣立一等功","116109"
"进击的巨人","110952"
"毛晓彤缎面露背鱼尾裙","105093"
"吴谨言晒短发造型","96219"
"王牌对王牌","93114"
"闺蜜应该被无条件信任吗","88078"
"70国强调香港事务是中国内政","81972"
"一直说我爱你会发生什么","80330"
"孙俪晒低脂晚餐","78320"
"中学校长开学典礼上喊话德育处","75411"
"超30位日本名人请辞奥运火炬手","75004"
"建议将心肺复苏术培训纳入驾考","74922"
"李现顺毛自拍","67995"
"李一桐鎏金丝缎抹胸裙","63428"
"第二名的逆袭","62545"
"俞敏洪建议将儿童孤独症筛查入医保","61538"
"电视剧品质盛典","60985"
"日本老人波澜万丈的坎坷人生","56230"
"华晨宇 花峰想知道汪峰老师怎么评价","54676"
"杨紫肩颈线","50224"
"建议将近视防控节点前移至0岁","48681"
"宋亚轩古装地板动作","48220"
"锦心似玉","47973"
"最强大脑","47752"
"吴白艾情接吻被围观","46312"
"暴风眼","43175"
"玲珑大结局","41433"
"建议调整小学入学年龄划分节点","39248"
"热恋草莓春雪鲜牛乳","35192"
"春日清甜紫玫瑰妆","34558"
"三四线城市共享电单车火了","34342"
"全球首例非人类新冠疫苗接种","34069"
