"hot_word","hot_word_num"
"最高检报告点名辣笔小球","1174315"
"修复巴黎圣母院需近千棵百年橡树","1172121"
"张雨绮 买克拉只选I Do","1126190"
"今后一年将制定突发公共卫生事件应对法","980740"
"张伯礼说明年开春有望摘口罩","871279"
"腾讯为贩售鬼谷八荒离线版道歉","516280"
"浙江今年有20例14天隔离后阳性病例","510696"
"建议为缩小贫富差距可考虑开征遗产税","490314"
"温客行喝醉酒","472553"
"张镇麟46分","470820"
"青你3主题曲音源试听","470259"
"锦心似玉","469550"
"李佳琦直播","468525"
"文在寅称韩国女性平等情况令人羞愧","465203"
"奥地利叫停接种一批阿斯利康疫苗","459453"
"龚俊工作室声明","458110"
"王冰冰请老人对着镜头和子女说句话","455435"
"基金人已亏到毫无波澜","452457"
"八省联考成绩","449183"
"白敬亭让大家克制","442100"
"郑州拟调整公积金贷款政策","417071"
"王传君 齐溪","415486"
"和马后援会辞职重组","407027"
"近8成避孕药由女性主动购买","395977"
"刘宇宁演唱网剧司藤主题曲","387789"
"定制蛋糕翻车风险有多大","360890"
"锦心似玉预告","318835"
"顶楼穿搭教科书","302291"
"广东男篮 辽宁男篮","301379"
"张艺兴翻牌粉丝","300807"
"建议培养短期全科医生缓解村医短缺压力","268979"
"赵敬究竟有几个儿子","264597"
"郭德纲给女粉丝送冰糖葫芦花","252982"
"30岁对女性到底意味着什么","249332"
"河南庙会2平米摊位拍卖到27.2万","241032"
"没脖子的好处","225586"
"过去2年因正当防卫不捕不诉800余人","224617"
"2020年结算新冠患者医疗费28.4亿元","211184"
"鹦鹉吵架能有多凶","210422"
"米卡庆怜赞多后援会辟谣退赛传闻","208692"
"建议主流媒体适当减少娱乐栏目比重","207246"
"长沙粉红色灯光秀","206143"
"2020年检察机关办理各类案件301万件","204182"
"万有引力博物馆","203652"
"蒜蓉黄油面包虾","199578"
"建议降低平日高速费代替节假日免费","197707"
"山东舰话务女兵能记上千组号码","197475"
"时代峰峻澄清丁程鑫资助贫困大学生","197252"
"最高检工作报告","186985"
"来自母亲发自内心的笑","186690"
