"hot_word","hot_word_num"
"韩国女子咬掉性侵者舌头被判无罪","3301130"
"拜登将宣布美国加入全球疫苗计划","3106671"
"知情人称吴秀波今后将不再从事演员职业","2963216"
"曾志伟小儿子曾国猷离婚","2479041"
"艾克里里是怎么变白的","1396995"
"乘风破浪的姐姐二公","1234497"
"饿了么回应变相降低骑手过年奖励","1211156"
"微博之夜阵容","984859"
"华春莹批加拿大贼喊捉贼","979318"
"4名解放军官兵在中印边境冲突中牺牲","977562"
"骑手质疑饿了么变相降加班奖励","753555"
"王灿主动追求杜淳","743031"
"复旦大学推出拔尖学科高中先修计划","719124"
"巴菲特减持苹果和银行股","700578"
"印度微型牛濒临灭绝","685314"
"千万别把智齿一次性拔完","658702"
"李宇春 我不想他们拆开","648087"
"原来天线宝宝还分性别","618699"
"扬州一11岁女孩坠楼身亡","615214"
"任重求导演AI换脸","597476"
"女医生拿自己做实验后报警并致歉","565594"
"对亲戚最无语的一次","483632"
"山东禹城火灾幸存大儿子要撑起蛋糕房","385363"
"暗恋橘生淮南","383307"
"你好李焕英路演","336285"
"在日本遇到最恐怖的事","333329"
"2分钟教你使用AED","329065"
"詹姆斯最年轻35000分先生","322618"
"国家文物局督办翁丁村火灾事故","310071"
"人民日报批BBC刻意妖魔化中国","300369"
"科学家对首个恒星级黑洞作出更精确测量","297547"
"贾玲 让你妈给你跳行不","267510"
"员工回家过年拒带电脑工作被开除","255068"
"华春莹说中方让疫苗成为全球公共产品","245965"
"顶楼第二季开播","242985"
"唐九洲不愧是文化人","241828"
"如何平衡学生成绩和减负","210809"
"毅力号成功登陆火星","210738"
"米聊关停","199847"
"阿煜说自己跳舞蛮拉胯的","191339"
"官方回应东北地区率先全面放开生育限制","182175"
"你好安怡开播","179014"
"美国散户带头人遭起诉","178833"
"虞书欣加上了Lisa微信","178751"
"南极雪变色","177593"
"张小斐跳舞真好看","177205"
"北京朝霞","175740"
"篮网 湖人","171259"
"以前选秀是怎么投票的","170841"
"海南离岛免税店春节销售额超15亿元","170737"
