"hot_word","hot_word_num"
"宋亚轩把王一博认成吴君如","1807687"
"延迟退休不会一刀切","1611693"
"底妆2.0时代","1443277"
"教资","1443277"
"范丞丞回应没认出张小斐","1348724"
"骂学生笨支教老师被取消研究生资格","1098885"
"温客行 美强惨","1091175"
"十四五规划和2035年远景目标纲要全文","1024073"
"多地婚姻登记窗口3月14日加班","941365"
"弗洛伊德家人获赔2700万美元","883909"
"武汉最高礼遇迎接援鄂医护赏樱","865697"
"关晓彤开衩红裙","815546"
"精神出轨该不该选择原谅","812707"
"地铁小哥10秒救回误入电梯口萌娃","804062"
"直播武大樱花季抗疫专场","797824"
"延迟退休改革原则确定","791473"
"李佳琦晒妹妹奈娃同框图","790999"
"俄罗斯被禁止奥运会用喀秋莎替代国歌","715650"
"教资 高山滑雪","712720"
"日本外务省发言人发表不当涉港言论","678980"
"王祖蓝杜海涛涛妈眼睛连成一条线","675232"
"这日语也太正宗了","515086"
"教师资格证作文","475183"
"教资选择题","455144"
"光明日报 996和007是违法不是奋斗","421396"
"教资作文","368156"
"何炅看宋亚轩的眼神","349516"
"公寓油烟机藏摄像头正对着床","314348"
"如何看待正月里不让理发","293053"
"延迟退休","280353"
"和相亲对象周旋的经历","278615"
"只有本专业才明白的梗","258600"
"世卫称新冠病毒将会出现更多变异","248352"
"司藤","245739"
"王栎鑫否认参加中国版我们离婚了","244708"
"小米回应美法院判决","224138"
"宋亚轩夜礼服假面","220376"
"作家能不能教作文","217583"
"邢菲看顶楼后遗症","201357"
"我国成功发射遥感三十一号04组卫星","200623"
"范丞丞没认出张小斐","171809"
"ipad猎巫","169358"
"教师资格证考试","166776"
"长白山下冰凌花开","154924"
"当醉拳遇上十面埋伏","152529"
"阿凡达重映首日票房超2200万","152183"
"上海地铁乘务员有多热情","146500"
"卡梅隆回应阿凡达重映","142081"
"给6万棵杨树画上性别符号","134211"
"张晓明说被美国列入制裁名单深以为荣","133686"
