"hot_word","hot_word_num"
"陈建斌蒋勤勤接吻","2753350"
"好利来称卷入西藏冒险王事件系谣言","1847110"
"陈卓璇评价张雨绮能力普通却自信","1782705"
"被男友拍成了一只青蛙","1358283"
"刘诗诗生图","1267032"
"山河令演唱会批复","1261422"
"别轻易尝试黄瓜减肥","1133355"
"外交部向全球特别推介湖北","1075914"
"速度与激情9确认引进","1002665"
"Angelababy短发","946012"
"魏大勋摘头套","943156"
"秦海璐一早起床就听霸总文","923465"
"赵立坚说美方泼中国脏水是想转移视线","899707"
"双胞胎学生过斑马线被撞一死一伤","882083"
"利路修 从喜欢到恨只有一步","855919"
"房产税","835008"
"鸭舍失火导致一万只活鸭变烤鸭","824936"
"日本大阪将取消奥运火炬传递活动","819402"
"备孕者可以接种新冠疫苗","817155"
"好利来","815959"
"你是我的城池营垒全员剧透","663373"
"家里穷对性格影响有多大","610279"
"男子做核磁共振被忘在检查舱","541369"
"马思纯不舍米佧","486721"
"张哲瀚胶片感生活照","387895"
"陈小纭回应怼网友","362638"
"杜兰特到底有多少针织帽","333403"
"记忆细胞遇病毒感染可被唤醒提供免疫力","316310"
"王一博连续六年为汪涵庆生","307667"
"星巴克试用可重复使用杯子","301597"
"你是我的城池营垒","288601"
"建立完善个人收入和财产信息系统","284236"
"每个人的身上都有苗苗","281343"
"男子在机场摆渡车上猥亵少女被拘","264939"
"朴春嘴唇","237617"
"长歌行","219327"
"陈祥榕与家人最后相聚画面","214785"
"一季度北京平均月薪达11187元","190746"
"小森生活","177566"
"大宋宫词版狸猫换太子","175035"
"尹正 我的尺寸已经回到陆离时期","172587"
"网络缩写引发的社死瞬间","172164"
"货车司机被罚款扣车后服毒自杀","171852"
"要放弃家乡优越生活去大城市打拼吗","171840"
"RNG FPX","159301"
"以色列在红海袭击一艘伊朗船只","157258"
"内蒙古纸面服刑案问责74人","156580"
"为什么说不打新冠疫苗会吃亏","156045"
"巴西侨领张伟晨练时遭歹徒枪击遇害","155219"
"山河令","153120"
