"hot_word","hot_word_num"
"郑秀晶 创4","3238064"
"大润发就女装尺码建议表致歉","1694532"
"素媛案受害人搬家","1564448"
"孙俪发长文为等等庆生","1141607"
"特战女兵身上爬满虫子竟纹丝不动","978666"
"王一博的SVIP","966219"
"退款","729715"
"天津一冷库1份样本核酸阳性","693043"
"拜登选择其长期助手担任白宫办公厅主任","676768"
"买到假名牌牵出1.6亿制售假案","668942"
"伊能静双十一买900件商品","656948"
"跟面试官说瞎话讲竞争女生是女朋友","606917"
"我国单身成年人口2.4亿人","604828"
"南风知我意开机","600382"
"入境文件纸里藏毒75份","590904"
"48岁的陈慧琳","583094"
"唐嫣直播","579254"
"女生期中考试考高分回家嚣张砸门","569644"
"田鹏飞新冠检测呈阳性","567126"
"网红用棍猛砸41楼落地窗测质量","561312"
"人类的幼崽到底有多可爱","504110"
"95岁奶奶赶集给近40岁孙子买零食","503311"
"霍尔沃茨的四个学院","467133"
"火箭多名球员不满球队","422182"
"最怕明星营业说青岛话","395657"
"张恒关联公司被列为被执行人","356278"
"牦牛误入一高中操场散步撒欢","348941"
"小霸王声明并未破产","340276"
"美国务院阻止拜登和外国领导人通信","334181"
"潜江无症状感染者居住小区全员阴性","333600"
"杨紫复古色彩视觉大片","310984"
"可以拉花的小猫","297172"
"郑州现脱单公交","279050"
"英国首相称特朗普为美国前总统","254795"
"江南百景图","250995"
"威少去哪儿","250452"
"特朗普出售其私人直升机","249038"
"刘耀文下课冲向食堂的样子","246010"
"体院拔河可能要用钢绳","244999"
"于正警告造谣者","239771"
"你微笑时很美回应抄袭","231126"
"金希澈写外卖点评好认真","224253"
"金贤重胜诉","221960"
"让人无法抵抗的漫画腿","221506"
"原来猫也能痛并快乐着","211277"
"没有人在周四还能上得动班","209976"
"多地开启医用耗材团购","206212"
"遭父亲虐待男童部分手指需切除","203791"
"英雄联盟","199342"
"高三老师自习课给学生传小纸条鼓励","198553"
