"hot_word","hot_word_num"
"王毅说如果不爱国谈何爱港","1421741"
"建议增加独生子女看护假","1385693"
"周笔畅李佳琦撞款了","1341048"
"岳云鹏自己P的童年照","1299836"
"建议公务员考试打破35岁门槛","1237458"
"黄奕说男孩比女孩更需要爸爸","1224115"
"建议清理以罚款为目的的电子抓拍","790950"
"外交部将为湖北举行全球特别推介会","730244"
"2021中国发展六大新走向","702058"
"哪吒给你好李焕英的贺图","685884"
"周星驰现身吴孟达设灵仪式","677920"
"专家建议女性要每年做一次妇科检查","663407"
"吴孟达设灵仪式","519118"
"妹妹为捐髓救姐姐每天跑10公里","480166"
"王毅谈台湾问题","443614"
"刘亦菲春日紫樱蛋糕裙","405789"
"李钟硕扎丸子头","402147"
"拉萨舰入列北海舰队","401094"
"UFC","395418"
"赘婿里的意难平","392751"
"分手了彩礼要不要还","388241"
"清华女生节条幅","386022"
"建议男性陪产假不低于20天","364175"
"王毅答记者问","343663"
"时代少年团清唱宠爱","331994"
"赘婿","302904"
"建议减少学校与教育无关的工作","296150"
"NBA总裁拒绝更换联盟Logo","292044"
"美国钢铁价格高于全球市场价格近七成","291990"
"王嘉尔隔离第一天视频","291952"
"美国抗议现场鼓励孩子烧口罩","275840"
"清澈的爱只为中国MV","266674"
"你说什么是爱情","259077"
"山河令","253093"
"女生节","248298"
"东海航空回应机长与乘务长互殴","247882"
"张桂梅谈华坪女高为什么本科率高","214512"
"建议提高网约货车司机准入门槛","210114"
"编剧称山河令是圆满结局","209092"
"张桂梅跟学生说走出去就不要回头看","183456"
"韩国数千人接种新冠疫苗现不良反应","181594"
"吴孟达曾带一麻袋现金到汶川救助","172044"
"张桂梅说女高校训给了孩子们自信","167382"
"建议公安机关进行反家暴专项统计","166720"
"代表建议中小学体育课晒课表","166223"
"云南彩色油菜花","150151"
"iG TES","138289"
"李佳琦直播","137129"
"宋亚东UFC首败","129114"
"马嘉祺告别我就是演员","128711"
