"hot_word","hot_word_num"
"高圆圆小学时的证件照","2646688"
"英国首相想把新冠病毒归咎于中医","2158150"
"雪梨年货心意先到家","2139031"
"肖战说自己长了一张大众脸","2011077"
"朱锁锁怀孕","1784344"
"不塑料的闺蜜有多暖","1634249"
"张雨绮 这一年嘴都没闲着","1069603"
"谢允求周翡嫁一个短命的丈夫","1000132"
"遭退单代孕女童生物学父亲现身","911353"
"网友称被拼多多APP远程删除照片","800288"
"流金岁月","791387"
"山海情开播","628531"
"萧綦一个月不洗澡","564606"
"石家庄新增21例确诊","503607"
"杨幂行走的饭圈百科","488262"
"罗晋上班图像一条贪吃蛇","479168"
"如何看待先婚后爱","474133"
"女孩子来例假最希望男孩子说什么","473590"
"山东省委书记喊话被困工人","469676"
"北京居民人均可支配收入居全国第二","467795"
"应聘骑手被要求自愿放弃社保","462510"
"超市给老人贴我是小偷纸条","460586"
"新冠疫苗保护效力79.34％意味着什么","457004"
"雪顶草莓脏脏挞","454453"
"上海上港更名为上海海港","449435"
"奇妙之城重庆篇","449363"
"阳光之下","367153"
"RW战胜TES","361387"
"军营版送你一朵小红花","361117"
"去年全国基本医保参保人数13.6亿人","361009"
"奶奶辈的气质能有多绝","360904"
"仅39%美国人负担得起1000美元紧急开支","339644"
"哈尔滨香坊","315537"
"有翡","312513"
"特朗普承认自己对国会骚乱负部分责任","290297"
"金世正否认与吴世勋恋情","280118"
"打麻将容易让人性情大变","278816"
"山东金矿事故迟报30小时","264563"
"在鬼屋当鬼有多难","260613"
"警方介入调查假冒健康码软件","259567"
"南京扬子石化丁苯装置起火爆炸","236586"
"警方通报湖南高院女法官被同乡刺死","235170"
"上阳赋","229075"
"肖战发文谈重庆","228722"
"央视牛年春晚Logo","228527"
"滔搏","226804"
"如何看待留守老人大多是男性","226623"
"王一博侧脸轮廓","218627"
"CBA名帅为裁判团队授课","216020"
"首个遭代孕客户退单女童无法上户","181476"
