"hot_word","hot_word_num"
"郭老师 我儿子要来啦","5195058"
"新冠疫苗接种9个月还有一定水平抗体","3141862"
"偶遇王子文吴永恩逛街","2468943"
"沈梦辰录真正男子汉暴晒后的肤色","1625641"
"威廉王子被评为世界最性感秃顶男人","1314566"
"3月最后一波薅羊毛指南","975868"
"吊牌写含96%羊毛实际一根羊毛都没","942370"
"中国新冠疫苗已在50个国家和地区使用","570495"
"这就是帅哥氛围感吗","532183"
"已设计新冠疫苗加强针","482569"
"Abbily转性成功","433714"
"张绍刚说龚俊很能吃苦","431154"
"山河令","381512"
"美国爆发亚裔反歧视大游行","297261"
"尹正第二周吃了什么","292989"
"蒙古国沙尘如何进京","262510"
"黄磊说节目跟流量没关系","262376"
"Angelababy绝美精灵造型","261305"
"华为拿下支付牌照","260598"
"公交公司为一个人设一个公交站","260424"
"司机出现幻觉致40秒6连撞","259416"
"尚雯婕说厕所是社恐人的共享充电宝","259256"
"任嘉伦叫颖儿原名刘颖","258568"
"王一博穿的像养蜂人","257586"
"肖战玉骨遥路透","257256"
"景甜南宁","256287"
"西安钟楼熄灯瞬间市民围观打卡","256002"
"共享充电宝又集体涨价了","255069"
"边防部队有了新式训练鞋","254464"
"你生日在圆周率第几位","253889"
"杭州女子生三孩哺乳期被开除","253525"
"套路贷被害人生前哭着说早死早解脱","247372"
"听姐说","233588"
"我才不要和你做兄弟开机","229912"
"恋与制作人","205381"
"奔跑吧珠海路透","185311"
"Hero LGD","174139"
"城管威胁店员清理贴纸否则格杀勿论","171031"
"300秒看熊猫专列有多巴适","164337"
"韩国接种新冠疫苗后可休假1天","134152"
"阿德签约篮网","121687"
"五彩芝士火鸡面野餐饭团","120599"
"创4二公直拍","119666"
"黄俊捷 花儿超级乖","114085"
"中国女子在美失踪2年遗骸被发现","113988"
"妈妈说出李焕英同款台词","113095"
"大学生酒后强奸女同学获缓刑4年","112151"
"2021LPL","110948"
"顶楼","110091"
"北京蓝太阳","109123"
