"hot_word","hot_word_num"
"王菲谢霆锋牵手","3931003"
"一百多买包怀疑是假LV","2982212"
"夜里的事别挂脸上","2501551"
"陈坤儿子晒与女生合照","1608894"
"南大碎尸案家属撤诉","1444626"
"娄滋博","1327989"
"得物回应个别鞋款价格波动","960723"
"杭州832对夫妻因离婚冷静期放弃离婚","911720"
"律师砍价免费拿未成功起诉拼多多","680214"
"中国7.7亿农村贫困人口摆脱贫困","646913"
"少年感到底是什么","640660"
"Rihanna参加反歧视亚裔活动","635076"
"朝鲜不参加东京奥运会","624044"
"NINEPERCENT出道三周年","532952"
"单田芳先生的墓碑 且听下回分解","478930"
"小欢喜编剧 南京爱情故事在炼成中","452525"
"小舍得定档","450959"
"王冰接受审查调查","450508"
"假如用一亿换你的一分钟","447951"
"风筝线断了应尽量回收","447381"
"女生与父亲发生争执负气跳江","445871"
"中国疫苗接种率远低于英美国家","432343"
"良辰美景好时光定档","386940"
"游客穿越西藏一峡谷偶遇雪崩","386935"
"首艘国产航母山东舰到底长什么样","386931"
"饭圈集资量力而行","386930"
"号手就位定档","380045"
"年下不喊姐","370253"
"今天是奥特之母的生日","366750"
"库克称10年内可能卸任苹果CEO","364820"
"人类减贫的中国实践白皮书发布","363860"
"律师回应南大碎尸案家属撤诉","340853"
"在中国长大的外国人的烦恼","327269"
"没想到考拉这么悲惨","301310"
"韩国30多岁未婚人群中超半数与父母同住","294255"
"女子购买南航快乐飞后遇14次航变","273599"
"原神","262611"
"美颜滤镜下的景甜张彬彬","261933"
"丁真 见到了贾玲的妈妈","251145"
"王者荣耀","240088"
"因口误引发的社死现场","229964"
"光遇","218083"
"哪个瞬间你感觉青春结束了","218054"
"山河令演唱会","209069"
"黄河古村梨花开","208577"
"尾鱼在嗑真人CP","208468"
"王毅奉劝日方不要把手伸得太长了","197657"
"欧文40分","193740"
"河南一商场举办发呆大赛","192725"
"陈卓璇点评丁太昇","192241"
