"hot_word","hot_word_num"
"十三届全国人大四次会议新闻发布会","109070"
"代表建议让学生在校内完成家庭作业","106536"
"发光玩家在线应战","96015"
"鲜花价格猛涨","86685"
"建议鼓励用人单位为职工提供托幼服务","81645"
"超S自拍季","80732"
"中国17支新冠疫苗进入临床试验","77495"
"江苏明确教师不得用手机布置作业","72881"
"人大将审议完善香港选举制度议案","68514"
"代表建议设轻罪前科消灭制度","63714"
"菠萝价涨近3倍创历史新高","63201"
"杜淳哄王灿测血糖","63017"
"全国人大会议议程","62657"
"院士不建议普通孩子学奥数","62163"
"全国两会","62084"
"中国抗疫合作不为谋求地缘政治目标","61514"
"新西兰北岛海域发生7.3级地震","61244"
"山河令孙俪错位图","60791"
"金莎挑战10天不洗头出街","60272"
"海底捞牛肉粒变素了","60148"
"白举纲微博评论","59615"
"马化腾建议共享单车社区团购纳入监管","59205"
"胡一天说吴白求婚太难了","59107"
"司机强行穿过学生队伍过斑马线","58528"
"老人花28年种出9层楼高三角梅","56977"
"冲断学生队伍司机已被警方控制","49240"
"肖战磨冰刀","47423"
"导盲犬未带嘴罩被地铁拒绝入内","43203"
"天问一号拍出了火星极冠和晨昏线","41464"
"基金","41150"
"黄圣依杨子小学生式互怼","41140"
"男子西藏发现蓝色古冰川","41003"
"中国加强国防建设不针对不威胁任何国家","40466"
"假名牌化妆品马桶边加工","39275"
"建议尽快制定老年代步车法律法规","38222"
"我国第三批航天员将进入训练","37657"
"政协开幕会现场版手语国歌","37491"
"建议未成年人网游每30分钟刷一次脸","37401"
"中国脱贫标准符合自身经济社会发展水平","36475"
"青春有你","35917"
"赘婿","35725"
"丁程鑫为宋亚轩庆生","34810"
"宋亚轩跟妈妈弟弟连线","33518"
"张天爱喊话营销号","33156"
"全国政协十三届四次会议开幕","32581"
"青你3一公舞台","31454"
"肖战冰球运动推广大使","31291"
"R1SE官博回应录制团综","30097"
"北大设电竞高级人才研修班","29899"
"女兵背18公斤导弹筒冲刺300米","27509"
