"hot_word","hot_word_num"
"女子因未孕遭虐待致死案细节","206008"
"向天歌刘泽煊","111733"
"向太晒向佐郭碧婷北京豪宅","90654"
"周游","89583"
"武汉1小时内密集上演气象大片","71512"
"鹿鼎记","68247"
"基辛格警告美国下任总统","67660"
"韦小宝双儿破庙相遇","67259"
"萧燕燕儿子被下毒","66972"
"中央气象台三预警齐发","66413"
"刘泽煊发文","65878"
"R1SE合照回应只有一个座位","65244"
"魏大勋蓝色寸头","64442"
"金砖国家领导人第十二次会晤举行","64185"
"爱马仕将建最大鳄鱼养殖场","63378"
"张培萌妻子首谈家暴细节","62752"
"苹果客服回应iPhone12屏幕发绿","62190"
"金晨星河流光长裙","55565"
"追光吧哥哥路透","48035"
"M1芯片","47842"
"山本宽","45542"
"从结婚开始恋爱","42535"
"孔雪儿电梯间大片","40356"
"打了瘦脸针的GAI","37640"
"建宁公主出逃失败","36712"
"爱的厘米","32283"
"王智签约赵薇工作室","31809"
"钟睒睒再次成为中国首富","31053"
"承租人不得单方面提高租金","28691"
"社交中需要了解的言外之意","27924"
"患阿尔兹海默症的父亲和影子吵架","27886"
"关雨晴爸爸道德绑架","26498"
"妇联回应女子无法怀孕被夫家人虐待致死","24599"
"河北省原副省长李谦受贿案一审开庭","23841"
"中国蓝盔撒哈拉沙漠种出绿洲","23516"
"韦小宝向皇上表明身份","23424"
"成年人必修班","22584"
"英国男子自称去年9月感染新冠","22193"
"赵志勇打小报告举报顾耀东","22179"
"离婚案件为何安全风险系数高","21814"
"央视调查湖北荆州巨型关公雕像违建始末","21349"
"心疼萧胡辇","21149"
"专家建议养老金领取早减晚增","20490"
"你有容貌焦虑吗","20488"
"印度考虑有条件放宽外国投资限制","18342"
"爱的厘米原生家庭","18318"
"蔡徐坤咪咕汇金海","18003"
"校方回应学生自办宽带遭强拆","17771"
"狮子座流星雨","17534"
"宋茜风起洛阳开机图","16179"
