"hot_word","hot_word_num"
"恶意投诉两千多名网约车司机获利被刑拘","2917358"
"高考平均680分的婚礼","2864578"
"弟弟藏了姐姐高考准考证","1556735"
"999999999",""
"胡宾果 那100个人里面有两对情侣","1399119"
"女更衣室","856553"
"刘涛 我哪有时间对所有人好","855349"
"这个夏天因你而燃",""
"全国新冠疫苗接种剂次超8亿","744517"
"金靖 都这样了还不叫老板娘吗","737019"
"考生凌晨手术早上参加高考","639518"
"榴莲开出了榴莲糖的感觉","607800"
"王一博回归街舞4","591316"
"外交部回应日本资助中国个人赴日考察","529519"
"女子因害怕打针被老公打","499013"
"班主任用古代礼仪给学生颁奖","458011"
"11分钟换4个小时的生命接力","435567"
"阿娇说自己曾被闺蜜抢走男友","435395"
"黄旭熙生图","433545"
"没想到我爸真的回来了","431652"
"王一博梦幻风蓝白挑染造型","430936"
"天津高考化学","428694"
"这才是香水的正确喷法","428137"
"Mnet中日韩女团选秀预告","426955"
"河南专升本 天一","418464"
"中央财经大学通报男生女厕内偷拍","383516"
"怦然心动20岁男五","370260"
"这生日突然就不想过了","366417"
"当不了辣妹的原因找到了","348679"
"领导要求晚上去殡仪馆帮忙","327261"
"我国又一新冠灭活疫苗上市使用","276703"
"如何看待弟弟藏了姐姐的准考证","273432"
"马嘉祺快乐大本营录制","263997"
"美国的惯用伎俩有多可笑","260592"
"蒋方舟","260581"
"和相恋五年的人互删了","254745"
"范丞丞粉丝 他脑子不太好使","253132"
"刘宇撑伞氛围感","248117"
"MAMAMOO辉人不与公司续约","242113"
"高考后张桂梅一个人躲进办公室","240870"
"学校发的野猪逃生秘诀","231529"
"黄明昊","228579"
"广州一小区4万的房子卖2.8万","213909"
"考生考后向交警鞠躬致谢","211980"
"NINEPERCENT预告 粉丝2000w","210903"
"汪小菲 不要再占着公共资源了","199001"
"腾讯申请Q站商标","198843"
"喝咖啡不想洗杯子","198838"
"掌掴马克龙男子身份曝光","198834"
"孙俪晚上要给孩子做饭","193776"
