"hot_word","hot_word_num"
"邓紫棋 我得先结婚再生小孩","1388706"
"多地渔民捞到境外间谍装置","381282"
"中兴Axon30","380988"
"李长歌终于穿女装了","380265"
"脱粉","376077"
"别克纯电SUV来电进圈","374539"
"刘鑫拒绝回应被诉侵权一案","370583"
"任豪回应","364587"
"李亨利","346616"
"赵立坚播放FBI前翻译涉疆采访视频","240954"
"唐艺昕笑容五连拍好甜","235222"
"刘诗诗被打到头的反应","234991"
"夫妻吵架父母应不应该插手","226515"
"谭警官回应现实版的活着","192468"
"交警处罚严禁逐利执法","183911"
"小舍得","176880"
"项思醒","176751"
"张馨予力挺部队心理医生","176120"
"美国史上最大庞氏骗局主犯麦道夫死亡","175841"
"教资69","175513"
"Jennie春游照","174735"
"辣目洋子李宏毅新剧开机","174643"
"肖战晒武汉长江大桥夜景照","174212"
"微信群调侃领导彩旗飘飘被开除","169576"
"日本大叔讲核废水排海危害","166992"
"江歌妈妈起诉刘鑫案明日开庭","164851"
"这就是小说女主的婚纱吧","156079"
"直男是怎么切蛋糕的","126972"
"未来狗狗币会超越比特币吗","107257"
"想吃教资面试的苦","106250"
"预备特战女兵闯鬼屋喊biubiubiu","105580"
"山河令演唱会主创阵容","102882"
"更大的罩子","101180"
"当闺蜜问我能追你男朋友吗","100365"
"商场擅用钟南山形象做广告被罚20万","97686"
"女主颜值最能打的国漫","96321"
"广东警方通报医生医院坠亡","94659"
"张柏芝 这一次我想为自己拼","92999"
"长歌行超前点播","85712"
"文在寅欲起诉日本核污水入海","82930"
"四川人取名也用叠词","82278"
"吴磊哭戏代入感","81474"
"日本番茄酱大王停止进口新疆番茄","72006"
"三月三","71491"
"央行工作论文称应全面放开和鼓励生育","70595"
"吉野家2020年净亏75亿日元","64491"
"长歌行","58878"
"中国足额缴纳2021年联合国会费","57432"
"赵立坚说请日本官员先喝核废水","56649"
"美国禁止日本食品进入","49121"
