"hot_word","hot_word_num"
"康辉说和21岁最大差别是脸的宽度","2882239"
"初步估计河北零号病例早于12月15日","2567874"
"宇宙打歌中心粉丝好拼","2362677"
"邓超报销网友打车费","2347231"
"李菲儿","2278372"
"王嘉尔方回应","1255642"
"错换人生28年小伙姚策病危","1217218"
"女孩将婚房打造成迪士尼博物馆","1140401"
"北京新增本土病例确诊前曾自行服药","1062213"
"浪姐2节目组声明","776054"
"北京9日新增确诊和无症状行程轨迹","750787"
"向佐郭碧婷女儿名字","750500"
"林小宅林凡合作舞台","725164"
"黄晓明退出浪姐2","681979"
"消字号湿疹霜7批中4批含激素","674103"
"张文宏解读石家庄疫情","597242"
"猫为什么进不了十二生肖","595555"
"王一博推云掌打戏受伤","570305"
"裁判不让杨鸣站起来","523019"
"山寨食品一天卖出上百箱","516424"
"今年三九没有二九冷","513772"
"西贝","513074"
"买家秀可以有多吓人","471495"
"曾舜晞熬夜写了篇长文","432973"
"GOT7全员不续约JYP","423524"
"GOT7成员晒7人合照","389648"
"段宜恩","375585"
"你支持快乐教育还是压力教育","364022"
"白酒股还能涨多久","361715"
"公安部举行升警旗仪式","360593"
"有翡","359626"
"金唱片","334763"
"不能露脸的缉毒英雄","312925"
"密室NPC的演技有多绝","309610"
"众议院民主党人将推出弹劾特朗普立法条款","301937"
"给男朋友听热恋期时的语音","301235"
"小红花成中国第79部票房10亿电影","291258"
"西班牙马德里遭遇罕见暴雪","289494"
"济南多名大学生疑被套路网贷","289444"
"上阳赋开分","289219"
"感染过新冠病毒者暂不建议接种疫苗","285400"
"放假回家宿舍的盆栽怎么养","275620"
"灵域","272560"
"谢允致富经","271294"
"王妃的衣橱有多美","270535"
"易烊千玺撸猫的样子","270384"
"JYP回应GOT7不续约","265139"
"全球多家车企缺芯被迫减产","264139"
"周一围演技","263516"
"河北疫情","262639"
