"hot_word","hot_word_num"
"罗志祥说还没出时间管理大师的书","4177203"
"河北新增90例本土确诊","2591072"
"2021有你真好","2205278"
"郑爽回归追哥因为没协调下来","1937183"
"虞书欣","1823191"
"告诉我妈我有抑郁症后","1549269"
"山东新增1例本地无症状","1286915"
"山西新增本地确诊病例1例","834646"
"抖音回应袁隆平账号已注销","798866"
"英国首相想把新冠病毒归咎于中医","622949"
"石家庄两万村民转移隔离","619985"
"杨超越被双倍辣火鸡面辣哭","611613"
"黑龙江新增确诊16例","610313"
"29个省区市倡议就地过年","587649"
"吉林寻找1月5日乘坐K350次列车人员","580122"
"吉林新增7例无症状","532133"
"廊坊","532016"
"蒲巴甲5分钟镜头拍了9个月","529832"
"中南财经政法大学","526135"
"石家庄疫情","525501"
"山东威海","522233"
"石家庄市民开启擦玻璃大扫除模式","521287"
"东京奥运会将在今夏如期举行","501892"
"阳光之下 剪辑","460956"
"石家庄血小板库存告急","450695"
"孟晚舟申请变更保释条件","430268"
"女孩子来例假最希望男孩子说什么","425184"
"顶楼","401345"
"1.68万亿元国资划转充实社保基金","379424"
"特朗普称民主党人弹劾我对美国很危险","367590"
"荷兰边检没收英国司机的火腿三明治","365003"
"王者荣耀","363741"
"31省区市新增本土病例107例","320083"
"朱锁锁发现谢宏祖撒谎","313428"
"美驻联合国大使克拉夫特取消访台","294174"
"顶楼第二季预告","290578"
"女生一定要结婚才会得到幸福吗","255151"
"周一围章子怡感情戏","249423"
"唇膏的正确涂法","237858"
"阴阳师","234761"
"恰好是少年改名的原因","210418"
"朋友圈不再晒娃的原因","210320"
"超市回应给老人贴我是小偷纸条","210262"
"最高检对湖南女法官遇刺发声","210126"
"用196个账户操控股价亏逾3亿被罚百万","210046"
"专家称固态电池5年内不可能商用","210029"
"小学生排队被老师竹板打手","185948"
"无骨鸡爪原来是这样脱骨的","183303"
"联想集团拟在科创板上市","182325"
"山东省考成绩","181493"
