"hot_word","hot_word_num"
"谢娜晒张杰手写的留言卡","2363589"
"俄罗斯五一连休十天不调休","1141161"
"青春有FILA 训练有颜值","1128325"
"刘诗诗探班杨幂","1096898"
"沈梦辰斑秃","1095410"
"张伟丽被KO","1090813"
"年轻男子奶茶中被投安眠药","982246"
"腾讯公开单向好友检测专利","899984"
"印度新冠患者出现了新症状","820458"
"教育部规定严禁要求家长批改作业","814078"
"张艺谋评价周深歌声","809322"
"INTO1成员生图","809076"
"24岁城管协管考上厦大研究生","792660"
"美国拒绝对印度放宽疫苗原料出口","784694"
"霍格沃茨收中国人吗","755556"
"津巴布韦准备出售大象猎杀权","736888"
"张哲瀚五阿哥造型","729272"
"晋江月逝水","652383"
"拜登认定亚美尼亚惨案为种族灭绝","568925"
"金钟大请假为女儿举办周岁宴","484958"
"伯远要单身8年了","471186"
"方便面菜包源于航天食品","469946"
"福建驴友越未开发海岸线1死1伤","442137"
"邓稼先隐姓埋名搞原子弹时夫人一无所知","424922"
"小舍得","419292"
"教育部提出中小学生作业管理十条要求","394991"
"突然回家发现父母都病了","383153"
"英国近万人抗议疫情封锁爆发冲突","377093"
"出道位是在致敬EXO吗","357927"
"宋妍霏看妈妈在舞台上跳舞哭了","330672"
"可乐荷包蛋拌饭","318559"
"中国女排5月1日将交手日本女排","314336"
"利老师的美貌","295431"
"悬崖之上","291787"
"悬崖之上口碑","272155"
"医院回应婴儿看病被拒之门外","267742"
"龚俊在张雨绮的广告里当过群演","265528"
"99岁杨振宁寄语广大学子","261461"
"海鸥压在同伴身上搭顺风车","255432"
"特斯拉维权车主一审胜诉","255118"
"长歌行","250729"
"上班","248529"
"广东佛山一初中开理财课","224032"
"早期新闻有多离谱","214754"
"故宫五一假期5天门票全售罄","209067"
"上海楼盘认购前需公示3天","208531"
"腾讯被南山法院强制执行标的25元","208129"
"印度民众排长队购氧自救","204831"
"奔跑吧济南路透","202658"
"水果的新吃法","201821"
