"hot_word","hot_word_num"
"郭德纲 我现在看谁都是郭麒麟","1595323"
"华春莹带照片上记者会回应澳总理言论","1337230"
"乌合麒麟","1094239"
"佳偶天橙","900955"
"13岁的天天","688898"
"华春莹回应泡菜问题","415115"
"招聘中不得将全日制作为限制性条件","415041"
"乌合麒麟致莫里森","397816"
"嫦娥五号着陆月球","384811"
"新冠去年12月中就在美国出现","372886"
"王怡人金施贤新冠阳性","365361"
"马伊琍12岁女儿腿长","362678"
"虞书欣工作室再发文","361135"
"总和生育率破警戒线","358045"
"嫦娥五号","354939"
"王海称辛巴道歉是再次欺骗","354130"
"于谦把尚九熙马褂扒了","351398"
"吴宣仪 我还不是演员但是我在努力","305234"
"监考时开直播老师被停职","289714"
"关震雷李贝领证","257666"
"奶奶买的天宫牌加湿器","200807"
"泰山山顶矿泉水5元一瓶","191032"
"初雪","168331"
"俄罗斯外交部发言人痛批澳大利亚","163343"
"井柏然背带裤造型","160677"
"河南的雪是人工降雪","143030"
"李冰冰任泉晒旧照为母校庆生","133473"
"十二月是最幸运的一个月","114571"
"上海上港惨败悉尼FC","106543"
"报复渣男的方式","104288"
"住在5元旅店的女人们","100854"
"阚清子","95894"
"独腿女子拄拐杖参加旗袍大赛","89607"
"青岛一小区物业回应禁养宠物","87516"
"小米集团将增发10亿股股票","86006"
"德云社开箱","77336"
"徐清风识别绿茶CT机","74540"
"李现眼神大片","67613"
"HIV感染者拒绝父亲逼婚","67580"
"美可能在圣诞节前提供两款新冠疫苗","66920"
"虞书欣妈妈被限制消费","66524"
"骁龙888","63997"
"比手办还精致的coser","63300"
"嫦娥五号第一时间传回着陆影像","63270"
"蔡素芬醉酒","63240"
"已有七尊兽首铜像归国","61989"
"16年背对春晚舞台老兵退伍","61230"
"十二月有太多盼头了","60896"
"爱的厘米","60242"
"装台","58426"
