"hot_word","hot_word_num"
"女子因未孕遭虐待致死案细节","506688"
"武汉1小时内密集上演气象大片","187697"
"向太晒向佐郭碧婷北京豪宅","187689"
"周游","179268"
"中央气象台三预警齐发","125194"
"向天歌刘泽煊","124524"
"韦小宝双儿破庙相遇","121111"
"基辛格警告美国下任总统","109899"
"承租人不得单方面提高租金","99445"
"离婚案件为何安全风险系数高","89654"
"刘泽煊发文","89615"
"R1SE合照回应只有一个座位","89061"
"魏大勋蓝色寸头","88706"
"萧燕燕儿子被下毒","88240"
"鹿鼎记","87635"
"苹果客服回应iPhone12屏幕发绿","87383"
"金晨星河流光长裙","86801"
"张培萌妻子首谈家暴细节","86168"
"孔雪儿电梯间大片","86036"
"从结婚开始恋爱","85657"
"患阿尔兹海默症的父亲和影子吵架","84890"
"打了瘦脸针的GAI","74090"
"关雨晴爸爸道德绑架","73025"
"山本宽","72663"
"追光吧哥哥路透","65253"
"钟睒睒再次成为中国首富","65243"
"M1芯片","64401"
"印度考虑有条件放宽外国投资限制","64302"
"河北省原副省长李谦受贿案一审开庭","64245"
"王智签约赵薇工作室","64231"
"建宁公主出逃失败","61184"
"妇联回应女子无法怀孕被夫家人虐待致死","57906"
"英国男子自称去年9月感染新冠","51706"
"金砖国家领导人第十二次会晤举行","50694"
"专家建议养老金领取早减晚增","50486"
"社交中需要了解的言外之意","50336"
"爱马仕将建最大鳄鱼养殖场","45412"
"校方回应学生自办宽带遭强拆","43535"
"心疼萧胡辇","41638"
"中国蓝盔撒哈拉沙漠种出绿洲","41554"
"爱的厘米","41511"
"成年人必修班","40109"
"韦小宝向皇上表明身份","39564"
"宋茜风起洛阳开机图","38396"
"你有容貌焦虑吗","37648"
"狮子座流星雨","37519"
"央视调查湖北荆州巨型关公雕像违建始末","37372"
"赵志勇打小报告举报顾耀东","36424"
"SM新女团aespa风格","36152"
"爱的厘米原生家庭","35547"
