"hot_word","hot_word_num"
"中国视协回应郑爽被查","3444923"
"75位一线艺人注销200家关联公司","1221053"
"小明代言全新明锐PRO","1220717"
"张恩华去世","1216252"
"郭晓东不赞同夫妻AA制","936033"
"爱豆V力量","930091"
"金莎 从上往下拍同款下巴你也有","919526"
"王源是在手机上打麻将吗","907136"
"心疼胡明轩","884326"
"公安部派出工作组赴广西","846645"
"郭艾伦采访看哭了","834460"
"小学校长愿意聘用残障女硕士","830845"
"印度105岁老人与95岁妻子战胜新冠病毒","725949"
"刘嘉玲向窦骁何超莲道歉","624496"
"国家广电总局回应郑爽被查","617901"
"印度男子下跪恳求警察不要拿走氧气瓶","598165"
"郑爽涉嫌偷逃税涉事企业被约谈","595410"
"退赛","595410"
"杨鸣","590493"
"余景天父母","586627"
"金靖李佳琦互怼太好笑了","582025"
"过三爽一家都是戏精","577934"
"课上一半就退休的老师","575902"
"男子伙同母亲虐待妻子终审获刑一年半","572460"
"高校男生裤子晾宿舍半年长出鸟窝","569502"
"金莎下巴","566186"
"辽宁男篮战胜广东男篮","425703"
"送外卖副处长化身乘客体验网约车","422854"
"米卡妈妈道歉","417776"
"金融管理部门约谈13家网络平台企业","412948"
"欢欢向米桃道歉","409971"
"福原爱用笔记本记录江宏杰言语霸凌","407698"
"什么是阴阳合同","382332"
"龚俊 青春就是做你想做的","355040"
"全国新冠疫苗接种超2.4亿剂次","340878"
"张萌模仿黄圣依程莉莎","340775"
"长沙唯一导盲犬能听懂300句口令","322939"
"吴宇恒直播插不进话","322039"
"特斯拉维权女主称为自保谎称怀孕","295281"
"子悠 我不要妈妈了","294190"
"称孩子没死就得购物导游被处罚","272594"
"印度1岁儿童感染新冠死亡","265320"
"Kingdom","256612"
"甘望星打游戏太好笑了","249310"
"CBA总决赛","242515"
"青春有你3合作舞台","233460"
"他在逆光中告白","227429"
"石狮子能有多搞笑","204653"
"父母应该干预孩子追星吗","179715"
"我国空间站可在轨至少10年","173140"
