"hot_word","hot_word_num"
"杨紫 碰到了这么多好朋友还有酒喝","3870447"
"婚前隐瞒精神病史法院支持撤销婚姻","2916649"
"真我GT Neo","2751844"
"国产礼服","2684529"
"迪丽热巴 赵露思","2634179"
"张恒被判归还借款2000万","2391967"
"时尚芭莎年度派对","984540"
"HM在华关闭约20家门店","858590"
"水貂和猫等动物对新冠病毒高度易感","735308"
"赵丽颖的高定是国货","731514"
"HM最新声明全文没提新疆","633546"
"王嘉尔 小白我也爱你","615367"
"在沪停留超24小时需登记","567807"
"南大碎尸案被害人家属喊话凶手","561863"
"李现对李雪琴说我不是吴亦凡","558157"
"迪丽热巴男装造型","552114"
"苏醒三观","551976"
"赵露思希望大家爱上乐嫣小公主","551868"
"椰树被立案调查","551728"
"教育部考试中心不再承办剑桥MSE考试","551514"
"龚俊牵辛芷蕾下台","551362"
"吉克隽逸模仿张柏芝","531027"
"李汶翰说酒醉的蝴蝶是乐华企业文化","468469"
"烈士王伟墓内埋着一套旧军装","439834"
"快乐大本营预告","432582"
"王者荣耀","396748"
"月销售额15万以下纳税人免征增值税","395451"
"中戏成绩","394948"
"沙磊","392572"
"英国高校花21万打造环保少女铜像","391132"
"殷桃出演人世间最惨角色","390610"
"焦恩俊称与林千钰和平分开","385359"
"女生可以有多酷","380447"
"尹弘同志任甘肃省委书记","351931"
"爱好和性别有关吗","332531"
"那些被核酸检测支配的恐惧","307734"
"顶楼","300140"
"14天内从瑞丽出来的人都去了哪","287557"
"我们是不是没有批评的权利了","235069"
"男人该不该有私房钱","225771"
"清风朗月花正开杀青","205101"
"迪丽热巴打戏","202450"
"张柏芝港风蜜桃妆","193952"
"原来玉昭令司藤是一个作者","193549"
"哈尔滨民宅燃气爆炸致3伤","184316"
"看过最奇怪的书","181765"
"与福原爱约会男子否认恋情","176996"
"中国天眼向全球天文学家征集观测申请","127038"
"钟南山说不抓紧打疫苗有危险","115156"
"沉香如屑服化道","114628"
