"hot_word","hot_word_num"
"马增蕙去世","3512314"
"新冠病毒能消灭肿瘤吗","2721054"
"淘宝过年不打烊","2630904"
"柯洁痛失世界棋王赛冠军","2573267"
"迪丽热巴宋小宝最强肤色差","2287537"
"唐探剧组的春节记忆","2224586"
"网易云再发长文怼酷狗","2197606"
"林更新 别人家的事你不要管","1100477"
"杭州11户被取消购房摇号资格","858917"
"贪官被通缉一年后可没收违法所得","805751"
"最难以启齿的地名","779247"
"提取逝者1万以内存款无需继承公证","665436"
"明星大侦探","630908"
"陈坤儿子为他庆生","546188"
"北京提前发放2月社保待遇","535076"
"白敬亭工作室声明","497811"
"教育部明确小学阶段作业不出校门","430014"
"上海浦东新高苑","429570"
"李现 爱情无价账单两清","428604"
"双马尾的女孩能有多可爱","426968"
"再摸5天鱼就放假了","425674"
"丁真第一次到北京看升国旗","425346"
"偷偷回家时长辈的反应","424425"
"风大时千万不要去坐摩天轮","399808"
"整容为何越来越普遍","380555"
"塞尔维亚高度信任中国疫苗","370247"
"石原里美预计本周末复工","344473"
"为什么北方和南方的小年差一天","315658"
"拜登承诺其家人不会在白宫工作","309198"
"苹果多项服务出现中断问题","297364"
"石家庄一超市用购物车自制旋转门","297028"
"丁真新歌","257743"
"当玩偶经过洗衣机的洗礼后","235170"
"卫健局介入高溜整形失败事件","231612"
"拜登政府坚持一个中国政策","226917"
"上阳赋","226455"
"中国每分钟有7.5人确诊癌症","205522"
"小年","203428"
"年夜番茄饺子牛腩锅","202076"
"2021年你的年终奖有多少","199819"
"95后非遗传人捏面人还原春晚经典","197174"
"你是否有外貌焦虑","196789"
"北京三部门约谈自媒体大V","196557"
"陈伟霆李易峰朱一龙玩密室逃脱","195728"
"魏晨到底有多能接梗","188713"
"卫健委称对返乡群众乱加码是懒政","185108"
"柠檬百香果泡鸡爪","183682"
"诺安","183142"
"昂山素季被控非法使用对讲机","171096"
"平安京","170522"
