"hot_word","hot_word_num"
"王俊凯 少点关注我年轻的时候","3981618"
"日本10月自杀人数超新冠死亡人数","2734297"
"曹格儿子长大了","2134474"
"丁真所在国企负责人回应拒绝选秀","1518102"
"东京奥运申请退票截止","1416304"
"顶楼","962049"
"教育部推出首批国家级一流本科课程","796569"
"89岁韩国前总统全斗焕出庭受审","792111"
"央视评主播卖假燕窝事件","788329"
"云南腾冲热气球故障致工作人员坠亡","783964"
"丁真登上日本电视台","779426"
"康辉第一次跳街舞","777509"
"李佳琦直播","631306"
"被家长举报索贿老师获党内严重警告处分","627001"
"半影月食","618912"
"郑爽林更新客串刘老根4","614600"
"中国高收入城市排行榜","607210"
"长春女子把雪地当宣纸作画","605447"
"陈奕迅想和易烊千玺组男团","599946"
"跪守病母男孩母亲已去世","534295"
"谋女郎刘浩存首封","493920"
"狼殿下","466840"
"日本给雄鳗鱼变性迎合市场偏好","454531"
"华春莹回应美国对台军售","420214"
"蔡依林小S感谢对方让自己再红了一次","407535"
"今夕何夕","402433"
"黄子韬新歌朋友圈","360064"
"这才是真正的鹅毛大雪","359487"
"深圳官方回应代持炒房","259911"
"今晚月亮高清图","247632"
"男子上班路上被冰溜子砸中身亡","230869"
"常州12只自主繁育小熊猫亮相","212908"
"冬日里的小橘灯","206048"
"伊朗为遇害核科学家举行国葬","189633"
"青年大学习","188620"
"河南4名儿童被埋质监站长被公诉","187585"
"全程憋笑考完试有多难","180095"
"Peanut加入DYN","179819"
"北京设百余个蛋壳公寓接待点","165091"
"阿扎尔受伤","157246"
"李心草溺亡案维持原判","154118"
"绿皮火车内抽烟现状","152715"
"虎鲸世仇座头鲸","148190"
"如何识别有家暴倾向的人","147593"
"华春莹四个反问回击澳总理","147010"
"陈铭","145844"
"被蓝俏俏气死","137950"
"武汉流星","136714"
"哈尔滨继红小学出现诺如病毒患者","136255"
"大四男生用蜡烛做出腊梅","133543"
