"hot_word","hot_word_num"
"向佐药水哥对决","1492406"
"沈阳疫情","767382"
"钟南山张伯礼喊你尽快打疫苗","650677"
"和地心引力反着来",""
"跟关系最差的同学表白了","635807"
"上海暴雨","626210"
"奚梦瑶二胎孕肚","546421"
"CT猎爱魔法",""
"山东航空的飞机餐","330013"
"医务人员彻夜检测累到就地睡着","327374"
"营口3例确诊5例感染者与摄影基地有关","327367"
"马伊琍道歉","324988"
"这就是天腚的缘分","323677"
"蜜雪冰城道歉","322133"
"空袭后加沙一家庭仅2月婴儿幸存","321086"
"天问一号总设计师回应为什么要去火星","320389"
"日本近百名家中休养的新冠患者死亡","318615"
"司机冒着大雨打开了车窗","318101"
"刘雯情商","304568"
"严屹宽自毁颜值式演技","282031"
"学校耗资800万购波音737教学","268707"
"以色列军方炸毁半岛电视台大楼","263822"
"殷世航订婚现场","262955"
"沈梦辰爆炸头","259454"
"中国人对种菜有多执着","227082"
"甘肃兰州一幼童吃饭时被呛致死","179022"
"成都特警基地内的网红打卡地","153852"
"娜扎穷哈式报幕","153523"
"没想到妈妈会给我道歉","149559"
"生孩子可以巩固婚姻吗","129774"
"科比邓肯加内特正式进入名人堂","126431"
"湖人战胜步行者","124645"
"耳背引成的社死瞬间","124584"
"硬糖少女改编版平凡之路","103311"
"肖战晒怼脸自拍","102599"
"9岁男孩多动还梦游竟是铅中毒","97895"
"天问一号总设计师回应落泪","96784"
"GALA好稳","95871"
"如何巧妙拒绝加班","83101"
"毕加索画作拍卖出6.6亿元","81616"
"宫脇咲良将从HKT48毕业","78312"
"内陆城市为何会出现龙卷风","73750"
"沈阳确诊病例曾与12人去鲅鱼圈旅游","73282"
"火星探测的难度到底有多高","73155"
"重庆一小学组织学生校内收麦子","73058"
"詹姆斯复出","71116"
"低估了小偷的敬业","71053"
"中国97%的成年人患有牙结石","68655"
"2020篮球名人堂","67628"
"张艺兴金曲青春染色体改编专场","66700"
