"hot_word","hot_word_num"
"阿娇说不会再结婚了","3570868"
"19371213","2797368"
"百县千红新农人","2514297"
"张翰力挺杜淳","2392980"
"三亚疫情","1919095"
"大学生在张纯如纪念馆外点1213根蜡烛","1361997"
"新冠病毒灭活口罩","1196110"
"于朦胧是人间洗洁精吧","1183512"
"中国有两种大熊猫","959026"
"这是今天10点的南京","915186"
"去油吧哥哥","893664"
"今日说法播出拉姆的案件","783374"
"姜潮 现在全国人民都知道我演技差了","781162"
"康辉21岁面试视频","595467"
"南京大屠杀每隔12秒就有一人遇难","564616"
"关晓彤 造型师赖着不走我也没办法","554595"
"呼伦贝尔出现零下43.6度极寒天气","554152"
"50分钟内接38个国际骚扰电话","551196"
"乌合麒麟","527307"
"新疆油田又诞生一个200万吨级采油厂","486238"
"加油吧哥哥","467153"
"南京大屠杀真实影像","417237"
"郫都再寻需核酸检测人员","371845"
"彭昱畅演技","349719"
"为什么这么多歌手参加我就是演员","333939"
"成都一女子强行翻越隔离墙","308918"
"6000多只大天鹅飞抵荣成","267380"
"台企印度苹果工厂发生暴动","239638"
"保罗 有人说詹姆斯老了就很好笑","232312"
"南京大屠杀死难者国家公祭仪式","230868"
"金姐表情包","230037"
"我们离婚了","229825"
"三亚2游客为无症状感染者密接","228724"
"紫金草表情","218045"
"拜登承诺美39天后重返巴黎协定","215410"
"冬天的阿拉斯加","213934"
"对话张纯如母亲","205265"
"南京大屠杀幸存者仅剩73位","204759"
"李汶翰头套是不是太紧了","184916"
"联合国呼吁各国宣布气候紧急状态","177549"
"粉笔模考好难","175642"
"社恐人有多矛盾","160082"
"南京大屠杀史实展收到20550条留言","157781"
"成都一工厂给员工划格子隔离","154963"
"孔子像前被摆上健胃消食片","154928"
"上海首辆流浪猫移动绝育车进社区","154907"
"字母哥眉骨被打破","154427"
"墨西哥学习中国用二维码抗击疫情","149225"
"迪士尼把雪花和星星都挂在圣诞树上","149112"
"包头副市长坠楼身亡排除刑事案件","148533"
