"hot_word","hot_word_num"
"天天向上节目组声明","211277"
"印官方首次承认恒河浮尸有新冠死者","152054"
"沈月直播插不上嘴","80195"
"御赐小仵作","73836"
"王俊凯像极了在ktv的我","65852"
"粉丝坐在男朋友肩上看蔡徐坤","64560"
"夏天的身体需要什么",""
"天天向上","62439"
"福岛核电站储水罐已多次泄漏","62219"
"极限挑战","61825"
"全球多国爆发反以游行","61679"
"沈梦辰说跟杜海涛该结婚了","61223"
"曾毅又没被认出来","60941"
"王俊凯董子健海边相处好浪漫","60437"
"RNG输了","60097"
"护士人群中多看一眼救人一命","59979"
"张彬彬大半夜加餐被工作人员抓包","59703"
"你很喜欢但穿不出去的衣服","59656"
"年轻人适合过低欲望生活吗","58446"
"初级会计","55698"
"刘诗雯无缘东京奥运会单打","54538"
"合肥一确诊病例合作公司老板发声","53946"
"贾乃亮说假话好好笑","46013"
"小偷吃力背走五六十斤硬币","45079"
"邓伦在线求助网友安排行程","39493"
"肖战诛仙拍摄特辑","39152"
"恰好是少年","35877"
"内蒙古曾接收3000多名南方孤儿","35707"
"王毅将主持安理会巴以冲突紧急公开会","35528"
"你心中科比的精神是什么","35413"
"高中语文教资面试","35389"
"张大仙晒照片","35387"
"专家研判李某某吕某可能不是零号病人","33020"
"雅培奶粉检出微量香兰素被罚909万","32320"
"飞机飞过云层有多美","31919"
"急寻5月8日D3058次12车厢乘客","30214"
"李宇春拍的云","29138"
"MSI","27449"
"52岁男子骑行2000公里到天津看女儿","26289"
"下班遇堵车便衣民警亮证指挥","25833"
"修文物时脚手架倒塌他大喊抓好壁画","25789"
"米卡直播清唱","24478"
"你为了生活做过什么妥协","24465"
"八零九零大结局","23898"
"广西致3人死亡命案嫌犯已自首","23484"
"奶奶喂猫有多生猛","22872"
"洛克王国手游","21261"
"男生的奇怪友谊","20995"
"RNG PSG","20590"
"这年头连鸭子都会演戏了","20386"
