"hot_word","hot_word_num"
"王思聪评论半藏森林","1135308"
"医院回应护士在副院长家顶楼自杀","385761"
"杨洋蜡像遭骚扰","384198"
"重庆万州地震","356636"
"邓家佳","345102"
"在副院长家顶楼自杀女护士父亲发声","259856"
"圆通内鬼致40万条个人信息泄露","240723"
"顶楼","210335"
"特朗普发推称赢了大选","208549"
"杭州拍到一丘之貉中的貉","208248"
"张一山方回应演技争议","197684"
"周杰伦的创作能力有多强","197091"
"金莎 追星女孩单身的原因","186524"
"钟南山说新冠病毒溯源尚未完成","171546"
"萧胡辇怀孕","166694"
"官方回应卖淫嫖娼者通报单位社区及家人","165449"
"方怡答应做韦小宝老婆","162322"
"化学老师制作49支唇膏送学生","160516"
"天下足球","157943"
"住山洞8年小伙回应参观收费","156220"
"卖玩具枪获刑十年男子提前回家","141073"
"美国大选正式结果何时官宣","136698"
"新鹿鼎记鳌拜家写了鳌府","135297"
"李现","123053"
"韦小宝在小郡主脸上画画","116557"
"大学生订婚假批语有多温柔","105729"
"故宫的秋天请慢一点","98948"
"蒙古族新兵首次实弹射击50环","95136"
"麦当劳中国投资25亿卖咖啡","95119"
"6起交通死亡案例全是骑车人和行人全责","95117"
"日本一年少50万人","93818"
"分别时偷偷挥手的老人","79783"
"潘长江cos陈奕迅","79429"
"马明被双开","76940"
"李宇春珍珠白断层西装","76126"
"人类能懒到什么程度","71953"
"河南农家6口被杀家里8岁女孩仍失踪","69909"
"王源20岁首封","66335"
"理工男将宿舍门锁改成智能锁","62780"
"沈青禾男友力","59783"
"如何形容高光很亮","59187"
"哈尔滨警方通报法官被刺死","58588"
"韦小宝偷太后经书","57519"
"顾耀东 我关心是因为我喜欢你","55916"
"爱的厘米","49142"
"乐华娱乐否认王富贵是公司职粉","48725"
"英国驻重庆总领事救落水女大学生","47060"
"新冠2019年或已在意大利传播","46213"
"微众银行","45592"
"千万不要让男朋友折纸鹤","45371"
