"hot_word","hot_word_num"
"工藤静香给木村拓哉买冰淇淋","2899524"
"南京首辆新冠疫苗移动接种车","1241660"
"韩东君的RS6","1239199"
"赵奕欢 我红不红不需要你提醒我","1200639"
"杨幂对最炫民族风的执念","1184630"
"印度老人遗体火化时女儿跳进火堆","990692"
"复旦团队首次公布人体经络影像","782571"
"江苏退运3346.6吨韩国洋垃圾","660231"
"老师揪学生头发致皮骨分离被刑拘","653657"
"一个多月后是端午假期了","644760"
"夫妻骑马从新疆回福建已花30多万","630947"
"乃万 我不会退缩因为我没有做错","628045"
"张哲瀚龚俊换头像","619793"
"杨紫白色纱裙","602175"
"焦裕禄临终前最后一个请求","597831"
"印度制氧厂剧烈爆炸致3死8伤","590242"
"刘亦菲","584163"
"买鱼剪开鱼肚发现完整塑料杯","571890"
"京东被曝显卡售后不肯维修要原价退款","559132"
"广州健康码上线木棉花皮肤","552132"
"女子为逃刑罚10年连生5娃","539485"
"任嘉伦抱着邢菲摔了85次","539288"
"同学录里的遗憾和温柔","448476"
"澳大利亚两只座头鲸在浮潜者旁边嬉戏","445443"
"无限期暂停中澳战略经济对话机制下活动","434496"
"沈月刘以豪CP感","434322"
"乃万 给心爱的男孩一些宽容和理解","409245"
"赵丽颖绿衣仙踪","388679"
"北京文化跌停","381810"
"脸书宣布维持对特朗普账号的封禁","381131"
"杭州转塘疑似发现豹子","381041"
"邢昭林新恋情","329010"
"利路修登上BBC首页","319234"
"密室大逃脱","314172"
"杂技学校4名男孩深夜出走失联","270537"
"肖宇梁恢复训练","269944"
"外籍旅客不戴口罩遭邻座阿姨怒怼","265690"
"官方回应驴友穿越鳌太线遇难","259055"
"G7","257921"
"还以为在动物园偶遇明星了","255079"
"甜醉晚安酒","251627"
"印度男子为母亲求氧气遭医生扇耳光","249718"
"那些让你想离婚的瞬间","246483"
"我亲爱的小洁癖定档","246122"
"秘密访客","238692"
"老师揪学生头发致皮骨分离家长发声","223259"
"汪文斌提醒澳方别在错误道路上越走越远","205110"
"辣妹蜜桃妆","204200"
"特斯拉年内或将上线数据平台","202384"
"妈妈陪孩子练跳绳结果自己骨折","201428"
