"hot_word","hot_word_num"
"印度女子感染新冠被儿子遗弃死亡","1946231"
"INTO1声明","1905430"
"最缺工100个职业排行","1631762"
"我爸给狗穿上了我的衣服","1518567"
"妈妈给了我说喜欢的勇气","1100502"
"张哲瀚叫你别手洗啦","1062863"
"董子健 希望你们懂得许愿和鞠躬区别","1034467"
"皓嫣","963783"
"利路修 机场","852158"
"官方介入煮鸡蛋返生论文调查","757360"
"白敬亭张彬彬同框","689161"
"刘宇粉丝拼字车祸现场","687255"
"中方获邀加入日本核污水排海工作组","682853"
"中国800台制氧机运抵印度","676398"
"创造营庆功宴上的林墨","670151"
"虎口救人村民获见义勇为奖","669507"
"小学生被3条恶犬咬死双方和解","663204"
"北京无印良品再诉日本無印良品","657210"
"秀动崩了","652482"
"和马后援会维权声明","648051"
"Ella向五月天及布农族道歉","644188"
"晋江月逝水录音","640196"
"茶颜悦色小票","617805"
"首尔340人抢1套房","613336"
"歌隼","612421"
"月亮","545489"
"频繁跳槽到底利大还是弊大","489513"
"庆怜 机场","469573"
"美团涉嫌垄断被调查","432012"
"INTO1机场造型","402799"
"娜扎演的周子萱好飒","392276"
"杨幂炙热火圈封面","385612"
"蔡徐坤下午好说成早上好","351952"
"印度超级富豪花近百万元飞英国","343020"
"当代年轻人眼中的一百万","342164"
"假如一天赚两百万你会干什么","339433"
"领导说下班后开会要怎么回","337833"
"晋江月逝水","335390"
"外交部 中方第一时间表明愿帮印度抗疫","315504"
"司藤庆功宴","313024"
"山东乡村的婚宴有多硬核","272779"
"王俊凯给董子健煮长寿面","269399"
"赵让 曾淑岩","267435"
"进入上海地铁线路男子已身亡","267344"
"虎牙崩了","263159"
"六部门要求加强住房租赁企业从业管理","259425"
"爸爸把儿子抗癌经历画成漫画","251437"
"证券从业资格考试成绩","247729"
"如何拒绝讨好型人格","243698"
"印度派警察护送氧气罐车","243321"
