"hot_word","hot_word_num"
"曾黎卸妆","536047"
"央视曝直播平台雇聊手代主播撩用户","414034"
"新能源代步汽车哪家强","412277"
"李亚鹏回应欠债被判赔4000万","355442"
"岳云鹏助理做的牛年宣传图","315419"
"网红减肥产品效果来自禁药","271534"
"郑州1例境外输入无症状系非法入境","216420"
"仙剑奇侠传1翻拍","165821"
"个人养老金制度来了","163013"
"外交部痛批美日恶意攻击中方","161779"
"锦心似玉","158876"
"儿童血液病恶性肿瘤救治新增12个病种","156794"
"欧洲多国进入第三波疫情","156189"
"黄峥辞任拼多多董事长","152307"
"河北武安铁矿瞒报6人死亡事故","151157"
"美加州拟禁游客坐过山车尖叫","149096"
"angelababy晒小海绵背影照","146299"
"张子枫边吃边哭","145072"
"大衣哥谈拉面哥现状","142791"
"向往的生活常驻嘉宾","114728"
"宋家三胞胎9岁生日合照","114457"
"黑龙江女生弑母藏尸案村民发声","113965"
"林依晨为怀孕把该试的方法都试了","113092"
"宋妍霏 我妈一个人坐飞机走了","112923"
"第一次去健身房就被嘲笑了","105769"
"江苏一老师拿玻璃杯敲公交司机脑袋","103318"
"林心如自制迪士尼公主甜点","93101"
"得物APP遭克隆","88149"
"拼多多第四季度财报","87507"
"外交部回应美方制裁中方人员","87385"
"张翰帮唐明轩通过了好友请求","87345"
"韩国网友因中国拌饭植入广告炸锅","85009"
"俄罗斯美女宇航员成芭比娃娃原型","76643"
"乃万给孙滢皓写歌","75468"
"英国视中国为系统性竞争对手","74635"
"爷爷给2岁孙子针扎放血治抽搐","73975"
"朋友结婚男子随礼千张1元纸币","71756"
"南宁电动车夹缝中撞上劳斯莱斯","67671"
"郑仁","66919"
"女人在女强男弱的婚姻中更累吗","60044"
"阿凡不达拟邀阵容","59536"
"李若彤谈脱口秀有提词器","56632"
"若你安好便是晴天","54474"
"货车司机6个月拍出星辰大海","53151"
"小狐狸一到饭点就进厂讨食","51872"
"咒术回战","51854"
"李亚鹏被控欠债案判赔4000万","49184"
"外出就餐吃到异物得10倍赔偿","42412"
"杭州一小学开设方言课","41161"
"古代的求职自荐信","40619"
