"hot_word","hot_word_num"
"六安百万人口核酸检测结果出来了","2429412"
"肖战戴耳机猜题","1376431"
"生猪价格跌破一斤10元","1011089"
"朱一龙520不送玫瑰",""
"难听","1001108"
"大头儿子的真名叫头太元","979781"
"王子奇苏晓彤在忙着写论文","762487"
"517一起吃吃吃",""
"御赐小仵作","749944"
"乌鸦小姐与蜥蜴先生","631847"
"辽宁新增4例本土确诊","534849"
"朴灿烈私生活虚假传闻发帖人移送检方","512449"
"殷世航快手账号被封禁","510274"
"赵立坚说福岛核污染水排海后患无穷","415865"
"沈阳 鸡架","358806"
"李佳琦刘宇直播","327853"
"日本冲绳误将生理盐水当疫苗注射","327602"
"520暂停离婚登记合理吗","327317"
"谢娜","326907"
"周瑜小乔520新皮肤","326813"
"陕西一老人乘出租车用皮带勒司机","326249"
"警惕炒作空气币新型传销","326153"
"成都10岁女孩再破吉尼斯纪录","325702"
"孟美岐宋妍霏闺蜜出游拍照指南","325422"
"旅游社死现场","324896"
"奶奶用放置4年冬瓜水喂孙女致中毒","324865"
"葡萄奶盖脆啵啵","298108"
"妇联回应女子遭家暴头骨开裂昏迷60天","275785"
"左肩有你路透","271920"
"原来真的有不近视体质","264635"
"安徽特岗","241431"
"无人机插秧","239280"
"成都海关查获250支人体胎盘素","237354"
"白岩松谈年轻人不愿意生孩子","225059"
"请病假去非洲被开除辩称我是去看病","223340"
"张哲瀚浮雕花朵白衬衫","214542"
"教育部将进一步规范名校办民校","214182"
"曹县是什么梗","214161"
"人前是爸人后是狗","188955"
"北京晚霞","176450"
"在公交车上遇到的双向暗恋","174721"
"唐艺昕夏日游园会plog","172071"
"广东禁止采集个人生物识别信息","164968"
"张哲瀚直播","159794"
"防疫通告错将鲅鱼圈写成鱿鱼圈","153945"
"福州烟花","153860"
"米卡全白西装","153846"
"恒河不断出现疑似病患浮尸","151613"
"董又霖新恋情","142248"
"薇娅直播","139555"
