"hot_word","hot_word_num"
"婆婆回应陈松伶放弃生育","3653689"
"中美高层战略对话中方代表团抵达美国","2551615"
"2021政务v影响力峰会","2432075"
"李诞黑尾酱合资公司注销","1848434"
"杜淳最大的黑粉是王灿","1421941"
"亮在美白起跑线","1383147"
"清华规定申请硕士学位不必发表论文","990887"
"西虹市首富涉侵权案开庭","830782"
"印尼知名女运动员被确认为男性","742910"
"西安新增1例本土确诊病例","657060"
"青春有你","650240"
"郭美美等销售违禁减肥食品被刑拘","649881"
"余景天拿A开心到扇自己巴掌","649397"
"中国有超3亿人存在睡眠障碍","649193"
"中国翻拍忠犬八公","648854"
"天津狗不理公司被注销","648415"
"顶楼","647777"
"向往的生活路透","647347"
"黄圣依杨子对视哭了","646941"
"蓝鲸误入繁殖地被75只虎鲸吃掉","646654"
"深夜网约车改道女生害怕报警","454922"
"山河令","442008"
"90后炒熊一只最多赚数万元","432130"
"黄奕再现李玉湖嫁衣扮相","424192"
"Doinb","400579"
"张新成问我的称什么时候坏了","400241"
"考拉打架打输哭到声音沙哑","395647"
"喜茶芝芝四季春","394163"
"18个新职业发布","393716"
"中方敦促美国立即停止侵犯人权","393687"
"胡歌保安造型","393664"
"父母让孩子窒息的教育方式","305934"
"TF家族三代团翻跳青3主题曲","280312"
"王一博怕被NPC吓到","277976"
"俄罗斯召回驻美大使","250817"
"大海的压迫感有多强","234582"
"余景天表情管理","205187"
"你是我的城池营垒","201320"
"近百年前男孩自信用英文介绍中国","194296"
"朱珠结婚","190473"
"王石","190369"
"戴希希向段序逼婚","189121"
"李宇春送李俊濠哆啦A梦","188887"
"觉醒年代","188127"
"连淮伟孙亦航白天吵架晚上和好","187306"
"摩根士丹利推出比特币投资基金","186150"
"AG赢了","185328"
"西安新增病例所在医院已停诊","184720"
"山东警车被拍到车窗抛垃圾","184428"
"枣庄警车车窗抛物情况通报","183593"
