"hot_word","hot_word_num"
"专家建议女性退休年龄延至55岁","3209227"
"特朗普团队称出现死人票","1147353"
"薇娅双十一直播","1139945"
"赵丽颖演的幸福好可爱","1136616"
"被小朋友误认成公主","1101424"
"郑爽陈立农撞衫","1054454"
"你最后网购的那个东西拥有了2万倍","982584"
"金晨张继科真的好像大姨和大舅","902798"
"最高法指令对杨光毅强奸案再审","794143"
"露华浓为申请破产作准备","787452"
"易烊千玺衣服设计灵感来自奥特曼吧","787435"
"盛况承认对金莎一见钟情","622560"
"美队回应与拜登撞脸","514939"
"拜登称特朗普拒绝承认选举结果令人尴尬","510014"
"柯洁对韩国棋手已13连胜","508110"
"研究生导师不得侮辱研究生人格","506305"
"李诞 娱乐圈90%艺人靠运气","499542"
"言承旭张熙恩","496326"
"哔哩哔哩注册呵呵呵商标","493185"
"露华浓225","486296"
"李栋旭给孔刘送咖啡车应援","480883"
"原来乌鸦喝水是真的","477476"
"露华浓325","469010"
"农民工返回擦刚坐过的椅子","465183"
"论丸子头的重要性","463369"
"王一博原声台词","440559"
"蛋壳公寓","402599"
"杨紫告黑粉胜诉","368173"
"四字弟弟把沙发借蔡国庆坐坐呗","348649"
"阿云嘎可以把钢琴借给蔡国庆躺","283301"
"李佳琦直播","283203"
"苹果测试可折叠iPhone显示屏","263697"
"pencil有多怕冷","248963"
"猫咪诱惑学生被捕","239988"
"女儿们的恋爱","233286"
"娃娃脸女生图鉴","231178"
"华鼎奖提名名单","224958"
"生育对女性职业生涯的影响","217007"
"萧亚轩吐槽黄皓幼稚","210832"
"伊能静小作文助攻金莎恋爱","204909"
"黄奕帮女儿追星易烊千玺","202047"
"黄子韬 我的CP以后才是最好磕的","197555"
"蜜汁山楂樱桃肉","196843"
"日本政府拟对东京奥运外国观众免隔离","196403"
"日本首相菅义伟欲率先会见拜登","195135"
"湖北潜江一境外返潜人员核酸阳性","194246"
"高校快递站长东北口音喊话走红","192643"
"北控因李根被罚款100万","192187"
"墨西哥一记者被枪杀","191293"
"青龙奖入围名单","190958"
