"hot_word","hot_word_num"
"未来5年的新职业什么样","143218"
"陶勇说近视度数不断增加或致盲","133691"
"建议全面取消经营性公墓","86180"
"建议公示逃税主播名单","71410"
"日原子力委员会称福岛核电站或再爆炸","64833"
"建议强制平台为外卖小哥买意外险","61880"
"你的职业是你的兴趣吗","51581"
"平均不满23岁女兵给导弹做体检","47349"
"2分钟混剪2021两会好声音","47306"
"原来你是这样的杨利伟","47180"
"司藤","47177"
"浙江两名高校学生拒服兵役被处罚","47078"
"景甜气质","46977"
"山河令","46914"
"张凯丽谈女性容貌焦虑","46843"
"李兰迪演技","46821"
"别想打扰我学习","46770"
"美特斯邦威拟卖资产回血","46694"
"铜价涨至九年新高","46621"
"龚俊模特时期业务范围好广","46584"
"上海一教练车坠河致1人死亡","46540"
"在猪肉店起舞的9岁芭蕾女孩","45404"
"元娘竟然是被乔莲房害死的","39290"
"锦心似玉","38227"
"薇娅做手术","38214"
"王中军称华谊还没到摘牌边缘","34842"
"司藤身世","32275"
"东京奥运会体操测试赛被取消","31931"
"联通电信辟谣首批5G用户被抛弃","31828"
"哈尔滨全面有序恢复","31773"
"特斯拉上海工厂摄像头被入侵","31525"
"时代少年团赞赞新时代","29810"
"周子舒好温柔","29457"
"夏之光面部受伤","28891"
"司藤救秦放","28514"
"建议警惕一些影视作品伪娘化","28086"
"埃及医生用2万余根火柴杆制天坛","27294"
"如何看待娘系男生","26569"
"特斯拉回应女子坐车顶维权","26443"
"顶楼","25767"
"创造营","25251"
"张文宏说年轻人打疫苗是为国家做贡献","24640"
"夏之光报平安","23704"
"物业撤明星广告牌换成戍边英雄","23630"
"张文宏说今年摘口罩难度很大","23100"
"脏车禁止进入成都主城区","21058"
"建议9年义务教育延至12年","20950"
"暴风眼","19646"
"庭审现场家暴者竟跑到受害者家中","19360"
"今年五一连放5天假","18726"
