"hot_word","hot_word_num"
"西藏日报 丁真我们在西藏等你","3535546"
"外交部呼吁彻查澳军虐杀暴行","2711532"
"金鸡奖手机电影计划","2703879"
"为什么坠楼的是赵志勇不是钟百鸣","2652656"
"邓超便秘还吃馕","2185040"
"十天荐片挑战","1984956"
"以为周冬雨踩着平衡车领奖","1443987"
"酷似马云男孩现状","1442957"
"五大银行发公告暂停贵金属开户","1295074"
"四川省体育局回应川渝联合申奥","1104027"
"少年的你将代表香港角逐奥斯卡","1012785"
"四川为了丁真有多努力","903142"
"辛巴回应燕窝事件","875028"
"倪妮造型","708864"
"广东禁止餐饮企业设最低消费额","679382"
"莆田水泥车与农用车碰撞9死7伤","673042"
"重庆体育局称对申办奥运会不知情","672872"
"张颜齐","672713"
"黄晓明 我觉得我电量还挺足的","646922"
"怪不得四川观察总观察丁真","594456"
"黄金","524958"
"蔡徐坤银发","502240"
"易烊千玺后座剧场","500608"
"妇联回应21岁女孩被逼婚禁食","464035"
"正当防卫不捕不诉典型案例","461854"
"李现 我有点无法fu吸","461303"
"哈哈哈哈哈","399397"
"西藏拥有了躺赢的快乐","393880"
"张艺谋说刘浩存是周冬雨接班人","362803"
"成都大学毛洪涛事件调查结果","362798"
"李宇春互联网在逃emoji","362797"
"与晨同光","360871"
"BY2再唱爱的双重魔力","331418"
"玫瑰机关枪","322597"
"外交部回应澳机构接受美资助用于反华项目","317606"
"照顾好身体就是赚钱","315442"
"夏继成牺牲意难平","266831"
"学了医才知道的事","266814"
"西游记里的选角有多绝","247953"
"全球限量运动鞋假冒工厂有上万双","233229"
"顾耀东沈青禾诀别","232201"
"钟南山称辉瑞疫苗试验结果远远不够","217605"
"唐山曹妃甸区急寻密切接触者","215296"
"刘诗诗流金氛围感大片","212913"
"DYG教练SK道歉","209617"
"AG晋级四强","207359"
"北京车辆占用消防通道拖车费自付","204302"
"顾耀东击杀钟百鸣","204046"
"易烊千玺接受金鸡奖提名者表彰","187232"
"除暴细节","164590"
