"hot_word","hot_word_num"
"狗仔镜头下的关晓彤","3758017"
"川航确诊飞行员在江油密接均为阴性","2193071"
"幻书启世录书化人形","2176177"
"邓超对孙俪的字佩服得五体投地","2164914"
"劳斯莱斯回应拼多多122万元补贴","1965294"
"小黑瓶开启圣诞季","1769804"
"39岁全智贤状态","1034389"
"广东药科大学失联男生已离世","849825"
"追光吧哥哥不做成团出道","591380"
"巴西将使用中国新冠疫苗","590469"
"一只小动物从嫦五返回器前跑过","590217"
"王自健前妻发文","552616"
"安徽一批国产鸡腿外包装核酸阳性","488148"
"BLACKPINK演唱会延期","466178"
"上万只乌鸦遮天蔽日侵袭加拿大","403965"
"黄子韬怒斥偷拍者","402299"
"微博之夜投票","377524"
"黄多多短发","377349"
"戚薇雾莲仙女裙","377180"
"名侦探学院","377162"
"英国议员夺走女王权杖抗议","376644"
"金在中身材","371715"
"义乌市图书馆停用制热空调","360718"
"重庆又一冻库牛肉外包装核酸呈阳性","356928"
"有翡原音","334773"
"四川最硬气耙耳朵","326184"
"Jinjiao加入SN","325996"
"狗子从鳄鱼嘴里逃脱被收编成警犬","310453"
"嫦五返回器成功着陆","289913"
"郎平确认带队至东京奥运会结束","287568"
"李嘉欣","286652"
"男子扯掉并脚踢国旗被依法行拘","285731"
"大江大河2定档1220","279453"
"毛衣如何穿出时髦感","278833"
"中方已从海外接回超7.3万名同胞","267190"
"义乌限电晚上关闭所有路灯","263597"
"韩国佛教燃灯会申遗成功","256497"
"人类一败涂地进不去","244979"
"如何回怼倚老卖老","230830"
"有翡配音出戏","221921"
"丁程鑫 不要跟我车让我回家","219552"
"基金","209106"
"日本出售3D仿真人脸面具","195129"
"Youdang成为自由人","191038"
"松鼠的起床气有多大","186465"
"13批次电动平衡车不合格","182312"
"施罗德脚踝扭伤","179267"
"紧急救援","174610"
"还以为进了青青草原","168006"
"从嫦五返回器前跑过的是兔子","165619"
