"hot_word","hot_word_num"
"民警查嫖娼反被当作仙人跳","1053127"
"拍摄者详述男孩进女更衣室事件经过","518148"
"端午","456895"
"龚俊护发秘诀",""
"长期不上班会导致什么后果","422308"
"小象睡觉实力演绎蹬鼻子上脸","372220"
"成都一食品企业6人掉废水池死亡","343577"
"长成这样谁还网恋","332377"
"终于等到庆余年2","309925"
"中国女排战胜多米尼加女排","292441"
"洛神水赋摄影师泡水太久曾毛细血管破裂","263846"
"被王梦洁气到","256830"
"埃里克森倒地黄金救援14分钟恢复意识","250708"
"原来体检才是社死第一名","203315"
"有些肩颈痛按摩可能会加重","163268"
"欧文受伤","160307"
"包贝尔否认是资源咖有后台","160008"
"张钧甯为新戏瘦了十几斤","158723"
"杨紫说看了阳光姐妹淘哭惨了","156419"
"穷不过三代是什么意思","154977"
"贾乃亮终于赢了","153730"
"林允晒和张蓝心亲密旧照","152677"
"反对父母生二胎是自私吗","151454"
"李光洙最后一期RM","150606"
"岳云鹏被邓伦敲车窗受到惊吓","147389"
"男子游泳偶遇小鸭子被当成顺风船","146690"
"邓家佳深V","146493"
"连猫咪都知道防晒了","142612"
"你认识的有钱人是怎样生活的","140509"
"煮血肠的时候一定要谨慎","134608"
"刘彰 QQ空间贴吧发言","121898"
"狐妖小红娘竹业篇 李现","112801"
"欧洲杯","106971"
"洛神水赋女演员回应节目走红","99627"
"cp发糖可不可以内卷","97724"
"95后核酸检测员通宵单手拧管2000余次","92751"
"有个偏心的妈妈是什么体验","90697"
"LGD MAJOR冠军","90412"
"四川北川3.8级地震","90301"
"广州将对封闭封控区域有序解封","89897"
"德约科维奇夺大满贯第19冠","89656"
"荷兰绝杀乌克兰","89235"
"雄鹿战胜篮网","88864"
"美洲杯","88506"
"洛神水赋舞飞天由拉鱼线实现","88432"
"外籍船舶在中国海域违法排污","87902"
"摩尔庄园维护","87693"
"周震南 这两年给大家添麻烦了","87343"
"河北三河公布1密接者行动轨迹","87168"
"BBC播放埃里克森治疗及妻子哭泣特写","86620"
