"hot_word","hot_word_num"
"央视评高中生坠亡通报需以更多事实回应","4352009"
"吴磊模仿钟楚曦的拍照姿势","1247007"
"毕业生学位论文查重乱象","1077807"
"少年的你日本版新镜头","1064941"
"大学生利用肯德基漏洞诈骗20余万元","1007229"
"尹正喝醉偷吃午餐肉忘了味道","920173"
"黄奕 我的家庭没有爸爸这个角色","896065"
"于敏生前采访中反复说死而后已","767395"
"成都警方回应四十九中学生坠亡","642017"
"吴青峰称苏打绿休团是林暐哲逼的","633952"
"山河令剧本围读花絮","609680"
"李宰镇将结婚","592838"
"12省份进入中度老龄化","592522"
"郭杰瑞称美国故意不报道中国抗疫成果","590853"
"吴磊范丞丞不敢看钟楚曦","590206"
"杜海涛回应被沈梦辰催婚催不动","588370"
"临沂大学张瑞莹","587497"
"马斯克发起狗狗币支付特斯拉投票","586098"
"安徽阜阳一中学工地挖出炸弹","586063"
"曾黎 我至今未婚","570210"
"董明珠看许佳琪跳蝎子舞的表情","559870"
"功夫熊猫竟然真的存在","498557"
"Sunnee问现在狗仔做得这么大吗","465560"
"老人驾车逆行碾轧小学生后跑了","370926"
"虞书欣说自己是横店千颂伊","353742"
"警方通报多名幼儿身上现针眼","332028"
"技嘉道歉","321523"
"深圳已成立深房理联合调查组","320715"
"华春莹批美国每年花3亿美元抹黑中国","320605"
"张柏芝想为结婚对象再生小孩","320296"
"吴倩说对待老人只有真诚和耐心","319849"
"张哲瀚的脸比新浪公仔还小","317789"
"菅田将晖说利路修的故事像少女漫画","280410"
"后进生偷偷递给我的纸条","278149"
"印度一ICU供氧量突降致11人死亡","255315"
"中小学原则上采用纸质作业","250123"
"小猫咪的力气能有多大","224564"
"华春莹说强征慰安妇是严重反人类罪行","223620"
"教育部建议家长不跟风报班","221642"
"老师撤离150名学生后大树瞬间倒下","200219"
"律师解读电动车电梯里起火烧伤多人","200175"
"瀑布小龙虾盖浇饭","200131"
"不要轻易把话筒递给歌迷","194247"
"31省份人口性别比","192569"
"梁建章建议生1个孩子奖励100万","166570"
"京东下架技嘉全部产品","160586"
"一生一世首支预告","154211"
"室友的打工日记","153776"
"校方否认学生坠亡与化学老师有关","153223"
"东莞牺牲民警搏斗时故意往人少处去","146816"
