"hot_word","hot_word_num"
"花呗借呗不得向大学生放款","2333490"
"中国有超3亿人存在睡眠障碍","1926992"
"朱珠结婚","1870783"
"张小斐 我不要面子的吗","1213940"
"NASA称火星地壳下可能含有大量水","781815"
"李亚鹏","764629"
"中方敦促美国立即停止侵犯人权","729397"
"腾讯阿里字节跳动等11家企业被约谈","621263"
"山河令","550475"
"陆川说高晓松暴瘦到单薄","548811"
"美国亚裔奶奶反击袭击者","542758"
"聊城禁止校长老师带手机进课堂","537256"
"福州滴滴司机案发后自述音频曝光","535306"
"西藏冒险王遗体疑似被找到","531249"
"银行回应推出墓地按揭贷","526358"
"默读","520626"
"深圳一幼婴掉进床缝窒息身亡","516403"
"近百年前男孩自信用英文介绍中国","509901"
"蓝盈莹吕一小手拉大手","508792"
"范丞丞湿发朋克封面","507802"
"为免费吃日本寿司改名鲑鱼","451892"
"邓超晒和孙俪合照","400177"
"创4学员睡衣趴造型","396884"
"抑郁症早期的4大征兆","379436"
"今天是沸羊羊的生日","336869"
"福州撞死乘客司机弟弟鞠躬致歉","311580"
"张一得","310155"
"崔天凯谈中美高层战略对话","303258"
"104岁炒股奶奶","300632"
"武汉近六成申请离婚夫妻放弃登记","293151"
"恋恋小酒窝定档","285783"
"当小朋友走累了","263872"
"崔天凯说中方核心利益没有妥协余地","259188"
"司藤","257172"
"黄峥向浙大捐赠一亿美金","252333"
"女孩遇车祸高位截瘫后成时尚博主","251242"
"吴镇宇女装照","243545"
"乘风破浪的姐姐四公造型","222203"
"景甜童年照","215938"
"公司强收离职员工4200元工装费","206082"
"河北蠡县一家五口被害身亡","202472"
"锦心似玉","201380"
"猪肉价格连续7周回落","200597"
"义务教育质量评价指南发布","200432"
"84岁奶奶7年创作300多幅农民画","200426"
"你是我的城池营垒","200425"
"隐匿23年命案逃犯因检测核酸落网","188981"
"医学生的奇葩操作","183032"
"东京奥运会开闭幕式总监辞职","182634"
"张小斐曾把裤子穿反了","182232"
