"hot_word","hot_word_num"
"陈德容退出我就是演员","4000180"
"白岩松说防疫是大事但行为不能破底线","2300646"
"撒贝宁和薇娅躺倒直播间","2215180"
"杜淳 是动作的问题还是我的问题","1523680"
"永鼎医院","1515470"
"合成大西瓜","1497673"
"泉州隔离点酒店坍塌详情","1411673"
"30人贩卖6亿条个人信息获利800余万","783297"
"上海流调报告只提地点不提人","771426"
"通化物资","576126"
"江苏镇江无症状感染者行程轨迹","562907"
"山海情大结局","537106"
"南京破获19年前抢劫杀人案","525768"
"跪下的警察","507998"
"石家庄新增5例本土确诊","493264"
"阳光之下","492476"
"李荣浩早起吃了四个韭菜盒子","491922"
"娜扎镜头下的北漂","490591"
"印小天教金巧巧跳阿里巴巴","489176"
"八省联考物理","487668"
"郭德纲晒和于谦背影合照","485794"
"关晓彤借网友班婳衣服","484573"
"石家庄车厘子","483773"
"创4制服","483257"
"警方通报22岁女生乘网约车后失联","482437"
"没有吴亦凡救不了的衣服","482129"
"湖南益阳","479092"
"上海今年将推进数字人民币试点","474562"
"山东金矿爆炸事故一矿工成功升井","473107"
"广东2020年GDP超11万亿元","472985"
"女生戴帽子前后反差有多大","472949"
"雪顶草莓啵啵奶油卷","385846"
"栖霞金矿事故11名矿工成功升井","370534"
"艾克里里","341966"
"吉林通化就生活物资配送不及时问题致歉","332494"
"北京倡导环京人员居家办公","326851"
"原来猫咪也有烦恼","325522"
"离婚重组家庭会幸福吗","295956"
"山东金矿爆炸事故","290744"
"袁姗姗初舞台练习室全过程","287140"
"2020王者荣耀年度颁奖典礼","280638"
"2021LPL","272841"
"陈钰琪林一吻戏","266150"
"车厘子","249106"
"青你3训练生官宣","247332"
"正青春开播","208767"
"英国新冠死亡率全球最高","170941"
"柯滢小武正式联手","170339"
"获救矿工说最想让家人知道我还活着","169221"
"多因素影响蔬菜批发价上行","168423"
