"hot_word","hot_word_num"
"王一博换头像","2176804"
"多地发布海虹织纹螺预警","908309"
"不好的全抛光","894558"
"央视五四晚会节目单出炉","816635"
"8400亿人民币是什么概念","791426"
"新青年就要开拓","777201"
"结婚当天到底有多累","770810"
"超50%哮喘患者与家族有关","656844"
"萧敬腾问练习生就是练习谈恋爱吗","614648"
"外交部回应菲律宾高层涉华言论","595546"
"AI修复五四运动现场","594310"
"五四青年节","556210"
"胡宇桐与私生起争执","519152"
"郭晓东 我愿意当程莉莎的巨婴","518203"
"疫情期近6成日本民众有头顶焦虑","464567"
"黄明昊向日葵头套挡雨","464565"
"印度演员表演疫情失控如何发生","464450"
"迪丽热巴侧编双马尾造型","464312"
"任嘉伦自拍死亡角度","464201"
"何洛洛扣子开了","464045"
"北京草莓音乐节","464031"
"广州天气","403735"
"章若楠婚纱造型","378028"
"西安大唐不夜城地铁口排起百米长龙","365787"
"周恩来写人民英雄纪念碑碑文写了40余次","354081"
"当代年轻人可以有多强","347063"
"丁太升","344290"
"王俊凯模仿汪峰唱北京北京","326460"
"余景天","325027"
"五一酒店外卖订单涨2倍","292555"
"渔民捕700斤金枪鱼卖出10万元","292352"
"山河令主题演唱会彩排花絮","281851"
"这就是传说中的比翼双飞吗","278924"
"我让男朋友社死了","246374"
"五四特别版错位时空","241085"
"美国亚裔女子遭锤子狠砸脑袋","240116"
"Hero RW","232793"
"秘密访客","226998"
"浙江一高速6车追尾致6死3伤","220182"
"8旬退休教授为贫困生捐70万","211658"
"理想照耀中国首播","210171"
"中国青年面对时代之问的回答","210144"
"北京大风","210141"
"恋爱应该听父母的意见吗","199537"
"张哲瀚分享演出图","192861"
"少林寺500多年古碑遭熊孩子刻画","192565"
"女子为给偶像删帖被骗8000元","170342"
"世界上穿越沙漠最长的高速","169331"
"我的青春宣言","169296"
"姚策养母将起诉网暴用户","169275"
