"hot_word","hot_word_num"
"盖茨婚后与前女友度假豪宅","292128"
"第二只被麻醉的金钱豹正在恢复","251489"
"一万个理由爱小白管","240787"
"乃万网易云","239327"
"男孩深夜离家去坟地看妈妈","231540"
"每条皱纹 都是勋章","215770"
"赵薇 居然有人来祝我生日快乐","206103"
"白敬亭给张雨绮系鞋带","160468"
"阿富汗首都喀布尔发生爆炸","160235"
"31岁医生去世遗体捐母校","133615"
"上海武康路蝴蝶结已被摘除","131182"
"李佳航发文呼吁互相理解","124598"
"NINEVER","123851"
"三亚政法委介入女子跳舞坠楼事件","112821"
"武警求婚时消防员爬墙围观","107415"
"shib 涨","103792"
"宋祖儿给杨幂做手机壳","93317"
"演员的眼技能有多绝","92929"
"INTO1今天吃什么","92584"
"巴萨","92023"
"交警通报男子被货车货物刮到头","91740"
"硬糖少女异域风造型","91289"
"过三爽吃醋","90865"
"用小时代的方式给依萍庆生","83020"
"日本一医院贴标语呼吁取消东京奥运会","80363"
"金晨 现在和动物都能唠嗑","80216"
"那英cos长公主","77101"
"海底捞市值56天跌2000亿","76896"
"上海老洋房标价上亿元","76811"
"杭州野生动物世界主要负责人已被控制","76811"
"高三老师自费送86名学生机器猫玩偶","76810"
"女生养300斤香猪当宠物","75857"
"印度议员示范喝牛尿预防新冠","73054"
"吴亦凡晒头盔照","65345"
"严厉打击炒作劣迹艺人行为","65271"
"妈妈的身上是香的","65225"
"御赐小仵作","65016"
"Vans联合创始人去世","64678"
"烧伤男孩回应戴奥特曼面具卖樱桃","59939"
"水果还能这样吃","56384"
"段宜恩 回国","55447"
"被白敬亭李维嘉笑死","55033"
"郑州破1990年来5月8日当日高温记录","52703"
"居民楼前建鬼城住户吓得不敢睡","48229"
"母亲节礼物","46458"
"你的婚礼","42760"
"林墨喊话官博","39341"
"游客用铜钱购物体验穿越感","35422"
"杭州野生动物世界第二只外逃豹子找到","27008"
"张镇麟被男球迷偷吻","26030"
