"hot_word","hot_word_num"
"央视批商家平台在倒奶事件中难辞其咎","1204771"
"美国将放弃新冠疫苗知识产权专利","1186125"
"张萌 我道歉每次都是真心的","676121"
"梅琳达盖茨或将成世界第二女富豪","457658"
"世卫称印度疫情向周边扩散","456881"
"牛奶成箱倒掉或涉违法","419026"
"小区保安回应男孩被困电梯坠亡","370929"
"龙门石窟一佛像实现身首合璧","365061"
"五一档总票房破纪录","358641"
"张柏芝和儿子的相处方式","358557"
"张翰初恋因近视无视了他的表白","358419"
"杨笠回应爆红","358369"
"程莉莎 我老公是我的荷尔蒙","358164"
"张柏芝说话大声是因为耳弱","358087"
"美国2020年新生儿为41年来最少","357963"
"张柏芝上海给孩子择校","357844"
"叶小妹撞见过三爽和前女友","357726"
"欧冠","357593"
"印度公布5G试验电信设备供应商名单","357440"
"南京查处首例食品浪费行为","357285"
"杨紫P土味表情包为张一山庆生","357161"
"谢楠 中了周深的毒","357014"
"赵奕欢拍游客照帽子被风刮走了","356981"
"在家吃火锅有多窒息","344257"
"孟佳模仿张含韵嗲音","339349"
"程潇下腰","325272"
"切尔西淘汰皇马","318553"
"美军给阿富汗留下了什么","318420"
"广东通报汕尾4人死亡事故原因","318381"
"关于人性的实验有多恐怖","318344"
"JackeyLove","273996"
"橘猫愣是养成了海豹","257962"
"尹正看郁可唯模仿王者英雄时的反应","226482"
"五一假期人均出游4.18天","201333"
"一不小心就社死了","177770"
"上班第一天","172270"
"这不在一起很难收场吧","171297"
"新疆一沙漠频现海市蜃楼","170878"
"恶意抹黑滴滴司机短视频作者道歉","167885"
"你的婚礼","165508"
"边伯贤更新ins","154294"
"如何处理与父母的经济问题","134654"
"吴磊赵露思 星汉灿烂","109271"
"实拍雷电击中广州塔瞬间","106009"
"印度官员表示第三波疫情不可避免","73238"
"学而思新东方等培训机构被通报","70065"
"依维柯售后","68942"
"27岁以太币创建者获利11亿美元","64288"
"上海申花 上海海港","63763"
"明天要上班了","63729"
