"hot_word","hot_word_num"
"刘芸演的丫鬟","3086056"
"河北新增46例本土确诊","1719776"
"刘宇宁发文告别黑眼镜","1669483"
"年轻人猝死的三大导火索","1646100"
"回老家别随便逗小孩","1461355"
"上阳赋开播","1126579"
"送你一朵小红花票房10亿","996388"
"石家庄新增一例确诊为新娘","949756"
"石家庄多例本土确诊为一家人","940877"
"蓬佩奥称美将停止官方与台湾的接触限制","813140"
"朱锁锁拒绝谢宏祖妈妈条件","782893"
"河北疫情","779040"
"低风险地区返汉人员要持核酸阴性证明","735070"
"谢宏祖三观","560376"
"王彦霖李一桐牙膏吻","515042"
"小沈阳说不再演小品了","440325"
"袁媛","437734"
"山寨食品一天卖出上百箱","427240"
"秦岚刘以豪背后抱","420992"
"辣椒价格持续上涨","415577"
"左小青回眸演技","406278"
"章子怡给赫子铭满星","404058"
"来自爸妈的调侃式催婚","397462"
"范丞丞演技","371861"
"黄光熙近照","362343"
"北京新增1例本土确诊","360918"
"阳光之下","353800"
"公安部举行升警旗仪式","343029"
"梅西梅开二度","341298"
"4家银行踩中房贷红线","340619"
"警察节","340493"
"石家庄大爷不戴口罩强行外出","338980"
"健康码出自一名杭州民警","336285"
"娄艺潇版希尔瓦娜斯","334102"
"众议院民主党人将推出弹劾特朗普立法条款","328700"
"吴邪变成三叔","327393"
"有翡","307244"
"辽宁新增1例本土确诊","294615"
"张艺凡镜头时长","294407"
"卡姆 郑重地和所有人说一声对不起","282558"
"独家探访健康女婴变毛孩子体检医院","256544"
"于朦胧跳舞动作","254991"
"塔图姆新冠检测呈阳性","252354"
"河北南宫今起开展第二轮全员核酸检测","219144"
"商企大亨开始疏远特朗普","218458"
"一只见过世面的兔子","217141"
"下辈子只想考虑一个问题","215645"
"抱走佩洛西讲台的美国男子被捕","214307"
"上海春考","213095"
"2020王者荣耀冬冠","212409"
