"hot_word","hot_word_num"
"张檬最后悔的事情是整容","4953208"
"香港一确诊男子擅自离开医院","3100207"
"沙溢说14年前还是校草","2680355"
"杨幂郑爽同框吐槽好敢说","2547770"
"盛一伦 我现在已经凉透了","2375911"
"青春有你3初C","1361651"
"一诺状态","999208"
"追光吧哥哥","954813"
"中国已为全球提供超2000亿只口罩","929543"
"我就是演员","898660"
"于朦胧李泽锋嗑到了","827904"
"章子怡说马嘉祺谢可寅争气","799857"
"章若楠吃瓜倒立吻戏吃到自己","774229"
"108岁糖果奶奶去世","773971"
"奇葩说","772776"
"快乐大本营","770402"
"有翡配音收到王一博粉丝鼓励","769179"
"螺蛳粉产销量5年翻了21倍","767791"
"南非发现新冠病毒变异","766378"
"劳荣枝","766122"
"路人镜头下的丁真","749569"
"鹿晗兑现医护粉丝承诺","654224"
"国网湖南电力全面进入战时状态","609537"
"DYG夺冠","603288"
"李汶翰李泽锋平板支撑七分钟","600910"
"丰田汽车掌门人炮轰电动汽车","600509"
"崔世安钟南山获授大莲花荣誉勋章","598521"
"一茶一坐全国大面积关店","594604"
"漠河官兵洗裤子5分钟后冻成铁裤","593322"
"郑爽贝雷帽造型","592173"
"5名快递员考入同所大学同专业","533853"
"胖虎斥易烊千玺私生饭","519909"
"SBS演艺大赏","484310"
"美舰穿航台湾海峡东部战区回应","483867"
"杜淳竟然学过跳舞","483846"
"胡夏内投第一","482708"
"宋紫薇","479460"
"了不起的儿科医生","475974"
"钟南山称新冠病毒出现环境传人","469667"
"AG教练月光","468083"
"中国远征军女兵张炳芝逝世","462151"
"广厦对阵广东","460295"
"SBS演艺大赏安全距离","455911"
"这英文翻译很上头","451179"
"如何应对被社会性死亡","449786"
"伊能静刘端端 风中有朵雨做的云","446689"
"小鹿 女人的幽默会消解性感","443067"
"美国驻阿富汗空军基地遭火箭弹袭击","425749"
"美网站评选2020年度谎言","424406"
"周震南星光大赏彩排图","424145"
