"hot_word","hot_word_num"
"郑爽回归追哥因为没协调下来","3196394"
"英国首相想把新冠病毒归咎于中医","1839599"
"2021有你真好","1511402"
"石家庄血小板库存告急","1283332"
"女孩子来例假最希望男孩子说什么","1050975"
"石家庄两万村民转移隔离","1012949"
"朱锁锁发现谢宏祖撒谎","842880"
"顶楼","701198"
"周一围章子怡感情戏","574285"
"春运期间推动健康码全国一码通行","503744"
"抖音回应袁隆平账号已注销","502359"
"肖战说自己长了一张大众脸","495895"
"唇膏的正确涂法","482735"
"多地出现新冠疫苗诈骗","479495"
"央视评山东金矿爆炸企业迟报30小时","472586"
"嵩山少林寺13日起暂停对外开放","465246"
"虞书欣","453396"
"蒲巴甲5分钟镜头拍了9个月","449490"
"中南财经政法大学","439547"
"女生一定要结婚才会得到幸福吗","434488"
"专家称固态电池5年内不可能商用","407024"
"金莎 不希望只被定义为甜姐","363707"
"袁隆平抖音账号已注销","340436"
"王攀招研资格被撤后首次发声","313225"
"特朗普彭斯国会骚乱后首会面","271113"
"王者荣耀","267671"
"恰好是少年改名的原因","263036"
"遭退单代孕女童生物学父亲现身","262554"
"黄轩蒙奇奇同款发型","239088"
"彭冠英苏感","210708"
"烟台一宗进口大马哈鱼新冠检测阳性","182687"
"她和他的恋爱剧本大结局","172002"
"肖战发文谈重庆","169116"
"王儇萧綦篝火吻","155579"
"去年全国基本医保参保人数13.6亿人","153521"
"如何看待留守老人大多是男性","152986"
"湖南高院回应法官遭报复杀害","138944"
"山东省委书记喊话被困工人","138407"
"谢允求周翡嫁一个短命的丈夫","137335"
"2020中国民航旅客运输量达4.2亿人次","135754"
"高圆圆小学时的证件照","135746"
"超市给老人贴我是小偷纸条","134577"
"黑龙江新增确诊16例","128925"
"流金岁月","127869"
"日本滨冈核电站发生漏水事故","127632"
"应聘骑手被要求自愿放弃社保","119548"
"美国赌王去世","115063"
"滔搏","111964"
"山东金矿爆炸事故救援进展","99603"
"警方介入调查假冒健康码软件","99097"
