"hot_word","hot_word_num"
"郑秀晶 创4","2697038"
"素媛案受害人搬家","1862116"
"陈学冬谭松韵舞台上找戒指","1501524"
"百香果女孩","1434025"
"金贤重胜诉","1231745"
"王一博的SVIP","1223969"
"男子被叫下车三分钟后大货车撞上","1076212"
"买到假名牌牵出1.6亿制售假案","941910"
"拜登选择其长期助手担任白宫办公厅主任","916839"
"大润发就女装尺码建议表致歉","894840"
"伊能静双十一买900件商品","889372"
"巴西恢复对中国科兴新冠疫苗试验","845945"
"孙俪发长文为等等庆生","816852"
"特战女兵身上爬满虫子竟纹丝不动","702363"
"我国单身成年人口2.4亿人","649826"
"退款","644068"
"唐嫣直播","643358"
"北京地铁正在研究安检检票二合一","642077"
"田鹏飞新冠检测呈阳性","611625"
"女生期中考试考高分回家嚣张砸门","514030"
"95岁奶奶赶集给近40岁孙子买零食","449689"
"人类的幼崽到底有多可爱","400217"
"网红用棍猛砸41楼落地窗测质量","386733"
"霍尔沃茨的四个学院","371321"
"跟面试官说瞎话讲竞争女生是女朋友","345068"
"入境文件纸里藏毒75份","325068"
"可以拉花的小猫","289552"
"南风知我意开机","267255"
"美国务院阻止拜登和外国领导人通信","266244"
"天津一冷库1份样本核酸阳性","266003"
"最怕明星营业说青岛话","251023"
"杨紫复古色彩视觉大片","236679"
"潜江无症状感染者居住小区全员阴性","232980"
"英国首相称特朗普为美国前总统","232208"
"火箭多名球员不满球队","231978"
"小霸王声明并未破产","223162"
"48岁的陈慧琳","222065"
"辉瑞CEO套现556万美元","217769"
"刘耀文下课冲向食堂的样子","209828"
"原来猫也能痛并快乐着","204991"
"白酒股","204323"
"江南百景图","197255"
"中山1境外输入无症状出院后复阳","194332"
"每分每秒浦东在发生什么","193890"
"巴林首相在美国去世","193021"
"3岁女童横穿马路10次后被撞","192325"
"空降犬跟兵哥哥高空跳伞","190536"
"郑州现脱单公交","190381"
"于正警告造谣者","189494"
"你微笑时很美回应抄袭","188797"
