"hot_word","hot_word_num"
"卓文萱恋情","4399035"
"中美对话女翻译官张京","3015032"
"伊能静婆婆魔性躺赢单曲","2660402"
"杨幂漫画腰","2358308"
"王子文吴永恩同游三亚","1767096"
"苹果因不附赠充电头被罚200万美元","1306896"
"名创优品装万店掌摄像头被立案调查","798440"
"新冠疫苗安全性有效性有关情况","739751"
"古典眉毛","705259"
"英特尔 杨笠","499773"
"张彬彬 没人比我更想司藤下一秒更新","486408"
"蔡徐坤生图","486033"
"吴尊友 几乎所有人都对新冠易感","423991"
"四川师范大学发现宋代古墓","394045"
"青你初C没进出道位","393655"
"全国新冠疫苗已接种7495.6万剂次","392266"
"金靖嗓子里是住着摩托车吗","380927"
"张小斐费加罗男士封面预告","372143"
"山河令编剧微博简介","356399"
"手机壳有多容易翻车","354812"
"浙江酒店推出一键哄睡服务","343561"
"美军计划与印度在喜马拉雅山脉训练","318495"
"张哲瀚微博评论区","300493"
"王霏霏孟佳一口销魂包饭","300106"
"拜登被推友玩坏了","297014"
"马思纯说羡慕米佧邢克垒的爱情","292206"
"华晨宇改编酒醉的蝴蝶","291054"
"机票预订量翻番","287125"
"昆明通报4起重大旅游案件","282473"
"司藤","271551"
"延迟退休对就业的冲击有限可控","249741"
"四川三星堆几千年前就有像火锅的器具","238528"
"黄河大堤内现多头不明来源死猪","230333"
"美国国际学生注册人数下降18%","212245"
"吴珊卓街头演讲呼吁停止仇恨亚裔","187981"
"女子忘拉手刹闺蜜帮踩油门致连环撞车","187798"
"山河令专组","183098"
"好多宇","182644"
"他们选择二次入伍","173444"
"2021LPL","165610"
"世界睡眠日","157059"
"歌曲和MV没有任何关系","153885"
"朝鲜大使馆人员今天离开马来西亚","136522"
"CBA全明星周末","90077"
"漫画腰挑战","88742"
"雪后长城自带仙气滤镜","88057"
"90后将游戏账号虚拟财产列为遗产","87639"
"宰杀食用箐鸡9年后被判拘役","87317"
"深圳地铁争议宣传漫画","86524"
"香港教育局为学生派发国情读本","86143"
