"hot_word","hot_word_num"
"小S 我老公真的是一个好人","3703798"
"成都新增3例本土确诊","2583956"
"黄明昊妈妈已从失信被执行人名单中移出","2486557"
"苏诗丁离婚","2308103"
"成都健康码","2300468"
"成都确诊病例孙女","2112334"
"长相酷似周杰伦摊主回应","1275959"
"大熊猫美香一家三口留美再延长3年","777487"
"福奇被拜登提名首席新冠顾问","740010"
"近几日塌房粉丝们的现状","712976"
"猫妹妹","703139"
"郑爽 拥有过的恋情都是珍贵的","701842"
"虞书欣录歌时差点被砸到","689016"
"成都疾控提醒接触冷冻食品戴手套","620559"
"多名驴友在贵州未开发溶洞失联","592735"
"女子高铁上辱骂母亲","592515"
"成都","591924"
"哈登仍未归队","591556"
"特斯拉市值破6000亿美元","591129"
"焉栩嘉表白文案 粉丝写的CP文","590787"
"王者荣耀","590703"
"印度不明原因怪病儿童更易感染","548603"
"南京提供蛋壳公寓租客一批过渡房源","481425"
"15名擅入未开发溶洞驴友全部找到","425515"
"成都新增3例确诊活动轨迹","416882"
"AK","406681"
"日本欲推迟驻日美军费用分摊谈判","391261"
"霹雳舞等4项成巴黎奥运会比赛项目","384471"
"染发球员过多被判负学校回应","383955"
"送你一朵小红花角色海报","383896"
"五条悟","356798"
"郑爽回应直播失控","326333"
"个税扣除信息如不确认将自动延至2021","317856"
"华春莹感谢世界各国祝贺嫦五奔月","312034"
"邻居称坠楼女婴已是二次坠楼","309196"
"年过的有点突然","294324"
"美香","284114"
"太原晋中两地市民闻到刺激性气味","269445"
"嘀嗒哈啰等顺风车平台公司被约谈","262129"
"坐女童身上玩手机幼师被拘留","229650"
"6日21时后到过成都赫本酒吧的人员","200801"
"31省区市新增确诊12例","181353"
"郫都区中风险地区师生居家隔离","180535"
"举重4个小项被移出巴黎奥运会","178985"
"成都理工","176464"
"八旬奶奶报班学用智能手机","174542"
"成都确诊病例家中冰箱和门把手阳性","172369"
"巨人评分","168860"
"毛戈平又出裸妆大法","168209"
"看起来就很好吃的网红美食","166295"
