"hot_word","hot_word_num"
"货拉拉跳窗身亡女孩搬家视频曝光","253904"
"男子旅居国外诋毁戍边英雄被上网追逃","165252"
"TOMFORD奢光气垫","164809"
"Daft Punk解散","161223"
"澳大利亚一地遭8万狐蝠入侵","86445"
"你好李焕英票房破41亿","64647"
"顶楼","56968"
"陈红军烈士珍藏着妻子的信","56485"
"我国渤海再获亿吨级油气大发现","55797"
"吴孟达患肝癌","55120"
"张小斐路演服装品牌变化","54475"
"正月十六16时17分月亮最圆","46442"
"Uzi加入小象大鹅","43748"
"月球土特产首次公开亮相","43480"
"印度十万人聚集抗议政府新法案","43461"
"西藏冒险王王相军系意外落水","43395"
"张馨予陪袁姗姗过生日","43203"
"比特币","42967"
"火币","42739"
"张艺兴工作室捐赠粉丝匿名红包","42490"
"男子回应假装自杀女友相救溺亡","42223"
"旧金山一栋139岁房屋整体搬迁","41993"
"猝死有这些身体信号","41815"
"假装在开飞机的刘耀文","41726"
"宁毅苏檀儿圆房","41018"
"张杰看歌迷们两年前给他的信","40671"
"华为发布会","39644"
"茅台大跌","39360"
"严禁城里人利用农村宅基地建别墅会馆","39345"
"刘昊然童年旧照","39339"
"吴谨言催章小鱼林睿快和好","37075"
"辽宁一田地里打井涌出75度热水","37005"
"日本超小公寓受年轻人青睐","33694"
"农民收入增速连续11年快于城镇居民","33227"
"美联航停飞所有波音777客机","33148"
"斗罗大陆","32945"
"班婳买了复活甲","30666"
"华为手机4月升级鸿蒙","30438"
"赘婿","27190"
"娜扎魔性撑腰舞","26413"
"赘婿加更","25465"
"中方将向19个有需要的非洲国家提供疫苗","24317"
"王鸥想求一个wink教程","24310"
"学生时代打发时间的巨头","23815"
"原来剧本杀是这样玩的","23283"
"韩美娟发际线","23126"
"家属回应女孩跳货拉拉车窗身亡","22118"
"孙家栋院士入场全场鼓掌致敬","20589"
"长江大学考研成绩查询时间","18123"
"王嘉尔帮老奶奶捡纸箱子","17882"
