"hot_word","hot_word_num"
"刘诗诗称儿子性格很热情","3283002"
"素媛案罪犯所穿羽绒服品牌回应","2171130"
"高洁丝卸妆棉超好用","1887308"
"黄明昊踩空摔下舞台","1878529"
"武汉一小区紧急隔离是在拍电影","1724989"
"司机为救婴儿连闯红灯家属拒绝作证","1272808"
"韩国扑杀440多万只家禽","1006389"
"王一博罗晋给菜取的名字","936150"
"游客凤凰古城租衣服被禁止自拍","825211"
"默克尔宣布实施硬性封锁令","745761"
"给兵马俑拍照的人","718968"
"为了看潘长江爬上树","660387"
"多地出现自称辛巴客服形式诈骗","614414"
"宝蓝回应ID事件","420423"
"村民深夜被带走谈话6小时后昏迷","410247"
"吴京儿子手臂线条","355297"
"RM","352327"
"老君山因泡面走红结果垃圾遍地","346893"
"上海地铁","341030"
"韩国无住房新婚家庭占比近6成","337243"
"傲慢与偏见背后的故事","331832"
"有翡武术特辑","328149"
"黑龙江新增2例本土病例","297168"
"90后用6年写书还原南京大屠杀真相","281059"
"长沙下雪","276760"
"深圳首次招录港澳籍公务员","273045"
"男子骑马从新疆伊犁回福建老家","257103"
"快船 湖人","229340"
"交个朋友直播间答复王海","225479"
"乌合麒麟","224898"
"杜兰特回来了","224822"
"纽约发生枪击案枪手朝警方开火","223228"
"黑龙江不得新建高度500米以上建筑","220992"
"尼日利亚一中学遭袭300多名学生失踪","218153"
"美国选举人团将投票","213472"
"明年起江苏省乡镇工作人员补贴翻番","211796"
"进击的巨人","211283"
"股市","200879"
"表演艺术家黄宗英去世","192770"
"成都疫情","190620"
"河南濮阳一进口冷冻带鱼核酸阳性","190524"
"70城房价涨幅回落","188991"
"杜兰特威少赛后拥抱","187378"
"山西侯马急寻涉两场所市民","186415"
"初雪下的南京城","185420"
"周一的网上和现实","184371"
"长江口一船进水下沉16人遇险","184072"
"冬季青海湖如蓝宝石","177195"
"富大龙演秦始皇绝了","172296"
"包装礼物的正确手法","171848"
