"hot_word","hot_word_num"
"院士不建议普通孩子学奥数","2329940"
"建议鼓励用人单位为职工提供托幼服务","1046332"
"发光玩家在线应战","966686"
"杜淳哄王灿测血糖","896056"
"建议未成年人网游每30分钟刷一次脸","871670"
"十三届全国人大四次会议新闻发布会","735286"
"江苏明确教师不得用手机布置作业","719120"
"鲜花价格猛涨","682110"
"代表建议让学生在校内完成家庭作业","666852"
"菠萝价涨近3倍创历史新高","665117"
"中国17支新冠疫苗进入临床试验","529660"
"全国人大会议议程","528457"
"永不消逝的爱","484888"
"建议尽快制定老年代步车法律法规","462852"
"中国抗疫合作不为谋求地缘政治目标","461303"
"马化腾建议共享单车社区团购纳入监管","461219"
"海底捞牛肉粒变素了","460660"
"金莎挑战10天不洗头出街","458363"
"青春有你","446542"
"黄圣依杨子小学生式互怼","443091"
"张天爱喊话营销号","439169"
"人大代表再谈整顿饭圈文化","428507"
"R1SE官博回应录制团综","423150"
"韩国首位变性军人死于家中","414570"
"SHINee获得一位","414031"
"假名牌化妆品马桶边加工","404005"
"老人花28年种出9层楼高三角梅","396557"
"基金","393611"
"女兵背18公斤导弹筒冲刺300米","392176"
"全国两会","392027"
"肖战磨冰刀","363518"
"冲断学生队伍司机已被警方控制","353691"
"司机强行穿过学生队伍过斑马线","337459"
"男子西藏发现蓝色古冰川","337413"
"肖战冰球运动推广大使","334302"
"徐穗珍","321201"
"人大将审议完善香港选举制度议案","317212"
"魏大勋说太感动案子不破了","317033"
"孙亦航大哭","306953"
"创4一公副本直播","276385"
"政协开幕会现场版手语国歌","262754"
"中国加强国防建设不针对不威胁任何国家","255154"
"代表建议设轻罪前科消灭制度","236742"
"赘婿","227554"
"中国脱贫标准符合自身经济社会发展水平","227405"
"宋亚轩跟妈妈弟弟连线","227289"
"徐子未vocal组第一","227288"
"我国第三批航天员将进入训练","227287"
"天问一号拍出了火星极冠和晨昏线","221699"
"导盲犬未带嘴罩被地铁拒绝入内","221050"
