"hot_word","hot_word_num"
"考生因太紧张连续2天丢失身份证","1197536"
"面具男孩要高考啦","486729"
"为店铺刷好评被明确定性为黑灰产","472011"
"易烊千玺抱胖虎女儿","365589"
"加好友是想看你们越过越好","310647"
"专家提醒亚洲象会不惜代价保护小象","263140"
"3个动作消除富贵包","257279"
"粗心父亲半年时间两次丢娃","249752"
"高三老师入住学生宿舍全程伴考","212293"
"黑龙江鸡西煤矿事故失联8人全部幸存","210531"
"袁咏琳小时候曾被霸凌","209604"
"男子隔玻璃给猩猩送吻被回吻","202402"
"夏之光微博热评","202061"
"女子超市偷4000元巧克力只嚼不咽","201429"
"深圳疫情","200387"
"汪小菲太有趣了","199277"
"李荣浩连续六年的高考祝福","198786"
"路人听到杨超越王迅说谢谢的反应","198428"
"林志玲晒照纪念结婚两周年","197150"
"一诺状态","196502"
"邓伦发微博有多严谨","195859"
"你喜欢的人也喜欢你是什么感觉","195095"
"杨紫哭戏秒落泪","194588"
"angelababy为高考生打call","180191"
"张彬彬把隐形眼镜哭掉了","172156"
"张颜齐","165156"
"看完电影能直接走吗","159063"
"初晨的露娜","145379"
"巴西消费者告赢苹果公司","139189"
"白俄总理称准备放弃欧美技术","138666"
"高三晚自习遇上夏夜晚霞","138330"
"刘涛许凯吃西瓜沾盐的表情","123513"
"大S妈妈透露大S仍在生气","115783"
"李现晒重庆大学打卡照","103407"
"东风快递员夏日烧烤晚会","100188"
"连打疫苗都有内卷了","98002"
"校长为高考生送1个火腿2鸡蛋","92291"
"有些人比狗还要狗","89783"
"觉醒年代","82204"
"看把小象给摔的","79653"
"被公司要求转发朋友圈","74633"
"与君初相识剧组杀青","67067"
"陕西有一块985和211路牌","65458"
"广州地铁好空","60187"
"高考前最后一课图鉴","59273"
"天天向上","59098"
"恰好是少年","55477"
"明天都给我好好考","51415"
"月光变奏曲","50898"
"高考祝福","47432"
