"hot_word","hot_word_num"
"谢娜晒张杰手写的留言卡","2035368"
"俄罗斯五一连休十天不调休","1686623"
"林墨被阻止比赞的表情","1403728"
"沈梦辰斑秃","1272663"
"救下被老虎扑倒女子司机回忆经过","1139933"
"彭昱畅 腹肌还在吗","716572"
"年轻男子奶茶中被投安眠药","694289"
"伤人东北虎进入隔离检疫期","672861"
"教育部规定严禁要求家长批改作业","629831"
"上海楼盘认购前需公示3天","598823"
"张伟丽被KO","589186"
"张柏芝倒立摔伤腿","586827"
"刘诗诗探班杨幂","580657"
"INTO1成员生图","571472"
"印度民众排长队购氧自救","564729"
"腾讯公开单向好友检测专利","552713"
"沙溢回应被安吉说像大狗熊","543872"
"徐璐漫画腿","538479"
"大学生炒鞋被鞋圈假大佬骗百万","524809"
"晋江月逝水","517801"
"故宫五一假期5天门票全售罄","515057"
"陈博鉴方婷","472119"
"撒贝宁刘雨昕毛不易斗舞","450382"
"张哲瀚五阿哥造型","400672"
"邓稼先隐姓埋名搞原子弹时夫人一无所知","385118"
"拜登认定亚美尼亚惨案为种族灭绝","377115"
"伯远要单身8年了","321037"
"突然回家发现父母都病了","302781"
"可乐荷包蛋拌饭","288848"
"林书豪鼓励张伟丽","273747"
"小舍得","273118"
"张艺谋评价周深歌声","269555"
"英国近万人抗议疫情封锁爆发冲突","249242"
"教育部提出中小学生作业管理十条要求","246424"
"多名驴友穿越未开发海岸被海浪卷走","246318"
"24岁城管协管考上厦大研究生","228540"
"津巴布韦准备出售大象猎杀权","226795"
"张伟丽回应卫冕失败","224614"
"悬崖之上","212161"
"印度新冠患者出现了新症状","207516"
"早期新闻有多离谱","187001"
"保障学生校内外各1小时体育活动","186096"
"盗墓笔记动画水下戏","182257"
"Hero LGD","181764"
"蔡徐坤高腰工装","181727"
"广东佛山一初中开理财课","181711"
"90年代复古港星妆","180363"
"霍格沃茨收中国人吗","180254"
"福建驴友越未开发海岸线1死1伤","154850"
"出道位是在致敬EXO吗","154291"
