"hot_word","hot_word_num"
"专家回应别人打了疫苗我就不用打","428728"
"黄明昊泼贾乃亮的水泼到自己身上","287702"
"沈海高速交通事故4人仍在ICU抢救","223150"
"陈乔恩艾伦接吻庆生照","196514"
"我国接种新冠疫苗为何先年轻人再老人","169755"
"李菲儿为假唱道歉","167072"
"极限挑战","158601"
"陈祥榕奶奶至今还不知孙子已牺牲","157719"
"2021年共和国已痛失9位院士","157211"
"iG战胜EG","156299"
"VaVa说丁太昇吃了文化有限的亏","154972"
"印度安全部队遭袭已致22人死亡","153209"
"易立竞 提词器是在限制我只能这么吐","153103"
"肖战玉骨遥定妆路透","152962"
"汤普森加盟广东男篮","152264"
"赵露思领养需要特殊照顾的流浪狗","152015"
"迪丽热巴吴磊 般配式演技","151426"
"阮青夏束文波结婚","150597"
"5家上市银行个人房贷占比超标","150439"
"米佧邢克垒沙发吻","138982"
"李一桐晒沙滩照","131953"
"张彬彬是预言家吧","131688"
"龚俊大喇叭应援创4学员","118007"
"陈卓璇钻石星月复古套装","114012"
"安徽农业大学学生拒服兵役被处罚","107107"
"泰山酒店价高游客挤厕所过夜","101878"
"美海军罗斯福号航母进入南海","87166"
"魅族就清明争议文案道歉","85725"
"人民英雄永垂不朽","85708"
"日本已婚女性超四分之一遭家暴","85707"
"kaka","85706"
"女性展示身材有错吗","81041"
"黄明昊我想有个家","80852"
"八旬烈士母亲跨越千里墓前痛哭","78315"
"米佧邢克垒订婚","78112"
"亡命毒贩冲撞民警被开枪击中","75553"
"魏宏宇排名","74968"
"文森佐","73188"
"15岁男生网络发布不良信息被抓","70383"
"那兔清明特别版","67730"
"HIStory4近距离爱上你","65407"
"成年人的累是看不见的","63364"
"新冠疫苗接种犹豫普遍存在原因","62653"
"最让人舒服的角落","58823"
"民警牺牲数月女儿还在发微信找爸爸","58600"
"如何看待炒鞋热蔓延至国货","58002"
"山河令","54385"
"长歌行","53129"
"清明","52525"
"永远记住你","51152"
