"hot_word","hot_word_num"
"黄子韬想和性转后的自己结婚","3378848"
"大连24例感染者经4次以上核酸后呈阳性","2289657"
"李晋晔王骁詹秋怡拿offer","1461121"
"石家庄疫情","1424904"
"范丞丞妈妈就是我妈妈本人","1363777"
"航拍今晚的石家庄站","1299184"
"健康码的温度在哪","1113352"
"美国国会确认拜登胜选","917923"
"浙江取消单位集体团拜活动","835604"
"谈莉娜方回应穿的衣服是假货","825038"
"郑爽粉色纱裙","823567"
"小鹿 为什么不能有灯牌里的妈妈","758422"
"河北南宫新增2例阳性","746979"
"发型对颜值的重要性","746672"
"赘婿","746329"
"新郎结完婚把新娘忘在酒店","745529"
"周深曾和父母一年只通一次电话","745142"
"多家银行着手清理个人睡眠账户","744312"
"西单大悦城全部餐饮商户闭店整改","743672"
"虞书欣淡绿色连衣裙","743229"
"山东春晚官宣张韶涵刘雨昕","742888"
"赘婿原作者发文","733341"
"妈妈当年的穿搭有多美","675151"
"流金岁月","659953"
"财阀千金晚宴妆","659460"
"特朗普承诺有序进行政权交接","658353"
"基金","657705"
"中消协点名大数据杀熟","656904"
"女子零下17度吹泡泡变水晶球","656556"
"杨丞琳让李荣浩潘玮柏带她认识Lisa","596943"
"令人心动的offer","553127"
"有翡","495871"
"暴乱后美国国会内部","492506"
"了不起的女孩大结局","491508"
"泼水成冰泼了个寂寞","466276"
"美国国会骚乱中枪身亡女子系退伍女兵","460175"
"奇葩说","446413"
"石家庄新增阳性11例","435928"
"蔡文静的年度关键词像恐怖片","408430"
"李一桐金晨687手势拍照","387071"
"该不该阻拦妈妈疯狂应援男明星","382586"
"公交公司再回应老人不会扫码被赶","364559"
"万茜现身央视春晚","357364"
"文咏珊演技","355243"
"高晓松身材","354149"
"女神降临","335553"
"刘宇宁直播","333580"
"字节跳动称腾讯封禁飞书系列产品","330299"
"申通回应应届生拒绝996被辞退","329387"
"华信信托董事长用锤子打伤总经理","313991"
