"hot_word","hot_word_num"
"吴亦凡方律师声明","3307370"
"电视剧泄露私人手机号被判赔3.5万","1741879"
"男孩70天打赏主播158万被判全额返还","1501974"
"广州疫情","1423521"
"新北市36岁男子确诊隔天死亡","1126538"
"许晴说肖战演的五号病人是美强惨","866092"
"萌探探探案","825949"
"中国新冠疫苗报告接种不良反应31434例","686530"
"河南2019级高中学考176人违规作弊","634343"
"三星堆又出土一件金面具残片","587172"
"原来小象不会用自己的鼻子","580787"
"福建立法4岁以下儿童乘车必用安全座椅","526133"
"曾经的疫苗我不懂得珍惜","525989"
"月球上新增8个中国地名","522818"
"两院院士大会","521667"
"丁香医生科普吴宣仪贫血喝奶茶","518528"
"孙亦航改微博名","516625"
"终于可以给妈妈零花钱了","515659"
"张蓝心用腿帮沈梦辰挡腿","505598"
"中国澳门女排选手吹奏国歌","496043"
"奔跑吧","489633"
"广东22岁女孩遇害案嫌疑人被抓","481493"
"阚清子晒泡泡发型照","449819"
"淘宝特价版更名成淘特","437798"
"xwonder是软件商标名","436875"
"外卖评论里的高能回复","436859"
"宋茜紫色麻花辫造型","372448"
"老人退休金迟迟不到账发现被死亡","359308"
"妹妹找哥哥帮忙写作业","351587"
"华为注册鲁班商标","348144"
"德国承认在纳米比亚进行种族屠杀","346862"
"731部队负责人曾是德特里克堡顾问","317385"
"上海2020年结婚9万对离婚6万对","299673"
"买荔枝指南","287656"
"萧敬腾 三亚下雨","273079"
"中国人造太阳创亿度百秒世界纪录","269934"
"醉倒小象已回归象群","242581"
"寂静之地2","242010"
"当男人恋爱时定档","222269"
"哆啦A梦","218299"
"警方通报呼和浩特一小学生自缢身亡","210434"
"赞多打架子鼓","203057"
"三星堆铜顶尊跪坐人像","189775"
"B站上线老友记重聚特辑被指侵权","185394"
"NASA火星直升机发生重大飞行错误","180700"
"广东英德遇害女生父亲发声","178401"
"如梦之梦repo","177664"
"朵唯再回应二驴夫妻被指带货山寨机","177469"
"被甄嬛传配音惊艳到了","177117"
"张哲瀚电梯氛围感大片","171912"
