"hot_word","hot_word_num"
"奥斯卡评委夸易烊千玺","1855281"
"不得故意安排学生单独坐最后一排","1824410"
"太平鸟星设计师刘雯","1818682"
"余景天回应15岁做中国新歌声评委","1818504"
"丁真和老板合照故事感","1372847"
"绝密使命热播","1249006"
"小舍得","809929"
"巴基斯坦酒店遭袭击时中国代表团外出","788154"
"香奈儿诉华为logo侵权败诉","686109"
"林书豪想回亚洲打球","616319"
"广西唯一的世界地质公园遭破坏性开发","609164"
"寻找周杰伦停止再版发行","596717"
"肖战演的五号病人","565742"
"王灿回忆生产过程","505179"
"汪文斌提醒日方人类只有一个地球","434004"
"如梦之梦repo","433928"
"肖战如梦之梦首演","417802"
"中南大学一硕士生坠楼身亡","407844"
"龚俊帮张哲瀚认人","387114"
"警惕明星代言金融产品风险","384863"
"建立中国自主棉花标准体系","364779"
"刘昊然辣评痛仰","361354"
"鹿晗ELLEMEN封面","360497"
"领导没走的话可以下班吗","354583"
"女演员发言可以有多绝","317440"
"原来你是这样的人民海军","313730"
"星巴克自带杯免费喝咖啡","312829"
"白发奶奶设计师开个人时装秀","293680"
"白敬亭 全世界都知道我不干净了","261298"
"摩托车驾考人数成倍暴涨","247488"
"央美学生刺绣作品","244154"
"王者荣耀新英雄云缨","240204"
"吴磊为一场戏健身四个月","234132"
"外交部回应澳方撕毁一带一路协议","220592"
"亚马逊考虑接受狗狗币支付","214043"
"职工医保可支付家庭成员在定点医院费用","212308"
"伊朗无人机拍美航母近距离画面","211189"
"当猫咪偷亲成功后","197996"
"南京被困电梯30分钟可获赔200元","181072"
"AI首次预测未来两年气候","168257"
"长歌行","167074"
"青你3训练生随机女团舞挑战","159368"
"李一桐教许凯方言版快乐星球","158041"
"一袋火锅底料牵出跨省贩毒链","157755"
"陕西千年渡口摆渡人即将失业","157621"
"天琴座流星雨","149320"
"网红第一股如涵控股美股退市","146765"
"FPX关于选手周杨博处罚结果公告","146490"
"爷青回日系JK妆","145947"
"作者介绍的差别有多大","145915"
