"hot_word","hot_word_num"
"信小呆被多家公司抢注商标","1699378"
"广州高风险区孕妇早产母子平安","932983"
"易烊千玺to签模仿粉丝笔迹","931222"
"理想生活狂欢季",""
"把男朋友熬成了祖孙三代","930603"
"谢娜分享跳跳俏俏互动日常","876409"
"杨洋迪丽热巴客厅路透","841489"
"看月光变奏曲学谈恋爱",""
"辞职后工作群千万不要主动退","805994"
"你介意同事上班摸鱼吗","803693"
"鸿蒙全家桶","796763"
"全国新冠疫苗接种剂次超7亿","792562"
"被领导故意撮合怎么办","792057"
"差点笑死在简历里","776902"
"陈薇称正在申请吸入式新冠疫苗紧急使用","645429"
"台女子持阳性证明登机抵厦门","578046"
"万名志愿者退出东京奥运会","568865"
"中餐厅5 嘉宾","564064"
"岳岳 我更好了但机会更少了","553385"
"岳云鹏不知道德云斗笑社哪天录制","550537"
"薇娅公司被行政处罚","541940"
"吸烟装","521437"
"印度8岁孩童打扫新冠隔离点厕所","511466"
"刘芸扮演邓稼先夫人倒模过程","486968"
"李兰娟呼吁60岁以上老人打疫苗","428427"
"不教高年级的原因","406538"
"李健 Marine不是某一个女人","398171"
"刘耀文跟NPC尴尬对视","351649"
"深圳龙岗区居民自发为医护人员送行","350350"
"外交部称美国是公认全球头号窃密大户","329933"
"湖人快船会被双双淘汰吗","324508"
"原来这就是轻奢啊","322981"
"给蚊子做了个口罩","322936"
"主动放弃爱情的瞬间","322889"
"袁娅维演出后台摊煎饼","320025"
"挨着坐的两只小奶狗","317554"
"商务部 中美经贸领域已开始正常沟通","286039"
"王源 建议恐怖本程度加深","275625"
"觉醒年代","269757"
"广州又有2地实行封闭管理","261638"
"高考诈骗受害者3年后诈骗高考生","252248"
"从今以后只信CCTV厂牌的曾毅","248922"
"云南堵象人4天吃住卡车上","238511"
"梁洁晒双世宠妃三季小檀对比照","223435"
"上海警方查处趣住APP","223397"
"驾驶员社死现场","222884"
"被骗后拉闺蜜入伙共被骗130万","222118"
"广州核酸排查已发现阳性29人","221762"
"白敬亭逗NPC","221637"
"戚薇把香蕉皮挂胸口","208722"
