"hot_word","hot_word_num"
"张璋切错号夸自己温柔大漂亮","2696914"
"我国适龄儿童可免费接种11种一类疫苗","1182886"
"500余名艺人发声反对短视频侵权","1127490"
"原来家有儿女鼠标长大了","1088167"
"张家界通报导游怒骂游客骗吃骗喝","1010646"
"马伯骞的幻想世界","865685"
"贾乃亮打掉节目组摄像头","851348"
"INTO1发文告别创4","672800"
"美国将向印度提供医疗资源","630842"
"58岁时他终于完成了7岁的梦想","618234"
"张蓝心 不要因为我是女孩降低标准","614894"
"阚清子妈妈朋友圈","610234"
"上海车展车顶维权车主发声","601707"
"印度公司下单中国制氧机","598176"
"从法律角度看小舍得","593159"
"梅西被铲倒","584978"
"原来世界上真有人会偷影子","576891"
"男孩被疯牛袭击躲车底道歉","576274"
"北京五一发放45亿消费大礼包","567113"
"张馨予医生造型","564477"
"张文宏谈印度疫情失控","499256"
"外卖超时的原因找到了","452695"
"王一博回忆坐绿皮火车经历","403701"
"洛阳一在建大桥发生坍塌","360391"
"董子健 美好回忆碰了就没了","327618"
"孟鹤堂画的周九良","313265"
"中俄等多国表示将向印度提供必要援助","290854"
"清华大学110周年校庆晚会","275498"
"B站回应招聘争议并致歉","273776"
"郭老师 南京","272588"
"亲人离世对人的影响有多大","270439"
"INTO1离岛向粉丝90度鞠躬","260931"
"圆明园万株牡丹齐盛放","191987"
"烟台发现1例入境确诊治愈后复阳","180585"
"玩密室逃脱被NPC咬了两口","176680"
"利路修 谢谢大家的支持我终于下班了","176427"
"小学女生跳舞帅到犯规","164358"
"李润祺带花接机付思超","146532"
"人不可能一直倒霉吧","143080"
"肖战粉丝如梦之梦15分钟repo","137924"
"我国科学家将光存储时间提升至1小时","137915"
"晋江月逝水","136501"
"长歌行","122397"
"我国数字经济总量跃居世界第二","119543"
"校长发表熟蛋返生孵雏鸡论文","117968"
"租70万元宝马轿车以20万卖掉","116840"
"恰好是少年","104210"
"00后高原女兵机降训练","88738"
"内蒙古沙尘暴现巨型沙墙","84932"
"语文老师讲与妻书学生掩面哭泣","84402"
