"hot_word","hot_word_num"
"货拉拉跳窗身亡女孩搬家视频曝光","418047"
"男子旅居国外诋毁戍边英雄被上网追逃","234286"
"今天呼吸自由了吗","233204"
"Daft Punk解散","222259"
"你好李焕英票房破41亿","172469"
"张小斐路演服装品牌变化","100201"
"吴孟达患肝癌","99296"
"澳大利亚一地遭8万狐蝠入侵","94143"
"我国渤海再获亿吨级油气大发现","90039"
"西藏冒险王王相军系意外落水","89633"
"顶楼","87591"
"Uzi加入小象大鹅","80055"
"正月十六16时17分月亮最圆","74516"
"陈红军烈士珍藏着妻子的信","69077"
"印度十万人聚集抗议政府新法案","68965"
"赘婿","68929"
"张艺兴工作室捐赠粉丝匿名红包","68926"
"华为发布会","68921"
"比特币","68279"
"张馨予陪袁姗姗过生日","67779"
"男子回应假装自杀女友相救溺亡","66329"
"刘昊然童年旧照","66015"
"宁毅苏檀儿圆房","64543"
"猝死有这些身体信号","63599"
"吴谨言催章小鱼林睿快和好","63193"
"日本超小公寓受年轻人青睐","62618"
"火币","60086"
"茅台大跌","59857"
"严禁城里人利用农村宅基地建别墅会馆","59768"
"王鸥想求一个wink教程","59740"
"华为手机4月升级鸿蒙","59320"
"张杰看歌迷们两年前给他的信","55801"
"旧金山一栋139岁房屋整体搬迁","54976"
"农民收入增速连续11年快于城镇居民","54369"
"假装在开飞机的刘耀文","54014"
"韩美娟发际线","48660"
"学生时代打发时间的巨头","48139"
"赘婿加更","47899"
"月球土特产首次公开亮相","46075"
"斗罗大陆","44974"
"美联航停飞所有波音777客机","44711"
"原来剧本杀是这样玩的","41813"
"娜扎魔性撑腰舞","41397"
"辽宁一田地里打井涌出75度热水","38467"
"孙家栋院士入场全场鼓掌致敬","37082"
"班婳买了复活甲","34583"
"家属回应女孩跳货拉拉车窗身亡","34213"
"王嘉尔帮老奶奶捡纸箱子","28967"
"长江大学考研成绩查询时间","23592"
"中方将向19个有需要的非洲国家提供疫苗","23391"
