"hot_word","hot_word_num"
"河南卫视杀疯了","6055580"
"外籍船舶在中国海域违法排污","4214493"
"杜海涛沈梦辰隔空秀恩爱","2532022"
"王鸥斯斯斯斯斯 斯维诗",""
"男明星生图 不行","2147020"
"张予曦小号微博评论","1733452"
"兰陵王入阵曲 震撼","1055725"
"因为你我觉得党员真了不起","830491"
"林汝为逝世","810463"
"周琦左眼视网膜裂孔","782308"
"南方人过不了六级的原因","721181"
"魏晨看不出已经35岁了","710211"
"男明星什么时候卷起来","689286"
"周也张婧仪去拍双生姐妹花吧","675962"
"高校通报教师多配偶言论","658779"
"建党100周年庆祝大会首次综合演练","643115"
"宋妍霏不回弟弟微信","620162"
"十堰天然气爆炸","612084"
"粽子不宜空腹吃","601955"
"倪妮刘浩存在张艺谋面前哭了","597116"
"国网痛斥资本大搞1分钱充电","555457"
"11岁男童杨展豪","553666"
"当年的刘忻洪辰","543191"
"夫妻摆摊养活脑瘫3胞胎","505021"
"张哲瀚说自己现在上高速路了","472987"
"模型逼真到以为作者是个巨人","469827"
"超越","468574"
"你永远可以相信张艺谋","431660"
"张天爱回应背后有金主","424428"
"尹正 无效减肥","411065"
"逃犯接种新冠疫苗被辅警被认出","396561"
"在水下泡26个小时拍出的水下飞天","377252"
"一定要拒绝借花献佛式帮忙","358402"
"张哲瀚把自己的奖杯递给刘浩存","339365"
"北京这辆公交车秒变救护车","309096"
"八旬老人用十几味中药制非遗香囊","299557"
"云南野象群互踹打闹","293195"
"爷爷 快看镜头有人在拍你","250976"
"快船战胜爵士","250018"
"越南证券交易所交易量大到休市","247926"
"广州通报涉疫重点区域和场所","244559"
"陈立农孟美岐用奖杯碰杯","242183"
"这一次爱神拦截了死神","239911"
"划伤后的正确止血方法","238799"
"热带往事","235174"
"封闭备考的广州考生说也没多慌","231959"
"甘肃监测到四对野生大熊猫母子","230808"
"中国女排战胜荷兰女排","227199"
"普普通通却又爱意浓浓","226629"
"埃里克森突然倒地","226172"
