"hot_word","hot_word_num"
"建议明确中学性教育课时安排","1901362"
"建议取消1至3年级家庭作业","1637387"
"建议劣迹艺人惩戒期满后可复播作品","1584832"
"建议整顿无底线追星","1280374"
"发现未成年人遭受侵害不报告可追刑责","930654"
"飞天小女警真人剧集主演","892203"
"杭州酒店床品抹布装芯片","779634"
"店主讲述共享猫咪9块9租一天","777196"
"建议对996工作制进行监管","765121"
"建议鼓励城市离退休人员告老还乡","749455"
"吴奇隆刘诗诗带儿子出游","736951"
"餐厅起火老板丢下顾客逃跑被行拘","726061"
"违背祖训神医张文荣被医院免职","716001"
"赛琳娜将暂别乐坛","711893"
"郑允浩为违反防疫规定道歉","697246"
"邓超晒孙俪做的布里修","689894"
"王嘉尔回复白敬亭说我爱你","685275"
"基金大跌","676383"
"张坤刘格菘旗下基金创最大回撤纪录","664683"
"创4主题曲中英双语版歌词","652039"
"迪丽热巴走着走着鞋掉了","641809"
"赖冠霖别想打扰我学习MV","631424"
"重庆刀片天路","625008"
"春日限定小雏菊妆","609189"
"减肥辅助器","601052"
"肖战光点2020全球单曲畅销榜第七","551625"
"英国医生称多数咖啡粉中含有蟑螂","506010"
"教育应该培养全才还是专才","440817"
"2021届名人堂最终候选名单","422909"
"山羊奶可以难喝到什么程度","412194"
"菲律宾一市发生枪击市长身亡","404753"
"昆山成全国首个市场主体破百万县级市","395483"
"和马对粉丝说会尽快回来","376089"
"轮到你了将拍电影","357518"
"邓超说孙俪做的早餐像猫粮","356711"
"贫穷真的会限制想象","353548"
"建议保障农村女性平等土地权益","349143"
"人类幼崽后脑勺图鉴","344657"
"星援App开发者一审获刑五年","313719"
"詹姆斯妻子晒婚纱照","304945"
"司藤是语言大师吧","289722"
"河南安阳97年基层干部用OKR养猪","289399"
"感觉眼睛被欺骗了","284100"
"建议推行免费婚检","277506"
"韩国一肉类市场暴发新冠疫情","275531"
"英国首相回应哈里夫妇爆料式访谈","275076"
"庭审现场家暴者竟跑到受害者家中","271504"
"建议将虐待动物纳入治安管理处罚法","270167"
"尤文欧冠出局","269241"
"基金段子大赏","261461"
