"hot_word","hot_word_num"
"我们离婚了","5612502"
"出生仅41天婴儿熟睡中完成核酸检测","1320632"
"汪涵李雪琴李佳琦直播被中消协点名","1303330"
"丁真开通微博","1274474"
"鹿鼎记导演说张一山是演技扛把子","1131864"
"李易峰爱让你放闪","1115703"
"教育部回应为中小学生减负大学生加压","1054905"
"刘嘉玲双马尾","1025706"
"美总统官方推特账号将自动转给拜登","811714"
"江歌妈妈 网络暴力是在伤口上撒盐","802010"
"杨幂刘诗诗合照","743514"
"孟佳 看节目那走向都觉得自己挺锋利","626764"
"我国电子社保卡申领超3亿张","581246"
"内蒙古新增2例本土确诊","546691"
"被虐致死女子生前三次电话求熟人","543024"
"北京人和降级中乙","540703"
"鹿呦呦好可爱","534728"
"暴雪后大学生僵尸式下台阶","531041"
"不提雪字描述雪很大","527807"
"从前的偶像有多绝","490028"
"初雪奶枣","478919"
"17岁男孩被压车底众人抬车救人","474599"
"刘诗诗像小说里的豪门千金","369744"
"当朋友问我是不是生气了","369193"
"适合代入豪门小说的长相","358543"
"满洲里","357960"
"故宫初雪新人雪中拍婚纱照","304103"
"猫咪的丑各有千秋","291235"
"失去手掌脚掌坚持当老师12年","284672"
"初雪烧烤宽粉","281723"
"业主自救烂尾楼交房前遭开发商加价","273590"
"爱乐之程还没找到节目定位吗","261150"
"女子造谣上海某学院强奸案被行拘","237862"
"特朗普律师开记者会两颊抢镜","220355"
"山东德州发现东汉古墓","209917"
"天官赐福","209376"
"冬日糯糯鸡爪煲","204956"
"内蒙古满洲里客运站停运","203334"
"希望长存的原班综艺人马","185912"
"东北人对大雪的尊重","178971"
"浙江绍兴出现1例境外输入无症状复阳","177410"
"山东乳山拟推出购房冷静期","167610"
"中国最牛打印店IPO","163145"
"下雪的真正含义","162302"
"警方通报男子被浸猪笼","160497"
"首尔vs国安","157794"
"故宫的雪","156780"
"VOGUE晚宴回顾照","147914"
"北京下雪","145294"
"开国少将詹大南逝世","144815"
