"hot_word","hot_word_num"
"杨超越 曝光我造型出图还有新鲜感么","3707422"
"90岁结核医生说最有效的处方是爱","1066583"
"广本极限挑战赛最新成绩","1065642"
"林峯拒绝婚前财产公证","1062659"
"没有武林外传蹭不上的热点","987195"
"张翰十年只谈过两个女朋友","978810"
"大岛日记","889476"
"副处长送外卖12小时赚41元","734829"
"华谊兄弟回应王忠军被限制高消费","633108"
"米卡对庆怜说你做得已经足够成团了","631185"
"阿娇高中校服照","629033"
"吴奇隆刘诗诗一家三口逛超市","566226"
"贵阳机场厕所洗手池布满化石","565788"
"武汉在校博士后因套路贷自杀","563861"
"国台办回应两岸最终难免一战说法","562410"
"已故三星会长遗产税高达699亿元","561213"
"何榜","560061"
"冷门歌手孙燕姿","557770"
"美团回应副处长当骑手1天赚41块","556279"
"刘涛 小图以为我穿了蓬蓬裙","554406"
"初中生800米冲刺没摔没撞竟骨折","553105"
"谢娜为何炅庆生","552797"
"从楼上明白了分手的痛苦","533475"
"SDT娱乐声明","466359"
"李想谈员工侮辱别人企业是否该道歉","400443"
"怦然心动20岁艺人官宣","400281"
"小舍得","358095"
"重庆土拍","330910"
"广州房贷28日起再度涨价","328068"
"张艺兴晒童年与何炅合照","327526"
"我科学家发现能降解塑料菌群","316965"
"龚俊五四晚会路透","301249"
"男子15万8卖亲儿子后到处挥霍","297589"
"住农家乐游客报案遭村民入室性侵","287407"
"秘密访客","278237"
"你的婚礼","262112"
"依法打击短视频侵权盗版行为","253847"
"广东成全国首个单日接种量破百万省份","248981"
"女孩主动要求被风筝带上天","235191"
"杨超越工作室声明","227394"
"红火蚁已扩散至我国12个省份","222137"
"女心理师蒙眼吻海报","219115"
"狗狗币大涨","210357"
"成都日晕","203143"
"上海一高校期末考当堂办婚礼","186497"
"完达山1号为何隔离45天","182546"
"弹琴遇到专业的邻居后","166367"
"苹果将削减AirPods的产量","160973"
"醉驾比例减少70%以上","160710"
"印度新冠死亡病例超20万","160158"
