"hot_word","hot_word_num"
"Angelababy短发","3442838"
"双胞胎学生过斑马线被撞一死一伤","1276524"
"陈小纭回应怼网友","1271519"
"好利来","1264172"
"利路修 从喜欢到恨只有一步","1256368"
"别轻易尝试黄瓜减肥","879154"
"妻子的浪漫旅行5开播","766633"
"中国为全球抗疫做了哪些贡献","645100"
"13岁女孩花70万约稿","612644"
"迪丽热巴吴磊陈伟霆张彬彬电梯照对比","606516"
"印度16名囚犯向狱警泼辣椒粉后成功越狱","595100"
"岳云鹏老婆没找到合影错过卡点庆生","497116"
"黎智英认罪","491571"
"北京一小学到校先上体育课再上文化课","488631"
"日月潭潭底龟裂成块状","474593"
"王一博连续六年为汪涵庆生","467474"
"星巴克试用可重复使用杯子","450133"
"香港教材对鸦片战争部分做较大修改","442259"
"朴春嘴唇","422915"
"刘涛 第一次当电灯泡瓦数不高","404504"
"每个人的身上都有苗苗","390942"
"泰国猕猴胖成球被强制减肥","380994"
"我的小尾巴","365646"
"黄明昊探班范丞丞","342624"
"赵丽颖自然之灵大片","338125"
"基金下跌","331767"
"军队文职考试报名","330913"
"外交部回应美国针对亚裔仇恨犯罪激增","330697"
"大岛日记","330495"
"山河令花絮","321444"
"故宫海棠","312254"
"Sunnee认出粉丝手机壳是丁程鑫","302474"
"不得违背农民意愿强迫农民上楼","266204"
"木村拓哉因疫情放弃进军美国","259041"
"斯里兰卡选美皇后皇冠遭前冠军抢夺","241781"
"美边境移民男童哭着向巡逻人员求助","207845"
"网购一定要看清楚尺寸","199290"
"BBC新疆报道的解说词跟画面完全相反","196333"
"三星堆3号神树神秘造型初露真颜","195886"
"长歌行","192364"
"被指像公墓的商铺统一招牌已拆除","190441"
"原来成龙是发明家","190352"
"中国最早的火柴盒图案","182276"
"女子纹风水眉被纹成两把大刀","177963"
"库里怒吼庆祝","169064"
"中国北极村冰面爆破","168992"
"19岁网民侮辱南京大屠杀死难者被刑拘","168985"
"山河令","168984"
"同一屋檐下收官","168015"
"司藤","166411"
