"hot_word","hot_word_num"
"应采儿 人要害怕变老","1997014"
"西藏发现多座吐蕃时期高级墓葬","1140383"
"程潇妹妹舞蹈","1119642"
"白瘦幼审美是一种pua吗","943356"
"INTO1出席R1SE演唱会","846519"
"云南大理古城发布出行预警","565492"
"你的婚礼彩蛋","555134"
"爷爷在孙子婚礼上说的话","545104"
"世卫专家称印度或已感染3.5至5.3亿人","505496"
"断臂男孩手术完成状况良好","445381"
"刘雯教吴昕妈妈性感眼神","442599"
"baby带小海绵赶飞机","433743"
"岳云鹏要把双皮奶寄到北京","423321"
"广东汕尾发生一起事故致4人死亡","417938"
"河南网红小吃街环卫工凌晨下班","410536"
"原来鼻炎也会导致社死","410281"
"再也不想睡火车上铺了","410112"
"苹果或面临1777亿反垄断罚款","409764"
"巴菲特承认卖出苹果股票是错误","409427"
"游客质疑茶卡盐湖卖2次门票","409084"
"上海女法医揭秘刑侦剧漏洞","408868"
"猫房间价格赶上人宾馆","408316"
"阿云嘎一个小时才买到时代少年团专辑","408100"
"会嫁给自己爸爸那样的人吗","407987"
"如何停止自我PUA","388499"
"任嘉伦邢菲床戏花絮甜","370971"
"4名国际空间站宇航员返回地球","353501"
"五一首日全国铁路发送旅客创新高","350204"
"武警神枪手10米外用子弹钉钉子","348916"
"苍蝇为什么会搓手","348820"
"断桥王俊凯幕后照","345802"
"女子因与男子通电话被塔利班鞭刑40下","333003"
"谭松韵风中凌乱游客照","325308"
"美军开始撤离阿富汗","314258"
"利路修没学成团夜舞蹈","306666"
"顾川 我一定要控制我自己","298275"
"印度165名记者感染新冠死亡","292944"
"杨紫芭莎礁石瀑布大片","251835"
"恋爱结婚和收入有关吗","246635"
"美国加州7.6万囚犯将被提前释放","238900"
"印度大壶节或成超级传播","236154"
"男童脚踢电影屏幕5次被索赔18万","234643"
"巴菲特回应马斯克承保火星移民","230485"
"游乐场设备故障多人悬在半空","229449"
"广州天气","227495"
"草莓音乐节","222423"
"印度牧师每天火化150具遗体","218010"
"澳大利亚暂禁本国公民从印度回国","217759"
"米卡以为营业就是工作的意思","217478"
"医生连续4个月为一位病人提前上班","215486"
