"hot_word","hot_word_num"
"山西晋中疫情防控发布会","1831181"
"蒙古6.8级地震","1100113"
"取消信用卡透支利率上限和下限管理","952518"
"武汉急寻河北确诊病例密切接触者","923196"
"奢侈品将迎来新年涨价潮","791938"
"郭德纲又招人了","780837"
"意大利女子19年11月已感染新冠","691017"
"蒋南孙无条件支持朱锁锁","663680"
"车厘子大量到货","593534"
"辽宁省政协原副主席刘国强被开除党籍","561960"
"黑龙江绥化新增26例无症状","536840"
"叶谨言哭了","533500"
"山西晋中榆次区紧急调整学生放假时间","425134"
"范金刚送朱锁锁出嫁","386229"
"被锦儿气死了","384312"
"陈道明倪妮感情戏","381982"
"李子柒做泡菜遭韩国网友围攻","380077"
"幼儿园老师逼孩子吃辣椒酱被开除","379336"
"石家庄民警的手机婚礼","376213"
"江苏苏宁改名江苏队","375338"
"一家八口躲过印尼空难","370649"
"石家庄公安局退休副局长被处罚","370018"
"员工下班后猝死公司被判赔46万","349785"
"王一博方声明","327459"
"杨超越吃醋Yamy段奥娟的样子","293497"
"山西晋中疫情","290924"
"河北廊坊固安县一地调为中风险","290860"
"杨超越微博屏蔽的关键词","286022"
"周一围演的将军","286004"
"最高检专设惩治网络犯罪指导组","285686"
"7楼漏水冰瀑布冰封1楼阳台","285543"
"鱼都吐不出这种圈","276101"
"山东一在建金矿爆炸事故","270268"
"程潇哭戏","263268"
"美国将降半旗悼念因国会骚乱丧生的警察","247294"
"封潇声对柯滢献殷勤","234926"
"美国新冠肺炎超2254万例","231823"
"外甥女眼里的小姨","231421"
"广州男子上班贴7个暖宝宝冒烟","231317"
"萧綦王儇 先婚后爱","229879"
"防疫志愿者生前最后一条朋友圈","223989"
"肺部健康测试","219610"
"河北固安全县居民7天居家隔离","214873"
"叶舒华part","214629"
"常驻藁城区的人和车一律不得离藁","196609"
"有哪些东西是被年龄带走的","177181"
"翟晓川被通报批评","173953"
"广州时隔五年再次下霰","168541"
"北京男篮罚单","166945"
"罗聪说自己比许嵩红","166189"
