"hot_word","hot_word_num"
"科比大女儿签约模特公司","1587622"
"张文宏称去年防同事今年防自己","810859"
"原年人过节指南","800430"
"央视春晚最后一次大联排","793182"
"语文水平退化的日常表现","788054"
"过年不要黑眼圈","767526"
"盛淮南连喊14遍我喜欢你","751396"
"赘婿定档","743903"
"基金","683030"
"武契奇再提对中国绝不吝惜感谢","664796"
"哈尔滨居民家自来水黑如墨","585369"
"看电影拍照发朋友圈算盗摄吗","583891"
"盛淮南洛枳吵架为什么要飙英语","404847"
"周深代喝豆汁的表情","392936"
"澳门特首贺一诚接种新冠疫苗","392860"
"明星大侦探","392856"
"雀巢举报中国商业经济学会母婴产业委员","390704"
"江疏影这才叫大红包","390691"
"男子做核酸因孩子怕冷殴打志愿者","386470"
"卢靖姗晒合照为韩庚庆生","384910"
"中国如何走出低生育率陷阱","383166"
"Angelababy尘缘杀青","379549"
"小熊猫脚受伤到青城山求助","379508"
"刘德华宋小宝合唱天意","355876"
"乘风破浪奶奶团平均年龄90岁","330285"
"皓衣行","307085"
"牛年牛牛美甲","275396"
"创4学员制服大片","262295"
"军工","257078"
"股市","255788"
"肖战谈再唱野子感悟","255142"
"年夜饭","254618"
"李宇春加盟青你3","243775"
"周扬青的年夜饭","226553"
"外交部回应澳籍记者成蕾被逮捕","201235"
"哈士奇能有什么坏心思呢","199299"
"GM减肥法","192392"
"混血的后代真的很神奇","189809"
"陈伟霆春晚开场表演","175092"
"河北核酸10人混检下调至20元","174778"
"许诺可思议奶油吻","174512"
"唐三地图鉴","170566"
"博泰五菱举报腾讯垄断","168950"
"被北极兔的可爱打败了","168121"
"任正非称华为永远不会出售终端业务","167635"
"90岁奶奶直播讲述2077万还账历程","167462"
"开运爆汁酸辣粉","166434"
"全国低风险来浙江城市无需核酸","165931"
"你好李焕英阖家沸腾预告","165663"
"上阳赋","149892"
