"hot_word","hot_word_num"
"白金汉宫宣布菲利普亲王去世","2619279"
"纽约飞上海航班检出10例阳性","1526649"
"了不起的吸科技","1497410"
"张彬彬没把钟汉良微信推给景甜","1399520"
"桐庐偶遇邓超孙俪","1385456"
"春姐和你聊陕北","1354439"
"约翰逊悼念菲利普亲王","1270576"
"陈小纭微博小尾巴是关你peace","1177432"
"美华裔老太反杀袭击者视频","954410"
"幼儿连续用电子产品不宜超过15分钟","924432"
"菲利普亲王最后时光和女王一起度过","902313"
"腾格尔把吴亦凡照片唱倒了","900250"
"张馨予隔空表白老公","898558"
"龚俊乔欣 沉睡花园","782927"
"广东正研究免费接种HPV疫苗","775169"
"王牌对王牌","775153"
"闲鱼涉嫌发布违规租赁信息被约谈","731409"
"第二名的逆袭","706989"
"人类幼崽社死名场面","647026"
"允许非居民在海南自由贸易港内买房","638452"
"刘宇甘望星合唱那些年","634910"
"胡静 姐妹的浓度高到上头","605712"
"男子拔活翠鸟羽毛制作饰品被刑拘","445001"
"浓颜系轻混血妆","407765"
"长歌行李乐嫣仿妆","402307"
"那英被迫甜美营业","400435"
"水果蘸了辣椒后","398369"
"百世极兔因低价倾销被罚","385311"
"人脸识别第一案终审宣判","358891"
"幼儿园不得设学前班","343204"
"创造营粉丝见面会","342652"
"武汉解封首飞航班一年前后广播对比","338772"
"唐嫣为吕一打call","330061"
"李易峰说傻子才不拍号手就位","318924"
"小学严格执行免试就近入学","297274"
"三星堆3号青铜神树或为扶桑树","293766"
"皓嫣","292816"
"长辈安排的相亲有多难","289923"
"拥有了整个春天的鸭子","272523"
"医生一铁锹拍翻持刀施暴男子","228859"
"米卡高卿尘合唱你就不要想起我","221628"
"各大视频平台影视公司联合声明","205397"
"赞多力丸再现初舞台","201870"
"好多宇","198330"
"辛巴团队称遭职业打假人电话敲诈","195439"
"日本政府基本决定将福岛核污水排入大海","181875"
"巨型粉色兔子消失了","181572"
"司藤","114535"
"外交部回应日本将核污水排入大海","107803"
"马斯克公布猴子用意念打游戏视频","96359"
