"hot_word","hot_word_num"
"刘宇垫肩","2807745"
"Kingdom","899858"
"武汉一路面发生爆炸","795066"
"努比亚Z30Pro",""
"王子文坐吴永恩肩上自拍","776686"
"奥巴马被曝曾脏话攻击特朗普","755354"
"沃尔玛致歉","703370"
"520送爱神操作",""
"六安260名学生跑着去支援核酸检测","688657"
"端午放假三天不调休","634642"
"浙江卫视总监回应MV涉抄袭","528804"
"我国现有新冠疫苗可应对印度变异株","525713"
"姜潮麦迪娜公布二胎","525456"
"约每5个中小学生就有1个小胖墩","523050"
"20215201314","489410"
"沃尔玛全国门店下架召回涉事啤酒","488345"
"韩美娟拍毕业照的表情管理","486550"
"金莎冒充追求者给孟佳送玫瑰花娃娃","484308"
"乔欣晒鲜花蛋糕","480546"
"原来唐钰小宝本名叫唐钰","477820"
"腾讯2021年第一季度财报","475680"
"左晖刚被评上地产首富","472299"
"穿肉色衣服需谨慎","470916"
"网友称被交警用个人二维码收罚款","468256"
"儿子送爸爸520贺卡打开变250","466644"
"不良学姐甜茶妆","462170"
"618预售提前","460051"
"沈阳144家药店关停","458427"
"打苗苗最新信息都在这里","451329"
"速度与激情9","449946"
"赵立坚提到520说祝融号带着爱继续前行","439037"
"深圳多家银行上调房贷利率","437376"
"林志玲晒手写信为台湾加油","435840"
"一束有味道的花","342641"
"贝壳创始人左晖去世","317446"
"不建议接种完2剂次疫苗再打1剂次疫苗","308590"
"2021年最新国家赔偿标准","283672"
"王俊凯从北电金字塔滑下来屁股不痛吗","262594"
"罗一舟回学校了","250217"
"御赐小仵作","224152"
"官方回应路面爆炸多人被炸飞","220207"
"印度卫生专家逛超市拒戴口罩","207214"
"我要我们在一起","204621"
"中疾控回应疫苗中发现絮状物","193442"
"李现否认暗戳戳秀恩爱","193286"
"追星人的反应都一样","190175"
"郑州冰雹","187470"
"薇娅直播","181852"
"李易峰生图","174077"
"周也晒毕业照","157218"
