"hot_word","hot_word_num"
"女子因未孕遭虐待致死案细节","771454"
"武汉1小时内密集上演气象大片","304614"
"向太晒向佐郭碧婷北京豪宅","280073"
"周游","260682"
"韦小宝双儿破庙相遇","198537"
"中央气象台三预警齐发","187743"
"向天歌刘泽煊","179008"
"承租人不得单方面提高租金","146570"
"基辛格警告美国下任总统","144670"
"离婚案件为何安全风险系数高","143112"
"刘泽煊发文","143098"
"R1SE合照回应只有一个座位","137049"
"魏大勋蓝色寸头","135052"
"萧燕燕儿子被下毒","133795"
"印度考虑有条件放宽外国投资限制","131427"
"苹果客服回应iPhone12屏幕发绿","126626"
"金晨星河流光长裙","124616"
"张培萌妻子首谈家暴细节","121605"
"孔雪儿电梯间大片","117883"
"患阿尔兹海默症的父亲和影子吵架","117527"
"从结婚开始恋爱","115312"
"关雨晴爸爸道德绑架","100251"
"打了瘦脸针的GAI","96965"
"钟睒睒再次成为中国首富","96597"
"山本宽","93683"
"王智签约赵薇工作室","88719"
"追光吧哥哥路透","86977"
"专家建议养老金领取早减晚增","79659"
"河北省原副省长李谦受贿案一审开庭","79428"
"建宁公主出逃失败","79344"
"妇联回应女子无法怀孕被夫家人虐待致死","73605"
"鹿鼎记","69409"
"M1芯片","64514"
"金砖国家领导人第十二次会晤举行","64082"
"英国男子自称去年9月感染新冠","63896"
"社交中需要了解的言外之意","59029"
"爱马仕将建最大鳄鱼养殖场","53646"
"校方回应学生自办宽带遭强拆","53272"
"中国蓝盔撒哈拉沙漠种出绿洲","53227"
"心疼萧胡辇","51812"
"成年人必修班","49342"
"韦小宝向皇上表明身份","47652"
"爱的厘米","46091"
"SM新女团aespa风格","45578"
"宋茜风起洛阳开机图","44807"
"你有容貌焦虑吗","43478"
"央视调查湖北荆州巨型关公雕像违建始末","43232"
"赵志勇打小报告举报顾耀东","40953"
"狮子座流星雨","40251"
"晚上不要在天台晾衣服","38784"
