"hot_word","hot_word_num"
"张小斐全国粉丝后援会解散","2967783"
"春秋时期男性美容面脂","2034444"
"欧阳娜娜宠粉问答全记录","1973240"
"佟年结婚空隙还在改论文","1742994"
"当代年轻人买基金现状","1591395"
"蔡明潘长江小品立意","1328328"
"3月1日起这些行为触犯刑法","1163843"
"王一博央视特供手势","1071772"
"谭德塞建议暂时放弃新冠疫苗知识产权","857743"
"周也演技","853141"
"张柏芝小哑巴嗓子","751123"
"黄子韬 是我的问题我改","575112"
"世卫称未来有可能暴发新的大流行病","433053"
"尼日利亚300多名女学生遭绑架","376399"
"李雪琴孟鹤堂撒娇情头","369766"
"陈薇谈为何自己第一个接种疫苗","340269"
"兔子对车厘子的理解","339852"
"百世快递部分地区网点倒闭","338005"
"林书豪为詹姆斯发声","336303"
"唐嫣晒吴彤表情包","336001"
"对比家长收入老师曾被评为最美教师","334649"
"Angelababy晒小海绵吃元宵","332927"
"五条悟露脸","332229"
"月球土特产","318592"
"王菊模仿蕾哈娜","314525"
"多平台联系姚策限时退筹款","295459"
"苏妙玲十年后重回舞台","277538"
"袭警罪正式明确","263301"
"湖人 开拓者","247099"
"山河令 唇语","246748"
"1984年杭州第一次元宵灯会","245642"
"谭松韵 脸圆不代表我好拿捏","241116"
"朴槿惠未交1亿人民币罚款","220082"
"山河令片场 动物喋喋的声音","218997"
"华晨宇猜热依扎为迪丽热扎","208995"
"全面排查中国人寿黑龙江相关业务","191483"
"对比家长收入歧视学生老师道歉","188255"
"高考倒计时一百天","182610"
"一句话证明你在追赘婿","166060"
"睢冉发文回应巩晓彬","149969"
"对比学生家长收入老师被撤销资格","149264"
"丁程鑫被砸到脑瓜子嗡嗡的","148137"
"百日夫妻似海参","146919"
"网店虚构上千条评价被罚20万","145750"
"恩比德MVP榜超越詹姆斯","144619"
"长沙两月受理裸聊敲诈案76起","144283"
"湖人签约琼斯","142719"
"广州500架无人机致敬戍边英雄","141991"
"陈薇说针对变异株的疫苗研究早已启动","141278"
"武汉大学设立抗疫医护赏樱专场","140373"
