"hot_word","hot_word_num"
"吴京在汶川地震时给灾民搭建帐篷","2932643"
"为考研她摸过的盲文试卷有半米高","2030288"
"母亲回应14岁儿子火海救两儿童","1196137"
"周杰伦的稻香是写给汶川地震的","1156387"
"药水哥道歉","1053735"
"江苏宜兴重大命案","950717"
"90后的三十岁","837858"
"512","743916"
"第2只金钱豹进食量增加","580218"
"金曲奖入围名单","578301"
"向太 药水哥是谁","512760"
"小米起诉美国政府诉讼达成和解","451727"
"汶川地震夹缝男孩明年结婚","446654"
"杭州杀妻案周五开庭","444376"
"范跑跑","411088"
"许嵩","408029"
"秦海璐说张馨月矫情","401702"
"明星天价片酬四大洗钱招数","395540"
"霍尊","393895"
"地铁偶遇龚俊","388332"
"杨丞琳回应有工作才回内地","379882"
"张雪迎姐姐","373787"
"原来西瓜还有分品种","366629"
"官方通报苏州中转站出现宠物盲盒","366181"
"阿达娃 曾凡博","363232"
"开榴莲开出了盲盒的感觉","362127"
"密室大逃脱","356827"
"华为鸿蒙商标被驳回复审","354595"
"乔丹曝光与科比最后的短信交流","352202"
"成都大规模新冠疫苗接种开始","350219"
"小学生超强逻辑让骗子自挂电话","347136"
"齐齐哈尔一村庄疑发现四只野狼","333382"
"卫星看汶川地震极重灾区新貌","314215"
"2名女生河中央拍照被激流冲下","267073"
"南方的荔枝熟了","249211"
"13年前的新闻播报 她哭了我们也哭了","242813"
"陈坚","237731"
"金曲奖","221233"
"512大地震十三周年","219549"
"对台独顽固分子终身追责","206506"
"禁忌女孩","184619"
"HTMoon下跌","181314"
"周杰伦女儿拉琴照和前世情人MV一样","181161"
"韩国滩涂申遗被联合国退回","178164"
"尼泊尔珠峰大本营首位确诊者发声","145350"
"赖弘国称已和阿娇办好离婚手续","139288"
"女子地震失去双腿后嫁给假肢制作师","130412"
"如何回答女朋友的灵魂拷问","129015"
"新冠病毒精确完整基因注释图谱完成","128137"
"空降兵15勇士惊天一跳","126888"
