"hot_word","hot_word_num"
"鹿晗 化妆不分性别","3558172"
"张文宏谈印度疫情对中国防控影响","2327158"
"韩雪代言新一代好奶粉","1611247"
"Capper道歉","1274347"
"红孩儿扮演者如今是中科院博士","1253933"
"宋亚轩晒弟弟海选视频","1214577"
"极限挑战","782099"
"印度23名新冠患者逃离医院","693320"
"女教师实名举报校长猥亵宣判","516406"
"张小斐的妈妈叫王桂香","496437"
"李易峰帮小演员挽头发","494678"
"乃万","485197"
"吸血鬼城堡原型改造为疫苗接种点","473401"
"富阳宣传部回应豹子后掌疑断裂","471543"
"刘宇宁直播","470912"
"第二只外逃豹子后掌疑断裂缺失","467850"
"这鼠洗澡也太专业了吧","466968"
"狗狗币6个月上涨近250倍","464547"
"三星耳机疑似引发耳部炎症","462989"
"小朋友对年龄没有概念","460690"
"贺峻霖的工资卡上交","460280"
"吉林又拍到野生东北虎","455870"
"三星堆博物馆临时闭馆2天","454204"
"特斯拉今年已提价6次","454154"
"赵奕欢翻拍妈妈年轻时旧照","454129"
"高三老师暂停讲课让学生去看晚霞","406354"
"俄罗斯卫国战争胜利76周年阅兵","392443"
"第十四届全运会","392102"
"西藏侦察兵30米外打中摇晃瓶盖","391990"
"周深请粉丝喝奶茶","391887"
"钢化玻璃进电梯瞬间被夹爆","357494"
"庆怜晒童年照","344392"
"周深 重庆","328337"
"第七次全国人口普查主要数据即将公布","309759"
"金钱豹出逃一周园方被质疑瞒报","298662"
"如何看待年轻人网购式尽孝","290922"
"李佳航 维护女性权益我也拥护","276730"
"奚梦瑶怀二胎","268558"
"台南号召小便不冲水","250303"
"母亲节快乐","248026"
"UOL RNG","244279"
"双娇亲晕顾人齐","243219"
"三亚跳舞坠楼女子遗体已火化","240762"
"奇奇怪怪的家庭作业","239912"
"阴间版迪士尼","238532"
"杜锋给胡明轩和球迷拍照","236327"
"四点半妈妈","233693"
"等了三十年的母子团圆","231390"
"成年人为什么愿意相信奥特曼","231153"
"体育社死现场","230480"
