"hot_word","hot_word_num"
"上海浦东发现相关人员核酸结果可疑","2243157"
"SM被韩国国税厅调查","1120558"
"京东携陈佩斯再登春节档","985273"
"美国说唱歌手在额头安装11克拉粉钻","978152"
"黄龄假唱","909488"
"央视网络春晚不一样了","869631"
"魏晨到底有多能接梗","843059"
"加拿大将骄傲男孩列为恐怖组织","709109"
"汪文斌拿照片点名涉疆谎言制造者","611841"
"网易云再发长文怼酷狗","568760"
"湖南卫视春晚","567463"
"迪丽热巴宋小宝最强肤色差","565364"
"央视网络春晚","564407"
"奇葩说","561649"
"新冠病毒能消灭肿瘤吗","472543"
"马增蕙去世","455914"
"提取逝者1万以内存款无需继承公证","452007"
"胡杏儿7个月孕肚大片","451143"
"二辰道歉","444182"
"德勤","437546"
"父母该不该告诉孩子家里不富裕","432601"
"长了张大众脸的好处","432107"
"教育部明确小学阶段作业不出校门","402322"
"整容为何越来越普遍","396812"
"柯洁痛失世界棋王赛冠军","396426"
"央视网络春晚嘉宾证件照","396153"
"李现 爱情无价账单两清","382182"
"小年夜","380570"
"FPX LNG","360237"
"贪官被通缉一年后可没收违法所得","358926"
"广东警方通报辅警踹倒骑行男子","358785"
"女神降临","339821"
"医院特许导盲犬探望生病主人","310357"
"我的时代你的时代开播","284300"
"拜登政府坚持一个中国政策","275455"
"再摸5天鱼就放假了","269419"
"湖南卫视春晚节目单","238474"
"英国撤销CGTN在英广播许可","222572"
"王冰冰采访丁真","214460"
"我就是这般女子改名大赛","212396"
"双马尾的女孩能有多可爱","205715"
"明星最具年味穿搭","183831"
"我的小确幸大结局","165222"
"第一视角滑全国最难雪道","143858"
"一起上春晚阵容官宣","143531"
"姚琛800万粉丝福利","141598"
"你是否有外貌焦虑","140858"
"37款APP未按要求整改被下架","139754"
"江南百景图松江府","113795"
"卫健委称对返乡群众乱加码是懒政","110617"
