"hot_word","hot_word_num"
"关晓彤2个月午餐打卡","2076190"
"2600万美元中奖彩票被扔进洗衣机","1706340"
"安徽公布最早感染者基本轨迹","1543478"
"OPPO Find X3",""
"沈梦辰说跟杜海涛该结婚了","1520407"
"张柏芝生图","1061998"
"五年级弟弟发的微信消息","936834"
"大国少年有功夫",""
"这年头连鸭子都会演戏了","722330"
"急寻5月8日D3058次12车厢乘客","595409"
"梅琳达宣布离婚后已获得30亿美元","512252"
"全球多国爆发反以游行","429362"
"曾毅又没被认出来","420109"
"王毅将主持安理会巴以冲突紧急公开会","412184"
"安徽新增确诊2例","384897"
"广西致3人死亡命案嫌犯已自首","380632"
"林墨让张嘉元离他的房间远一点","374444"
"李一桐粉丝关站","373602"
"孙莉晒多多自制戒指","372336"
"心动的信号第四季路透","371466"
"初级会计","370973"
"刘诗雯无缘东京奥运会单打","369274"
"宋妍霏 我妈的身材我都夸累了","367942"
"董又霖每天都要量头发","366968"
"欧阳娜娜小碎花吊带","366171"
"长沙一红头文件漏洞百出","365165"
"和有洁癖的人同居是什么体验","364317"
"孙俪字帖展出","359225"
"奶奶喂猫有多生猛","342467"
"见过最少女心的老师","316573"
"高中语文教资面试","299926"
"如何看待刘诗雯无缘奥运单打","299370"
"以总理称将继续袭击加沙","299106"
"鞠婧祎初恋感写真","284838"
"赵丽颖粉色挑染直发","284783"
"李雪琴停车停了半小时","247296"
"男子深夜开车撞上200斤野猪","243630"
"男生的奇怪友谊","222925"
"诛仙CCTV6第一季度国产影片收视率第一","213306"
"如何看待花钱谈虚拟恋爱","204083"
"差点被这首歌送走","183047"
"禁忌女孩","175987"
"公安部团圆系统5年找回4707名儿童","175695"
"北京晚霞","174229"
"韩国减肥霜再生贴被曝虚假宣传","174177"
"美疾控中心规定接种疫苗后不必戴口罩","174139"
"女子酒后爬豪车蹦迪致车损28万","174136"
"4AM吃鸡","155676"
"天问一号着陆90后女调度淡定指令","138155"
"辣条专业班学生开发辣条粽子","123185"
