"hot_word","hot_word_num"
"何炅父亲被强制执行","3863130"
"美国支持日本福岛污水入海决定","3674894"
"王俊凯的潮范新品","3674243"
"刘嘉玲回应删Angelababy好友","3609756"
"秦牛正威 吴岱林","2233360"
"迪士尼的初始形象有多吓人","966584"
"飞天小女警真人剧定妆照","887793"
"日本政府正式决定福岛核废水排海","683240"
"专家称核废水恐损害人类DNA","607775"
"2020年度全国考古十大新发现","493365"
"那英 成团出道我是认真的","486670"
"力丸好像被吸尘器吸走了","479779"
"司藤","466871"
"日本核废水排入海洋影响有多大","465804"
"趵突泉水下世界有多美","463522"
"长歌行","460758"
"汪小菲秒删","456873"
"2021胡润40岁以下白手起家富豪榜","453036"
"蚂蚁集团将整体申设金融控股公司","450061"
"红黄蓝幼儿园幼师发男童闻脚图","443916"
"肖战为那英打call","438661"
"张艺兴彭昱畅张子枫春日写真","436787"
"女子闲置5年房屋被前户主出租","432579"
"剑网3七秀","428031"
"自拍错发到公司群怎么办","423459"
"乖乖洗头的小朋友有多可爱","422589"
"猫咪为了配合幼崽有多拼","419390"
"穆雷受伤","386929"
"库里成为勇士队史得分王","385883"
"创4COSMO治愈系大片","385233"
"2哥来了怎么办定档","362689"
"徐睿知缺席新片发布会","345143"
"婚礼社死现场","317065"
"五月中内地居民赴港豁免14天检疫","255890"
"男子打110要求加微信接警员秒懂","247797"
"美在全球设有超200个生物实验室","229562"
"1921首支预告","225142"
"野生大熊猫求偶打斗3小时","219104"
"蔡徐坤新专辑上线","210535"
"亲密关系中如何保持吸引力","209785"
"蔡徐坤新专辑销量","208464"
"库里53分","207960"
"动画模拟福岛核泄漏扩散","194959"
"慈善型消费","192816"
"圣彼得堡一百年历史工厂被烧毁","185320"
"人脸识别年龄有多不靠谱","180144"
"日本政府要求2年后能开始核废水排海","171528"
"城市落户政策要对租购房者同等对待","141513"
"张小寒刘大锤 找个厂子上班吧","130985"
"我国一季度进出口8.47万亿元","130415"
