"hot_word","hot_word_num"
"沈梦辰说跟杜海涛该结婚了","3931531"
"急寻5月8日D3058次12车厢乘客","1542141"
"梅琳达宣布离婚后已获得30亿美元","1358904"
"五年级弟弟发的微信消息","1334136"
"全球多国爆发反以游行","1276516"
"沈阳新增确诊排查密接59人","617546"
"利路修大雄同款睡姿","617445"
"郑合惠子否认拍夏至未至加戏","596724"
"白岩松谈放开生育政策","579202"
"六安两家医疗机构擅自接诊发热病人","578785"
"李莎旻子隔壁老樊手挽手","574614"
"怎么老是你们仨","574001"
"赞多力丸比心","569532"
"白宫就以色列炸毁媒体大楼表态","569125"
"蔡徐坤接机名改成颜文字了","566658"
"黄景瑜问粉丝你是哥哥","564156"
"赵丽颖粉色挑染直发","561280"
"诛仙CCTV6第一季度国产影片收视率第一","559140"
"初级会计","556103"
"刘诗雯无缘东京奥运会单打","554445"
"林墨 南京","551481"
"李雪琴停车停了半小时","549063"
"孙怡晒妈妈节目前后对比照","547664"
"王源下班发型","494288"
"女子酒后爬豪车蹦迪致车损28万","441456"
"乌鸦小姐与蜥蜴先生名场面PK","414865"
"原来奥特曼里还有小学生","334404"
"禁忌女孩","322345"
"高中语文教资面试","300233"
"如何看待刘诗雯无缘奥运单打","292560"
"韶关通报6学生骑1辆共享电动车","289404"
"男子深夜开车撞上200斤野猪","260370"
"舞蹈教室","244288"
"邓伦眼神里的故事感","242151"
"台湾单日新增206例本土病例","241585"
"天问一号着陆90后女调度淡定指令","218263"
"会修油烟机的猫咪","209800"
"辣条专业班学生开发辣条粽子","201019"
"北京上空同时出现日华日晕环地平弧","198433"
"关晓彤2个月午餐打卡","173371"
"群众雨中迎2名洱海坠机烈士回家","163149"
"70岁超模奶奶登台走秀9年","148348"
"湖南岳阳局地出现12级大风","145728"
"皮囊之下","139901"
"鲅鱼圈区初中小学封校停课","137909"
"武功山的风到底有多大","132904"
"上课时令人绝望的社死现场","126600"
"7座面包车竟塞下28名幼童","125290"
"凯里520当天暂停办理离婚业务","124306"
"你心中科比的精神是什么","118535"
