"hot_word","hot_word_num"
"蔡卓宜 我离得很干净","4366948"
"中国将向埃及和阿盟秘书处提供疫苗援助","3410382"
"心之所向","3287441"
"小沐沐和汪涵相似度","3173957"
"关晓彤 我不喜欢被人知道每天在干嘛","1250148"
"美籍记者和日本导演眼中的中国","953213"
"超级碗","951837"
"无职转生下架","950544"
"多地发生儿童窨井里鞭炮爆炸事件","947815"
"美国一线医护被迫重复使用口罩","946823"
"罗斯被交易至尼克斯","944256"
"李诞 CP万一有一对是真的造福","943092"
"马伯骞听Sunnee唱歌时的表情","942067"
"王一博 没想过收获一直在努力做自己","926793"
"印度北部冰川断裂已致3人死亡","892151"
"去年超15亿只废弃口罩流入海洋","861490"
"微信红包封面","819400"
"金莎穿汉服再唱星月神话","815977"
"嘉宝米粉下架","794206"
"朋友发声明回应马金瑜债务问题","707997"
"国家宝藏又见蒋欣古装","587725"
"不想秒回微信有错吗","393945"
"金晨求网友删博","349686"
"詹俊","349344"
"王勉叫陈卓璇我们家璇儿","324258"
"张碧晨点赞华晨宇生日微博","293451"
"杨幂谈白幼瘦审美","287694"
"春运母亲的海上生活","285562"
"还有3天过年","265739"
"协和等知名医院字号不得擅自使用","265167"
"济南一批进口冷冻带鱼检出阳性","265063"
"北京餐企餐具开始换新装","226727"
"章小鱼的底气在淮海路","213730"
"夏之光被激光笔照射","191528"
"杨洁篪同美国国务卿布林肯通电话","190492"
"美国前国务卿舒尔茨逝世","189797"
"lex","189046"
"玉秀宋怀恩大婚","184802"
"金晶科技","171102"
"黑龙江无新增确诊病例","160766"
"吴宣仪看自己演戏尖叫","153882"
"华为确定2020年分红每股1.86元","150399"
"晴雅集","106962"
"新相亲大会","106316"
"霸王别姬皮肤返场","99468"
"坦桑尼亚出现不明疾病","94267"
"唐三 不流血不痛苦怎么走自己的路","90079"
"中国天眼10%观测时间将对全球开放","88651"
"一人食小份制年夜饭需求增加","84204"
"大年初一有7部电影上映","83641"
