"hot_word","hot_word_num"
"盛况说和金莎恋爱可能性只有三成","2471487"
"黑龙江一确诊曾到女儿班级看护学生","2358254"
"顺丰发往河北省快递暂停三天","2350691"
"黄晓明李菲儿 浪姐2","2079592"
"仙剑翻拍","1740306"
"铁锅爱炖糖葫芦开锅","1604393"
"陈凯歌举报吐槽自己的up主","1524570"
"石家庄旅客乘火车飞机需凭72小时核酸证明","739633"
"特朗普签令禁止与8款中国应用交易","656048"
"美国反口罩男子感染后哭求人们戴口罩","632894"
"安吉胖了","629663"
"郑渊洁 我认识你老公王一博","629245"
"韩红说孟美岐为中国女明星争了光","621386"
"新疆报告1例无症状","601867"
"流金岁月","591229"
"茶颜悦色反诉茶颜观色","585704"
"谢腾飞长大了","577546"
"爸爸帮5岁患癌儿子列愿望清单","567009"
"饿了么起诉饿了吗获赔1万元","560126"
"夫妻吵架男子怒将自家SUV推入江中","550310"
"论一双靴子在冬天有多重要","547120"
"魏大勋回忆当特约演员经历","537127"
"倪妮鎏金妆","514376"
"佘诗曼素颜海报","478080"
"陈凯歌律所声明","461035"
"戚薇模仿石榴姐","458590"
"特朗普支持者与警方发生冲突","420818"
"基金","413008"
"西部战区多架运20新年首飞","410437"
"明星大侦探","410222"
"林更新 这不该是男神该有的关键词","409962"
"北京泼水成冰","404754"
"大连新增本土确诊1例","380811"
"港警今早至少拘捕50人","374462"
"当你在男朋友面前突然摔倒","373999"
"家属宣告王相军遗体搜救结束","354565"
"女儿们的恋爱","336621"
"侃爷卡戴珊离婚","321300"
"村干部硬核叫停金婚纪念酒宴","285754"
"纽约空管收到不明音频威胁","277580"
"沈阳新增1例本土确诊病例","254262"
"小朋友的舞台失误有多可爱","251185"
"人类幼崽驯服作业实录","249537"
"石家庄邯郸进京车票暂停发售","246176"
"英超上周40人新冠检测呈阳性","241282"
"新年桃花朵朵开妆容","234987"
"南京市消协回应扫码才能点菜","234955"
"石家庄多家医院实行封闭式管理","193242"
"河北暂停自考理论课程报考","190814"
"逆水寒翻拍","189919"
