"hot_word","hot_word_num"
"印度男子杀害感染新冠妻子后跳楼自尽","1894028"
"熟蛋返生孵小鸡论文作者道歉","910142"
"范丞丞刘雨昕新歌首发","824780"
"刘诗诗教育儿子的方式","808520"
"叔叔你别拉了我害怕","788748"
"甘望星补做青年大学习","640231"
"南通海关截获活体剧毒寡妇蛛","600753"
"林允被叫阿姨后的反应","513385"
"日本新版外交蓝皮书提及中国273次","493145"
"王毅重申愿随时根据印度需要提供帮助","437800"
"加州外海发现逾2万桶有毒废弃物","383463"
"美国解除中国学生赴美限制","368426"
"故宫角楼月亮","297708"
"超级月亮","296217"
"熟蛋返生孵小鸡论文系代写","254147"
"实拍超级月亮破云而出瞬间","244791"
"子悠抑郁了","243465"
"上海一幼儿园为家长上性教育课","241648"
"欧冠","218152"
"吴磊看迪丽热巴眼神","217999"
"白敬亭晒怼脸自拍","217251"
"殷晨希发歌diss刘彰","215805"
"深圳5岁男童28楼扔剪刀砸伤老人","215366"
"孩子喜欢打扮家长应该制止吗","214624"
"泰国杀妻骗保案原告律师团队回应","213640"
"过三爽被砸鸡蛋","213294"
"任嘉伦邢菲CP感","211981"
"杨鸣战术","211253"
"周鹏对广东有多重要","210817"
"沉迷刷手机的原因找到了","209440"
"女生团建掰手腕上臂当场被扭断","209330"
"谢兴阳模仿井胧唱丢了你","208648"
"低生育率是社会发展的必然吗","198047"
"中国风能有多惊艳","188662"
"杭电宿舍着火","186952"
"重庆悬崖边吊脚楼火车站","184429"
"印度医院里两三个病人挤一张床","170308"
"导游怒怼游客孩子没死就得购物","160319"
"日本推出铁味冰淇淋","159569"
"这才是真正的眼技","152377"
"高铁小姐姐90分钟默画全国铁路图","144074"
"李大钊英勇就义94周年","134422"
"莫迪亲属因新冠肺炎去世","129135"
"最会吓人的小猫","128636"
"郑恺苗苗录制跑男","124001"
"英国称无多余新冠疫苗分给印度","118223"
"听凤凰传奇唱的海底被治愈","114640"
"皇马战平切尔西","95806"
"加拿大中国留学生地铁站遭持刀袭击","94101"
"过三爽入住养老院","93339"
