"hot_word","hot_word_num"
"咸素媛陈华分手","207492"
"上海海关查获406只活体蚂蚁","107941"
"夏巴特跳是什么","102702"
"山西发布最高级别暴雪预警","91041"
"杨紫井柏然海边吻戏路透","89590"
"宁静回应单方面宣布退团","80341"
"暴风眼","80167"
"山河令","79392"
"外交部点名BBC","79267"
"看李焕英感动不是因为共情","78777"
"创造营","78211"
"朴灿烈向粉丝道歉","77600"
"周深谈网红歌手和职业歌手","77401"
"驻华韩文化院成立纠错改正团","76600"
"赘婿","76173"
"周震南被问哇唧唧哇成团概率","75818"
"张智霖喊话袁咏仪要换手机","75235"
"朴智妍收到死亡威胁","74993"
"上海大学考研成绩","73117"
"中国人寿被举报人去年已离职","72747"
"一次过量饮酒对大脑影响长达6周","72700"
"郑州下雪","63347"
"吉利和沃尔沃宣布合并","55450"
"故意在父母面前吃外卖","50728"
"大学生抢不到票骑行200公里返校","50720"
"宁毅苏檀儿被迫分别","50719"
"共享汽车座位现4枚钢针扎伤用户","43038"
"基金大跌","42260"
"拼多多关联公司申请拼刀刀商标","41962"
"圆明园发布365张老照片","41818"
"人类幼崽的温柔时刻","41739"
"喻言翻唱Therefore I Am","39434"
"粉丝告诉庆怜房子塌了","35317"
"吴白输给王浩","34292"
"国家法律法规数据库已开通","33541"
"老大爷用1万多双筷子搭出天坛","33243"
"余景天模仿生气的唐老鸭","29548"
"弑母骗保案罪犯被执行死刑","28849"
"斗罗大陆片场照","28836"
"青你3一公造型","27342"
"人的肉眼能看多远","26531"
"小伙用瓜子壳摆出孙悟空刘德华","26487"
"牛年以来最大规模雨雪上线","25618"
"中纪委评货拉拉事件","25317"
"辣条馅元宵","25306"
"家属不能进手术室的原因","24072"
"斗罗大陆","23808"
"国乒退出WTT中东赛","19142"
"不想努力的原因找到了","18220"
"济南新增确诊病例曾乘G882次高铁","17970"
