"hot_word","hot_word_num"
"黄晓明工作室声明","3356359"
"女子假期频繁聚餐诱发急性胰腺炎","3182302"
"请给韩美娟一个reaction机位","3177606"
"可是我妈现在还不会缝啊","2535288"
"张嘉元 哇唧唧哇和我哇唧娱乐有什么关系","2071224"
"最受网友喜爱春晚节目","1676380"
"青春有你","1589706"
"创4是国际交流大会吗","1408364"
"章小鱼淮海路的底气没了","1385430"
"拜登任命美国防部中国战略工作小组新成员","1368301"
"山东对所有地下非煤矿山开展检查","1345924"
"Amber 不愧是二代团出来的","1320530"
"黄晓明微博评论","1312233"
"Lisa情人舞台","1059776"
"感动中国2020年度人物","988828"
"创造营","950672"
"李现 我选择的时候就都买了","950347"
"河北一游乐场35人被困高空","947027"
"春节零售餐饮消费超8000亿元","594878"
"基金","558772"
"带厌学儿子游走中国的父亲已回家","538208"
"妻夫木聪王宝强合照","534831"
"网购时商家标错价格能薅羊毛吗","418311"
"豆乳奶冻雪媚娘","390375"
"海南离岛免税店4天销售超7亿元","385779"
"贾玲谈真正的快乐和最大的痛苦","385567"
"宁毅苏檀儿好甜","385310"
"感动中国2020给张桂梅的颁奖词","379099"
"纳达尔遭逆转无缘澳网四强","367980"
"驻英使馆批英方涉新冠疫情起源表态","367155"
"斗罗大陆爸爸图鉴","366918"
"周柯宇初舞台评级首A","357733"
"一个简单的动作消除鼻塞","357685"
"人潮汹涌","293527"
"人工眼角膜移植术成功了","293327"
"春节电影票房已破75亿元","293211"
"你好李焕英哪个细节打动了你","276251"
"感动中国2020特别致敬抗疫英雄","229467"
"你好李焕英","224123"
"年初六打工人的心声","220741"
"99岁叶嘉莹先生一生只做一件事","206937"
"林俊杰唱我不愿让你一个人","206771"
"AK道歉信","206295"
"和马中文发音","195709"
"奥斯卡rap","192775"
"离家时爸妈装的行李箱","192525"
"唐三喝毒药喝到撑","192081"
"今年元宵十五的月亮十六圆","189061"
"边防战士开八驱全地形车巡逻","187283"
"优衣库市值首超ZARA","186672"
