"hot_word","hot_word_num"
"西藏冒险王遗体找到系谣言","3087382"
"方志敏烈士遗骸22年后因脚镣被认出","2426675"
"王家卫2021心之所向","2398728"
"张雨绮 我没想到自己这么famous","2346824"
"敬业福","2225824"
"央视揭假活佛10年骗了2亿","1859257"
"孟美岐方否认当导师点评周传雄","1852014"
"佳木斯大润发超市多个食品检测阳性","1091219"
"驻缅甸大使馆紧急提醒在缅中国公民","1053832"
"人文社就五福错字致歉","1046534"
"封潇声强吻柯滢两次","863150"
"黑龙江迎50年来最冷一天","549682"
"全球新冠新增病例数连续三周下降","549044"
"这周日上班","538011"
"Apple watch可解锁iPhone","535654"
"美国超两千万剂疫苗不知去向","526755"
"娜扎秒删","525521"
"姚晨7岁儿子演奏大鱼海棠","519157"
"当看到偶像变成同学的反应","513805"
"娜扎在线求面人","497408"
"韩流男星式动作","478306"
"蔡文静追剧哭了","473465"
"浪奇一年亏掉30年攒下的利润","401181"
"女大学生举报公职父亲出轨家暴","381108"
"世界上最高狗狗去世","313540"
"湖北一小学建议设爸爸接送日","298720"
"俄勒冈州成美国首个毒品合法州","267317"
"饿了么","251600"
"外交部批美匿名涉华报告","247040"
"郑秀晶Vlog","246105"
"禁塑后生活发生了哪些变化","244921"
"缅甸国内银行全部暂停营业","231277"
"藁城区副区长及卫健局局长被免职","225141"
"外交部回应巴基斯坦获我援助疫苗","217428"
"男子电梯内猥亵年轻妈妈遭反打","216868"
"胡一天李一桐好甜","201953"
"深圳地铁","191252"
"男子拒绝春节带电脑回家工作被开除","190564"
"假如巨人是真人版","186566"
"如何让中小学生放下手机","177673"
"高中生模仿奥特曼被劝退涉事学校致歉","160589"
"接种新冠疫苗后不得带走按压棉签","160522"
"咖啡店发拍照收费公告劝退蹭拍者","160482"
"人民日报评医疗美容热","160418"
"耐撕大会官宣","160348"
"刘禅开挖掘机","160294"
"戈登左脚严重扭伤","153316"
"紧急公关","153079"
"深圳租房押金和租金将纳入监管","153059"
"卫衣飘绳的结系法","152209"
