"hot_word","hot_word_num"
"青春有你 决赛夜返厂","2175483"
"云南蝴蝶大爆发","2126224"
"韩美娟邀请利路修连麦被拒绝","1642882"
"杜淳向王灿求婚","1625647"
"张哲瀚工作室回应自动点赞","1346028"
"警方回应三亚女子跳舞坠楼","1299881"
"你不喜欢夏天的原因","1037665"
"面包店报废不好看的面包被约谈","916636"
"教育部明确师范生教师职业四大能力","747624"
"失联驴友获救后减扣搜救者车费","747461"
"三亚跳舞坠楼","746678"
"郝景芳要为龚俊张哲瀚写剧本","746052"
"在学校参加成人礼的丁程鑫","745848"
"御赐小仵作","745344"
"今年大风为啥这么多","744535"
"恋爱一年以上的聊天记录","744068"
"秦岚说和王鹤棣拍吻戏像吃榴莲","743109"
"央行5月20号发行心形纪念币","743038"
"坦克开上海拔5700米高原","742121"
"山河令","741453"
"维和防暴队","741374"
"女子阳台跳舞坠楼目击者发声","693827"
"兰州一小区禁止特斯拉入内","650049"
"MSI","636946"
"Kingdom","634643"
"四川肯德基辣椒包要收费了","564859"
"00后成五一假期出游最活跃群体","553609"
"2020年上市公司分红1.52万亿元","553321"
"京东被曝显卡售后不肯维修要原价退款","553275"
"白敬亭 三月男友太短暂了","553263"
"云南滇池南岸别墅密布成水泥森林","485760"
"见过最像脚的鞋子","476434"
"王一博新电影杀青照","449895"
"五一假期全国发送旅客2.67亿人次","429787"
"白居易不娶琵琶女的原因","412864"
"韩美娟直播","403509"
"刘亦菲","399029"
"印度平均每分钟2人死于新冠","360132"
"庆怜怼脸自拍","342603"
"我家猫有一只鸽子朋友","323541"
"印度给牛收容所配备血氧仪","321623"
"利路修没回复BBC的采访请求","303162"
"优秀示范村农民自建厕所不敢用","299156"
"3只雪豹咬死咬伤39只羊4头牛","281192"
"DK战胜C9","277062"
"南昌每天直排超50万吨生活污水","270086"
"还以为在动物园偶遇明星了","255842"
"原来化妆品也有高原反应","251794"
"官方调查学校强制实习赚取人头费","251453"
"乃万 我不会退缩因为我没有做错","251284"
