"hot_word","hot_word_num"
"金晨新约会对象陈一鸣","3513435"
"将保胎药错发成打胎药护士被停职","1851387"
"金莎对耿斯汉没有心动","1746498"
"不为劣迹艺人提供公开出镜发声机会","1365080"
"张继科","1183548"
"白夜追凶没有第二部","880542"
"圆通速递被约谈并责令整改","654059"
"台湾间谍施正屏在大陆被判4年","628673"
"N号房主犯赵主彬翻供","623763"
"林更新 盖玥希","618376"
"吉林气温回升多人受伤","595404"
"女儿们的恋爱","528479"
"权志龙NIKE联名","474156"
"错换人生28年姚策留绝笔信","430319"
"央视辟谣食物相克说法","372153"
"母丹","367178"
"张颜齐","364492"
"华为再次重申不造整车","358276"
"李诚儒加盟我就是演员","351826"
"花呗借呗200亿ABS融资计划获通过","341318"
"一下雪中国就穿越了时空","339675"
"清华已开启6G试验","313184"
"日常消费不得拒收现金","303506"
"我们恋爱吧","303191"
"我最想看的一键换装出现了","301546"
"300万房产送水果摊主老人家属发声","295204"
"A股","284624"
"蓬佩奥称美国务院已开始政权过渡进程","282678"
"图书编辑批流量明星粉丝控评养号","282133"
"蛇蛇离队","268449"
"LPL名人堂","255686"
"苏格兰成全球首个卫生巾免费地区","231027"
"国台办回应台湾开始建造潜艇","230519"
"改为礼貌句","230169"
"金鸡奖开幕式节目单","219611"
"大一男生组团穿军大衣上课","199104"
"基金","187975"
"起底燕窝市场乱象","182241"
"9个关于家暴背后的真相","161126"
"国际消除对妇女暴力日","152484"
"漠寒回应张培萌","140059"
"格莱美提名","136938"
"特朗普回应道指首次突破30000点","136218"
"陶崇园导师王攀被恢复招研资格","135584"
"白酒股","134266"
"牛津词典首次不选年度词汇","133950"
"体育老师遍访武林发明武术操","128818"
"国药集团已提交新冠疫苗上市申请","128115"
"盆栽怼格莱美","127516"
"白宫批准向拜登团队提供总统每日简报","122561"
