"hot_word","hot_word_num"
"张雨绮 希望我明年不会塌房","199139"
"成都新增2例本土确诊","141161"
"时尚先生盛典","119234"
"杨幂蝴蝶结好大","112998"
"宋轶带苹果走红毯","89250"
"成都确诊新冠女孩首度公开视频","78898"
"台湾地震","71157"
"华春莹说就做战狼又何妨","62397"
"刘诗诗背影","62094"
"小鬼催提词器翻快一点","58472"
"金晨把自己包装成了礼物","54575"
"爱的厘米","51320"
"成都本起疫情累计报告确诊8例","50249"
"吉娜怀孕7个月状态","49724"
"小风暴","48378"
"星巴克要在中国新开600家店","48225"
"欧阳娜娜星河入梦裙","47531"
"专家建议小学到研究生缩短两年","43715"
"邓伦的大片是在冷冻柜旁拍的","42333"
"在显微镜下清理手机","41509"
"大秦赋","41038"
"宋祖儿港风白天鹅","36984"
"女子20楼遥控指挥同事停车","36116"
"福建震感","36019"
"央视评演员不背台词念数字","35532"
"小黄车等退押金还要988年","35346"
"阿塞拜疆阅兵","35320"
"中国驻美大使馆推特账号被黑客攻击","35316"
"教练体罚学生用便池水洗脸","35315"
"杨幂重回小时代拍摄地","34165"
"了不起的儿科医生","32179"
"谭松韵立体花朵裙","31396"
"外交部宣布对美对等制裁","30512"
"吴宣仪好像人鱼公主","29707"
"天津大学推出可订制健身餐","29222"
"中宣部授予张桂梅时代楷模称号","28732"
"霉霉新专辑","28574"
"郫都复检发现4例阳性","27448"
"终极笔记","26635"
"沐浴之王","25581"
"绥芬河青云小区升为中风险","25300"
"李佳琦直播","23987"
"王者荣耀新峡谷","23412"
"关震雷李贝复合","22976"
"东宁中心社区调为中风险地区","20800"
"郫都中铁奥维尔二期三期升级为中风险","20196"
"装台","20096"
"亚冠","18201"
"绥芬河","17919"
"微笑表情对聊天的影响","16743"
