"hot_word","hot_word_num"
"安崎在北京穿短裤","3181006"
"妻子擅自终止妊娠是否侵犯丈夫生育权","2346854"
"刘翔 献给跨过2020的你","2330138"
"网购羽绒服有丧事臂章","2137897"
"华东失饭大学","1967071"
"李易峰对金晨说明年再约","1915522"
"张若昀首谈女儿","1466371"
"北极圈是划到烟台了吗","750592"
"明确人工授精生子法律地位","679853"
"李沁的保暖衣能充电","633687"
"北京顺义取消全部100人以上大型活动","633290"
"花小猪打车在京暂停服务一周","631461"
"今晚的月亮","630423"
"警方通报乐山职院女生遇害案","629273"
"豆瓣崩了","627982"
"北京顺义局部聚集性疫情系单一传播链","626050"
"孙悦","625013"
"零下8度幼儿园只来了1个学生","624640"
"杨幂假装自己在夏天","623425"
"张雨绮熬夜写了篇长文","597998"
"从王源的发型看出上海风有多大","585748"
"青簪行","580140"
"跟半生不熟的人聊天有多难","566066"
"原来辣条还能做成豆浆","511387"
"懒人麻辣烫","477112"
"关晓彤军大衣裹羽绒服","464487"
"特朗普当选全美最受钦佩男性","441425"
"乔丹姓名权纠纷案宣判","425938"
"任何竞赛奖项均不与基础教育阶段入学挂钩","423103"
"被周迅唱哭了","422486"
"跨年蛋糕","396634"
"差点热死在福建的冬天","389129"
"丁飞俊退出创造营","360541"
"2男子酒后割手腕结拜血流不止","343432"
"台湾出现首例新冠病毒变种病例","307573"
"李易峰金晨","297289"
"Gugudan解散","294699"
"乐山","294431"
"辽宁沈阳立即启动应急响应","287203"
"阳光之下","268414"
"上海正式立法整治医闹","249505"
"流金岁月","246802"
"婚前父母帮买房的出资属于个人财产","231944"
"人社局介入员工连上2次厕所被罚款","227233"
"糯糯南瓜饼","213527"
"以色列两老人接种美产疫苗后死亡","210596"
"河北师范大学通报学生坠楼身亡事件","205382"
"送你一朵小红花","200229"
"美出售香港总领馆房产计划未能达成","197478"
"中国方言真是博大精深","196721"
