"hot_word","hot_word_num"
"24岁小伙滑雪坠亡母亲发声","3567483"
"百香果女孩案凶手被改判死刑","1986120"
"2021开年流金雨","1973462"
"警方通报王一博被报假警结果","1969681"
"梁静茹唱分手快乐哭了","1786805"
"1块钱包1年","1539373"
"网易云音乐年度总结","1517857"
"姚晨回怼恶评","1405940"
"Windows10将永久删除FlashPlayer","1106224"
"治疗新冠药品纳入国家医保目录","1006804"
"追光吧哥哥节目组道歉","953089"
"北京三例确诊曾在全聚德烤鸭店聚餐","929256"
"香港高校研制出透明口罩","871640"
"江苏卫视跨年全阵容","760344"
"顺丰称确诊病例未接触任何快件","738550"
"王子文离别戏哭了11小时","684379"
"春节前争取开通老年人一键叫车功能","574144"
"陈龙 支持妻子工作是丈夫的责任","561216"
"药水哥击败刘洲成","545523"
"暖宝宝贴哪最暖","535344"
"蔡文静被薅头发","513842"
"饭店电子秤把500毫升水称出1.8斤","505886"
"谢蕾蕾","495375"
"数百英国游客不愿隔离不告而别","488926"
"青年大学习","488307"
"一张毕业照激励小胖墩两个月减30斤","487856"
"姚晨为杨笠发声","456544"
"百香果女孩母亲对判决结果满意","450459"
"韩国人造太阳打破世界纪录","440620"
"乱港分子林卓廷今早被拘捕","439375"
"侍神令预告","439363"
"王一博和舌尖上的中国适配度","421274"
"黄海设计送你一朵小红花海报","417840"
"从戴口罩方式看出人格","403244"
"黄渤荣梓杉手绘莫扎特","368955"
"大连新增确诊中有一18个月男婴","360012"
"沈阳3小区调为中风险","351696"
"安妮玫瑰 刘著","349464"
"杨笠","349128"
"陈小春GAI我们的歌冠军","315471"
"狗狗宠物医院上演大逃亡","303922"
"101岁奶奶接种德国首针新冠疫苗","303772"
"王俊凯侧颜杀","303568"
"杭州明日或迎降雪","303445"
"湖人 森林狼","303350"
"晚霞遇上冰花的瞬间有多美","303113"
"基金","302875"
"秃鹫太冷了到牧民家求救","302817"
"库兹马首节14分","271682"
"勇士三分绝杀公牛","266521"
