"hot_word","hot_word_num"
"薇娅严选被强制执行","3426092"
"建议免费为中学女生接种HPV疫苗","1986242"
"女生因过度吃甜食近视1500度","1619341"
"你选原味鸡还是脆皮鸡",""
"李沁为和黄景瑜搭戏买增高垫","1465001"
"周也是穿了白展堂的衣服吗","978446"
"男子和网恋女友视频接通却是警察","880100"
"莫小奇直播状态",""
"广州疫情为何以无症状感染者居多","753808"
"监控看到父亲摔倒儿子泪奔回家","737326"
"35岁教师为救落水儿童被水冲走","700906"
"当代研究生能有多怕开组会","646172"
"杨幂身材好辣","642172"
"迪丽热巴的腰","630354"
"唐嫣超近景怼脸照","600648"
"摩尔庄园的任务是不是发朋友圈","578990"
"妈妈用1年记录女儿跟在爸爸身后散步","536125"
"陈赫让彭于晏发减肥心得","532274"
"邢昭林妈妈没有追剧的原因","514517"
"有些人天生就是C位","505431"
"嘉人女性影响力之夜","491061"
"原来菠萝蜜的核是可以吃的","476859"
"外交部点赞中国基层卫生工作者","460573"
"爱狗人士殴打卖狗肉男子5人获刑","460449"
"小老虎撒娇","448163"
"赵奕欢 不红就没有选择角色的权利","441425"
"宋妍霏家氛围太好了","436231"
"杨幂半面公主切","412353"
"1078万人报名高考","403326"
"iG英雄联盟分部2021LPL夏季赛名单","399948"
"男子投资狗狗币翻两百倍却无法套现","374960"
"片寄凉太胖了好多","368636"
"吃泡面的理由找到了","330085"
"陈建斌蒋勤勤定情信物是麦子","291824"
"乃万确诊肠胃炎","285484"
"因没被叫学长罚学弟抄名字50遍","282792"
"体育总局暂停山地越野等赛事","272022"
"教育部回应安徽六安读音问题","271325"
"深圳东门","262441"
"嘉人主持人有多高","257300"
"印度茶叶减产超6000万公斤","257061"
"酸甜荔枝杨梅饮","255086"
"15头野象急行军画面","254495"
"氛围感拍照技巧","252847"
"尚未清零的停业网贷机构1387家","252060"
"外交部呼吁美回应德特里克堡疑云","250978"
"嘉人深V内卷","250116"
"新冠疫苗铝佐剂不会危害大脑","248992"
"夏日车厘子果浆妆","247884"
"曹县究竟有多好吃","246250"
