"hot_word","hot_word_num"
"神舟十二与天和交会对接","2888243"
"神舟十二号发射圆满成功","2648278"
"神舟十二号发射升空","1984050"
"理想生活狂欢季",""
"尔冬升 13岁的小演员能有什么话语权","1977542"
"五块钱以下的雪糕有多好吃","1381449"
"航天员聂海胜刘伯明汤洪波","1311325"
"健康聊医聊",""
"未婚夫想通过婚姻改变命运","1049711"
"10元以上方便面销量逐年增长","853224"
"南京阿姨送核桃反遭街坊投诉","808292"
"许渊冲逝世","728496"
"黄子韬停止一切平面拍摄","725738"
"玉骨遥剧组声明","719947"
"拜登赠送普京飞行员太阳镜","618934"
"孙楠 孩子们没上过女德学校","613274"
"神舟十二号发射升空瞬间","581040"
"打听同事工资被开除了","558168"
"鹿晗帮制作人闯入kpop舞台","552273"
"毛晓彤抽烟戏份路透","544253"
"航天员喝的水从哪来","534932"
"拜登误将普京叫成特朗普","533786"
"黄子韬 粉丝的意见我从来没听过","532611"
"王一博抉择定妆花絮","526707"
"钟薛高特级红提实为散装红提","498514"
"暖羊羊瘦了","488082"
"专八成绩","486242"
"赵露思朦胧感胶片写真","447786"
"外卖真的不健康吗","437161"
"意大利致14死缆车事故最新监控曝光","428924"
"张新成演的女生","404192"
"一旅客携带82瓶未申报茅台酒入境","382312"
"神舟十二号与天和核心舱完成对接","368999"
"神舟十二发射对中国航天有何重大意义","363933"
"3名航天员将进入天和核心舱","363357"
"第一次看到反向凑整","361035"
"两教师收家长5万元企图协助高考作弊","358989"
"爆浆荔枝酸奶冻冻","357228"
"全封闭管理的高考评卷场什么样","355102"
"2021LPL","353691"
"用霸道总裁语气说话的爸爸","352128"
"至今想起来最让你后怕的事","350028"
"公安部新闻发布会","347261"
"4岁娃公安局前寻找牺牲民警父亲","345482"
"这位川妹子想做下一个女飞人","343807"
"台湾新增175例本地确诊","341644"
"航天员在天上怎么理发","340484"
"中国航天员在空间站能吃川菜","337461"
"诺安该不该止盈","335061"
"50米超近距离看神舟十二号发射","334649"
