"hot_word","hot_word_num"
"沈腾把假发笑掉了","1676783"
"中国外交官回击BBC","1454875"
"刘宇 初C","1293861"
"张小斐回应范丞丞没认出她","1243881"
"阿凡达再度成为全球票房冠军","1168637"
"全球双胞胎出生率创新高","765903"
"教资","757942"
"中国各省菠萝产量","629276"
"延迟退休不会一刀切","548092"
"韩国记者塑料中文提问赵立坚一脸问号","542930"
"门店挂无饿不坐招牌被查","452793"
"山河令","410168"
"沙溢比划的蒙娜丽莎","388577"
"百香果女孩家属被退赔32元","349833"
"骂学生笨支教老师被取消研究生资格","349710"
"金莎 姐换造型师了","349703"
"妻子的浪漫旅行5路透","349692"
"十四五规划和2035年远景目标纲要全文","349675"
"直播武大樱花季抗疫专场","349662"
"武汉最高礼遇迎接援鄂医护赏樱","349659"
"印度4男子树下避雨遭雷劈瞬间倒地","349634"
"榫卯技术 韩国申遗","349622"
"杨紫烟雾朦胧感大片","349614"
"教资科目二","349605"
"周深笑到满地乱爬","349593"
"王一博宁波","349575"
"创4全员主题曲舞台爷青回","349557"
"俄罗斯被禁止奥运会用喀秋莎替代国歌","349554"
"未来15年中国要办的事","349535"
"把廉价的东西穿出高级感","349532"
"阿凡达","347508"
"消防员演示风筝线杀伤力","300159"
"emoji还能组合起来使用","290243"
"为啥越来越多人不想生娃","289028"
"金酸莓奖提名","268634"
"ipad猎巫","257798"
"武汉早餐店老板给抗疫英雄免单","257006"
"鸡鸣寺樱花","229587"
"高晓松","226714"
"光明日报 996和007是违法不是奋斗","222345"
"3人祭祀烧毁山林被罚种2000棵树","215700"
"原来咖啡真的能提神","214761"
"奥地利指控欧盟疫苗分配不均","203303"
"范丞丞回应没认出张小斐","200883"
"英国拒绝将帕台农神庙雕塑归还希腊","193817"
"关晓彤开衩红裙","192267"
"我国成功发射遥感三十一号04组卫星","181062"
"李佳琦晒妹妹奈娃同框图","181036"
"张晓明说被美国列入制裁名单深以为荣","180580"
"小斑海豹连续4天爬上岸边","176018"
