"hot_word","hot_word_num"
"盛况承认对金莎一见钟情","2974985"
"香港4人丧失立法会议员资格","2631200"
"天猫双11","2602887"
"金晨张继科真的好像大姨和大舅","2574574"
"四字弟弟把沙发借蔡国庆坐坐呗","1300008"
"值得买的家居好物","1144326"
"苹果测试可折叠iPhone显示屏","920295"
"pencil有多怕冷","777863"
"诺安","664765"
"安徽颍上张洋小区升为中风险","641850"
"美国允许新冠阳性医护工作","640767"
"赵天宇 哇唧唧哇","640672"
"黄子韬 我的CP以后才是最好磕的","595451"
"李荣浩提词器的字比别人大一倍","516833"
"辅警殉职前半小时还在汇报工作","516438"
"湖北潜江一境外返潜人员核酸阳性","514580"
"希望蔡国庆蔡少芬组合出道","513057"
"露华浓为申请破产作准备","510894"
"猫咪诱惑学生被捕","510064"
"新版绯闻女孩路透","508550"
"张豆豆于家翊甜","506555"
"拜登称特朗普拒绝承认选举结果令人尴尬","426803"
"女儿们的恋爱","425052"
"当心电图实验被喊男友名字","374260"
"你微笑时很美","363765"
"法国担心青年戴口罩妨碍约会","341364"
"狗狗睡觉有多销魂","324272"
"特朗普称将揭露选票腐败","315625"
"沙特公主30个爱马仕被盗气到住院","311405"
"基金","278647"
"我和别人清空购物车的区别","277734"
"用计算器定了个闹钟","259927"
"三轮车撞上700万元劳斯莱斯","259062"
"宋茜范丞丞毫无默契","242889"
"黄奕帮女儿追星易烊千玺","242685"
"双十一老公等级表","227760"
"沈腾马丽的塑料粤语","227353"
"蔡徐坤手臂线条","226526"
"A股","221459"
"最高法指令对杨光毅强奸案再审","209062"
"林书豪和勇士合练","199710"
"站错cp的黄子韬","198034"
"一夜变闰土","194208"
"柴达木盆地中的绿翡翠","192949"
"导师不得违规随意拖延研究生毕业","192919"
"毛不易接话筒的姿势","192895"
"天津一无症状感染者转确诊","165443"
"外公回应9岁姐姐带5岁弟弟寻母","145450"
"你最后网购的那个东西拥有了2万倍","135220"
"双十一","135119"
