"hot_word","hot_word_num"
"jasper对着每个镜头道歉","3548799"
"医生喝葡萄糖遭质疑市民专程送水","2537289"
"舒畅否认隐婚生子","2141829"
"R1SE只有一个座位","1751262"
"钟南山被催睡觉和妻子讨价还价","774250"
"全班为考一百分的同学欢呼","671472"
"吴尊友提醒海淘要注意这些","657074"
"江西万载发生一起重大刑事案件","543185"
"四川88个贫困县全部摘帽","512610"
"你有容貌焦虑吗","511541"
"赵丽颖谈网络评价","505423"
"沈梦辰 总是敷衍都会渐行渐远","500701"
"张一山 我也有演不好的时候","496006"
"听见她说","443024"
"老WE队员成立战队","432554"
"爱奇艺公布第三季度财报","426789"
"应采儿教育方式","415915"
"白酒","411150"
"赵薇齐溪谈容貌焦虑","400760"
"买个面条都要出省","393220"
"许光汉别再想见我MV","388280"
"王嘉尔碎发长刘海造型","383306"
"诺安","367721"
"法院通报法官在单位遭报复杀害","333532"
"新生日记","326822"
"近藤真彦承认出轨","309012"
"李宇春那女孩对我说","308086"
"世卫称新冠病毒在中国传播水平极低","298678"
"世卫组织总干事谭德塞已结束隔离","293156"
"奔跑吧银川路透","289526"
"腾讯发布虚假广告被罚20万","247319"
"还能放心海淘吗","241939"
"Khan和GimGoon成为自由人","233562"
"美国大选正式结果何时官宣","232926"
"刘阳","232296"
"Swordart成为自由人","212319"
"成毅时尚健康封面","207213"
"蔡志忠落发少林寺","205674"
"陈乔恩探望安以轩女儿","198416"
"风起洛阳开机","188872"
"langx成为自由人","181903"
"别人学校的才艺表演","177684"
"棋魂","163369"
"父亲给新兵儿子手写千字毛笔家书","162607"
"宿迁泗阳急寻相关接触者","161851"
"小时候的天赋长大后消失了","161831"
"蛋壳公寓拖欠员工工资","161820"
"福州流向临沂的进口刀鱼检出弱阳性","142830"
"湖南姐妹为父追凶25年案开庭","142249"
"男友制造惊喜有多努力","140803"
