"hot_word","hot_word_num"
"马思纯回应自己胖了","322061"
"梅根或准备竞选美国总统","223630"
"王建国呼兰合体了","202355"
"你好李焕英即将全球上映","179306"
"吐槽大会","135753"
"金莎说女人有男闺蜜很正常","133921"
"缅甸中资服装厂遭纵火打砸","128874"
"日本变异新冠病毒迅猛蔓延","111291"
"彭波接受审查调查","108167"
"解放军三大海域练兵大场面","107851"
"陈芳语回应热依娜藏头歌","98517"
"易立竞问马思纯现在过得安生吗","91542"
"贵阳方舟戏台失火","88365"
"海南万宁迎来菠萝采摘季","87899"
"四川全面禁止从省外违规调运生猪","87140"
"币圈首富比特币投资收益100倍","86079"
"揭秘电商直播带货乱象","85395"
"郭艾伦助攻创生涯单场新高","84750"
"巴西前总统接种中国新冠疫苗","84006"
"窦骁晒何超莲做的雪花酥","83338"
"大虞海棠","81841"
"消防员出警救火发现着火的是自己家","81408"
"龚俊大学时期照片","81026"
"安怡死了","80925"
"男子用绘画让万物隐身","70422"
"山河令","63698"
"张镇麟暴扣","58589"
"桃叭崩了","58170"
"加拿大法院拒收孟晚舟方提交新证据","58083"
"2021314众多情侣打卡连理枝","58003"
"广州餐厅违规收茶位费","53715"
"白敬亭眼神里都是戏","53639"
"天天向上","53132"
"许佳琪分享长隆回忆小碎片","46625"
"景甜好白","46341"
"司藤","46033"
"IZONE宣布解散","42687"
"日企新规若偶像结婚可请带薪假","39972"
"护肤中心查出兽用注射器","38590"
"什么叫表演用力过猛","36863"
"赵丽颖为张碧晨新歌打call","36590"
"锦心似玉","35469"
"二月二","32565"
"延迟退休不会一刀切","32094"
"Lisa在线求THE9演唱会门票","32084"
"李雪琴择偶标准是郭麒麟","30335"
"陕西勉县2000多棵美人梅竞相绽放","27757"
"辽宁男篮 福建男篮","27120"
"26年为6万患者义诊的老医生离世","26988"
"救坠江女孩牺牲的民警被追记一等功","26673"
