"hot_word","hot_word_num"
"建议对996工作制进行监管","255279"
"建议人口低于10万的小县合并","100378"
"王俊凯元气新歌","92717"
"成都9.9元共享猫咪店已关门","82965"
"为什么说中文是地狱难度","77550"
"建议适当放宽小学新生入学年龄","66732"
"建议给单身青年提供租购房优惠","65409"
"温客行原名叫甄衍","65036"
"日本基本决定奥运不接待海外普通观众","63545"
"共享猫咪9块9租一天","62143"
"你好李焕英延长上映","60910"
"货拉拉司机不充会员每天只能接两单","60690"
"司藤","60346"
"委员建议完善女性分娩前后抑郁筛查","59946"
"江苏一高校为教职工提供托幼服务","59456"
"锦心似玉","59159"
"陈赫带女儿和朱桢逛街","58642"
"梅根","58498"
"沈腾瞿颖旧照","57180"
"王源新发色","56887"
"李一桐替艾情发结婚证词","55213"
"安心裤","54201"
"谈恋爱一定要承诺未来吗","52592"
"女心理师官宣全阵容","52119"
"景甜晒司藤一寸照","48027"
"中南财大博士生被骗10万余元","46519"
"杀破狼","37109"
"为什么空巢青年越来越多","35674"
"美股高开","35522"
"保险机构纷纷否认大量赎回基金传闻","35452"
"日本祈愿风筝被批恐怖","35410"
"唐探3延长上映","34961"
"印度超4.2万名士兵感染新冠病毒","32449"
"唐江澎 孩子应接受让他们优雅的教育","28756"
"大连湾海底隧道沉管安装施工","28039"
"周柯宇直播","28000"
"阿凡达","27605"
"荣耀乒乓","27586"
"建议警惕课堂过度使用PPT","27285"
"姐姐妹妹的武馆明日开播","27222"
"报案人谎称毒花生随电瓶被盗","26964"
"徐令宜十一娘额头吻","26874"
"赵丽颖黑色连衣裙","26229"
"江苏八省联考成绩","25668"
"毒花生案报案车行已暂停营业","25604"
"院士吐槽带量子的护肤品肯定不好","25495"
"刘宇直播","25411"
"徐令宜撒娇","24734"
"锦心似玉预告","23844"
"拥有多少资产才算财务自由","23530"
