"hot_word","hot_word_num"
"那英你看看人家王鸥多淑女","3958265"
"牛年春节和情人节连一块了","3095825"
"四圣赐福新春赢吉","3030011"
"李文亮医生去世一周年","2913006"
"易烊千玺回应春晚戴假发","1561909"
"西藏冒险王同行者发声","1426109"
"袁姗姗 多么苦难的日子你都战胜了它","1202283"
"沈阳一月子会所14名新生儿被确诊肺炎","660284"
"人民日报评英方撤销CGTN播出执照","649916"
"江西一批阳性进口樱桃已售空","618447"
"音乐之声男主去世","617506"
"大张伟 我不能挡所有人挣钱的道","614225"
"杜兰特怒喷NBA","516068"
"上海一中学设养机场管理学生手机","434683"
"上海破获刷单全流程造假案共40人","390524"
"郭艾伦脑震荡","385571"
"王祖蓝帮老婆追星王力宏","385316"
"李一桐演技","385063"
"东莞干部慰问住别墅困难家庭","384392"
"央视评少年不问白发只关热爱","384090"
"丁程鑫把好运来唱成诗朗诵","383992"
"Cindy模仿的岳云鹏撞脸龚琳娜","350960"
"网红冷烟花也属禁燃范围","328495"
"大量志愿者考虑退出东京奥运会","320845"
"王牌对王牌贾玲哭了","315285"
"杨洁篪同美国国务卿布林肯通电话","309380"
"斗罗大陆剧情脑洞","288455"
"数据推算全球恢复到疫情前需7.4年","287541"
"雅思","280744"
"王骁追星任豪成功","279213"
"易烊千玺一口气绕口令","242932"
"福字应该正着贴还是倒着贴","238689"
"安徽宿松翻船事故死亡人数增至11人","227075"
"俄罗斯驱逐德国瑞典和波兰3名外交官","226228"
"山东鲁能更名山东泰山","225681"
"斗罗大陆最强魂师预告","219123"
"科学家发现地球最小爬行动物","193688"
"SpaceX拿下NASA大订单","167097"
"四川汶川一村庄给村民分红260万","156928"
"距过年还有5天","155042"
"上海新房摇号推出计分制","152816"
"绕着中国天眼FAST跑完一圈需要多久","137504"
"女子被天降大狗砸瘫获赔超百万","136004"
"小朋友春晚后台追星王俊凯","125213"
"东京都知事称东京奥运会面临严重问题","123419"
"斗罗大陆","119933"
"锡安扣坏篮筐","113963"
"粉笔模考","103530"
"盲道为绕开井盖穿过公交站牌","99912"
"拉塞尔三分绝杀","99521"
